Running Qemu with Precise passthrough
2321@1456171450.196345:vfio_initfn  (0000:00:16.4) group 6
2321@1456171450.196412:vfio_listener_region_add_ram region_add [ram] 0 - 9ffff [0x7f6983e00000]
2321@1456171450.196561:vfio_listener_region_add_skip SKIPPING region_add a0000 - bffff
2321@1456171450.196567:vfio_listener_region_add_ram region_add [ram] c0000 - dffff [0x7f6a19400000]
2321@1456171450.196600:vfio_listener_region_add_ram region_add [ram] e0000 - fffff [0x7f6a196e0000]
2321@1456171450.196621:vfio_listener_region_add_ram region_add [ram] 100000 - 7fffffff [0x7f6983f00000]
2321@1456171450.362944:vfio_listener_region_add_skip SKIPPING region_add fec00000 - fec00fff
2321@1456171450.362965:vfio_listener_region_add_skip SKIPPING region_add fed00000 - fed003ff
2321@1456171450.362968:vfio_listener_region_add_skip SKIPPING region_add fee00000 - feefffff
2321@1456171450.362972:vfio_listener_region_add_ram region_add [ram] fff00000 - ffffffff [0x7f6a19600000]
2321@1456171450.376079:vfio_get_device Device 0000:00:16.4 flags: 2, regions: 9, irqs: 5
2321@1456171450.376085:vfio_populate_device_region Device 0000:00:16.4 region 0:
  size: 0x1000, offset: 0x0, flags: 0x7
2321@1456171450.376088:vfio_populate_device_region Device 0000:00:16.4 region 1:
  size: 0x0, offset: 0x10000000000, flags: 0x0
2321@1456171450.376090:vfio_populate_device_region Device 0000:00:16.4 region 2:
  size: 0x0, offset: 0x20000000000, flags: 0x0
2321@1456171450.376092:vfio_populate_device_region Device 0000:00:16.4 region 3:
  size: 0x0, offset: 0x30000000000, flags: 0x0
2321@1456171450.376094:vfio_populate_device_region Device 0000:00:16.4 region 4:
  size: 0x0, offset: 0x40000000000, flags: 0x0
2321@1456171450.376096:vfio_populate_device_region Device 0000:00:16.4 region 5:
  size: 0x0, offset: 0x50000000000, flags: 0x0
2321@1456171450.376098:vfio_populate_device_config Device 0000:00:16.4 config:
  size: 0x100, offset: 0x70000000000, flags: 0x3
2321@1456171450.376100:vfio_populate_device_get_irq_info_failure VFIO_DEVICE_GET_IRQ_INFO failure: Invalid argument
2321@1456171450.376427:vfio_msi_setup 0000:00:16.4 PCI MSI CAP @0x8c
2321@1456171450.376433:vfio_pci_read_config  (0000:00:16.4, @0x3d, len=0x1) 1
2321@1456171450.376436:vfio_pci_read_config  (0000:00:16.4, @0x3d, len=0x1) 1
2321@1456171450.376509:vfio_intx_enable_kvm  (0000:00:16.4) KVM INTx accel enabled
2321@1456171450.376512:vfio_intx_enable  (0000:00:16.4)
2321@1456171450.432005:vfio_pci_hot_reset  (0000:00:16.4) multi
2321@1456171450.432152:vfio_intx_disable_kvm  (0000:00:16.4) KVM INTx accel disabled
2321@1456171450.432175:vfio_intx_disable  (0000:00:16.4)
2321@1456171450.432186:vfio_pci_read_config  (0000:00:16.4, @0x54, len=0x2) 8
2321@1456171450.432192:vfio_pci_read_config  (0000:00:16.4, @0x4, len=0x2) 2
2321@1456171450.432196:vfio_pci_write_config  (0000:00:16.4, @0x4, 0x0, len=0x2)
qemu-system-x86_64: vfio: Cannot reset device 0000:00:16.4, no available reset mechanism.
2321@1456171450.432226:vfio_pci_read_config  (0000:00:16.4, @0x3d, len=0x1) 1
2321@1456171450.432259:vfio_intx_enable  (0000:00:16.4)
2321@1456171450.432369:vfio_pci_reset  (0000:00:16.4)
2321@1456171450.432402:vfio_intx_disable  (0000:00:16.4)
2321@1456171450.432412:vfio_pci_read_config  (0000:00:16.4, @0x54, len=0x2) 8
2321@1456171450.432417:vfio_pci_read_config  (0000:00:16.4, @0x4, len=0x2) 0
2321@1456171450.432420:vfio_pci_write_config  (0000:00:16.4, @0x4, 0x0, len=0x2)
2321@1456171450.432430:vfio_pci_hot_reset  (0000:00:16.4) one
2321@1456171450.432437:vfio_pci_read_config  (0000:00:16.4, @0x54, len=0x2) 8
2321@1456171450.432443:vfio_pci_read_config  (0000:00:16.4, @0x4, len=0x2) 0
2321@1456171450.432445:vfio_pci_write_config  (0000:00:16.4, @0x4, 0x0, len=0x2)
qemu-system-x86_64: vfio: Cannot reset device 0000:00:16.4, no available reset mechanism.
2321@1456171450.432466:vfio_pci_read_config  (0000:00:16.4, @0x3d, len=0x1) 1
2321@1456171450.432487:vfio_intx_enable  (0000:00:16.4)
2321@1456171450.432494:vfio_pci_read_config  (0000:00:16.4, @0x3d, len=0x1) 1
2321@1456171450.432504:vfio_intx_disable  (0000:00:16.4)
2321@1456171450.432536:vfio_intx_enable  (0000:00:16.4)
2321@1456171450.873943:vfio_pci_read_config  (0000:00:16.4, @0x0, len=0x4) 9d3e8086
2321@1456171450.873958:vfio_pci_read_config  (0000:00:16.4, @0x0, len=0x4) 9d3e8086
2321@1456171450.873982:vfio_pci_read_config  (0000:00:16.4, @0x4, len=0x4) 100000
2321@1456171450.874001:vfio_pci_read_config  (0000:00:16.4, @0x8, len=0x4) 7800021
2321@1456171450.874052:vfio_pci_read_config  (0000:00:16.4, @0xc, len=0x4) 0
2321@1456171450.874079:vfio_pci_read_config  (0000:00:16.4, @0x10, len=0x4) a173f004
2321@1456171450.874094:vfio_pci_read_config  (0000:00:16.4, @0x14, len=0x4) 0
2321@1456171450.874108:vfio_pci_read_config  (0000:00:16.4, @0x18, len=0x4) 0
2321@1456171450.874122:vfio_pci_read_config  (0000:00:16.4, @0x1c, len=0x4) 0
2321@1456171450.874136:vfio_pci_read_config  (0000:00:16.4, @0x20, len=0x4) 0
2321@1456171450.874150:vfio_pci_read_config  (0000:00:16.4, @0x24, len=0x4) 0
2321@1456171450.874169:vfio_pci_read_config  (0000:00:16.4, @0x28, len=0x4) 0
2321@1456171450.874188:vfio_pci_read_config  (0000:00:16.4, @0x2c, len=0x4) 0
2321@1456171450.874203:vfio_pci_read_config  (0000:00:16.4, @0x30, len=0x4) 0
2321@1456171450.874222:vfio_pci_read_config  (0000:00:16.4, @0x34, len=0x4) 50
2321@1456171450.874241:vfio_pci_read_config  (0000:00:16.4, @0x38, len=0x4) 0
2321@1456171450.874260:vfio_pci_read_config  (0000:00:16.4, @0x3c, len=0x4) 1ff
2321@1456171450.878350:vfio_pci_read_config  (0000:00:16.4, @0x0, len=0x4) 9d3e8086
2321@1456171450.878365:vfio_pci_read_config  (0000:00:16.4, @0x0, len=0x4) 9d3e8086
2321@1456171450.878380:vfio_pci_read_config  (0000:00:16.4, @0x4, len=0x4) 100000
2321@1456171450.878399:vfio_pci_read_config  (0000:00:16.4, @0x8, len=0x4) 7800021
2321@1456171450.878414:vfio_pci_read_config  (0000:00:16.4, @0xc, len=0x4) 0
2321@1456171450.878428:vfio_pci_read_config  (0000:00:16.4, @0x10, len=0x4) a173f004
2321@1456171450.878442:vfio_pci_read_config  (0000:00:16.4, @0x14, len=0x4) 0
2321@1456171450.878458:vfio_pci_read_config  (0000:00:16.4, @0x18, len=0x4) 0
2321@1456171450.878472:vfio_pci_read_config  (0000:00:16.4, @0x1c, len=0x4) 0
2321@1456171450.878486:vfio_pci_read_config  (0000:00:16.4, @0x20, len=0x4) 0
2321@1456171450.878500:vfio_pci_read_config  (0000:00:16.4, @0x24, len=0x4) 0
2321@1456171450.878515:vfio_pci_read_config  (0000:00:16.4, @0x28, len=0x4) 0
2321@1456171450.878534:vfio_pci_read_config  (0000:00:16.4, @0x2c, len=0x4) 0
2321@1456171450.878548:vfio_pci_read_config  (0000:00:16.4, @0x30, len=0x4) 0
2321@1456171450.878563:vfio_pci_read_config  (0000:00:16.4, @0x34, len=0x4) 50
2321@1456171450.878582:vfio_pci_read_config  (0000:00:16.4, @0x38, len=0x4) 0
2321@1456171450.878597:vfio_pci_read_config  (0000:00:16.4, @0x3c, len=0x4) 1ff
2321@1456171450.878616:vfio_pci_read_config  (0000:00:16.4, @0x34, len=0x1) 50
2321@1456171450.878637:vfio_pci_read_config  (0000:00:16.4, @0x50, len=0x2) 8c01
2321@1456171450.878652:vfio_pci_read_config  (0000:00:16.4, @0x8c, len=0x2) 5
2321@1456171450.878671:vfio_pci_read_config  (0000:00:16.4, @0x4, len=0x2) 0
2321@1456171450.878690:vfio_pci_write_config  (0000:00:16.4, @0x4, 0x0, len=0x2)
2321@1456171450.878714:vfio_pci_read_config  (0000:00:16.4, @0x10, len=0x4) a173f004
2321@1456171450.878731:vfio_pci_write_config  (0000:00:16.4, @0x10, 0xffffffff, len=0x4)
2321@1456171450.878744:vfio_pci_read_config  (0000:00:16.4, @0x10, len=0x4) fffff004
2321@1456171450.878760:vfio_pci_write_config  (0000:00:16.4, @0x10, 0xa173f004, len=0x4)
2321@1456171450.878773:vfio_pci_read_config  (0000:00:16.4, @0x14, len=0x4) 0
2321@1456171450.878789:vfio_pci_write_config  (0000:00:16.4, @0x14, 0xffffffff, len=0x4)
2321@1456171450.878802:vfio_pci_read_config  (0000:00:16.4, @0x14, len=0x4) ffffffff
2321@1456171450.878818:vfio_pci_write_config  (0000:00:16.4, @0x14, 0x0, len=0x4)
2321@1456171450.878831:vfio_pci_read_config  (0000:00:16.4, @0x18, len=0x4) 0
2321@1456171450.878847:vfio_pci_write_config  (0000:00:16.4, @0x18, 0xffffffff, len=0x4)
2321@1456171450.878860:vfio_pci_read_config  (0000:00:16.4, @0x18, len=0x4) 0
2321@1456171450.878876:vfio_pci_write_config  (0000:00:16.4, @0x18, 0x0, len=0x4)
2321@1456171450.878888:vfio_pci_read_config  (0000:00:16.4, @0x1c, len=0x4) 0
2321@1456171450.878905:vfio_pci_write_config  (0000:00:16.4, @0x1c, 0xffffffff, len=0x4)
2321@1456171450.878917:vfio_pci_read_config  (0000:00:16.4, @0x1c, len=0x4) 0
2321@1456171450.878934:vfio_pci_write_config  (0000:00:16.4, @0x1c, 0x0, len=0x4)
2321@1456171450.878947:vfio_pci_read_config  (0000:00:16.4, @0x20, len=0x4) 0
2321@1456171450.878964:vfio_pci_write_config  (0000:00:16.4, @0x20, 0xffffffff, len=0x4)
2321@1456171450.878976:vfio_pci_read_config  (0000:00:16.4, @0x20, len=0x4) 0
2321@1456171450.878992:vfio_pci_write_config  (0000:00:16.4, @0x20, 0x0, len=0x4)
2321@1456171450.879005:vfio_pci_read_config  (0000:00:16.4, @0x24, len=0x4) 0
2321@1456171450.879021:vfio_pci_write_config  (0000:00:16.4, @0x24, 0xffffffff, len=0x4)
2321@1456171450.879034:vfio_pci_read_config  (0000:00:16.4, @0x24, len=0x4) 0
2321@1456171450.879050:vfio_pci_write_config  (0000:00:16.4, @0x24, 0x0, len=0x4)
2321@1456171450.879066:vfio_pci_write_config  (0000:00:16.4, @0x30, 0xfffffffe, len=0x4)
2321@1456171450.879079:vfio_pci_read_config  (0000:00:16.4, @0x30, len=0x4) 0
2321@1456171450.879094:vfio_pci_read_config  (0000:00:16.4, @0x34, len=0x1) 50
2321@1456171450.879119:vfio_pci_read_config  (0000:00:16.4, @0x50, len=0x2) 8c01
2321@1456171450.879139:vfio_pci_read_config  (0000:00:16.4, @0x54, len=0x2) 8
2321@1456171450.879155:vfio_pci_write_config  (0000:00:16.4, @0x54, 0x8008, len=0x2)
2321@1456171450.885482:vfio_pci_read_config  (0000:00:16.4, @0x0, len=0x4) 9d3e8086
2321@1456171450.885496:vfio_pci_read_config  (0000:00:16.4, @0x0, len=0x4) 9d3e8086
2321@1456171450.885516:vfio_pci_read_config  (0000:00:16.4, @0x4, len=0x4) 100000
2321@1456171450.885535:vfio_pci_read_config  (0000:00:16.4, @0x8, len=0x4) 7800021
2321@1456171450.885556:vfio_pci_read_config  (0000:00:16.4, @0xc, len=0x4) 0
2321@1456171450.885570:vfio_pci_read_config  (0000:00:16.4, @0x10, len=0x4) a173f004
2321@1456171450.885584:vfio_pci_read_config  (0000:00:16.4, @0x14, len=0x4) 0
2321@1456171450.885598:vfio_pci_read_config  (0000:00:16.4, @0x18, len=0x4) 0
2321@1456171450.885612:vfio_pci_read_config  (0000:00:16.4, @0x1c, len=0x4) 0
2321@1456171450.885626:vfio_pci_read_config  (0000:00:16.4, @0x20, len=0x4) 0
2321@1456171450.885640:vfio_pci_read_config  (0000:00:16.4, @0x24, len=0x4) 0
2321@1456171450.885660:vfio_pci_read_config  (0000:00:16.4, @0x28, len=0x4) 0
2321@1456171450.885679:vfio_pci_read_config  (0000:00:16.4, @0x2c, len=0x4) 0
2321@1456171450.885693:vfio_pci_read_config  (0000:00:16.4, @0x30, len=0x4) 0
2321@1456171450.885708:vfio_pci_read_config  (0000:00:16.4, @0x34, len=0x4) 50
2321@1456171450.885728:vfio_pci_read_config  (0000:00:16.4, @0x38, len=0x4) 0
2321@1456171450.885742:vfio_pci_read_config  (0000:00:16.4, @0x3c, len=0x4) 1ff
2321@1456171450.885762:vfio_pci_read_config  (0000:00:16.4, @0x34, len=0x1) 50
2321@1456171450.885778:vfio_pci_read_config  (0000:00:16.4, @0x50, len=0x2) 8c01
2321@1456171450.885793:vfio_pci_read_config  (0000:00:16.4, @0x8c, len=0x2) 5
2321@1456171450.885815:vfio_pci_read_config  (0000:00:16.4, @0x4, len=0x2) 0
2321@1456171450.885832:vfio_pci_write_config  (0000:00:16.4, @0x4, 0x0, len=0x2)
2321@1456171450.885848:vfio_pci_read_config  (0000:00:16.4, @0x10, len=0x4) a173f004
2321@1456171450.885865:vfio_pci_write_config  (0000:00:16.4, @0x10, 0xffffffff, len=0x4)
2321@1456171450.885878:vfio_pci_read_config  (0000:00:16.4, @0x10, len=0x4) fffff004
2321@1456171450.885897:vfio_pci_write_config  (0000:00:16.4, @0x10, 0xa173f004, len=0x4)
2321@1456171450.885910:vfio_pci_read_config  (0000:00:16.4, @0x14, len=0x4) 0
2321@1456171450.885927:vfio_pci_write_config  (0000:00:16.4, @0x14, 0xffffffff, len=0x4)
2321@1456171450.885940:vfio_pci_read_config  (0000:00:16.4, @0x14, len=0x4) ffffffff
2321@1456171450.885961:vfio_pci_write_config  (0000:00:16.4, @0x14, 0x0, len=0x4)
2321@1456171450.885989:vfio_pci_read_config  (0000:00:16.4, @0x18, len=0x4) 0
2321@1456171450.886008:vfio_pci_write_config  (0000:00:16.4, @0x18, 0xffffffff, len=0x4)
2321@1456171450.886021:vfio_pci_read_config  (0000:00:16.4, @0x18, len=0x4) 0
2321@1456171450.886046:vfio_pci_write_config  (0000:00:16.4, @0x18, 0x0, len=0x4)
2321@1456171450.886059:vfio_pci_read_config  (0000:00:16.4, @0x1c, len=0x4) 0
2321@1456171450.886078:vfio_pci_write_config  (0000:00:16.4, @0x1c, 0xffffffff, len=0x4)
2321@1456171450.886091:vfio_pci_read_config  (0000:00:16.4, @0x1c, len=0x4) 0
2321@1456171450.886111:vfio_pci_write_config  (0000:00:16.4, @0x1c, 0x0, len=0x4)
2321@1456171450.886124:vfio_pci_read_config  (0000:00:16.4, @0x20, len=0x4) 0
2321@1456171450.886140:vfio_pci_write_config  (0000:00:16.4, @0x20, 0xffffffff, len=0x4)
2321@1456171450.886153:vfio_pci_read_config  (0000:00:16.4, @0x20, len=0x4) 0
2321@1456171450.886172:vfio_pci_write_config  (0000:00:16.4, @0x20, 0x0, len=0x4)
2321@1456171450.886185:vfio_pci_read_config  (0000:00:16.4, @0x24, len=0x4) 0
2321@1456171450.886201:vfio_pci_write_config  (0000:00:16.4, @0x24, 0xffffffff, len=0x4)
2321@1456171450.886214:vfio_pci_read_config  (0000:00:16.4, @0x24, len=0x4) 0
2321@1456171450.886232:vfio_pci_write_config  (0000:00:16.4, @0x24, 0x0, len=0x4)
2321@1456171450.886249:vfio_pci_write_config  (0000:00:16.4, @0x30, 0xfffffffe, len=0x4)
2321@1456171450.886262:vfio_pci_read_config  (0000:00:16.4, @0x30, len=0x4) 0
2321@1456171450.886282:vfio_pci_read_config  (0000:00:16.4, @0x34, len=0x1) 50
2321@1456171450.886303:vfio_pci_read_config  (0000:00:16.4, @0x50, len=0x2) 8c01
2321@1456171450.886324:vfio_pci_read_config  (0000:00:16.4, @0x54, len=0x2) 8
2321@1456171450.886342:vfio_pci_write_config  (0000:00:16.4, @0x54, 0x8008, len=0x2)
2321@1456171450.889204:vfio_listener_region_add_ram region_add [ram] 80000000 - 8000ffff [0x7f6a0be00000]
2321@1456171450.892908:vfio_listener_region_del region_del 80000000 - 8000ffff
2321@1456171450.893332:vfio_listener_region_add_ram region_add [ram] 80000000 - 8003ffff [0x7f6a0bc00000]
2321@1456171450.911487:vfio_listener_region_del region_del 80000000 - 8003ffff
2321@1456171450.911875:vfio_pci_write_config  (0000:00:16.4, @0x10, 0x81000000, len=0x4)
2321@1456171450.911894:vfio_pci_write_config  (0000:00:16.4, @0x14, 0x0, len=0x4)
2321@1456171450.914652:vfio_listener_region_add_ram region_add [ram] 80000000 - 80ffffff [0x7f6a18200000]
2321@1456171450.916409:vfio_listener_region_add_skip SKIPPING region_add 81003400 - 8100341f
2321@1456171450.916422:vfio_listener_region_add_skip SKIPPING region_add 81003500 - 81003515
2321@1456171450.916424:vfio_listener_region_add_skip SKIPPING region_add 81003600 - 81003607
2321@1456171450.917016:vfio_listener_region_del region_del 80000000 - 80ffffff
2321@1456171450.917713:vfio_listener_region_del_skip SKIPPING region_del 81003400 - 8100341f
2321@1456171450.917717:vfio_listener_region_del_skip SKIPPING region_del 81003500 - 81003515
2321@1456171450.917719:vfio_listener_region_del_skip SKIPPING region_del 81003600 - 81003607
2321@1456171450.918497:vfio_listener_region_add_skip SKIPPING region_add 81002000 - 8100202f
2321@1456171450.918501:vfio_listener_region_add_skip SKIPPING region_add 81002800 - 81002807
2321@1456171450.919328:vfio_listener_region_del_skip SKIPPING region_del 81002000 - 8100202f
2321@1456171450.919332:vfio_listener_region_del_skip SKIPPING region_del 81002800 - 81002807
2321@1456171450.919834:vfio_pci_read_config  (0000:00:16.4, @0x4, len=0x2) 0
2321@1456171450.919851:vfio_pci_write_config  (0000:00:16.4, @0x4, 0x27, len=0x2)
2321@1456171450.919891:vfio_listener_region_add_skip SKIPPING region_add 81000000 - 81000fff
2321@1456171450.920354:vfio_pci_read_config  (0000:00:16.4, @0x4, len=0x2) 6
2321@1456171450.920375:vfio_pci_write_config  (0000:00:16.4, @0x4, 0x0, len=0x2)
2321@1456171450.920399:vfio_listener_region_del_skip SKIPPING region_del 81000000 - 81000fff
2321@1456171450.920852:vfio_pci_read_config  (0000:00:16.4, @0x4, len=0x2) 0
2321@1456171450.920870:vfio_pci_write_config  (0000:00:16.4, @0x4, 0x10, len=0x2)
2321@1456171450.920901:vfio_pci_read_config  (0000:00:16.4, @0x6, len=0x2) 10
2321@1456171450.921172:vfio_listener_region_add_skip SKIPPING region_add 81001000 - 8100101f
2321@1456171450.921176:vfio_listener_region_add_skip SKIPPING region_add 81001800 - 81001807
2321@1456171450.922485:vfio_listener_region_del_skip SKIPPING region_del 81001000 - 8100101f
2321@1456171450.922489:vfio_listener_region_del_skip SKIPPING region_del 81001800 - 81001807
2321@1456171450.923094:vfio_pci_read_config  (0000:00:16.4, @0x4, len=0x2) 0
2321@1456171450.923112:vfio_pci_write_config  (0000:00:16.4, @0x4, 0x0, len=0x2)
2321@1456171450.945978:vfio_pci_read_config  (0000:00:16.4, @0x34, len=0x1) 50
2321@1456171450.946000:vfio_pci_read_config  (0000:00:16.4, @0x50, len=0x2) 8c01
2321@1456171450.946016:vfio_pci_read_config  (0000:00:16.4, @0x8c, len=0x2) 5
2321@1456171450.946033:vfio_pci_write_config  (0000:00:16.4, @0x3c, 0xff, len=0x1)
2321@1456171453.554209:vfio_pci_read_config  (0000:00:16.4, @0x0, len=0x4) 9d3e8086
2321@1456171453.554228:vfio_pci_read_config  (0000:00:16.4, @0x4, len=0x4) 100000
2321@1456171453.554245:vfio_pci_read_config  (0000:00:16.4, @0x8, len=0x4) 7800021
2321@1456171453.554261:vfio_pci_read_config  (0000:00:16.4, @0xc, len=0x4) 0
2321@1456171453.554276:vfio_pci_read_config  (0000:00:16.4, @0x10, len=0x4) 81000004
2321@1456171453.554290:vfio_pci_read_config  (0000:00:16.4, @0x14, len=0x4) 0
2321@1456171453.554304:vfio_pci_read_config  (0000:00:16.4, @0x18, len=0x4) 0
2321@1456171453.554318:vfio_pci_read_config  (0000:00:16.4, @0x1c, len=0x4) 0
2321@1456171453.554332:vfio_pci_read_config  (0000:00:16.4, @0x20, len=0x4) 0
2321@1456171453.554346:vfio_pci_read_config  (0000:00:16.4, @0x24, len=0x4) 0
2321@1456171453.554362:vfio_pci_read_config  (0000:00:16.4, @0x28, len=0x4) 0
2321@1456171453.554378:vfio_pci_read_config  (0000:00:16.4, @0x2c, len=0x4) 0
2321@1456171453.554393:vfio_pci_read_config  (0000:00:16.4, @0x30, len=0x4) 0
2321@1456171453.554409:vfio_pci_read_config  (0000:00:16.4, @0x34, len=0x4) 50
2321@1456171453.554425:vfio_pci_read_config  (0000:00:16.4, @0x38, len=0x4) 0
2321@1456171453.554441:vfio_pci_read_config  (0000:00:16.4, @0x3c, len=0x4) 1ff
2321@1456171453.555151:vfio_listener_region_add_skip SKIPPING region_add 81001000 - 8100101f
2321@1456171453.555155:vfio_listener_region_add_skip SKIPPING region_add 81001800 - 81001807
2321@1456171454.019280:vfio_listener_region_add_ram region_add [ram] 80000000 - 80ffffff [0x7f6a18200000]
2321@1456171454.020384:vfio_listener_region_add_skip SKIPPING region_add 81003400 - 8100341f
2321@1456171454.020390:vfio_listener_region_add_skip SKIPPING region_add 81003500 - 81003515
2321@1456171454.020392:vfio_listener_region_add_skip SKIPPING region_add 81003600 - 81003607
2321@1456171454.022951:vfio_listener_region_del_skip SKIPPING region_del a0000 - bffff
2321@1456171454.022967:vfio_listener_region_add_ram region_add [ram] a0000 - affff [0x7f6a18200000]
2321@1456171454.022994:vfio_listener_region_add_skip SKIPPING region_add b0000 - bffff
2321@1456171454.075986:vfio_listener_region_del region_del c0000 - dffff
2321@1456171454.076032:vfio_listener_region_add_ram region_add [ram] c0000 - c3fff [0x7f6983ec0000]
2321@1456171454.076051:vfio_listener_region_add_ram region_add [ram] c4000 - dffff [0x7f6a19404000]
2321@1456171454.076752:vfio_listener_region_del region_del c0000 - c3fff
2321@1456171454.076765:vfio_listener_region_add_ram region_add [ram] c0000 - c3fff [0x7f6983ec0000]
2321@1456171454.171559:vfio_listener_region_add_skip SKIPPING region_add 81002000 - 8100202f
2321@1456171454.171565:vfio_listener_region_add_skip SKIPPING region_add 81002800 - 81002807
2321@1456171454.172817:vfio_pci_read_config  (0000:00:16.4, @0x0, len=0x4) 9d3e8086
2321@1456171454.172842:vfio_pci_read_config  (0000:00:16.4, @0x4, len=0x4) 100000
2321@1456171454.172863:vfio_pci_read_config  (0000:00:16.4, @0x8, len=0x4) 7800021
2321@1456171454.172882:vfio_pci_read_config  (0000:00:16.4, @0xc, len=0x4) 0
2321@1456171454.172898:vfio_pci_read_config  (0000:00:16.4, @0x10, len=0x4) 81000004
2321@1456171454.172912:vfio_pci_read_config  (0000:00:16.4, @0x14, len=0x4) 0
2321@1456171454.172927:vfio_pci_read_config  (0000:00:16.4, @0x18, len=0x4) 0
2321@1456171454.172941:vfio_pci_read_config  (0000:00:16.4, @0x1c, len=0x4) 0
2321@1456171454.172955:vfio_pci_read_config  (0000:00:16.4, @0x20, len=0x4) 0
2321@1456171454.172969:vfio_pci_read_config  (0000:00:16.4, @0x24, len=0x4) 0
2321@1456171454.172984:vfio_pci_read_config  (0000:00:16.4, @0x28, len=0x4) 0
2321@1456171454.173000:vfio_pci_read_config  (0000:00:16.4, @0x2c, len=0x4) 0
2321@1456171454.173015:vfio_pci_read_config  (0000:00:16.4, @0x30, len=0x4) 0
2321@1456171454.173038:vfio_pci_read_config  (0000:00:16.4, @0x34, len=0x4) 50
2321@1456171454.173054:vfio_pci_read_config  (0000:00:16.4, @0x38, len=0x4) 0
2321@1456171454.173070:vfio_pci_read_config  (0000:00:16.4, @0x3c, len=0x4) 1ff
2321@1456171454.173089:vfio_pci_read_config  (0000:00:16.4, @0x4, len=0x2) 0
2321@1456171454.173107:vfio_pci_write_config  (0000:00:16.4, @0x4, 0x6, len=0x2)
2321@1456171454.173146:vfio_listener_region_add_skip SKIPPING region_add 81000000 - 81000fff
2321@1456171454.586592:vfio_listener_region_del region_del a0000 - affff
2321@1456171454.586623:vfio_listener_region_del_skip SKIPPING region_del b0000 - bffff
2321@1456171454.586637:vfio_listener_region_add_skip SKIPPING region_add a0000 - bffff
2321@1456171454.587411:vfio_listener_region_del_skip SKIPPING region_del a0000 - bffff
2321@1456171454.587420:vfio_listener_region_add_ram region_add [ram] a0000 - affff [0x7f6a18200000]
2321@1456171454.587436:vfio_listener_region_add_skip SKIPPING region_add b0000 - bffff
2321@1456171454.588136:vfio_listener_region_del region_del a0000 - affff
2321@1456171454.588146:vfio_listener_region_del_skip SKIPPING region_del b0000 - bffff
2321@1456171454.588157:vfio_listener_region_add_skip SKIPPING region_add a0000 - bffff
2321@1456171454.588817:vfio_listener_region_del_skip SKIPPING region_del a0000 - bffff
2321@1456171454.588826:vfio_listener_region_add_ram region_add [ram] a0000 - affff [0x7f6a18200000]
2321@1456171454.588839:vfio_listener_region_add_skip SKIPPING region_add b0000 - bffff
2321@1456171454.589662:vfio_listener_region_del region_del a0000 - affff
2321@1456171454.589693:vfio_listener_region_del_skip SKIPPING region_del b0000 - bffff
2321@1456171454.589700:vfio_listener_region_add_skip SKIPPING region_add a0000 - bffff
2321@1456171454.590506:vfio_listener_region_del_skip SKIPPING region_del a0000 - bffff
2321@1456171454.590522:vfio_listener_region_add_ram region_add [ram] a0000 - affff [0x7f6a18200000]
2321@1456171454.590538:vfio_listener_region_add_skip SKIPPING region_add b0000 - bffff
2321@1456171456.091683:vfio_pci_read_config  (0000:00:16.4, @0x4, len=0x2) 6
2321@1456171456.091729:vfio_pci_write_config  (0000:00:16.4, @0x4, 0x6, len=0x2)
2321@1456171456.091752:vfio_pci_read_config  (0000:00:16.4, @0x4, len=0x2) 6
2321@1456171456.091769:vfio_pci_write_config  (0000:00:16.4, @0x4, 0x6, len=0x2)
2321@1456171456.091787:vfio_pci_read_config  (0000:00:16.4, @0x0, len=0x4) 9d3e8086
2321@1456171456.091803:vfio_pci_read_config  (0000:00:16.4, @0x8, len=0x4) 7800021
2321@1456171456.091817:vfio_pci_read_config  (0000:00:16.4, @0x3c, len=0x1) ff
2321@1456171456.091833:vfio_pci_read_config  (0000:00:16.4, @0x10, len=0x4) 81000004
2321@1456171456.091847:vfio_pci_read_config  (0000:00:16.4, @0x14, len=0x4) 0
2321@1456171456.091861:vfio_pci_read_config  (0000:00:16.4, @0x18, len=0x4) 0
2321@1456171456.091875:vfio_pci_read_config  (0000:00:16.4, @0x1c, len=0x4) 0
2321@1456171456.091891:vfio_pci_read_config  (0000:00:16.4, @0x20, len=0x4) 0
2321@1456171456.091905:vfio_pci_read_config  (0000:00:16.4, @0x24, len=0x4) 0
2321@1456171456.091923:vfio_pci_read_config  (0000:00:16.4, @0x9, len=0x1) 0
2321@1456171456.091939:vfio_pci_read_config  (0000:00:16.4, @0xa, len=0x1) 80
2321@1456171456.091963:vfio_pci_read_config  (0000:00:16.4, @0xb, len=0x1) 7
2321@1456171456.091980:vfio_pci_read_config  (0000:00:16.4, @0x9, len=0x1) 0
2321@1456171456.091995:vfio_pci_read_config  (0000:00:16.4, @0xa, len=0x1) 80
2321@1456171456.092011:vfio_pci_read_config  (0000:00:16.4, @0xb, len=0x1) 7
2321@1456171456.092027:vfio_pci_read_config  (0000:00:16.4, @0x9, len=0x1) 0
2321@1456171456.092042:vfio_pci_read_config  (0000:00:16.4, @0xa, len=0x1) 80
2321@1456171456.092058:vfio_pci_read_config  (0000:00:16.4, @0xb, len=0x1) 7
2321@1456171456.092074:vfio_pci_read_config  (0000:00:16.4, @0x0, len=0x4) 9d3e8086
2321@1456171456.092090:vfio_pci_read_config  (0000:00:16.4, @0x4, len=0x4) 100006
2321@1456171456.092105:vfio_pci_read_config  (0000:00:16.4, @0x8, len=0x4) 7800021
2321@1456171456.092121:vfio_pci_read_config  (0000:00:16.4, @0xc, len=0x4) 0
2321@1456171456.092135:vfio_pci_read_config  (0000:00:16.4, @0x10, len=0x4) 81000004
2321@1456171456.092149:vfio_pci_read_config  (0000:00:16.4, @0x14, len=0x4) 0
2321@1456171456.092163:vfio_pci_read_config  (0000:00:16.4, @0x18, len=0x4) 0
2321@1456171456.092177:vfio_pci_read_config  (0000:00:16.4, @0x1c, len=0x4) 0
2321@1456171456.092191:vfio_pci_read_config  (0000:00:16.4, @0x20, len=0x4) 0
2321@1456171456.092205:vfio_pci_read_config  (0000:00:16.4, @0x24, len=0x4) 0
2321@1456171456.092220:vfio_pci_read_config  (0000:00:16.4, @0x28, len=0x4) 0
2321@1456171456.092235:vfio_pci_read_config  (0000:00:16.4, @0x2c, len=0x4) 0
2321@1456171456.092250:vfio_pci_read_config  (0000:00:16.4, @0x30, len=0x4) 0
2321@1456171456.092265:vfio_pci_read_config  (0000:00:16.4, @0x34, len=0x4) 50
2321@1456171456.092280:vfio_pci_read_config  (0000:00:16.4, @0x38, len=0x4) 0
2321@1456171456.092296:vfio_pci_read_config  (0000:00:16.4, @0x3c, len=0x4) 1ff
2321@1456171456.092311:vfio_pci_read_config  (0000:00:16.4, @0x0, len=0x4) 9d3e8086
2321@1456171456.092327:vfio_pci_read_config  (0000:00:16.4, @0x4, len=0x4) 100006
2321@1456171456.092342:vfio_pci_read_config  (0000:00:16.4, @0x8, len=0x4) 7800021
2321@1456171456.092358:vfio_pci_read_config  (0000:00:16.4, @0xc, len=0x4) 0
2321@1456171456.092373:vfio_pci_read_config  (0000:00:16.4, @0x10, len=0x4) 81000004
2321@1456171456.092390:vfio_pci_read_config  (0000:00:16.4, @0x14, len=0x4) 0
2321@1456171456.092404:vfio_pci_read_config  (0000:00:16.4, @0x18, len=0x4) 0
2321@1456171456.092419:vfio_pci_read_config  (0000:00:16.4, @0x1c, len=0x4) 0
2321@1456171456.092433:vfio_pci_read_config  (0000:00:16.4, @0x20, len=0x4) 0
2321@1456171456.092447:vfio_pci_read_config  (0000:00:16.4, @0x24, len=0x4) 0
2321@1456171456.092462:vfio_pci_read_config  (0000:00:16.4, @0x28, len=0x4) 0
2321@1456171456.092478:vfio_pci_read_config  (0000:00:16.4, @0x2c, len=0x4) 0
2321@1456171456.092492:vfio_pci_read_config  (0000:00:16.4, @0x30, len=0x4) 0
2321@1456171456.092508:vfio_pci_read_config  (0000:00:16.4, @0x34, len=0x4) 50
2321@1456171456.092523:vfio_pci_read_config  (0000:00:16.4, @0x38, len=0x4) 0
2321@1456171456.092538:vfio_pci_read_config  (0000:00:16.4, @0x3c, len=0x4) 1ff
2321@1456171456.092554:vfio_pci_read_config  (0000:00:16.4, @0x0, len=0x4) 9d3e8086
2321@1456171456.092569:vfio_pci_read_config  (0000:00:16.4, @0x4, len=0x4) 100006
2321@1456171456.092585:vfio_pci_read_config  (0000:00:16.4, @0x8, len=0x4) 7800021
2321@1456171456.092600:vfio_pci_read_config  (0000:00:16.4, @0xc, len=0x4) 0
2321@1456171456.092614:vfio_pci_read_config  (0000:00:16.4, @0x10, len=0x4) 81000004
2321@1456171456.092633:vfio_pci_read_config  (0000:00:16.4, @0x14, len=0x4) 0
2321@1456171456.092648:vfio_pci_read_config  (0000:00:16.4, @0x18, len=0x4) 0
2321@1456171456.092662:vfio_pci_read_config  (0000:00:16.4, @0x1c, len=0x4) 0
2321@1456171456.092676:vfio_pci_read_config  (0000:00:16.4, @0x20, len=0x4) 0
2321@1456171456.092690:vfio_pci_read_config  (0000:00:16.4, @0x24, len=0x4) 0
2321@1456171456.092705:vfio_pci_read_config  (0000:00:16.4, @0x28, len=0x4) 0
2321@1456171456.092720:vfio_pci_read_config  (0000:00:16.4, @0x2c, len=0x4) 0
2321@1456171456.092734:vfio_pci_read_config  (0000:00:16.4, @0x30, len=0x4) 0
2321@1456171456.092749:vfio_pci_read_config  (0000:00:16.4, @0x34, len=0x4) 50
2321@1456171456.092764:vfio_pci_read_config  (0000:00:16.4, @0x38, len=0x4) 0
2321@1456171456.092779:vfio_pci_read_config  (0000:00:16.4, @0x3c, len=0x4) 1ff
2321@1456171456.092796:vfio_pci_read_config  (0000:00:16.4, @0xb, len=0x1) 7
2321@1456171456.092812:vfio_pci_read_config  (0000:00:16.4, @0xa, len=0x1) 80
2321@1456171456.092831:vfio_pci_read_config  (0000:00:16.4, @0x0, len=0x4) 9d3e8086
2321@1456171456.092848:vfio_pci_read_config  (0000:00:16.4, @0x4, len=0x4) 100006
2321@1456171456.092863:vfio_pci_read_config  (0000:00:16.4, @0x8, len=0x4) 7800021
2321@1456171456.092878:vfio_pci_read_config  (0000:00:16.4, @0xc, len=0x4) 0
2321@1456171456.092892:vfio_pci_read_config  (0000:00:16.4, @0x10, len=0x4) 81000004
2321@1456171456.092906:vfio_pci_read_config  (0000:00:16.4, @0x14, len=0x4) 0
2321@1456171456.092920:vfio_pci_read_config  (0000:00:16.4, @0x18, len=0x4) 0
2321@1456171456.092936:vfio_pci_read_config  (0000:00:16.4, @0x1c, len=0x4) 0
2321@1456171456.092950:vfio_pci_read_config  (0000:00:16.4, @0x20, len=0x4) 0
2321@1456171456.092964:vfio_pci_read_config  (0000:00:16.4, @0x24, len=0x4) 0
2321@1456171456.092979:vfio_pci_read_config  (0000:00:16.4, @0x28, len=0x4) 0
2321@1456171456.092993:vfio_pci_read_config  (0000:00:16.4, @0x2c, len=0x4) 0
2321@1456171456.093008:vfio_pci_read_config  (0000:00:16.4, @0x30, len=0x4) 0
2321@1456171456.093023:vfio_pci_read_config  (0000:00:16.4, @0x34, len=0x4) 50
2321@1456171456.093038:vfio_pci_read_config  (0000:00:16.4, @0x38, len=0x4) 0
2321@1456171456.093053:vfio_pci_read_config  (0000:00:16.4, @0x3c, len=0x4) 1ff
2321@1456171456.153135:vfio_pci_read_config  (0000:00:16.4, @0x4, len=0x2) 6
2321@1456171456.153155:vfio_pci_write_config  (0000:00:16.4, @0x4, 0x6, len=0x2)
2321@1456171456.153178:vfio_pci_read_config  (0000:00:16.4, @0x4, len=0x2) 6
2321@1456171456.153195:vfio_pci_write_config  (0000:00:16.4, @0x4, 0x6, len=0x2)
2321@1456171456.153213:vfio_pci_read_config  (0000:00:16.4, @0x0, len=0x4) 9d3e8086
2321@1456171456.153230:vfio_pci_read_config  (0000:00:16.4, @0x8, len=0x4) 7800021
2321@1456171456.153244:vfio_pci_read_config  (0000:00:16.4, @0x3c, len=0x1) ff
2321@1456171456.153259:vfio_pci_read_config  (0000:00:16.4, @0x10, len=0x4) 81000004
2321@1456171456.153273:vfio_pci_read_config  (0000:00:16.4, @0x14, len=0x4) 0
2321@1456171456.153288:vfio_pci_read_config  (0000:00:16.4, @0x18, len=0x4) 0
2321@1456171456.153302:vfio_pci_read_config  (0000:00:16.4, @0x1c, len=0x4) 0
2321@1456171456.153316:vfio_pci_read_config  (0000:00:16.4, @0x20, len=0x4) 0
2321@1456171456.153330:vfio_pci_read_config  (0000:00:16.4, @0x24, len=0x4) 0
2321@1456171456.153348:vfio_pci_read_config  (0000:00:16.4, @0x9, len=0x1) 0
2321@1456171456.153364:vfio_pci_read_config  (0000:00:16.4, @0xa, len=0x1) 80
2321@1456171456.153382:vfio_pci_read_config  (0000:00:16.4, @0xb, len=0x1) 7
2321@1456171456.153399:vfio_pci_read_config  (0000:00:16.4, @0x9, len=0x1) 0
2321@1456171456.153415:vfio_pci_read_config  (0000:00:16.4, @0xa, len=0x1) 80
2321@1456171456.153431:vfio_pci_read_config  (0000:00:16.4, @0xb, len=0x1) 7
2321@1456171456.153448:vfio_pci_read_config  (0000:00:16.4, @0x9, len=0x1) 0
2321@1456171456.153465:vfio_pci_read_config  (0000:00:16.4, @0xa, len=0x1) 80
2321@1456171456.153481:vfio_pci_read_config  (0000:00:16.4, @0xb, len=0x1) 7
2321@1456171456.153496:vfio_pci_read_config  (0000:00:16.4, @0x0, len=0x4) 9d3e8086
2321@1456171456.153513:vfio_pci_read_config  (0000:00:16.4, @0x4, len=0x4) 100006
2321@1456171456.153529:vfio_pci_read_config  (0000:00:16.4, @0x8, len=0x4) 7800021
2321@1456171456.153546:vfio_pci_read_config  (0000:00:16.4, @0xc, len=0x4) 0
2321@1456171456.153559:vfio_pci_read_config  (0000:00:16.4, @0x10, len=0x4) 81000004
2321@1456171456.153574:vfio_pci_read_config  (0000:00:16.4, @0x14, len=0x4) 0
2321@1456171456.153591:vfio_pci_read_config  (0000:00:16.4, @0x18, len=0x4) 0
2321@1456171456.153605:vfio_pci_read_config  (0000:00:16.4, @0x1c, len=0x4) 0
2321@1456171456.153619:vfio_pci_read_config  (0000:00:16.4, @0x20, len=0x4) 0
2321@1456171456.153633:vfio_pci_read_config  (0000:00:16.4, @0x24, len=0x4) 0
2321@1456171456.153649:vfio_pci_read_config  (0000:00:16.4, @0x28, len=0x4) 0
2321@1456171456.153665:vfio_pci_read_config  (0000:00:16.4, @0x2c, len=0x4) 0
2321@1456171456.153680:vfio_pci_read_config  (0000:00:16.4, @0x30, len=0x4) 0
2321@1456171456.153700:vfio_pci_read_config  (0000:00:16.4, @0x34, len=0x4) 50
2321@1456171456.153716:vfio_pci_read_config  (0000:00:16.4, @0x38, len=0x4) 0
2321@1456171456.153732:vfio_pci_read_config  (0000:00:16.4, @0x3c, len=0x4) 1ff
2321@1456171456.153747:vfio_pci_read_config  (0000:00:16.4, @0x0, len=0x4) 9d3e8086
2321@1456171456.153764:vfio_pci_read_config  (0000:00:16.4, @0x4, len=0x4) 100006
2321@1456171456.153780:vfio_pci_read_config  (0000:00:16.4, @0x8, len=0x4) 7800021
2321@1456171456.153796:vfio_pci_read_config  (0000:00:16.4, @0xc, len=0x4) 0
2321@1456171456.153810:vfio_pci_read_config  (0000:00:16.4, @0x10, len=0x4) 81000004
2321@1456171456.153824:vfio_pci_read_config  (0000:00:16.4, @0x14, len=0x4) 0
2321@1456171456.153838:vfio_pci_read_config  (0000:00:16.4, @0x18, len=0x4) 0
2321@1456171456.153852:vfio_pci_read_config  (0000:00:16.4, @0x1c, len=0x4) 0
2321@1456171456.153867:vfio_pci_read_config  (0000:00:16.4, @0x20, len=0x4) 0
2321@1456171456.153881:vfio_pci_read_config  (0000:00:16.4, @0x24, len=0x4) 0
2321@1456171456.153897:vfio_pci_read_config  (0000:00:16.4, @0x28, len=0x4) 0
2321@1456171456.153913:vfio_pci_read_config  (0000:00:16.4, @0x2c, len=0x4) 0
2321@1456171456.153928:vfio_pci_read_config  (0000:00:16.4, @0x30, len=0x4) 0
2321@1456171456.153944:vfio_pci_read_config  (0000:00:16.4, @0x34, len=0x4) 50
2321@1456171456.153960:vfio_pci_read_config  (0000:00:16.4, @0x38, len=0x4) 0
2321@1456171456.153976:vfio_pci_read_config  (0000:00:16.4, @0x3c, len=0x4) 1ff
2321@1456171456.153991:vfio_pci_read_config  (0000:00:16.4, @0x0, len=0x4) 9d3e8086
2321@1456171456.154008:vfio_pci_read_config  (0000:00:16.4, @0x4, len=0x4) 100006
2321@1456171456.154026:vfio_pci_read_config  (0000:00:16.4, @0x8, len=0x4) 7800021
2321@1456171456.154042:vfio_pci_read_config  (0000:00:16.4, @0xc, len=0x4) 0
2321@1456171456.154056:vfio_pci_read_config  (0000:00:16.4, @0x10, len=0x4) 81000004
2321@1456171456.154070:vfio_pci_read_config  (0000:00:16.4, @0x14, len=0x4) 0
2321@1456171456.154084:vfio_pci_read_config  (0000:00:16.4, @0x18, len=0x4) 0
2321@1456171456.154116:vfio_pci_read_config  (0000:00:16.4, @0x1c, len=0x4) 0
2321@1456171456.154131:vfio_pci_read_config  (0000:00:16.4, @0x20, len=0x4) 0
2321@1456171456.154145:vfio_pci_read_config  (0000:00:16.4, @0x24, len=0x4) 0
2321@1456171456.154161:vfio_pci_read_config  (0000:00:16.4, @0x28, len=0x4) 0
2321@1456171456.154177:vfio_pci_read_config  (0000:00:16.4, @0x2c, len=0x4) 0
2321@1456171456.154192:vfio_pci_read_config  (0000:00:16.4, @0x30, len=0x4) 0
2321@1456171456.154208:vfio_pci_read_config  (0000:00:16.4, @0x34, len=0x4) 50
2321@1456171456.154224:vfio_pci_read_config  (0000:00:16.4, @0x38, len=0x4) 0
2321@1456171456.154240:vfio_pci_read_config  (0000:00:16.4, @0x3c, len=0x4) 1ff
2321@1456171456.154259:vfio_pci_read_config  (0000:00:16.4, @0xb, len=0x1) 7
2321@1456171456.154276:vfio_pci_read_config  (0000:00:16.4, @0xa, len=0x1) 80
2321@1456171456.154291:vfio_pci_read_config  (0000:00:16.4, @0x0, len=0x4) 9d3e8086
2321@1456171456.154307:vfio_pci_read_config  (0000:00:16.4, @0x4, len=0x4) 100006
2321@1456171456.154325:vfio_pci_read_config  (0000:00:16.4, @0x8, len=0x4) 7800021
2321@1456171456.154342:vfio_pci_read_config  (0000:00:16.4, @0xc, len=0x4) 0
2321@1456171456.154356:vfio_pci_read_config  (0000:00:16.4, @0x10, len=0x4) 81000004
2321@1456171456.154373:vfio_pci_read_config  (0000:00:16.4, @0x14, len=0x4) 0
2321@1456171456.154387:vfio_pci_read_config  (0000:00:16.4, @0x18, len=0x4) 0
2321@1456171456.154401:vfio_pci_read_config  (0000:00:16.4, @0x1c, len=0x4) 0
2321@1456171456.154431:vfio_pci_read_config  (0000:00:16.4, @0x20, len=0x4) 0
2321@1456171456.154447:vfio_pci_read_config  (0000:00:16.4, @0x24, len=0x4) 0
2321@1456171456.154463:vfio_pci_read_config  (0000:00:16.4, @0x28, len=0x4) 0
2321@1456171456.154488:vfio_pci_read_config  (0000:00:16.4, @0x2c, len=0x4) 0
2321@1456171456.154504:vfio_pci_read_config  (0000:00:16.4, @0x30, len=0x4) 0
2321@1456171456.154525:vfio_pci_read_config  (0000:00:16.4, @0x34, len=0x4) 50
2321@1456171456.154542:vfio_pci_read_config  (0000:00:16.4, @0x38, len=0x4) 0
2321@1456171456.154559:vfio_pci_read_config  (0000:00:16.4, @0x3c, len=0x4) 1ff
2321@1456171456.696244:vfio_intx_update  (0000:00:16.4) IRQ moved -1 -> 10
2321@1456171456.696281:vfio_intx_enable_kvm  (0000:00:16.4) KVM INTx accel enabled
2321@1456171456.697572:vfio_pci_read_config  (0000:00:16.4, @0x0, len=0x4) 9d3e8086
2321@1456171456.697588:vfio_pci_read_config  (0000:00:16.4, @0x4, len=0x4) 100006
2321@1456171456.697602:vfio_pci_read_config  (0000:00:16.4, @0x8, len=0x4) 7800021
2321@1456171456.697617:vfio_pci_read_config  (0000:00:16.4, @0xc, len=0x4) 0
2321@1456171456.697631:vfio_pci_read_config  (0000:00:16.4, @0x10, len=0x4) 81000004
2321@1456171456.697644:vfio_pci_read_config  (0000:00:16.4, @0x14, len=0x4) 0
2321@1456171456.697658:vfio_pci_read_config  (0000:00:16.4, @0x18, len=0x4) 0
2321@1456171456.697671:vfio_pci_read_config  (0000:00:16.4, @0x1c, len=0x4) 0
2321@1456171456.697685:vfio_pci_read_config  (0000:00:16.4, @0x20, len=0x4) 0
2321@1456171456.697698:vfio_pci_read_config  (0000:00:16.4, @0x24, len=0x4) 0
2321@1456171456.697712:vfio_pci_read_config  (0000:00:16.4, @0x28, len=0x4) 0
2321@1456171456.697727:vfio_pci_read_config  (0000:00:16.4, @0x2c, len=0x4) 0
2321@1456171456.697741:vfio_pci_read_config  (0000:00:16.4, @0x30, len=0x4) 0
2321@1456171456.697755:vfio_pci_read_config  (0000:00:16.4, @0x34, len=0x4) 50
2321@1456171456.697770:vfio_pci_read_config  (0000:00:16.4, @0x38, len=0x4) 0
2321@1456171456.697784:vfio_pci_read_config  (0000:00:16.4, @0x3c, len=0x4) 1ff
2321@1456171456.697805:vfio_pci_write_config  (0000:00:16.4, @0x3c, 0xb, len=0x1)
2321@1456171456.777728:vfio_pci_read_config  (0000:00:16.4, @0x4, len=0x2) 6
2321@1456171456.777747:vfio_pci_write_config  (0000:00:16.4, @0x4, 0x6, len=0x2)
2321@1456171456.777773:vfio_pci_read_config  (0000:00:16.4, @0x4, len=0x2) 6
2321@1456171456.777789:vfio_pci_write_config  (0000:00:16.4, @0x4, 0x6, len=0x2)
2321@1456171456.777808:vfio_pci_read_config  (0000:00:16.4, @0x0, len=0x4) 9d3e8086
2321@1456171456.777827:vfio_pci_read_config  (0000:00:16.4, @0x8, len=0x4) 7800021
2321@1456171456.777841:vfio_pci_read_config  (0000:00:16.4, @0x3c, len=0x1) b
2321@1456171456.777855:vfio_pci_read_config  (0000:00:16.4, @0x10, len=0x4) 81000004
2321@1456171456.777869:vfio_pci_read_config  (0000:00:16.4, @0x14, len=0x4) 0
2321@1456171456.777883:vfio_pci_read_config  (0000:00:16.4, @0x18, len=0x4) 0
2321@1456171456.777896:vfio_pci_read_config  (0000:00:16.4, @0x1c, len=0x4) 0
2321@1456171456.777910:vfio_pci_read_config  (0000:00:16.4, @0x20, len=0x4) 0
2321@1456171456.777923:vfio_pci_read_config  (0000:00:16.4, @0x24, len=0x4) 0
2321@1456171456.777943:vfio_pci_read_config  (0000:00:16.4, @0x9, len=0x1) 0
2321@1456171456.777962:vfio_pci_read_config  (0000:00:16.4, @0xa, len=0x1) 80
2321@1456171456.777981:vfio_pci_read_config  (0000:00:16.4, @0xb, len=0x1) 7
2321@1456171456.778000:vfio_pci_read_config  (0000:00:16.4, @0x9, len=0x1) 0
2321@1456171456.778020:vfio_pci_read_config  (0000:00:16.4, @0xa, len=0x1) 80
2321@1456171456.778038:vfio_pci_read_config  (0000:00:16.4, @0xb, len=0x1) 7
2321@1456171456.778058:vfio_pci_read_config  (0000:00:16.4, @0x9, len=0x1) 0
2321@1456171456.778078:vfio_pci_read_config  (0000:00:16.4, @0xa, len=0x1) 80
2321@1456171456.778096:vfio_pci_read_config  (0000:00:16.4, @0xb, len=0x1) 7
2321@1456171456.778111:vfio_pci_read_config  (0000:00:16.4, @0x0, len=0x4) 9d3e8086
2321@1456171456.778130:vfio_pci_read_config  (0000:00:16.4, @0x4, len=0x4) 100006
2321@1456171456.778149:vfio_pci_read_config  (0000:00:16.4, @0x8, len=0x4) 7800021
2321@1456171456.778170:vfio_pci_read_config  (0000:00:16.4, @0xc, len=0x4) 0
2321@1456171456.778184:vfio_pci_read_config  (0000:00:16.4, @0x10, len=0x4) 81000004
2321@1456171456.778198:vfio_pci_read_config  (0000:00:16.4, @0x14, len=0x4) 0
2321@1456171456.778211:vfio_pci_read_config  (0000:00:16.4, @0x18, len=0x4) 0
2321@1456171456.778225:vfio_pci_read_config  (0000:00:16.4, @0x1c, len=0x4) 0
2321@1456171456.778238:vfio_pci_read_config  (0000:00:16.4, @0x20, len=0x4) 0
2321@1456171456.778252:vfio_pci_read_config  (0000:00:16.4, @0x24, len=0x4) 0
2321@1456171456.778266:vfio_pci_read_config  (0000:00:16.4, @0x28, len=0x4) 0
2321@1456171456.778282:vfio_pci_read_config  (0000:00:16.4, @0x2c, len=0x4) 0
2321@1456171456.778297:vfio_pci_read_config  (0000:00:16.4, @0x30, len=0x4) 0
2321@1456171456.778315:vfio_pci_read_config  (0000:00:16.4, @0x34, len=0x4) 50
2321@1456171456.778333:vfio_pci_read_config  (0000:00:16.4, @0x38, len=0x4) 0
2321@1456171456.778352:vfio_pci_read_config  (0000:00:16.4, @0x3c, len=0x4) 10b
2321@1456171456.778366:vfio_pci_read_config  (0000:00:16.4, @0x0, len=0x4) 9d3e8086
2321@1456171456.778387:vfio_pci_read_config  (0000:00:16.4, @0x4, len=0x4) 100006
2321@1456171456.778405:vfio_pci_read_config  (0000:00:16.4, @0x8, len=0x4) 7800021
2321@1456171456.778423:vfio_pci_read_config  (0000:00:16.4, @0xc, len=0x4) 0
2321@1456171456.778437:vfio_pci_read_config  (0000:00:16.4, @0x10, len=0x4) 81000004
2321@1456171456.778450:vfio_pci_read_config  (0000:00:16.4, @0x14, len=0x4) 0
2321@1456171456.778464:vfio_pci_read_config  (0000:00:16.4, @0x18, len=0x4) 0
2321@1456171456.778477:vfio_pci_read_config  (0000:00:16.4, @0x1c, len=0x4) 0
2321@1456171456.778490:vfio_pci_read_config  (0000:00:16.4, @0x20, len=0x4) 0
2321@1456171456.778504:vfio_pci_read_config  (0000:00:16.4, @0x24, len=0x4) 0
2321@1456171456.778522:vfio_pci_read_config  (0000:00:16.4, @0x28, len=0x4) 0
2321@1456171456.778540:vfio_pci_read_config  (0000:00:16.4, @0x2c, len=0x4) 0
2321@1456171456.778554:vfio_pci_read_config  (0000:00:16.4, @0x30, len=0x4) 0
2321@1456171456.778573:vfio_pci_read_config  (0000:00:16.4, @0x34, len=0x4) 50
2321@1456171456.778592:vfio_pci_read_config  (0000:00:16.4, @0x38, len=0x4) 0
2321@1456171456.778610:vfio_pci_read_config  (0000:00:16.4, @0x3c, len=0x4) 10b
2321@1456171456.778628:vfio_pci_read_config  (0000:00:16.4, @0x0, len=0x4) 9d3e8086
2321@1456171456.778646:vfio_pci_read_config  (0000:00:16.4, @0x4, len=0x4) 100006
2321@1456171456.778665:vfio_pci_read_config  (0000:00:16.4, @0x8, len=0x4) 7800021
2321@1456171456.778683:vfio_pci_read_config  (0000:00:16.4, @0xc, len=0x4) 0
2321@1456171456.778697:vfio_pci_read_config  (0000:00:16.4, @0x10, len=0x4) 81000004
2321@1456171456.778710:vfio_pci_read_config  (0000:00:16.4, @0x14, len=0x4) 0
2321@1456171456.778724:vfio_pci_read_config  (0000:00:16.4, @0x18, len=0x4) 0
2321@1456171456.778737:vfio_pci_read_config  (0000:00:16.4, @0x1c, len=0x4) 0
2321@1456171456.778751:vfio_pci_read_config  (0000:00:16.4, @0x20, len=0x4) 0
2321@1456171456.778764:vfio_pci_read_config  (0000:00:16.4, @0x24, len=0x4) 0
2321@1456171456.778778:vfio_pci_read_config  (0000:00:16.4, @0x28, len=0x4) 0
2321@1456171456.778792:vfio_pci_read_config  (0000:00:16.4, @0x2c, len=0x4) 0
2321@1456171456.778806:vfio_pci_read_config  (0000:00:16.4, @0x30, len=0x4) 0
2321@1456171456.778820:vfio_pci_read_config  (0000:00:16.4, @0x34, len=0x4) 50
2321@1456171456.778835:vfio_pci_read_config  (0000:00:16.4, @0x38, len=0x4) 0
2321@1456171456.778849:vfio_pci_read_config  (0000:00:16.4, @0x3c, len=0x4) 10b
2321@1456171456.778866:vfio_pci_read_config  (0000:00:16.4, @0xb, len=0x1) 7
2321@1456171456.778880:vfio_pci_read_config  (0000:00:16.4, @0xa, len=0x1) 80
2321@1456171456.778895:vfio_pci_read_config  (0000:00:16.4, @0x0, len=0x4) 9d3e8086
2321@1456171456.778909:vfio_pci_read_config  (0000:00:16.4, @0x4, len=0x4) 100006
2321@1456171456.778924:vfio_pci_read_config  (0000:00:16.4, @0x8, len=0x4) 7800021
2321@1456171456.778938:vfio_pci_read_config  (0000:00:16.4, @0xc, len=0x4) 0
2321@1456171456.778951:vfio_pci_read_config  (0000:00:16.4, @0x10, len=0x4) 81000004
2321@1456171456.779011:vfio_pci_read_config  (0000:00:16.4, @0x14, len=0x4) 0
2321@1456171456.779025:vfio_pci_read_config  (0000:00:16.4, @0x18, len=0x4) 0
2321@1456171456.779038:vfio_pci_read_config  (0000:00:16.4, @0x1c, len=0x4) 0
2321@1456171456.779052:vfio_pci_read_config  (0000:00:16.4, @0x20, len=0x4) 0
2321@1456171456.779065:vfio_pci_read_config  (0000:00:16.4, @0x24, len=0x4) 0
2321@1456171456.779164:vfio_pci_read_config  (0000:00:16.4, @0x28, len=0x4) 0
2321@1456171456.779181:vfio_pci_read_config  (0000:00:16.4, @0x2c, len=0x4) 0
2321@1456171456.779195:vfio_pci_read_config  (0000:00:16.4, @0x30, len=0x4) 0
2321@1456171456.779209:vfio_pci_read_config  (0000:00:16.4, @0x34, len=0x4) 50
2321@1456171456.779224:vfio_pci_read_config  (0000:00:16.4, @0x38, len=0x4) 0
2321@1456171456.779238:vfio_pci_read_config  (0000:00:16.4, @0x3c, len=0x4) 10b
2321@1456171457.322632:vfio_pci_read_config  (0000:00:16.4, @0x4, len=0x2) 6
2321@1456171457.322652:vfio_pci_write_config  (0000:00:16.4, @0x4, 0x6, len=0x2)
2321@1456171457.322684:vfio_pci_read_config  (0000:00:16.4, @0x4, len=0x2) 6
2321@1456171457.322700:vfio_pci_write_config  (0000:00:16.4, @0x4, 0x6, len=0x2)
2321@1456171457.322723:vfio_pci_read_config  (0000:00:16.4, @0x0, len=0x4) 9d3e8086
2321@1456171457.322743:vfio_pci_read_config  (0000:00:16.4, @0x8, len=0x4) 7800021
2321@1456171457.322757:vfio_pci_read_config  (0000:00:16.4, @0x3c, len=0x1) b
2321@1456171457.322770:vfio_pci_read_config  (0000:00:16.4, @0x10, len=0x4) 81000004
2321@1456171457.322784:vfio_pci_read_config  (0000:00:16.4, @0x14, len=0x4) 0
2321@1456171457.322801:vfio_pci_read_config  (0000:00:16.4, @0x18, len=0x4) 0
2321@1456171457.322815:vfio_pci_read_config  (0000:00:16.4, @0x1c, len=0x4) 0
2321@1456171457.322829:vfio_pci_read_config  (0000:00:16.4, @0x20, len=0x4) 0
2321@1456171457.322842:vfio_pci_read_config  (0000:00:16.4, @0x24, len=0x4) 0
2321@1456171457.322863:vfio_pci_read_config  (0000:00:16.4, @0x9, len=0x1) 0
2321@1456171457.322883:vfio_pci_read_config  (0000:00:16.4, @0xa, len=0x1) 80
2321@1456171457.322902:vfio_pci_read_config  (0000:00:16.4, @0xb, len=0x1) 7
2321@1456171457.322925:vfio_pci_read_config  (0000:00:16.4, @0x9, len=0x1) 0
2321@1456171457.322945:vfio_pci_read_config  (0000:00:16.4, @0xa, len=0x1) 80
2321@1456171457.322964:vfio_pci_read_config  (0000:00:16.4, @0xb, len=0x1) 7
2321@1456171457.322985:vfio_pci_read_config  (0000:00:16.4, @0x9, len=0x1) 0
2321@1456171457.323004:vfio_pci_read_config  (0000:00:16.4, @0xa, len=0x1) 80
2321@1456171457.323023:vfio_pci_read_config  (0000:00:16.4, @0xb, len=0x1) 7
2321@1456171457.323039:vfio_pci_read_config  (0000:00:16.4, @0x0, len=0x4) 9d3e8086
2321@1456171457.323059:vfio_pci_read_config  (0000:00:16.4, @0x4, len=0x4) 100006
2321@1456171457.323079:vfio_pci_read_config  (0000:00:16.4, @0x8, len=0x4) 7800021
2321@1456171457.323099:vfio_pci_read_config  (0000:00:16.4, @0xc, len=0x4) 0
2321@1456171457.323112:vfio_pci_read_config  (0000:00:16.4, @0x10, len=0x4) 81000004
2321@1456171457.323126:vfio_pci_read_config  (0000:00:16.4, @0x14, len=0x4) 0
2321@1456171457.323139:vfio_pci_read_config  (0000:00:16.4, @0x18, len=0x4) 0
2321@1456171457.323153:vfio_pci_read_config  (0000:00:16.4, @0x1c, len=0x4) 0
2321@1456171457.323166:vfio_pci_read_config  (0000:00:16.4, @0x20, len=0x4) 0
2321@1456171457.323179:vfio_pci_read_config  (0000:00:16.4, @0x24, len=0x4) 0
2321@1456171457.323199:vfio_pci_read_config  (0000:00:16.4, @0x28, len=0x4) 0
2321@1456171457.323218:vfio_pci_read_config  (0000:00:16.4, @0x2c, len=0x4) 0
2321@1456171457.323232:vfio_pci_read_config  (0000:00:16.4, @0x30, len=0x4) 0
2321@1456171457.323251:vfio_pci_read_config  (0000:00:16.4, @0x34, len=0x4) 50
2321@1456171457.323270:vfio_pci_read_config  (0000:00:16.4, @0x38, len=0x4) 0
2321@1456171457.323290:vfio_pci_read_config  (0000:00:16.4, @0x3c, len=0x4) 10b
2321@1456171457.323313:vfio_pci_read_config  (0000:00:16.4, @0x0, len=0x4) 9d3e8086
2321@1456171457.323332:vfio_pci_read_config  (0000:00:16.4, @0x4, len=0x4) 100006
2321@1456171457.323352:vfio_pci_read_config  (0000:00:16.4, @0x8, len=0x4) 7800021
2321@1456171457.323372:vfio_pci_read_config  (0000:00:16.4, @0xc, len=0x4) 0
2321@1456171457.323385:vfio_pci_read_config  (0000:00:16.4, @0x10, len=0x4) 81000004
2321@1456171457.323399:vfio_pci_read_config  (0000:00:16.4, @0x14, len=0x4) 0
2321@1456171457.323412:vfio_pci_read_config  (0000:00:16.4, @0x18, len=0x4) 0
2321@1456171457.323426:vfio_pci_read_config  (0000:00:16.4, @0x1c, len=0x4) 0
2321@1456171457.323439:vfio_pci_read_config  (0000:00:16.4, @0x20, len=0x4) 0
2321@1456171457.323452:vfio_pci_read_config  (0000:00:16.4, @0x24, len=0x4) 0
2321@1456171457.323472:vfio_pci_read_config  (0000:00:16.4, @0x28, len=0x4) 0
2321@1456171457.323491:vfio_pci_read_config  (0000:00:16.4, @0x2c, len=0x4) 0
2321@1456171457.323505:vfio_pci_read_config  (0000:00:16.4, @0x30, len=0x4) 0
2321@1456171457.323524:vfio_pci_read_config  (0000:00:16.4, @0x34, len=0x4) 50
2321@1456171457.323544:vfio_pci_read_config  (0000:00:16.4, @0x38, len=0x4) 0
2321@1456171457.323563:vfio_pci_read_config  (0000:00:16.4, @0x3c, len=0x4) 10b
2321@1456171457.323578:vfio_pci_read_config  (0000:00:16.4, @0x0, len=0x4) 9d3e8086
2321@1456171457.323598:vfio_pci_read_config  (0000:00:16.4, @0x4, len=0x4) 100006
2321@1456171457.323618:vfio_pci_read_config  (0000:00:16.4, @0x8, len=0x4) 7800021
2321@1456171457.323637:vfio_pci_read_config  (0000:00:16.4, @0xc, len=0x4) 0
2321@1456171457.323651:vfio_pci_read_config  (0000:00:16.4, @0x10, len=0x4) 81000004
2321@1456171457.323664:vfio_pci_read_config  (0000:00:16.4, @0x14, len=0x4) 0
2321@1456171457.323678:vfio_pci_read_config  (0000:00:16.4, @0x18, len=0x4) 0
2321@1456171457.323691:vfio_pci_read_config  (0000:00:16.4, @0x1c, len=0x4) 0
2321@1456171457.323704:vfio_pci_read_config  (0000:00:16.4, @0x20, len=0x4) 0
2321@1456171457.323721:vfio_pci_read_config  (0000:00:16.4, @0x24, len=0x4) 0
2321@1456171457.323740:vfio_pci_read_config  (0000:00:16.4, @0x28, len=0x4) 0
2321@1456171457.323759:vfio_pci_read_config  (0000:00:16.4, @0x2c, len=0x4) 0
2321@1456171457.323776:vfio_pci_read_config  (0000:00:16.4, @0x30, len=0x4) 0
2321@1456171457.323796:vfio_pci_read_config  (0000:00:16.4, @0x34, len=0x4) 50
2321@1456171457.323815:vfio_pci_read_config  (0000:00:16.4, @0x38, len=0x4) 0
2321@1456171457.323834:vfio_pci_read_config  (0000:00:16.4, @0x3c, len=0x4) 10b
2321@1456171457.323856:vfio_pci_read_config  (0000:00:16.4, @0xb, len=0x1) 7
2321@1456171457.323876:vfio_pci_read_config  (0000:00:16.4, @0xa, len=0x1) 80
2321@1456171457.323891:vfio_pci_read_config  (0000:00:16.4, @0x0, len=0x4) 9d3e8086
2321@1456171457.323910:vfio_pci_read_config  (0000:00:16.4, @0x4, len=0x4) 100006
2321@1456171457.323930:vfio_pci_read_config  (0000:00:16.4, @0x8, len=0x4) 7800021
2321@1456171457.323949:vfio_pci_read_config  (0000:00:16.4, @0xc, len=0x4) 0
2321@1456171457.323962:vfio_pci_read_config  (0000:00:16.4, @0x10, len=0x4) 81000004
2321@1456171457.323976:vfio_pci_read_config  (0000:00:16.4, @0x14, len=0x4) 0
2321@1456171457.323989:vfio_pci_read_config  (0000:00:16.4, @0x18, len=0x4) 0
2321@1456171457.324003:vfio_pci_read_config  (0000:00:16.4, @0x1c, len=0x4) 0
2321@1456171457.324016:vfio_pci_read_config  (0000:00:16.4, @0x20, len=0x4) 0
2321@1456171457.324030:vfio_pci_read_config  (0000:00:16.4, @0x24, len=0x4) 0
2321@1456171457.324049:vfio_pci_read_config  (0000:00:16.4, @0x28, len=0x4) 0
2321@1456171457.324068:vfio_pci_read_config  (0000:00:16.4, @0x2c, len=0x4) 0
2321@1456171457.324082:vfio_pci_read_config  (0000:00:16.4, @0x30, len=0x4) 0
2321@1456171457.324101:vfio_pci_read_config  (0000:00:16.4, @0x34, len=0x4) 50
2321@1456171457.324127:vfio_pci_read_config  (0000:00:16.4, @0x38, len=0x4) 0
2321@1456171457.324174:vfio_pci_read_config  (0000:00:16.4, @0x3c, len=0x4) 10b
2321@1456171462.978480:vfio_pci_read_config  (0000:00:16.4, @0x0, len=0x2) 8086
2321@1456171462.978492:vfio_pci_read_config  (0000:00:16.4, @0x0, len=0x4) 9d3e8086
2321@1456171462.978507:vfio_pci_read_config  (0000:00:16.4, @0x4, len=0x4) 100006
2321@1456171462.978517:vfio_pci_read_config  (0000:00:16.4, @0x8, len=0x4) 7800021
2321@1456171462.978527:vfio_pci_read_config  (0000:00:16.4, @0xc, len=0x4) 0
2321@1456171463.650744:vfio_pci_read_config  (0000:00:16.4, @0x0, len=0x4) 9d3e8086
2321@1456171463.650764:vfio_pci_read_config  (0000:00:16.4, @0x4, len=0x4) 100006
2321@1456171463.650779:vfio_pci_read_config  (0000:00:16.4, @0x8, len=0x4) 7800021
2321@1456171463.650793:vfio_pci_read_config  (0000:00:16.4, @0xc, len=0x4) 0
2321@1456171463.650803:vfio_pci_read_config  (0000:00:16.4, @0x10, len=0x4) 81000004
2321@1456171463.650812:vfio_pci_read_config  (0000:00:16.4, @0x14, len=0x4) 0
2321@1456171463.650822:vfio_pci_read_config  (0000:00:16.4, @0x18, len=0x4) 0
2321@1456171463.650831:vfio_pci_read_config  (0000:00:16.4, @0x1c, len=0x4) 0
2321@1456171463.650840:vfio_pci_read_config  (0000:00:16.4, @0x20, len=0x4) 0
2321@1456171463.650849:vfio_pci_read_config  (0000:00:16.4, @0x24, len=0x4) 0
2321@1456171463.650863:vfio_pci_read_config  (0000:00:16.4, @0x28, len=0x4) 0
2321@1456171463.650877:vfio_pci_read_config  (0000:00:16.4, @0x2c, len=0x4) 0
2321@1456171463.650887:vfio_pci_read_config  (0000:00:16.4, @0x30, len=0x4) 0
2321@1456171463.650904:vfio_pci_read_config  (0000:00:16.4, @0x34, len=0x4) 50
2321@1456171463.650918:vfio_pci_read_config  (0000:00:16.4, @0x38, len=0x4) 0
2321@1456171463.650932:vfio_pci_read_config  (0000:00:16.4, @0x3c, len=0x4) 10b
2321@1456171463.650944:vfio_pci_read_config  (0000:00:16.4, @0x0, len=0x4) 9d3e8086
2321@1456171463.650958:vfio_pci_read_config  (0000:00:16.4, @0x4, len=0x4) 100006
2321@1456171463.650972:vfio_pci_read_config  (0000:00:16.4, @0x8, len=0x4) 7800021
2321@1456171463.650986:vfio_pci_read_config  (0000:00:16.4, @0xc, len=0x4) 0
2321@1456171463.650995:vfio_pci_read_config  (0000:00:16.4, @0x10, len=0x4) 81000004
2321@1456171463.651005:vfio_pci_read_config  (0000:00:16.4, @0x14, len=0x4) 0
2321@1456171463.651014:vfio_pci_read_config  (0000:00:16.4, @0x18, len=0x4) 0
2321@1456171463.651023:vfio_pci_read_config  (0000:00:16.4, @0x1c, len=0x4) 0
2321@1456171463.651032:vfio_pci_read_config  (0000:00:16.4, @0x20, len=0x4) 0
2321@1456171463.651041:vfio_pci_read_config  (0000:00:16.4, @0x24, len=0x4) 0
2321@1456171463.651055:vfio_pci_read_config  (0000:00:16.4, @0x28, len=0x4) 0
2321@1456171463.651069:vfio_pci_read_config  (0000:00:16.4, @0x2c, len=0x4) 0
2321@1456171463.651079:vfio_pci_read_config  (0000:00:16.4, @0x30, len=0x4) 0
2321@1456171463.651093:vfio_pci_read_config  (0000:00:16.4, @0x34, len=0x4) 50
2321@1456171463.651107:vfio_pci_read_config  (0000:00:16.4, @0x38, len=0x4) 0
2321@1456171463.651121:vfio_pci_read_config  (0000:00:16.4, @0x3c, len=0x4) 10b
2321@1456171463.660880:vfio_intx_update  (0000:00:16.4) IRQ moved 10 -> -1
2321@1456171463.660958:vfio_intx_disable_kvm  (0000:00:16.4) KVM INTx accel disabled
2321@1456171463.672927:vfio_pci_read_config  (0000:00:16.4, @0x0, len=0x4) 9d3e8086
2321@1456171463.672944:vfio_pci_read_config  (0000:00:16.4, @0x4, len=0x4) 100006
2321@1456171463.672967:vfio_pci_read_config  (0000:00:16.4, @0x8, len=0x4) 7800021
2321@1456171463.672982:vfio_pci_read_config  (0000:00:16.4, @0xc, len=0x4) 0
2321@1456171463.672992:vfio_pci_read_config  (0000:00:16.4, @0x10, len=0x4) 81000004
2321@1456171463.673001:vfio_pci_read_config  (0000:00:16.4, @0x14, len=0x4) 0
2321@1456171463.673011:vfio_pci_read_config  (0000:00:16.4, @0x18, len=0x4) 0
2321@1456171463.673020:vfio_pci_read_config  (0000:00:16.4, @0x1c, len=0x4) 0
2321@1456171463.673029:vfio_pci_read_config  (0000:00:16.4, @0x20, len=0x4) 0
2321@1456171463.673038:vfio_pci_read_config  (0000:00:16.4, @0x24, len=0x4) 0
2321@1456171463.673053:vfio_pci_read_config  (0000:00:16.4, @0x28, len=0x4) 0
2321@1456171463.673067:vfio_pci_read_config  (0000:00:16.4, @0x2c, len=0x4) 0
2321@1456171463.673077:vfio_pci_read_config  (0000:00:16.4, @0x30, len=0x4) 0
2321@1456171463.673092:vfio_pci_read_config  (0000:00:16.4, @0x34, len=0x4) 50
2321@1456171463.673107:vfio_pci_read_config  (0000:00:16.4, @0x38, len=0x4) 0
2321@1456171463.673121:vfio_pci_read_config  (0000:00:16.4, @0x3c, len=0x4) 10b
2321@1456171463.687247:vfio_listener_region_del region_del 80000000 - 80ffffff
2321@1456171463.688666:vfio_listener_region_del_skip SKIPPING region_del 81003400 - 8100341f
2321@1456171463.688672:vfio_listener_region_del_skip SKIPPING region_del 81003500 - 81003515
2321@1456171463.688674:vfio_listener_region_del_skip SKIPPING region_del 81003600 - 81003607
2321@1456171463.690661:vfio_listener_region_add_ram region_add [ram] 80000000 - 80ffffff [0x7f6a18200000]
2321@1456171463.691970:vfio_listener_region_add_skip SKIPPING region_add 81003400 - 8100341f
2321@1456171463.691977:vfio_listener_region_add_skip SKIPPING region_add 81003500 - 81003515
2321@1456171463.691979:vfio_listener_region_add_skip SKIPPING region_add 81003600 - 81003607
2321@1456171463.696983:vfio_listener_region_del_skip SKIPPING region_del 81002000 - 8100202f
2321@1456171463.696989:vfio_listener_region_del_skip SKIPPING region_del 81002800 - 81002807
2321@1456171463.700150:vfio_listener_region_add_skip SKIPPING region_add 81002000 - 8100202f
2321@1456171463.700156:vfio_listener_region_add_skip SKIPPING region_add 81002800 - 81002807
2321@1456171463.702505:vfio_pci_read_config  (0000:00:16.4, @0x0, len=0x2) 8086
2321@1456171463.702522:vfio_pci_read_config  (0000:00:16.4, @0x2, len=0x2) 9d3e
2321@1456171463.702546:vfio_pci_read_config  (0000:00:16.4, @0x8, len=0x1) 21
2321@1456171463.702567:vfio_pci_read_config  (0000:00:16.4, @0x9, len=0x1) 0
2321@1456171463.702588:vfio_pci_read_config  (0000:00:16.4, @0xa, len=0x1) 80
2321@1456171463.702609:vfio_pci_read_config  (0000:00:16.4, @0xb, len=0x1) 7
2321@1456171463.702648:vfio_pci_read_config  (0000:00:16.4, @0xe, len=0x1) 0
2321@1456171463.702671:vfio_pci_read_config  (0000:00:16.4, @0x2c, len=0x2) 0
2321@1456171463.702721:vfio_pci_read_config  (0000:00:16.4, @0x2e, len=0x2) 0
2321@1456171463.702796:vfio_pci_read_config  (0000:00:16.4, @0x6, len=0x2) 10
2321@1456171463.702813:vfio_pci_read_config  (0000:00:16.4, @0x34, len=0x1) 50
2321@1456171463.702834:vfio_pci_read_config  (0000:00:16.4, @0x50, len=0x2) 8c01
2321@1456171463.702849:vfio_pci_read_config  (0000:00:16.4, @0x8c, len=0x2) 5
2321@1456171463.702872:vfio_pci_read_config  (0000:00:16.4, @0x4, len=0x2) 6
2321@1456171463.702888:vfio_pci_read_config  (0000:00:16.4, @0x10, len=0x4) 81000004
2321@1456171463.702901:vfio_pci_read_config  (0000:00:16.4, @0x14, len=0x4) 0
2321@1456171463.702913:vfio_pci_read_config  (0000:00:16.4, @0x18, len=0x4) 0
2321@1456171463.702925:vfio_pci_read_config  (0000:00:16.4, @0x1c, len=0x4) 0
2321@1456171463.702937:vfio_pci_read_config  (0000:00:16.4, @0x20, len=0x4) 0
2321@1456171463.702949:vfio_pci_read_config  (0000:00:16.4, @0x24, len=0x4) 0
2321@1456171463.702963:vfio_pci_read_config  (0000:00:16.4, @0x30, len=0x4) 0
2321@1456171463.703397:vfio_pci_read_config  (0000:00:16.4, @0x4, len=0x2) 6
2321@1456171463.703440:vfio_pci_read_config  (0000:00:16.4, @0x50, len=0x4) 40038c01
2321@1456171463.703458:vfio_pci_read_config  (0000:00:16.4, @0x54, len=0x4) 8
2321@1456171463.703480:vfio_pci_read_config  (0000:00:16.4, @0x6, len=0x2) 10
2321@1456171463.703501:vfio_pci_read_config  (0000:00:16.4, @0x4, len=0x2) 6
2321@1456171463.703522:vfio_pci_read_config  (0000:00:16.4, @0xc, len=0x1) 0
2321@1456171463.703543:vfio_pci_read_config  (0000:00:16.4, @0xd, len=0x1) 0
2321@1456171463.703560:vfio_pci_read_config  (0000:00:16.4, @0x3c, len=0x1) b
2321@1456171463.703576:vfio_pci_read_config  (0000:00:16.4, @0x3d, len=0x1) 1
2321@1456171463.703591:vfio_pci_read_config  (0000:00:16.4, @0x0, len=0x4) 9d3e8086
2321@1456171463.703610:vfio_pci_read_config  (0000:00:16.4, @0x4, len=0x4) 100006
2321@1456171463.703628:vfio_pci_read_config  (0000:00:16.4, @0x8, len=0x4) 7800021
2321@1456171463.703646:vfio_pci_read_config  (0000:00:16.4, @0xc, len=0x4) 0
2321@1456171463.703658:vfio_pci_read_config  (0000:00:16.4, @0x10, len=0x4) 81000004
2321@1456171463.703670:vfio_pci_read_config  (0000:00:16.4, @0x14, len=0x4) 0
2321@1456171463.703682:vfio_pci_read_config  (0000:00:16.4, @0x18, len=0x4) 0
2321@1456171463.703698:vfio_pci_read_config  (0000:00:16.4, @0x1c, len=0x4) 0
2321@1456171463.703711:vfio_pci_read_config  (0000:00:16.4, @0x20, len=0x4) 0
2321@1456171463.703723:vfio_pci_read_config  (0000:00:16.4, @0x24, len=0x4) 0
2321@1456171463.703741:vfio_pci_read_config  (0000:00:16.4, @0x28, len=0x4) 0
2321@1456171463.703759:vfio_pci_read_config  (0000:00:16.4, @0x2c, len=0x4) 0
2321@1456171463.703783:vfio_pci_read_config  (0000:00:16.4, @0x30, len=0x4) 0
2321@1456171463.703806:vfio_pci_read_config  (0000:00:16.4, @0x34, len=0x4) 50
2321@1456171463.703824:vfio_pci_read_config  (0000:00:16.4, @0x38, len=0x4) 0
2321@1456171463.703842:vfio_pci_read_config  (0000:00:16.4, @0x3c, len=0x4) 10b
2321@1456171463.703885:vfio_pci_read_config  (0000:00:16.4, @0x54, len=0x2) 8
2321@1456171463.703907:vfio_pci_read_config  (0000:00:16.4, @0x4, len=0x2) 6
2321@1456171463.703925:vfio_pci_write_config  (0000:00:16.4, @0x4, 0x400, len=0x2)
2321@1456171463.703974:vfio_listener_region_del_skip SKIPPING region_del 81000000 - 81000fff
2321@1456171463.707218:vfio_pci_read_config  (0000:00:16.4, @0x10, len=0x4) 81000004
2321@1456171463.707264:vfio_pci_read_config  (0000:00:16.4, @0x14, len=0x4) 0
2321@1456171463.707276:vfio_pci_read_config  (0000:00:16.4, @0x18, len=0x4) 0
2321@1456171463.707288:vfio_pci_read_config  (0000:00:16.4, @0x1c, len=0x4) 0
2321@1456171463.707301:vfio_pci_read_config  (0000:00:16.4, @0x20, len=0x4) 0
2321@1456171463.707313:vfio_pci_read_config  (0000:00:16.4, @0x24, len=0x4) 0
2321@1456171463.707331:vfio_pci_write_config  (0000:00:16.4, @0x10, 0xffffffff, len=0x4)
2321@1456171463.707345:vfio_pci_write_config  (0000:00:16.4, @0x14, 0xffffffff, len=0x4)
2321@1456171463.707358:vfio_pci_write_config  (0000:00:16.4, @0x18, 0xffffffff, len=0x4)
2321@1456171463.707371:vfio_pci_write_config  (0000:00:16.4, @0x1c, 0xffffffff, len=0x4)
2321@1456171463.707384:vfio_pci_write_config  (0000:00:16.4, @0x20, 0xffffffff, len=0x4)
2321@1456171463.707395:vfio_pci_write_config  (0000:00:16.4, @0x24, 0xffffffff, len=0x4)
2321@1456171463.707408:vfio_pci_read_config  (0000:00:16.4, @0x10, len=0x4) fffff004
2321@1456171463.707420:vfio_pci_read_config  (0000:00:16.4, @0x14, len=0x4) ffffffff
2321@1456171463.707432:vfio_pci_read_config  (0000:00:16.4, @0x18, len=0x4) 0
2321@1456171463.707477:vfio_pci_read_config  (0000:00:16.4, @0x1c, len=0x4) 0
2321@1456171463.707489:vfio_pci_read_config  (0000:00:16.4, @0x20, len=0x4) 0
2321@1456171463.707501:vfio_pci_read_config  (0000:00:16.4, @0x24, len=0x4) 0
2321@1456171463.707518:vfio_pci_write_config  (0000:00:16.4, @0x10, 0x81000004, len=0x4)
2321@1456171463.707530:vfio_pci_write_config  (0000:00:16.4, @0x14, 0x0, len=0x4)
2321@1456171463.707542:vfio_pci_write_config  (0000:00:16.4, @0x18, 0x0, len=0x4)
2321@1456171463.707554:vfio_pci_write_config  (0000:00:16.4, @0x1c, 0x0, len=0x4)
2321@1456171463.707565:vfio_pci_write_config  (0000:00:16.4, @0x20, 0x0, len=0x4)
2321@1456171463.707576:vfio_pci_write_config  (0000:00:16.4, @0x24, 0x0, len=0x4)
2321@1456171463.707590:vfio_pci_read_config  (0000:00:16.4, @0x30, len=0x4) 0
2321@1456171463.707606:vfio_pci_write_config  (0000:00:16.4, @0x30, 0xffffffff, len=0x4)
2321@1456171463.707618:vfio_pci_read_config  (0000:00:16.4, @0x30, len=0x4) 0
2321@1456171463.707636:vfio_pci_write_config  (0000:00:16.4, @0x30, 0x0, len=0x4)
2321@1456171463.707651:vfio_pci_write_config  (0000:00:16.4, @0x4, 0x6, len=0x2)
2321@1456171463.707710:vfio_listener_region_add_skip SKIPPING region_add 81000000 - 81000fff
2321@1456171463.709914:vfio_pci_read_config  (0000:00:16.4, @0x8e, len=0x2) 80
2321@1456171463.709941:vfio_pci_read_config  (0000:00:16.4, @0x8e, len=0x2) 80
2321@1456171463.709959:vfio_pci_write_config  (0000:00:16.4, @0x8e, 0x80, len=0x2)
2321@1456171463.709989:vfio_pci_read_config  (0000:00:16.4, @0x4, len=0x2) 6
2321@1456171463.710005:vfio_pci_read_config  (0000:00:16.4, @0x10, len=0x4) 81000004
2321@1456171463.710018:vfio_pci_read_config  (0000:00:16.4, @0x14, len=0x4) 0
2321@1456171463.710030:vfio_pci_read_config  (0000:00:16.4, @0x18, len=0x4) 0
2321@1456171463.710042:vfio_pci_read_config  (0000:00:16.4, @0x1c, len=0x4) 0
2321@1456171463.710054:vfio_pci_read_config  (0000:00:16.4, @0x20, len=0x4) 0
2321@1456171463.710066:vfio_pci_read_config  (0000:00:16.4, @0x24, len=0x4) 0
2321@1456171463.710081:vfio_pci_read_config  (0000:00:16.4, @0x30, len=0x4) 0
2321@1456171463.712412:vfio_listener_region_del_skip SKIPPING region_del 81001000 - 8100101f
2321@1456171463.712424:vfio_listener_region_del_skip SKIPPING region_del 81001800 - 81001807
2321@1456171463.715630:vfio_listener_region_add_skip SKIPPING region_add 81001000 - 8100101f
2321@1456171463.715637:vfio_listener_region_add_skip SKIPPING region_add 81001800 - 81001807
2321@1456171463.720479:vfio_pci_read_config  (0000:00:16.4, @0x0, len=0x2) 8086
2321@1456171463.720494:vfio_pci_read_config  (0000:00:16.4, @0x2, len=0x2) 9d3e
2321@1456171463.720514:vfio_pci_read_config  (0000:00:16.4, @0x4, len=0x2) 6
2321@1456171463.720532:vfio_pci_read_config  (0000:00:16.4, @0x6, len=0x2) 10
2321@1456171463.720549:vfio_pci_read_config  (0000:00:16.4, @0x8, len=0x2) 21
2321@1456171463.720566:vfio_pci_read_config  (0000:00:16.4, @0xa, len=0x2) 780
2321@1456171463.720583:vfio_pci_read_config  (0000:00:16.4, @0xc, len=0x2) 0
2321@1456171463.720601:vfio_pci_read_config  (0000:00:16.4, @0xe, len=0x2) 0
2321@1456171463.720613:vfio_pci_read_config  (0000:00:16.4, @0x10, len=0x2) 4
2321@1456171463.720625:vfio_pci_read_config  (0000:00:16.4, @0x12, len=0x2) 8100
2321@1456171463.720637:vfio_pci_read_config  (0000:00:16.4, @0x14, len=0x2) 0
2321@1456171463.720649:vfio_pci_read_config  (0000:00:16.4, @0x16, len=0x2) 0
2321@1456171463.720662:vfio_pci_read_config  (0000:00:16.4, @0x18, len=0x2) 0
2321@1456171463.734820:vfio_pci_read_config  (0000:00:16.4, @0x0, len=0x2) 8086
2321@1456171463.734842:vfio_pci_read_config  (0000:00:16.4, @0x2, len=0x2) 9d3e
2321@1456171463.734867:vfio_pci_read_config  (0000:00:16.4, @0x8, len=0x1) 21
2321@1456171463.734888:vfio_pci_read_config  (0000:00:16.4, @0x9, len=0x1) 0
2321@1456171463.734923:vfio_pci_read_config  (0000:00:16.4, @0xa, len=0x1) 80
2321@1456171463.734944:vfio_pci_read_config  (0000:00:16.4, @0xb, len=0x1) 7
2321@1456171463.734964:vfio_pci_read_config  (0000:00:16.4, @0xe, len=0x1) 0
2321@1456171463.734985:vfio_pci_read_config  (0000:00:16.4, @0x2c, len=0x2) 0
2321@1456171463.735005:vfio_pci_read_config  (0000:00:16.4, @0x2e, len=0x2) 0
2321@1456171463.735026:vfio_pci_read_config  (0000:00:16.4, @0x4, len=0x2) 6
2321@1456171463.735041:vfio_pci_read_config  (0000:00:16.4, @0x10, len=0x4) 81000004
2321@1456171463.735054:vfio_pci_read_config  (0000:00:16.4, @0x14, len=0x4) 0
2321@1456171463.735066:vfio_pci_read_config  (0000:00:16.4, @0x18, len=0x4) 0
2321@1456171463.735081:vfio_pci_read_config  (0000:00:16.4, @0x1c, len=0x4) 0
2321@1456171463.735093:vfio_pci_read_config  (0000:00:16.4, @0x20, len=0x4) 0
2321@1456171463.735105:vfio_pci_read_config  (0000:00:16.4, @0x24, len=0x4) 0
2321@1456171463.735120:vfio_pci_read_config  (0000:00:16.4, @0x30, len=0x4) 0
2321@1456171463.735139:vfio_pci_read_config  (0000:00:16.4, @0x4, len=0x2) 6
2321@1456171465.780399:vfio_listener_region_del_skip SKIPPING region_del 81001000 - 8100101f
2321@1456171465.780404:vfio_listener_region_del_skip SKIPPING region_del 81001800 - 81001807
2321@1456171465.782664:vfio_listener_region_add_skip SKIPPING region_add 81001000 - 8100101f
2321@1456171465.782670:vfio_listener_region_add_skip SKIPPING region_add 81001800 - 81001807
2321@1456171466.420191:vfio_pci_read_config  (0000:00:16.4, @0x0, len=0x4) 9d3e8086
2321@1456171466.420232:vfio_pci_read_config  (0000:00:16.4, @0x4, len=0x4) 100006
2321@1456171466.420250:vfio_pci_read_config  (0000:00:16.4, @0x8, len=0x4) 7800021
2321@1456171466.420282:vfio_pci_read_config  (0000:00:16.4, @0xc, len=0x4) 0
2321@1456171466.420293:vfio_pci_read_config  (0000:00:16.4, @0x10, len=0x4) 81000004
2321@1456171466.420303:vfio_pci_read_config  (0000:00:16.4, @0x14, len=0x4) 0
2321@1456171466.420312:vfio_pci_read_config  (0000:00:16.4, @0x18, len=0x4) 0
2321@1456171466.420324:vfio_pci_read_config  (0000:00:16.4, @0x1c, len=0x4) 0
2321@1456171466.420335:vfio_pci_read_config  (0000:00:16.4, @0x20, len=0x4) 0
2321@1456171466.420345:vfio_pci_read_config  (0000:00:16.4, @0x24, len=0x4) 0
2321@1456171466.420355:vfio_pci_read_config  (0000:00:16.4, @0x28, len=0x4) 0
2321@1456171466.420366:vfio_pci_read_config  (0000:00:16.4, @0x2c, len=0x4) 0
2321@1456171466.420375:vfio_pci_read_config  (0000:00:16.4, @0x30, len=0x4) 0
2321@1456171466.420385:vfio_pci_read_config  (0000:00:16.4, @0x34, len=0x4) 50
2321@1456171466.420396:vfio_pci_read_config  (0000:00:16.4, @0x38, len=0x4) 0
2321@1456171466.420406:vfio_pci_read_config  (0000:00:16.4, @0x3c, len=0x4) 10b
2321@1456171466.421567:vfio_pci_read_config  (0000:00:16.4, @0x0, len=0x4) 9d3e8086
2321@1456171466.421587:vfio_pci_read_config  (0000:00:16.4, @0x4, len=0x4) 100006
2321@1456171466.421598:vfio_pci_read_config  (0000:00:16.4, @0x8, len=0x4) 7800021
2321@1456171466.421635:vfio_pci_read_config  (0000:00:16.4, @0xc, len=0x4) 0
2321@1456171466.421646:vfio_pci_read_config  (0000:00:16.4, @0x10, len=0x4) 81000004
2321@1456171466.421656:vfio_pci_read_config  (0000:00:16.4, @0x14, len=0x4) 0
2321@1456171466.421665:vfio_pci_read_config  (0000:00:16.4, @0x18, len=0x4) 0
2321@1456171466.421675:vfio_pci_read_config  (0000:00:16.4, @0x1c, len=0x4) 0
2321@1456171466.421684:vfio_pci_read_config  (0000:00:16.4, @0x20, len=0x4) 0
2321@1456171466.421693:vfio_pci_read_config  (0000:00:16.4, @0x24, len=0x4) 0
2321@1456171466.421703:vfio_pci_read_config  (0000:00:16.4, @0x28, len=0x4) 0
2321@1456171466.421713:vfio_pci_read_config  (0000:00:16.4, @0x2c, len=0x4) 0
2321@1456171466.421722:vfio_pci_read_config  (0000:00:16.4, @0x30, len=0x4) 0
2321@1456171466.421732:vfio_pci_read_config  (0000:00:16.4, @0x34, len=0x4) 50
2321@1456171466.421742:vfio_pci_read_config  (0000:00:16.4, @0x38, len=0x4) 0
2321@1456171466.421753:vfio_pci_read_config  (0000:00:16.4, @0x3c, len=0x4) 10b
2321@1456171466.421960:vfio_intx_update  (0000:00:16.4) IRQ moved -1 -> 5
2321@1456171466.421988:vfio_intx_enable_kvm  (0000:00:16.4) KVM INTx accel enabled
2321@1456171466.422043:vfio_pci_write_config  (0000:00:16.4, @0x3c, 0x5, len=0x1)
2321@1456171466.423852:vfio_pci_write_config  (0000:00:16.4, @0x3c, 0x5, len=0x1)
2321@1456171466.424260:vfio_pci_write_config  (0000:00:16.4, @0x3c, 0x5, len=0x1)
2321@1456171466.424524:vfio_pci_write_config  (0000:00:16.4, @0x3c, 0x5, len=0x1)
2321@1456171466.424731:vfio_pci_write_config  (0000:00:16.4, @0x3c, 0x5, len=0x1)
2321@1456171466.425040:vfio_pci_write_config  (0000:00:16.4, @0x3c, 0x5, len=0x1)
2321@1456171466.425301:vfio_pci_write_config  (0000:00:16.4, @0x3c, 0x5, len=0x1)
2321@1456171466.626630:vfio_listener_region_del region_del 80000000 - 80ffffff
2321@1456171466.627933:vfio_listener_region_del_skip SKIPPING region_del 81003400 - 8100341f
2321@1456171466.627949:vfio_listener_region_del_skip SKIPPING region_del 81003500 - 81003515
2321@1456171466.627951:vfio_listener_region_del_skip SKIPPING region_del 81003600 - 81003607
2321@1456171466.629172:vfio_listener_region_add_ram region_add [ram] 80000000 - 80ffffff [0x7f6a18200000]
2321@1456171466.630929:vfio_listener_region_add_skip SKIPPING region_add 81003400 - 8100341f
2321@1456171466.630936:vfio_listener_region_add_skip SKIPPING region_add 81003500 - 81003515
2321@1456171466.630938:vfio_listener_region_add_skip SKIPPING region_add 81003600 - 81003607
2321@1456171466.634576:vfio_listener_region_del_skip SKIPPING region_del 81002000 - 8100202f
2321@1456171466.634582:vfio_listener_region_del_skip SKIPPING region_del 81002800 - 81002807
2321@1456171466.637013:vfio_listener_region_add_skip SKIPPING region_add 81002000 - 8100202f
2321@1456171466.637018:vfio_listener_region_add_skip SKIPPING region_add 81002800 - 81002807
2321@1456171466.640134:vfio_pci_read_config  (0000:00:16.4, @0x0, len=0x2) 8086
2321@1456171466.640158:vfio_pci_read_config  (0000:00:16.4, @0x2, len=0x2) 9d3e
2321@1456171466.640176:vfio_pci_read_config  (0000:00:16.4, @0x8, len=0x1) 21
2321@1456171466.640190:vfio_pci_read_config  (0000:00:16.4, @0x9, len=0x1) 0
2321@1456171466.640203:vfio_pci_read_config  (0000:00:16.4, @0xa, len=0x1) 80
2321@1456171466.640259:vfio_pci_read_config  (0000:00:16.4, @0xb, len=0x1) 7
2321@1456171466.640283:vfio_pci_read_config  (0000:00:16.4, @0xe, len=0x1) 0
2321@1456171466.640302:vfio_pci_read_config  (0000:00:16.4, @0x2c, len=0x2) 0
2321@1456171466.640318:vfio_pci_read_config  (0000:00:16.4, @0x2e, len=0x2) 0
2321@1456171466.640334:vfio_pci_read_config  (0000:00:16.4, @0x50, len=0x4) 40038c01
2321@1456171466.640347:vfio_pci_read_config  (0000:00:16.4, @0x54, len=0x4) 8
2321@1456171466.640363:vfio_pci_write_config  (0000:00:16.4, @0x54, 0x8, len=0x2)
2321@1456171466.681161:vfio_pci_read_config  (0000:00:16.4, @0x54, len=0x2) 8
2321@1456171466.681267:vfio_pci_read_config  (0000:00:16.4, @0x4, len=0x2) 6
2321@1456171466.681303:vfio_pci_write_config  (0000:00:16.4, @0x4, 0x400, len=0x2)
2321@1456171466.681349:vfio_listener_region_del_skip SKIPPING region_del 81000000 - 81000fff
2321@1456171466.682730:vfio_pci_write_config  (0000:00:16.4, @0x10, 0x81000000, len=0x4)
2321@1456171466.682743:vfio_pci_write_config  (0000:00:16.4, @0x14, 0x0, len=0x4)
2321@1456171466.682753:vfio_pci_write_config  (0000:00:16.4, @0x18, 0x0, len=0x4)
2321@1456171466.682763:vfio_pci_write_config  (0000:00:16.4, @0x1c, 0x0, len=0x4)
2321@1456171466.682773:vfio_pci_write_config  (0000:00:16.4, @0x20, 0x0, len=0x4)
2321@1456171466.682784:vfio_pci_write_config  (0000:00:16.4, @0x24, 0x0, len=0x4)
2321@1456171466.682876:vfio_pci_write_config  (0000:00:16.4, @0x30, 0x0, len=0x4)
2321@1456171466.682892:vfio_pci_write_config  (0000:00:16.4, @0x3c, 0x5, len=0x1)
2321@1456171466.682986:vfio_pci_write_config  (0000:00:16.4, @0xc, 0x0, len=0x1)
2321@1456171466.683007:vfio_pci_write_config  (0000:00:16.4, @0xd, 0x0, len=0x1)
2321@1456171466.683031:vfio_pci_write_config  (0000:00:16.4, @0x4, 0x400, len=0x2)
2321@1456171466.683052:vfio_pci_read_config  (0000:00:16.4, @0x4, len=0x2) 400
2321@1456171466.683069:vfio_pci_write_config  (0000:00:16.4, @0x4, 0x406, len=0x2)
2321@1456171466.683107:vfio_listener_region_add_skip SKIPPING region_add 81000000 - 81000fff
2321@1456171466.684342:vfio_pci_write_config  (0000:00:16.4, @0x6, 0xf900, len=0x2)
2321@1456171466.684358:vfio_pci_read_config  (0000:00:16.4, @0x4, len=0x2) 406
2321@1456171466.684376:vfio_pci_write_config  (0000:00:16.4, @0x4, 0x406, len=0x2)
2321@1456171466.684448:vfio_pci_read_config  (0000:00:16.4, @0x8e, len=0x2) 80
2321@1456171466.684470:vfio_pci_write_config  (0000:00:16.4, @0x8e, 0x80, len=0x2)
2321@1456171466.684487:vfio_pci_read_config  (0000:00:16.4, @0x4, len=0x2) 406
2321@1456171466.684553:vfio_pci_write_config  (0000:00:16.4, @0x4, 0x6, len=0x2)
2321@1456171466.684818:vfio_region_read  (0000:00:16.4:region0+0xc, 4) = 0x80000009
2321@1456171466.694403:vfio_region_read  (0000:00:16.4:region0+0x800, 4) = 0x4
2321@1456171466.694453:vfio_region_read  (0000:00:16.4:region0+0x800, 4) = 0x4
2321@1456171466.694672:vfio_region_write  (0000:00:16.4:region0+0x800, 0x0, 4)
2321@1456171466.694688:vfio_region_read  (0000:00:16.4:region0+0x800, 4) = 0x1
2321@1456171466.694803:vfio_region_read  (0000:00:16.4:region0+0x800, 4) = 0x1
2321@1456171466.695124:vfio_region_read  (0000:00:16.4:region0+0x800, 4) = 0x0
2321@1456171466.695143:vfio_region_read  (0000:00:16.4:region0+0x800, 4) = 0x0
2321@1456171466.695182:vfio_region_read  (0000:00:16.4:region0+0x4, 4) = 0x80000008
2321@1456171466.695206:vfio_region_write  (0000:00:16.4:region0+0x4, 0x80000008, 4)
2321@1456171466.695217:vfio_region_read  (0000:00:16.4:region0+0x4, 4) = 0x80000008
2321@1456171466.695225:vfio_region_read  (0000:00:16.4:region0+0x4, 4) = 0x80000008
2321@1456171466.695231:vfio_region_write  (0000:00:16.4:region0+0x4, 0x8000001f, 4)
2321@1456171466.696186:vfio_region_read  (0000:00:16.4:region0+0x4, 4) = 0x80000013
2321@1456171466.696226:vfio_region_write  (0000:00:16.4:region0+0x4, 0x80000012, 4)
2321@1456171466.696238:vfio_region_read  (0000:00:16.4:region0+0x4, 4) = 0x80000010
2321@1456171466.696249:vfio_region_read  (0000:00:16.4:region0+0xc, 4) = 0x80000009
2321@1456171466.696295:vfio_region_read  (0000:00:16.4:region0+0x800, 4) = 0x0
2321@1456171466.696311:vfio_region_read  (0000:00:16.4:region0+0x4, 4) = 0x80000010
2321@1456171466.696321:vfio_region_write  (0000:00:16.4:region0+0x4, 0x8000000c, 4)
2321@1456171466.696339:vfio_region_read  (0000:00:16.4:region0+0x4, 4) = 0x80000008
2321@1456171466.696350:vfio_region_write  (0000:00:16.4:region0+0x4, 0x80000009, 4)
2321@1456171466.696357:vfio_region_read  (0000:00:16.4:region0+0x800, 4) = 0x0
2321@1456171466.696369:vfio_region_read  (0000:00:16.4:region0+0x4, 4) = 0x80000009
2321@1456171466.696377:vfio_region_read  (0000:00:16.4:region0+0xc, 4) = 0x8000000b
2321@1456171466.696388:vfio_region_read  (0000:00:16.4:region0+0x4, 4) = 0x80000009
2321@1456171466.696398:vfio_region_read  (0000:00:16.4:region0+0xc, 4) = 0x8000000b
2321@1456171466.696518:vfio_region_read  (0000:00:16.4:region0+0x4, 4) = 0x80000009
2321@1456171466.696531:vfio_region_write  (0000:00:16.4:region0+0x0, 0x80040000, 4)
2321@1456171466.696541:vfio_region_write  (0000:00:16.4:region0+0x0, 0x1000001, 4)
2321@1456171466.696565:vfio_region_read  (0000:00:16.4:region0+0x4, 4) = 0x80020009
2321@1456171466.696576:vfio_region_write  (0000:00:16.4:region0+0x4, 0x8002000d, 4)
2321@1456171466.696624:vfio_region_read  (0000:00:16.4:region0+0xc, 4) = 0x8000000b
2321@1456171466.697045:vfio_region_read  (0000:00:16.4:region0+0x4, 4) = 0x8002020b
2321@1456171466.697067:vfio_region_write  (0000:00:16.4:region0+0x4, 0x8002020a, 4)
2321@1456171466.697079:vfio_region_read  (0000:00:16.4:region0+0x4, 4) = 0x80020208
2321@1456171466.697091:vfio_region_read  (0000:00:16.4:region0+0xc, 4) = 0x80020009
2321@1456171466.697119:vfio_region_read  (0000:00:16.4:region0+0x800, 4) = 0x0
2321@1456171466.697134:vfio_region_read  (0000:00:16.4:region0+0xc, 4) = 0x80020009
2321@1456171466.697145:vfio_region_read  (0000:00:16.4:region0+0x4, 4) = 0x80020208
2321@1456171466.697158:vfio_region_read  (0000:00:16.4:region0+0x8, 4) = 0x80040000
2321@1456171466.697170:vfio_region_read  (0000:00:16.4:region0+0x8, 4) = 0x2000181
2321@1456171466.697182:vfio_region_read  (0000:00:16.4:region0+0xc, 4) = 0x80020209
2321@1456171466.697225:vfio_region_read  (0000:00:16.4:region0+0x4, 4) = 0x80020208
2321@1456171466.697237:vfio_region_write  (0000:00:16.4:region0+0x4, 0x8002020c, 4)
2321@1456171466.697253:vfio_region_read  (0000:00:16.4:region0+0xc, 4) = 0x8002020b
2321@1456171466.697268:vfio_region_read  (0000:00:16.4:region0+0x4, 4) = 0x80020208
2321@1456171466.697279:vfio_region_read  (0000:00:16.4:region0+0x4, 4) = 0x80020208
2321@1456171466.697294:vfio_region_write  (0000:00:16.4:region0+0x4, 0x80020209, 4)
2321@1456171466.697319:vfio_region_read  (0000:00:16.4:region0+0x4, 4) = 0x80020209
2321@1456171466.697468:vfio_region_read  (0000:00:16.4:region0+0x800, 4) = 0x0
2321@1456171466.697485:vfio_region_read  (0000:00:16.4:region0+0xc, 4) = 0x80020209
2321@1456171466.697519:vfio_region_read  (0000:00:16.4:region0+0x4, 4) = 0x80020209
2321@1456171466.697529:vfio_region_read  (0000:00:16.4:region0+0xc, 4) = 0x80020209
2321@1456171466.697548:vfio_region_read  (0000:00:16.4:region0+0x4, 4) = 0x80020209
2321@1456171466.697556:vfio_region_write  (0000:00:16.4:region0+0x0, 0x80040000, 4)
2321@1456171466.697566:vfio_region_write  (0000:00:16.4:region0+0x0, 0xc05, 4)
2321@1456171466.697589:vfio_region_read  (0000:00:16.4:region0+0x4, 4) = 0x80040209
2321@1456171466.697596:vfio_region_write  (0000:00:16.4:region0+0x4, 0x8004020d, 4)
2321@1456171466.697611:vfio_region_read  (0000:00:16.4:region0+0xc, 4) = 0x8002020b
2321@1456171466.697869:vfio_region_read  (0000:00:16.4:region0+0x4, 4) = 0x8004040b
2321@1456171466.697880:vfio_region_write  (0000:00:16.4:region0+0x4, 0x8004040a, 4)
2321@1456171466.697897:vfio_region_read  (0000:00:16.4:region0+0x4, 4) = 0x80040408
2321@1456171466.697918:vfio_region_read  (0000:00:16.4:region0+0xc, 4) = 0x800a0209
2321@1456171466.697942:vfio_region_read  (0000:00:16.4:region0+0x800, 4) = 0x0
2321@1456171466.697951:vfio_region_read  (0000:00:16.4:region0+0xc, 4) = 0x800a0209
2321@1456171466.697960:vfio_region_read  (0000:00:16.4:region0+0x4, 4) = 0x80040408
2321@1456171466.697969:vfio_region_read  (0000:00:16.4:region0+0x8, 4) = 0x801c0000
2321@1456171466.697988:vfio_region_read  (0000:00:16.4:region0+0x8, 4) = 0xc85
2321@1456171466.698000:vfio_region_read  (0000:00:16.4:region0+0x8, 4) = 0x3e8d0870
2321@1456171466.698020:vfio_region_read  (0000:00:16.4:region0+0x8, 4) = 0x4208271a
2321@1456171466.698028:vfio_region_read  (0000:00:16.4:region0+0x8, 4) = 0xcb9ab58e
2321@1456171466.698036:vfio_region_read  (0000:00:16.4:region0+0x8, 4) = 0x4ae0294
2321@1456171466.698044:vfio_region_read  (0000:00:16.4:region0+0x8, 4) = 0x10c000a
2321@1456171466.698053:vfio_region_read  (0000:00:16.4:region0+0x8, 4) = 0x144
2321@1456171466.698061:vfio_region_read  (0000:00:16.4:region0+0xc, 4) = 0x800a0a09
2321@1456171466.698071:vfio_region_read  (0000:00:16.4:region0+0x4, 4) = 0x80040408
2321@1456171466.698102:vfio_region_write  (0000:00:16.4:region0+0x4, 0x8004040c, 4)
2321@1456171466.698115:vfio_region_read  (0000:00:16.4:region0+0xc, 4) = 0x800a0a0b
2321@1456171466.698123:vfio_region_read  (0000:00:16.4:region0+0x4, 4) = 0x80040408
2321@1456171466.698131:vfio_region_read  (0000:00:16.4:region0+0x4, 4) = 0x80040408
2321@1456171466.698138:vfio_region_write  (0000:00:16.4:region0+0x4, 0x80040409, 4)
2321@1456171466.698146:vfio_region_read  (0000:00:16.4:region0+0x4, 4) = 0x80040409
2321@1456171466.698276:vfio_region_read  (0000:00:16.4:region0+0x800, 4) = 0x0
2321@1456171466.698301:vfio_region_read  (0000:00:16.4:region0+0x800, 4) = 0x0
2321@1456171466.698311:vfio_region_read  (0000:00:16.4:region0+0xc, 4) = 0x800a0a09
2321@1456171466.698320:vfio_region_read  (0000:00:16.4:region0+0x4, 4) = 0x80040409
2321@1456171466.698329:vfio_region_read  (0000:00:16.4:region0+0xc, 4) = 0x800a0a09
2321@1456171466.698337:vfio_region_read  (0000:00:16.4:region0+0x4, 4) = 0x80040409
2321@1456171466.698358:vfio_region_write  (0000:00:16.4:region0+0x0, 0x8014000c, 4)
2321@1456171466.698379:vfio_region_write  (0000:00:16.4:region0+0x0, 0x9, 4)
2321@1456171466.698388:vfio_region_write  (0000:00:16.4:region0+0x0, 0x0, 4)
2321@1456171466.698394:vfio_region_write  (0000:00:16.4:region0+0x0, 0x1e, 4)
2321@1456171466.698400:vfio_region_write  (0000:00:16.4:region0+0x0, 0x0, 4)
2321@1456171466.698405:vfio_region_write  (0000:00:16.4:region0+0x0, 0x0, 4)
2321@1456171466.698414:vfio_region_read  (0000:00:16.4:region0+0x4, 4) = 0x800a0409
2321@1456171466.698438:vfio_region_write  (0000:00:16.4:region0+0x4, 0x800a040d, 4)
2321@1456171466.698459:vfio_region_read  (0000:00:16.4:region0+0xc, 4) = 0x800a0a0b
2321@1456171466.698857:vfio_region_read  (0000:00:16.4:region0+0x4, 4) = 0x800a0a0b
2321@1456171466.698875:vfio_region_write  (0000:00:16.4:region0+0x4, 0x800a0a0a, 4)
2321@1456171466.698883:vfio_region_read  (0000:00:16.4:region0+0x4, 4) = 0x800a0a08
2321@1456171466.698892:vfio_region_read  (0000:00:16.4:region0+0xc, 4) = 0x800a0a09
2321@1456171466.698918:vfio_region_read  (0000:00:16.4:region0+0x800, 4) = 0x0
2321@1456171466.698928:vfio_region_read  (0000:00:16.4:region0+0x4, 4) = 0x800a0a08
2321@1456171466.698934:vfio_region_write  (0000:00:16.4:region0+0x4, 0x800a0a09, 4)
2321@1456171466.698942:vfio_region_read  (0000:00:16.4:region0+0x4, 4) = 0x800a0a09
2321@1456171466.700118:vfio_region_read  (0000:00:16.4:region0+0x4, 4) = 0x800a0a0b
2321@1456171466.700152:vfio_region_write  (0000:00:16.4:region0+0x4, 0x800a0a0a, 4)
2321@1456171466.700162:vfio_region_read  (0000:00:16.4:region0+0x4, 4) = 0x800a0a08
2321@1456171466.700170:vfio_region_read  (0000:00:16.4:region0+0xc, 4) = 0x80100a09
2321@1456171466.700194:vfio_region_read  (0000:00:16.4:region0+0x800, 4) = 0x0
2321@1456171466.700223:vfio_region_read  (0000:00:16.4:region0+0xc, 4) = 0x80100a09
2321@1456171466.700243:vfio_region_read  (0000:00:16.4:region0+0x4, 4) = 0x800a0a08
2321@1456171466.700253:vfio_region_read  (0000:00:16.4:region0+0x8, 4) = 0x8014000c
2321@1456171466.700261:vfio_region_read  (0000:00:16.4:region0+0x8, 4) = 0x80000009
2321@1456171466.700269:vfio_region_read  (0000:00:16.4:region0+0x8, 4) = 0x0
2321@1456171466.700281:vfio_region_read  (0000:00:16.4:region0+0x8, 4) = 0x1e
2321@1456171466.700291:vfio_region_read  (0000:00:16.4:region0+0x8, 4) = 0x0
2321@1456171466.700303:vfio_region_read  (0000:00:16.4:region0+0x8, 4) = 0x0
2321@1456171466.700323:vfio_region_read  (0000:00:16.4:region0+0xc, 4) = 0x80101009
2321@1456171466.700332:vfio_region_read  (0000:00:16.4:region0+0x4, 4) = 0x800a0a08
2321@1456171466.700354:vfio_region_write  (0000:00:16.4:region0+0x4, 0x800a0a0c, 4)
2321@1456171466.700370:vfio_region_read  (0000:00:16.4:region0+0xc, 4) = 0x8010100b
2321@1456171466.700380:vfio_region_read  (0000:00:16.4:region0+0x4, 4) = 0x800a0a08
2321@1456171466.700388:vfio_region_read  (0000:00:16.4:region0+0x4, 4) = 0x800a0a08
2321@1456171466.700397:vfio_region_write  (0000:00:16.4:region0+0x4, 0x800a0a09, 4)
2321@1456171466.700406:vfio_region_read  (0000:00:16.4:region0+0x4, 4) = 0x800a0a09
2321@1456171466.700477:vfio_region_read  (0000:00:16.4:region0+0x800, 4) = 0x0
2321@1456171466.700487:vfio_region_read  (0000:00:16.4:region0+0x800, 4) = 0x0
2321@1456171466.700496:vfio_region_read  (0000:00:16.4:region0+0xc, 4) = 0x80101009
2321@1456171466.700505:vfio_region_read  (0000:00:16.4:region0+0x4, 4) = 0x800a0a09
2321@1456171466.700514:vfio_region_read  (0000:00:16.4:region0+0xc, 4) = 0x80101009
2321@1456171466.700521:vfio_region_read  (0000:00:16.4:region0+0x4, 4) = 0x800a0a09
2321@1456171466.700541:vfio_region_write  (0000:00:16.4:region0+0x0, 0x8004000c, 4)
2321@1456171466.700560:vfio_region_write  (0000:00:16.4:region0+0x0, 0x8, 4)
2321@1456171466.700571:vfio_region_read  (0000:00:16.4:region0+0x4, 4) = 0x800c0a09
2321@1456171466.700577:vfio_region_write  (0000:00:16.4:region0+0x4, 0x800c0a0d, 4)
2321@1456171466.700584:vfio_region_read  (0000:00:16.4:region0+0xc, 4) = 0x8010100b
2321@1456171466.700853:vfio_region_read  (0000:00:16.4:region0+0x4, 4) = 0x800c0c0b
2321@1456171466.700867:vfio_region_write  (0000:00:16.4:region0+0x4, 0x800c0c0a, 4)
2321@1456171466.700877:vfio_region_read  (0000:00:16.4:region0+0x4, 4) = 0x800c0c08
2321@1456171466.700886:vfio_region_read  (0000:00:16.4:region0+0xc, 4) = 0x80101009
2321@1456171466.700926:vfio_region_read  (0000:00:16.4:region0+0x800, 4) = 0x0
2321@1456171466.700939:vfio_region_read  (0000:00:16.4:region0+0x4, 4) = 0x800c0c08
2321@1456171466.700949:vfio_region_write  (0000:00:16.4:region0+0x4, 0x800c0c09, 4)
2321@1456171466.700957:vfio_region_read  (0000:00:16.4:region0+0x4, 4) = 0x800c0c09
2321@1456171466.701610:vfio_region_read  (0000:00:16.4:region0+0x4, 4) = 0x800c0c0b
2321@1456171466.701639:vfio_region_write  (0000:00:16.4:region0+0x4, 0x800c0c0a, 4)
2321@1456171466.701650:vfio_region_read  (0000:00:16.4:region0+0x4, 4) = 0x800c0c08
2321@1456171466.701659:vfio_region_read  (0000:00:16.4:region0+0xc, 4) = 0x80161009
2321@1456171466.701683:vfio_region_read  (0000:00:16.4:region0+0x800, 4) = 0x0
2321@1456171466.701692:vfio_region_read  (0000:00:16.4:region0+0xc, 4) = 0x80161009
2321@1456171466.701699:vfio_region_read  (0000:00:16.4:region0+0x4, 4) = 0x800c0c08
2321@1456171466.701707:vfio_region_read  (0000:00:16.4:region0+0x8, 4) = 0x8014000c
2321@1456171466.701714:vfio_region_read  (0000:00:16.4:region0+0x8, 4) = 0x80000008
2321@1456171466.701722:vfio_region_read  (0000:00:16.4:region0+0x8, 4) = 0x0
2321@1456171466.701729:vfio_region_read  (0000:00:16.4:region0+0x8, 4) = 0x0
2321@1456171466.701736:vfio_region_read  (0000:00:16.4:region0+0x8, 4) = 0x0
2321@1456171466.701744:vfio_region_read  (0000:00:16.4:region0+0x8, 4) = 0x0
2321@1456171466.701751:vfio_region_read  (0000:00:16.4:region0+0xc, 4) = 0x80161609
2321@1456171466.701759:vfio_region_read  (0000:00:16.4:region0+0x4, 4) = 0x800c0c08
2321@1456171466.701764:vfio_region_write  (0000:00:16.4:region0+0x4, 0x800c0c0c, 4)
2321@1456171466.701785:vfio_region_read  (0000:00:16.4:region0+0xc, 4) = 0x8016160b
2321@1456171466.701793:vfio_region_read  (0000:00:16.4:region0+0x4, 4) = 0x800c0c08
2321@1456171466.701801:vfio_region_read  (0000:00:16.4:region0+0x4, 4) = 0x800c0c08
2321@1456171466.701807:vfio_region_write  (0000:00:16.4:region0+0x4, 0x800c0c09, 4)
2321@1456171466.701816:vfio_region_read  (0000:00:16.4:region0+0x4, 4) = 0x800c0c09
2321@1456171466.701829:vfio_region_read  (0000:00:16.4:region0+0x800, 4) = 0x0
2321@1456171466.701837:vfio_region_read  (0000:00:16.4:region0+0x800, 4) = 0x0
2321@1456171466.701845:vfio_region_read  (0000:00:16.4:region0+0xc, 4) = 0x8016160b
2321@1456171466.701852:vfio_region_read  (0000:00:16.4:region0+0x4, 4) = 0x800c0c09
2321@1456171466.701860:vfio_region_read  (0000:00:16.4:region0+0xc, 4) = 0x8016160b
2321@1456171466.701867:vfio_region_read  (0000:00:16.4:region0+0x4, 4) = 0x800c0c09
2321@1456171466.701876:vfio_region_write  (0000:00:16.4:region0+0x0, 0x8004000c, 4)
2321@1456171466.701882:vfio_region_write  (0000:00:16.4:region0+0x0, 0x1, 4)
2321@1456171466.701889:vfio_region_read  (0000:00:16.4:region0+0x4, 4) = 0x800e0c09
2321@1456171466.701895:vfio_region_write  (0000:00:16.4:region0+0x4, 0x800e0c0d, 4)
2321@1456171466.701902:vfio_region_read  (0000:00:16.4:region0+0xc, 4) = 0x8016160b
2321@1456171466.702181:vfio_region_read  (0000:00:16.4:region0+0x4, 4) = 0x800e0e0b
2321@1456171466.702192:vfio_region_write  (0000:00:16.4:region0+0x4, 0x800e0e0a, 4)
2321@1456171466.702200:vfio_region_read  (0000:00:16.4:region0+0x4, 4) = 0x800e0e08
2321@1456171466.702209:vfio_region_read  (0000:00:16.4:region0+0xc, 4) = 0x80161609
2321@1456171466.702229:vfio_region_read  (0000:00:16.4:region0+0x800, 4) = 0x0
2321@1456171466.702237:vfio_region_read  (0000:00:16.4:region0+0x4, 4) = 0x800e0e08
2321@1456171466.702243:vfio_region_write  (0000:00:16.4:region0+0x4, 0x800e0e09, 4)
2321@1456171466.702250:vfio_region_read  (0000:00:16.4:region0+0x4, 4) = 0x800e0e09
2321@1456171466.702833:vfio_region_read  (0000:00:16.4:region0+0x4, 4) = 0x800e0e0b
2321@1456171466.702852:vfio_region_write  (0000:00:16.4:region0+0x4, 0x800e0e0a, 4)
2321@1456171466.702862:vfio_region_read  (0000:00:16.4:region0+0x4, 4) = 0x800e0e08
2321@1456171466.702871:vfio_region_read  (0000:00:16.4:region0+0xc, 4) = 0x80241609
2321@1456171466.702891:vfio_region_read  (0000:00:16.4:region0+0x800, 4) = 0x0
2321@1456171466.702901:vfio_region_read  (0000:00:16.4:region0+0xc, 4) = 0x80241609
2321@1456171466.702908:vfio_region_read  (0000:00:16.4:region0+0x4, 4) = 0x800e0e08
2321@1456171466.702916:vfio_region_read  (0000:00:16.4:region0+0x8, 4) = 0x8034000c
2321@1456171466.702924:vfio_region_read  (0000:00:16.4:region0+0x8, 4) = 0x80000001
2321@1456171466.702947:vfio_region_read  (0000:00:16.4:region0+0x8, 4) = 0x0
2321@1456171466.702960:vfio_region_read  (0000:00:16.4:region0+0x8, 4) = 0x6a1b96
2321@1456171466.702972:vfio_region_read  (0000:00:16.4:region0+0x8, 4) = 0x1
2321@1456171466.702993:vfio_region_read  (0000:00:16.4:region0+0x8, 4) = 0x1330095
2321@1456171466.703002:vfio_region_read  (0000:00:16.4:region0+0x8, 4) = 0x4000
2321@1456171466.703011:vfio_region_read  (0000:00:16.4:region0+0x8, 4) = 0xa40
2321@1456171466.703019:vfio_region_read  (0000:00:16.4:region0+0x8, 4) = 0x0
2321@1456171466.703028:vfio_region_read  (0000:00:16.4:region0+0x8, 4) = 0x10a
2321@1456171466.703035:vfio_region_read  (0000:00:16.4:region0+0x8, 4) = 0x470047
2321@1456171466.703043:vfio_region_read  (0000:00:16.4:region0+0x8, 4) = 0x40101
2321@1456171466.703052:vfio_region_read  (0000:00:16.4:region0+0x8, 4) = 0x0
2321@1456171466.703060:vfio_region_read  (0000:00:16.4:region0+0x8, 4) = 0x0
2321@1456171466.703081:vfio_region_read  (0000:00:16.4:region0+0xc, 4) = 0x80242409
2321@1456171466.703093:vfio_region_read  (0000:00:16.4:region0+0x4, 4) = 0x800e0e08
2321@1456171466.703103:vfio_region_write  (0000:00:16.4:region0+0x4, 0x800e0e0c, 4)
2321@1456171466.703123:vfio_region_read  (0000:00:16.4:region0+0xc, 4) = 0x8024240b
2321@1456171466.703133:vfio_region_read  (0000:00:16.4:region0+0x4, 4) = 0x800e0e08
2321@1456171466.703148:vfio_region_read  (0000:00:16.4:region0+0x4, 4) = 0x800e0e08
2321@1456171466.703156:vfio_region_write  (0000:00:16.4:region0+0x4, 0x800e0e09, 4)
2321@1456171466.703164:vfio_region_read  (0000:00:16.4:region0+0x4, 4) = 0x800e0e09
2321@1456171466.703178:vfio_region_read  (0000:00:16.4:region0+0x800, 4) = 0x0
2321@1456171466.703194:vfio_region_read  (0000:00:16.4:region0+0x800, 4) = 0x0
2321@1456171466.703203:vfio_region_read  (0000:00:16.4:region0+0xc, 4) = 0x80242409
2321@1456171466.703210:vfio_region_read  (0000:00:16.4:region0+0x4, 4) = 0x800e0e09
2321@1456171466.703218:vfio_region_read  (0000:00:16.4:region0+0xc, 4) = 0x80242409
2321@1456171466.703226:vfio_region_read  (0000:00:16.4:region0+0x4, 4) = 0x800e0e09
2321@1456171466.703235:vfio_region_write  (0000:00:16.4:region0+0x0, 0x8014000c, 4)
2321@1456171466.703242:vfio_region_write  (0000:00:16.4:region0+0x0, 0x2, 4)
2321@1456171466.703247:vfio_region_write  (0000:00:16.4:region0+0x0, 0x0, 4)
2321@1456171466.703253:vfio_region_write  (0000:00:16.4:region0+0x0, 0x0, 4)
2321@1456171466.703262:vfio_region_write  (0000:00:16.4:region0+0x0, 0x0, 4)
2321@1456171466.703268:vfio_region_write  (0000:00:16.4:region0+0x0, 0x0, 4)
2321@1456171466.703275:vfio_region_read  (0000:00:16.4:region0+0x4, 4) = 0x80140e09
2321@1456171466.703282:vfio_region_write  (0000:00:16.4:region0+0x4, 0x80140e0d, 4)
2321@1456171466.703290:vfio_region_read  (0000:00:16.4:region0+0xc, 4) = 0x8024240b
2321@1456171466.703591:vfio_region_read  (0000:00:16.4:region0+0x4, 4) = 0x8014140b
2321@1456171466.703631:vfio_region_write  (0000:00:16.4:region0+0x4, 0x8014140a, 4)
2321@1456171466.703641:vfio_region_read  (0000:00:16.4:region0+0x4, 4) = 0x80141408
2321@1456171466.703650:vfio_region_read  (0000:00:16.4:region0+0xc, 4) = 0x80242409
2321@1456171466.703675:vfio_region_read  (0000:00:16.4:region0+0x800, 4) = 0x0
2321@1456171466.703684:vfio_region_read  (0000:00:16.4:region0+0x4, 4) = 0x80141408
2321@1456171466.703690:vfio_region_write  (0000:00:16.4:region0+0x4, 0x80141409, 4)
2321@1456171466.703701:vfio_region_read  (0000:00:16.4:region0+0x4, 4) = 0x80141409
2321@1456171466.704554:vfio_region_read  (0000:00:16.4:region0+0x4, 4) = 0x8014140b
2321@1456171466.704588:vfio_region_write  (0000:00:16.4:region0+0x4, 0x8014140a, 4)
2321@1456171466.704601:vfio_region_read  (0000:00:16.4:region0+0x4, 4) = 0x80141408
2321@1456171466.704613:vfio_region_read  (0000:00:16.4:region0+0xc, 4) = 0x802a2409
2321@1456171466.704644:vfio_region_read  (0000:00:16.4:region0+0x800, 4) = 0x0
2321@1456171466.704655:vfio_region_read  (0000:00:16.4:region0+0xc, 4) = 0x802a2409
2321@1456171466.704664:vfio_region_read  (0000:00:16.4:region0+0x4, 4) = 0x80141408
2321@1456171466.704671:vfio_region_read  (0000:00:16.4:region0+0x8, 4) = 0x8014000c
2321@1456171466.704680:vfio_region_read  (0000:00:16.4:region0+0x8, 4) = 0x80000002
2321@1456171466.704689:vfio_region_read  (0000:00:16.4:region0+0x8, 4) = 0x0
2321@1456171466.704696:vfio_region_read  (0000:00:16.4:region0+0x8, 4) = 0x0
2321@1456171466.704704:vfio_region_read  (0000:00:16.4:region0+0x8, 4) = 0x0
2321@1456171466.704711:vfio_region_read  (0000:00:16.4:region0+0x8, 4) = 0x0
2321@1456171466.704719:vfio_region_read  (0000:00:16.4:region0+0xc, 4) = 0x802a2a09
2321@1456171466.704728:vfio_region_read  (0000:00:16.4:region0+0x4, 4) = 0x80141408
2321@1456171466.704734:vfio_region_write  (0000:00:16.4:region0+0x4, 0x8014140c, 4)
2321@1456171466.704745:vfio_region_read  (0000:00:16.4:region0+0xc, 4) = 0x802a2a0b
2321@1456171466.704752:vfio_region_read  (0000:00:16.4:region0+0x4, 4) = 0x80141408
2321@1456171466.704760:vfio_region_read  (0000:00:16.4:region0+0x4, 4) = 0x80141408
2321@1456171466.704766:vfio_region_write  (0000:00:16.4:region0+0x4, 0x80141409, 4)
2321@1456171466.704773:vfio_region_read  (0000:00:16.4:region0+0x4, 4) = 0x80141409
2321@1456171466.704792:vfio_region_read  (0000:00:16.4:region0+0x800, 4) = 0x0
2321@1456171466.706999:vfio_region_read  (0000:00:16.4:region0+0x800, 4) = 0x0
2321@1456171466.707035:vfio_region_read  (0000:00:16.4:region0+0xc, 4) = 0x802a2a09
2321@1456171466.707043:vfio_region_read  (0000:00:16.4:region0+0x4, 4) = 0x80141409
2321@1456171466.707051:vfio_region_read  (0000:00:16.4:region0+0xc, 4) = 0x802a2a09
2321@1456171466.707059:vfio_region_read  (0000:00:16.4:region0+0x4, 4) = 0x80141409
2321@1456171466.707066:vfio_region_write  (0000:00:16.4:region0+0x0, 0x7c000c, 4)
2321@1456171466.707075:vfio_region_write  (0000:00:16.4:region0+0x0, 0x3, 4)
2321@1456171466.707082:vfio_region_write  (0000:00:16.4:region0+0x0, 0x7f49b000, 4)
2321@1456171466.707090:vfio_region_write  (0000:00:16.4:region0+0x0, 0x7f496000, 4)
2321@1456171466.707095:vfio_region_write  (0000:00:16.4:region0+0x0, 0x7f491000, 4)
2321@1456171466.707101:vfio_region_write  (0000:00:16.4:region0+0x0, 0x7f48c000, 4)
2321@1456171466.707107:vfio_region_write  (0000:00:16.4:region0+0x0, 0x7f487000, 4)
2321@1456171466.707113:vfio_region_write  (0000:00:16.4:region0+0x0, 0x7f482000, 4)
2321@1456171466.707118:vfio_region_write  (0000:00:16.4:region0+0x0, 0x7f47d000, 4)
2321@1456171466.707124:vfio_region_write  (0000:00:16.4:region0+0x0, 0x7f478000, 4)
2321@1456171466.707129:vfio_region_write  (0000:00:16.4:region0+0x0, 0x7f473000, 4)
2321@1456171466.707135:vfio_region_write  (0000:00:16.4:region0+0x0, 0x7f46e000, 4)
2321@1456171466.707140:vfio_region_write  (0000:00:16.4:region0+0x0, 0x7f469000, 4)
2321@1456171466.707146:vfio_region_write  (0000:00:16.4:region0+0x0, 0x7f464000, 4)
2321@1456171466.707151:vfio_region_write  (0000:00:16.4:region0+0x0, 0x7f45f000, 4)
2321@1456171466.707156:vfio_region_write  (0000:00:16.4:region0+0x0, 0x7f45a000, 4)
2321@1456171466.707162:vfio_region_write  (0000:00:16.4:region0+0x0, 0x7f455000, 4)
2321@1456171466.707167:vfio_region_write  (0000:00:16.4:region0+0x0, 0x7f450000, 4)
2321@1456171466.707172:vfio_region_write  (0000:00:16.4:region0+0x0, 0x0, 4)
2321@1456171466.707178:vfio_region_write  (0000:00:16.4:region0+0x0, 0x0, 4)
2321@1456171466.707183:vfio_region_write  (0000:00:16.4:region0+0x0, 0x0, 4)
2321@1456171466.707189:vfio_region_write  (0000:00:16.4:region0+0x0, 0x0, 4)
2321@1456171466.707197:vfio_region_write  (0000:00:16.4:region0+0x0, 0x0, 4)
2321@1456171466.707203:vfio_region_write  (0000:00:16.4:region0+0x0, 0x0, 4)
2321@1456171466.707209:vfio_region_write  (0000:00:16.4:region0+0x0, 0x0, 4)
2321@1456171466.707215:vfio_region_write  (0000:00:16.4:region0+0x0, 0x0, 4)
2321@1456171466.707220:vfio_region_write  (0000:00:16.4:region0+0x0, 0x0, 4)
2321@1456171466.707225:vfio_region_write  (0000:00:16.4:region0+0x0, 0x0, 4)
2321@1456171466.707231:vfio_region_write  (0000:00:16.4:region0+0x0, 0x0, 4)
2321@1456171466.707236:vfio_region_write  (0000:00:16.4:region0+0x0, 0x0, 4)
2321@1456171466.707241:vfio_region_write  (0000:00:16.4:region0+0x0, 0x0, 4)
2321@1456171466.707247:vfio_region_write  (0000:00:16.4:region0+0x0, 0x0, 4)
2321@1456171466.707255:vfio_region_read  (0000:00:16.4:region0+0x4, 4) = 0x80341409
2321@1456171466.707261:vfio_region_write  (0000:00:16.4:region0+0x4, 0x8034140d, 4)
2321@1456171466.707268:vfio_region_read  (0000:00:16.4:region0+0xc, 4) = 0x802a2a0b
2321@1456171466.707276:vfio_region_read  (0000:00:16.4:region0+0xc, 4) = 0x802a2a0b
2321@1456171466.707285:vfio_region_read  (0000:00:16.4:region0+0x4, 4) = 0x80341409
2321@1456171466.707292:vfio_region_read  (0000:00:16.4:region0+0xc, 4) = 0x802a2a0b
2321@1456171466.707301:vfio_region_read  (0000:00:16.4:region0+0x4, 4) = 0x80341409
2321@1456171466.707307:vfio_region_write  (0000:00:16.4:region0+0x0, 0x7c000c, 4)
2321@1456171466.707313:vfio_region_write  (0000:00:16.4:region0+0x0, 0x0, 4)
2321@1456171466.707319:vfio_region_write  (0000:00:16.4:region0+0x0, 0x0, 4)
2321@1456171466.707324:vfio_region_write  (0000:00:16.4:region0+0x0, 0x7f49f000, 4)
2321@1456171466.707329:vfio_region_write  (0000:00:16.4:region0+0x0, 0x0, 4)
2321@1456171466.707335:vfio_region_write  (0000:00:16.4:region0+0x0, 0x0, 4)
2321@1456171466.707340:vfio_region_write  (0000:00:16.4:region0+0x0, 0x0, 4)
2321@1456171466.707346:vfio_region_write  (0000:00:16.4:region0+0x0, 0x7f49a000, 4)
2321@1456171466.707355:vfio_region_write  (0000:00:16.4:region0+0x0, 0x7f495000, 4)
2321@1456171466.707360:vfio_region_write  (0000:00:16.4:region0+0x0, 0x7f490000, 4)
2321@1456171466.707366:vfio_region_write  (0000:00:16.4:region0+0x0, 0x7f48b000, 4)
2321@1456171466.707371:vfio_region_write  (0000:00:16.4:region0+0x0, 0x7f486000, 4)
2321@1456171466.707377:vfio_region_write  (0000:00:16.4:region0+0x0, 0x7f481000, 4)
2321@1456171466.707382:vfio_region_write  (0000:00:16.4:region0+0x0, 0x7f47c000, 4)
2321@1456171466.707387:vfio_region_write  (0000:00:16.4:region0+0x0, 0x7f477000, 4)
2321@1456171466.707393:vfio_region_write  (0000:00:16.4:region0+0x0, 0x7f472000, 4)
2321@1456171466.707402:vfio_region_write  (0000:00:16.4:region0+0x0, 0x7f46d000, 4)
2321@1456171466.707414:vfio_region_write  (0000:00:16.4:region0+0x0, 0x7f468000, 4)
2321@1456171466.707420:vfio_region_write  (0000:00:16.4:region0+0x0, 0x7f463000, 4)
2321@1456171466.707426:vfio_region_write  (0000:00:16.4:region0+0x0, 0x7f45e000, 4)
2321@1456171466.707431:vfio_region_write  (0000:00:16.4:region0+0x0, 0x7f459000, 4)
2321@1456171466.707437:vfio_region_write  (0000:00:16.4:region0+0x0, 0x7f454000, 4)
2321@1456171466.707445:vfio_region_write  (0000:00:16.4:region0+0x0, 0x7f44f000, 4)
2321@1456171466.707450:vfio_region_write  (0000:00:16.4:region0+0x0, 0x0, 4)
2321@1456171466.707456:vfio_region_write  (0000:00:16.4:region0+0x0, 0x0, 4)
2321@1456171466.707462:vfio_region_write  (0000:00:16.4:region0+0x0, 0x0, 4)
2321@1456171466.707468:vfio_region_write  (0000:00:16.4:region0+0x0, 0x0, 4)
2321@1456171466.707473:vfio_region_write  (0000:00:16.4:region0+0x0, 0x0, 4)
2321@1456171466.707479:vfio_region_write  (0000:00:16.4:region0+0x0, 0x0, 4)
2321@1456171466.707491:vfio_region_write  (0000:00:16.4:region0+0x0, 0x0, 4)
2321@1456171466.707582:vfio_region_write  (0000:00:16.4:region0+0x0, 0x0, 4)
2321@1456171466.707626:vfio_region_write  (0000:00:16.4:region0+0x0, 0x0, 4)
2321@1456171466.707639:vfio_region_read  (0000:00:16.4:region0+0x4, 4) = 0x8054340b
2321@1456171466.707648:vfio_region_write  (0000:00:16.4:region0+0x4, 0x8054340d, 4)
2321@1456171466.707660:vfio_region_read  (0000:00:16.4:region0+0x4, 4) = 0x8054340b
2321@1456171466.707667:vfio_region_write  (0000:00:16.4:region0+0x4, 0x8054340a, 4)
2321@1456171466.707674:vfio_region_read  (0000:00:16.4:region0+0x4, 4) = 0x80543408
2321@1456171466.707682:vfio_region_read  (0000:00:16.4:region0+0xc, 4) = 0x802a2a0b
2321@1456171466.707699:vfio_region_read  (0000:00:16.4:region0+0x800, 4) = 0x0
2321@1456171466.707709:vfio_region_read  (0000:00:16.4:region0+0x4, 4) = 0x80543408
2321@1456171466.707716:vfio_region_write  (0000:00:16.4:region0+0x4, 0x80543409, 4)
2321@1456171466.707725:vfio_region_read  (0000:00:16.4:region0+0x4, 4) = 0x80543409
2321@1456171466.707733:vfio_region_read  (0000:00:16.4:region0+0xc, 4) = 0x802a2a09
2321@1456171466.707741:vfio_region_read  (0000:00:16.4:region0+0xc, 4) = 0x802a2a09
2321@1456171466.707750:vfio_region_read  (0000:00:16.4:region0+0x4, 4) = 0x80543409
2321@1456171466.707757:vfio_region_read  (0000:00:16.4:region0+0xc, 4) = 0x802a2a09
2321@1456171466.707765:vfio_region_read  (0000:00:16.4:region0+0x4, 4) = 0x80543409
2321@1456171466.707771:vfio_region_write  (0000:00:16.4:region0+0x0, 0x804c000c, 4)
2321@1456171466.707776:vfio_region_write  (0000:00:16.4:region0+0x0, 0x0, 4)
2321@1456171466.707783:vfio_region_write  (0000:00:16.4:region0+0x0, 0x0, 4)
2321@1456171466.707788:vfio_region_write  (0000:00:16.4:region0+0x0, 0x0, 4)
2321@1456171466.707794:vfio_region_write  (0000:00:16.4:region0+0x0, 0x0, 4)
2321@1456171466.707799:vfio_region_write  (0000:00:16.4:region0+0x0, 0x0, 4)
2321@1456171466.707806:vfio_region_write  (0000:00:16.4:region0+0x0, 0x0, 4)
2321@1456171466.707811:vfio_region_write  (0000:00:16.4:region0+0x0, 0x0, 4)
2321@1456171466.707817:vfio_region_write  (0000:00:16.4:region0+0x0, 0x7f4a0000, 4)
2321@1456171466.707823:vfio_region_write  (0000:00:16.4:region0+0x0, 0x0, 4)
2321@1456171466.707829:vfio_region_write  (0000:00:16.4:region0+0x0, 0xa40, 4)
2321@1456171466.707838:vfio_region_write  (0000:00:16.4:region0+0x0, 0x1001000, 4)
2321@1456171466.707844:vfio_region_write  (0000:00:16.4:region0+0x0, 0x0, 4)
2321@1456171466.707850:vfio_region_write  (0000:00:16.4:region0+0x0, 0x0, 4)
2321@1456171466.707856:vfio_region_write  (0000:00:16.4:region0+0x0, 0x0, 4)
2321@1456171466.707862:vfio_region_write  (0000:00:16.4:region0+0x0, 0x0, 4)
2321@1456171466.707868:vfio_region_write  (0000:00:16.4:region0+0x0, 0x0, 4)
2321@1456171466.707877:vfio_region_write  (0000:00:16.4:region0+0x0, 0x0, 4)
2321@1456171466.707883:vfio_region_write  (0000:00:16.4:region0+0x0, 0x0, 4)
2321@1456171466.707888:vfio_region_write  (0000:00:16.4:region0+0x0, 0x0, 4)
2321@1456171466.707947:vfio_region_read  (0000:00:16.4:region0+0x4, 4) = 0x8068540b
2321@1456171466.707956:vfio_region_write  (0000:00:16.4:region0+0x4, 0x8068540d, 4)
2321@1456171466.707965:vfio_region_read  (0000:00:16.4:region0+0xc, 4) = 0x802a2a0b
2321@1456171466.708016:vfio_region_read  (0000:00:16.4:region0+0x4, 4) = 0x8068680b
2321@1456171466.708024:vfio_region_write  (0000:00:16.4:region0+0x4, 0x8068680a, 4)
2321@1456171466.708031:vfio_region_read  (0000:00:16.4:region0+0x4, 4) = 0x80686808
2321@1456171466.708041:vfio_region_read  (0000:00:16.4:region0+0xc, 4) = 0x802a2a0b
2321@1456171466.708060:vfio_region_read  (0000:00:16.4:region0+0x800, 4) = 0x0
2321@1456171466.708068:vfio_region_read  (0000:00:16.4:region0+0x4, 4) = 0x80686808
2321@1456171466.708075:vfio_region_write  (0000:00:16.4:region0+0x4, 0x80686809, 4)
2321@1456171466.708083:vfio_region_read  (0000:00:16.4:region0+0x4, 4) = 0x80686809
2321@1456171466.710920:vfio_region_read  (0000:00:16.4:region0+0x4, 4) = 0x8068680b
2321@1456171466.710951:vfio_region_write  (0000:00:16.4:region0+0x4, 0x8068680a, 4)
2321@1456171466.710959:vfio_region_read  (0000:00:16.4:region0+0x4, 4) = 0x80686808
2321@1456171466.710968:vfio_region_read  (0000:00:16.4:region0+0xc, 4) = 0x80302a09
2321@1456171466.710987:vfio_region_read  (0000:00:16.4:region0+0x800, 4) = 0x0
2321@1456171466.710996:vfio_region_read  (0000:00:16.4:region0+0xc, 4) = 0x80302a09
2321@1456171466.711004:vfio_region_read  (0000:00:16.4:region0+0x4, 4) = 0x80686808
2321@1456171466.711012:vfio_region_read  (0000:00:16.4:region0+0x8, 4) = 0x8014000c
2321@1456171466.711019:vfio_region_read  (0000:00:16.4:region0+0x8, 4) = 0x80000003
2321@1456171466.711027:vfio_region_read  (0000:00:16.4:region0+0x8, 4) = 0x0
2321@1456171466.711034:vfio_region_read  (0000:00:16.4:region0+0x8, 4) = 0x0
2321@1456171466.711042:vfio_region_read  (0000:00:16.4:region0+0x8, 4) = 0x0
2321@1456171466.711049:vfio_region_read  (0000:00:16.4:region0+0x8, 4) = 0x0
2321@1456171466.711056:vfio_region_read  (0000:00:16.4:region0+0xc, 4) = 0x80303009
2321@1456171466.711066:vfio_region_read  (0000:00:16.4:region0+0x4, 4) = 0x80686808
2321@1456171466.711073:vfio_region_write  (0000:00:16.4:region0+0x4, 0x8068680c, 4)
2321@1456171466.711084:vfio_region_read  (0000:00:16.4:region0+0x800, 4) = 0x0
2321@1456171466.711092:vfio_region_read  (0000:00:16.4:region0+0xc, 4) = 0x8030300b
2321@1456171466.711099:vfio_region_read  (0000:00:16.4:region0+0x4, 4) = 0x80686808
2321@1456171466.711111:vfio_region_read  (0000:00:16.4:region0+0xc, 4) = 0x8030300b
2321@1456171466.711120:vfio_region_read  (0000:00:16.4:region0+0x4, 4) = 0x80686808
2321@1456171466.711126:vfio_region_write  (0000:00:16.4:region0+0x0, 0x8004000c, 4)
2321@1456171466.711132:vfio_region_write  (0000:00:16.4:region0+0x0, 0x5, 4)
2321@1456171466.711140:vfio_region_read  (0000:00:16.4:region0+0x4, 4) = 0x806a6808
2321@1456171466.711145:vfio_region_write  (0000:00:16.4:region0+0x4, 0x806a680c, 4)
2321@1456171466.711154:vfio_region_read  (0000:00:16.4:region0+0xc, 4) = 0x8030300b
2321@1456171466.711169:vfio_region_read  (0000:00:16.4:region0+0xc, 4) = 0x8030300b
2321@1456171466.711177:vfio_region_read  (0000:00:16.4:region0+0x4, 4) = 0x806a6808
2321@1456171466.711184:vfio_region_read  (0000:00:16.4:region0+0x4, 4) = 0x806a6808
2321@1456171466.711190:vfio_region_write  (0000:00:16.4:region0+0x4, 0x806a6809, 4)
2321@1456171466.711206:vfio_region_read  (0000:00:16.4:region0+0x4, 4) = 0x806a6809
2321@1456171466.711420:vfio_region_read  (0000:00:16.4:region0+0x4, 4) = 0x806a6a0b
2321@1456171466.711432:vfio_region_write  (0000:00:16.4:region0+0x4, 0x806a6a0a, 4)
2321@1456171466.711439:vfio_region_read  (0000:00:16.4:region0+0x4, 4) = 0x806a6a08
2321@1456171466.711447:vfio_region_read  (0000:00:16.4:region0+0xc, 4) = 0x80303009
2321@1456171466.711465:vfio_region_read  (0000:00:16.4:region0+0x800, 4) = 0x0
2321@1456171466.711474:vfio_region_read  (0000:00:16.4:region0+0x4, 4) = 0x806a6a08
2321@1456171466.711480:vfio_region_write  (0000:00:16.4:region0+0x4, 0x806a6a09, 4)
2321@1456171466.711487:vfio_region_read  (0000:00:16.4:region0+0x4, 4) = 0x806a6a09
2321@1456171476.697203:vfio_region_read  (0000:00:16.4:region0+0xc, 4) = 0x80303009
2321@1456171476.697326:vfio_region_read  (0000:00:16.4:region0+0x4, 4) = 0x806a6a09
2321@1456171476.697364:vfio_region_read  (0000:00:16.4:region0+0xc, 4) = 0x80303009
2321@1456171476.697400:vfio_region_read  (0000:00:16.4:region0+0x4, 4) = 0x806a6a09
2321@1456171476.697439:vfio_region_write  (0000:00:16.4:region0+0x0, 0x80040000, 4)
2321@1456171476.697480:vfio_region_write  (0000:00:16.4:region0+0x0, 0xa, 4)
2321@1456171476.697516:vfio_region_read  (0000:00:16.4:region0+0x4, 4) = 0x806c6a09
2321@1456171476.697554:vfio_region_write  (0000:00:16.4:region0+0x4, 0x806c6a0d, 4)
2321@1456171476.697589:vfio_region_read  (0000:00:16.4:region0+0xc, 4) = 0x8030300b
2321@1456171476.697921:vfio_region_read  (0000:00:16.4:region0+0x4, 4) = 0x806c6c0b
2321@1456171476.697964:vfio_region_write  (0000:00:16.4:region0+0x4, 0x806c6c0a, 4)
2321@1456171476.697997:vfio_region_read  (0000:00:16.4:region0+0x4, 4) = 0x806c6c08
2321@1456171476.698030:vfio_region_read  (0000:00:16.4:region0+0xc, 4) = 0x80323009
2321@1456171476.698129:vfio_region_read  (0000:00:16.4:region0+0x800, 4) = 0x0
2321@1456171476.698170:vfio_region_read  (0000:00:16.4:region0+0xc, 4) = 0x80323009
2321@1456171476.698204:vfio_region_read  (0000:00:16.4:region0+0x4, 4) = 0x806c6c08
2321@1456171476.698239:vfio_region_read  (0000:00:16.4:region0+0x8, 4) = 0x80040000
2321@1456171476.698272:vfio_region_read  (0000:00:16.4:region0+0x8, 4) = 0x8a
2321@1456171476.698326:vfio_region_read  (0000:00:16.4:region0+0xc, 4) = 0x80323209
2321@1456171476.698362:vfio_region_read  (0000:00:16.4:region0+0x4, 4) = 0x806c6c08
2321@1456171476.698394:vfio_region_write  (0000:00:16.4:region0+0x4, 0x806c6c0c, 4)
2321@1456171476.698430:vfio_region_write  (0000:00:16.4:region0+0x800, 0x4, 4)
2321@1456171476.698467:vfio_region_read  (0000:00:16.4:region0+0xc, 4) = 0x80323209
2321@1456171476.698500:vfio_region_read  (0000:00:16.4:region0+0x4, 4) = 0x806c6c08
2321@1456171476.698533:vfio_region_read  (0000:00:16.4:region0+0x4, 4) = 0x806c6c08
2321@1456171476.698596:vfio_region_write  (0000:00:16.4:region0+0x4, 0x806c6c09, 4)
2321@1456171476.698632:vfio_region_read  (0000:00:16.4:region0+0x4, 4) = 0x806c6c09
qemu-system-x86_64: terminating on signal 2
