


---

3250@1455399352.033140:vfio_pci_read_config  (0000:00:16.4, @0x0, len=0x2) 8086
3250@1455399352.033188:vfio_pci_read_config  (0000:00:16.4, @0x2, len=0x2) 9d3e
3250@1455399352.033218:vfio_pci_read_config  (0000:00:16.4, @0x8, len=0x1) 21
3250@1455399352.033244:vfio_pci_read_config  (0000:00:16.4, @0x9, len=0x1) 0
3250@1455399352.033273:vfio_pci_read_config  (0000:00:16.4, @0xa, len=0x1) 80
3250@1455399352.033299:vfio_pci_read_config  (0000:00:16.4, @0xb, len=0x1) 7
3250@1455399352.033326:vfio_pci_read_config  (0000:00:16.4, @0xe, len=0x1) 0
3250@1455399352.033350:vfio_pci_read_config  (0000:00:16.4, @0x2c, len=0x2) 0
3250@1455399352.033376:vfio_pci_read_config  (0000:00:16.4, @0x2e, len=0x2) 0
3250@1455399352.033401:vfio_pci_read_config  (0000:00:16.4, @0x4, len=0x2) 400
3250@1455399352.033426:vfio_pci_read_config  (0000:00:16.4, @0x4, len=0x2) 400

3250@1455399352.066578:vfio_intx_update  (0000:00:16.4) IRQ moved -1 -> 10
3250@1455399352.066669:vfio_intx_enable_kvm  (0000:00:16.4) KVM INTx accel enabled
3250@1455399352.066790:vfio_pci_write_config  (0000:00:16.4, @0x3c, 0xa, len=0x1)
3250@1455399352.067780:vfio_pci_read_config  (0000:00:16.4, @0x0, len=0x2) 8086
3250@1455399352.067822:vfio_pci_read_config  (0000:00:16.4, @0x2, len=0x2) 9d3e
3250@1455399352.067844:vfio_pci_read_config  (0000:00:16.4, @0x8, len=0x1) 21
3250@1455399352.067864:vfio_pci_read_config  (0000:00:16.4, @0x9, len=0x1) 0
3250@1455399352.067886:vfio_pci_read_config  (0000:00:16.4, @0xa, len=0x1) 80
3250@1455399352.067921:vfio_pci_read_config  (0000:00:16.4, @0xb, len=0x1) 7
3250@1455399352.067943:vfio_pci_read_config  (0000:00:16.4, @0xe, len=0x1) 0
3250@1455399352.067963:vfio_pci_read_config  (0000:00:16.4, @0x2c, len=0x2) 0
3250@1455399352.067984:vfio_pci_read_config  (0000:00:16.4, @0x2e, len=0x2) 0
3250@1455399352.068007:vfio_pci_read_config  (0000:00:16.4, @0x50, len=0x4) 40038c01
3250@1455399352.068023:vfio_pci_read_config  (0000:00:16.4, @0x54, len=0x4) b
3250@1455399352.068042:vfio_pci_write_config  (0000:00:16.4, @0x54, 0x8, len=0x2)
3250@1455399352.115090:vfio_pci_read_config  (0000:00:16.4, @0x54, len=0x2) 8
3250@1455399352.115635:vfio_pci_write_config  (0000:00:16.4, @0x10, 0x81000000, len=0x4)
3250@1455399352.115773:vfio_pci_write_config  (0000:00:16.4, @0x14, 0x0, len=0x4)
3250@1455399352.115855:vfio_pci_write_config  (0000:00:16.4, @0x18, 0x0, len=0x4)
3250@1455399352.115933:vfio_pci_write_config  (0000:00:16.4, @0x1c, 0x0, len=0x4)
3250@1455399352.116002:vfio_pci_write_config  (0000:00:16.4, @0x20, 0x0, len=0x4)
3250@1455399352.116076:vfio_pci_write_config  (0000:00:16.4, @0x24, 0x0, len=0x4)
3250@1455399352.116167:vfio_pci_write_config  (0000:00:16.4, @0x30, 0x0, len=0x4)
3250@1455399352.116262:vfio_pci_write_config  (0000:00:16.4, @0x3c, 0xa, len=0x1)
3250@1455399352.116352:vfio_pci_write_config  (0000:00:16.4, @0xc, 0x0, len=0x1)
3250@1455399352.116458:vfio_pci_write_config  (0000:00:16.4, @0xd, 0x0, len=0x1)
3250@1455399352.116552:vfio_pci_write_config  (0000:00:16.4, @0x4, 0x400, len=0x2)
3250@1455399352.116713:vfio_pci_read_config  (0000:00:16.4, @0x4, len=0x2) 400
3250@1455399352.116837:vfio_pci_write_config  (0000:00:16.4, @0x4, 0x406, len=0x2)

3250@1455399352.117345:vfio_listener_region_add_skip SKIPPING region_add 81000000 - 81000fff
3250@1455399352.141326:vfio_pci_write_config  (0000:00:16.4, @0x6, 0xf900, len=0x2)
3250@1455399352.141773:vfio_pci_read_config  (0000:00:16.4, @0x4, len=0x2) 406
3250@1455399352.141991:vfio_pci_write_config  (0000:00:16.4, @0x4, 0x406, len=0x2)
3250@1455399352.142053:vfio_pci_read_config  (0000:00:16.4, @0x8e, len=0x2) 80
3250@1455399352.142090:vfio_pci_write_config  (0000:00:16.4, @0x8e, 0x80, len=0x2)
3250@1455399352.142152:vfio_pci_read_config  (0000:00:16.4, @0x4, len=0x2) 406
3250@1455399352.142187:vfio_pci_write_config  (0000:00:16.4, @0x4, 0x6, len=0x2)

3250@1455399352.142520:vfio_region_read  (0000:00:16.4:region0+0xc, 4) = 0x80000009
3250@1455399352.143114:vfio_region_read  (0000:00:16.4:region0+0x800, 4) = 0x4
3250@1455399352.143155:vfio_region_read  (0000:00:16.4:region0+0x800, 4) = 0x4
3250@1455399352.143177:vfio_region_write  (0000:00:16.4:region0+0x800, 0x0, 4)0x80303009

3250@1455399352.143216:vfio_region_read  (0000:00:16.4:region0+0x800, 4) = 0x1
3250@1455399352.143375:vfio_region_read  (0000:00:16.4:region0+0x800, 4) = 0x1
3250@1455399352.143521:vfio_region_read  (0000:00:16.4:region0+0x800, 4) = 0x0
3250@1455399352.143600:vfio_region_read  (0000:00:16.4:region0+0x800, 4) = 0x0
3250@1455399352.143639:vfio_region_read  (0000:00:16.4:region0+0x4, 4) = 0x80000008
3250@1455399352.143664:vfio_region_write  (0000:00:16.4:region0+0x4, 0x80000008, 4)

3250@1455399352.143849:vfio_region_read  (0000:00:16.4:region0+0x4, 4) = 0x80000008
3250@1455399352.143883:vfio_region_read  (0000:00:16.4:region0+0x4, 4) = 0x80000008
3250@1455399352.143910:vfio_region_write  (0000:00:16.4:region0+0x4, 0x8000001f, 4)

3250@1455399352.144950:vfio_region_read  (0000:00:16.4:region0+0x4, 4) = 0x80000013
3250@1455399352.144989:vfio_region_write  (0000:00:16.4:region0+0x4, 0x80000012, 4)

3250@1455399352.145009:vfio_region_read  (0000:00:16.4:region0+0x4, 4) = 0x80000010
3250@1455399352.145025:vfio_region_read  (0000:00:16.4:region0+0xc, 4) = 0x80000009
3250@1455399352.145071:vfio_region_read  (0000:00:16.4:region0+0x800, 4) = 0x0
3250@1455399352.145101:vfio_region_read  (0000:00:16.4:region0+0x4, 4) = 0x80000010
3250@1455399352.145121:vfio_region_write  (0000:00:16.4:region0+0x4, 0x8000000c, 4)

3250@1455399352.145146:vfio_region_read  (0000:00:16.4:region0+0x4, 4) = 0x80000008
3250@1455399352.145163:vfio_region_write  (0000:00:16.4:region0+0x4, 0x80000009, 4)

3250@1455399352.145182:vfio_region_read  (0000:00:16.4:region0+0x4, 4) = 0x80000009
3250@1455399352.145204:vfio_region_read  (0000:00:16.4:region0+0x800, 4) = 0x0
3250@1455399352.145229:vfio_region_read  (0000:00:16.4:region0+0xc, 4) = 0x8000000b
3250@1455399352.145251:vfio_region_read  (0000:00:16.4:region0+0x4, 4) = 0x80000009
3250@1455399352.145271:vfio_region_read  (0000:00:16.4:region0+0xc, 4) = 0x8000000b
3250@1455399352.145293:vfio_region_read  (0000:00:16.4:region0+0x4, 4) = 0x80000009
3250@1455399352.145310:vfio_region_write  (0000:00:16.4:region0+0x0, 0x80040000, 4)
3250@1455399352.145324:vfio_region_write  (0000:00:16.4:region0+0x0, 0x1000001, 4)
3250@1455399352.145339:vfio_region_read  (0000:00:16.4:region0+0x4, 4) = 0x80020009
3250@1455399352.145353:vfio_region_write  (0000:00:16.4:region0+0x4, 0x8002000d, 4)
3250@1455399352.145373:vfio_region_read  (0000:00:16.4:region0+0xc, 4) = 0x8000000b
3250@1455399352.145774:vfio_region_read  (0000:00:16.4:region0+0x4, 4) = 0x8002020b
3250@1455399352.145803:vfio_region_write  (0000:00:16.4:region0+0x4, 0x8002020a, 4)
3250@1455399352.145823:vfio_region_read  (0000:00:16.4:region0+0x4, 4) = 0x80020208
3250@1455399352.145845:vfio_region_read  (0000:00:16.4:region0+0xc, 4) = 0x80020009
3250@1455399352.145887:vfio_region_read  (0000:00:16.4:region0+0x800, 4) = 0x0
3250@1455399352.145912:vfio_region_read  (0000:00:16.4:region0+0xc, 4) = 0x80020009
3250@1455399352.145933:vfio_region_read  (0000:00:16.4:region0+0x4, 4) = 0x80020208
3250@1455399352.145956:vfio_region_read  (0000:00:16.4:region0+0x8, 4) = 0x80040000
3250@1455399352.145976:vfio_region_read  (0000:00:16.4:region0+0x8, 4) = 0x2000181
3250@1455399352.145999:vfio_region_read  (0000:00:16.4:region0+0xc, 4) = 0x80020209
3250@1455399352.146020:vfio_region_read  (0000:00:16.4:region0+0x4, 4) = 0x80020208
3250@1455399352.146041:vfio_region_write  (0000:00:16.4:region0+0x4, 0x8002020c, 4)
3250@1455399352.146067:vfio_region_read  (0000:00:16.4:region0+0xc, 4) = 0x8002020b
3250@1455399352.146088:vfio_region_read  (0000:00:16.4:region0+0x4, 4) = 0x80020208
3250@1455399352.146108:vfio_region_read  (0000:00:16.4:region0+0x4, 4) = 0x80020208
3250@1455399352.146125:vfio_region_write  (0000:00:16.4:region0+0x4, 0x80020209, 4)
3250@1455399352.146149:vfio_region_read  (0000:00:16.4:region0+0x4, 4) = 0x80020209
3250@1455399352.146176:vfio_region_read  (0000:00:16.4:region0+0x800, 4) = 0x0
3250@1455399352.146202:vfio_region_read  (0000:00:16.4:region0+0xc, 4) = 0x80020209
3250@1455399352.146222:vfio_region_read  (0000:00:16.4:region0+0x4, 4) = 0x80020209
3250@1455399352.146242:vfio_region_read  (0000:00:16.4:region0+0xc, 4) = 0x80020209
3250@1455399352.146267:vfio_region_read  (0000:00:16.4:region0+0x4, 4) = 0x80020209
3250@1455399352.146283:vfio_region_write  (0000:00:16.4:region0+0x0, 0x80040000, 4)
3250@1455399352.146298:vfio_region_write  (0000:00:16.4:region0+0x0, 0xc05, 4)
3250@1455399352.146318:vfio_region_read  (0000:00:16.4:region0+0x4, 4) = 0x80040209
3250@1455399352.146333:vfio_region_write  (0000:00:16.4:region0+0x4, 0x8004020d, 4)
3250@1455399352.146352:vfio_region_read  (0000:00:16.4:region0+0xc, 4) = 0x8002020b
3250@1455399352.146627:vfio_region_read  (0000:00:16.4:region0+0x4, 4) = 0x8004040b
3250@1455399352.146653:vfio_region_write  (0000:00:16.4:region0+0x4, 0x8004040a, 4)
3250@1455399352.146673:vfio_region_read  (0000:00:16.4:region0+0x4, 4) = 0x80040408
3250@1455399352.146692:vfio_region_read  (0000:00:16.4:region0+0xc, 4) = 0x800a0209
3250@1455399352.146733:vfio_region_read  (0000:00:16.4:region0+0x800, 4) = 0x0
3250@1455399352.146767:vfio_region_read  (0000:00:16.4:region0+0xc, 4) = 0x800a0209
3250@1455399352.146789:vfio_region_read  (0000:00:16.4:region0+0x4, 4) = 0x80040408
3250@1455399352.146809:vfio_region_read  (0000:00:16.4:region0+0x8, 4) = 0x801c0000
3250@1455399352.146829:vfio_region_read  (0000:00:16.4:region0+0x8, 4) = 0xc85
3250@1455399352.146848:vfio_region_read  (0000:00:16.4:region0+0x8, 4) = 0x3e8d0870
3250@1455399352.146888:vfio_region_read  (0000:00:16.4:region0+0x8, 4) = 0x4208271a
3250@1455399352.146909:vfio_region_read  (0000:00:16.4:region0+0x8, 4) = 0xcb9ab58e
3250@1455399352.146930:vfio_region_read  (0000:00:16.4:region0+0x8, 4) = 0x4ae0294
3250@1455399352.146949:vfio_region_read  (0000:00:16.4:region0+0x8, 4) = 0x10c000a
3250@1455399352.146969:vfio_region_read  (0000:00:16.4:region0+0x8, 4) = 0x144
3250@1455399352.146988:vfio_region_read  (0000:00:16.4:region0+0xc, 4) = 0x800a0a09
3250@1455399352.147008:vfio_region_read  (0000:00:16.4:region0+0x4, 4) = 0x80040408
3250@1455399352.147024:vfio_region_write  (0000:00:16.4:region0+0x4, 0x8004040c, 4)
3250@1455399352.147050:vfio_region_read  (0000:00:16.4:region0+0xc, 4) = 0x800a0a0b
3250@1455399352.147070:vfio_region_read  (0000:00:16.4:region0+0x4, 4) = 0x80040408
3250@1455399352.147090:vfio_region_read  (0000:00:16.4:region0+0x4, 4) = 0x80040408
3250@1455399352.147106:vfio_region_write  (0000:00:16.4:region0+0x4, 0x80040409, 4)
3250@1455399352.147125:vfio_region_read  (0000:00:16.4:region0+0x4, 4) = 0x80040409
3250@1455399352.147244:vfio_region_read  (0000:00:16.4:region0+0x800, 4) = 0x0
3250@1455399352.147269:vfio_region_read  (0000:00:16.4:region0+0x800, 4) = 0x0
3250@1455399352.147289:vfio_region_read  (0000:00:16.4:region0+0xc, 4) = 0x800a0a09
3250@1455399352.147309:vfio_region_read  (0000:00:16.4:region0+0x4, 4) = 0x80040409
3250@1455399352.147328:vfio_region_read  (0000:00:16.4:region0+0xc, 4) = 0x800a0a09
3250@1455399352.147348:vfio_region_read  (0000:00:16.4:region0+0x4, 4) = 0x80040409
3250@1455399352.147364:vfio_region_write  (0000:00:16.4:region0+0x0, 0x8014000c, 4)
3250@1455399352.147380:vfio_region_write  (0000:00:16.4:region0+0x0, 0x9, 4)
3250@1455399352.147396:vfio_region_write  (0000:00:16.4:region0+0x0, 0x0, 4)
3250@1455399352.147412:vfio_region_write  (0000:00:16.4:region0+0x0, 0x1e, 4)
3250@1455399352.147431:vfio_region_write  (0000:00:16.4:region0+0x0, 0x0, 4)
3250@1455399352.147446:vfio_region_write  (0000:00:16.4:region0+0x0, 0x0, 4)
3250@1455399352.147466:vfio_region_read  (0000:00:16.4:region0+0x4, 4) = 0x800a0409
3250@1455399352.147481:vfio_region_write  (0000:00:16.4:region0+0x4, 0x800a040d, 4)
3250@1455399352.147500:vfio_region_read  (0000:00:16.4:region0+0xc, 4) = 0x800a0a0b
3250@1455399352.147801:vfio_region_read  (0000:00:16.4:region0+0x4, 4) = 0x800a0a0b
3250@1455399352.147823:vfio_region_write  (0000:00:16.4:region0+0x4, 0x800a0a0a, 4)
3250@1455399352.147839:vfio_region_read  (0000:00:16.4:region0+0x4, 4) = 0x800a0a08
3250@1455399352.147856:vfio_region_read  (0000:00:16.4:region0+0xc, 4) = 0x800a0a09
3250@1455399352.147892:vfio_region_read  (0000:00:16.4:region0+0x800, 4) = 0x0
3250@1455399352.147911:vfio_region_read  (0000:00:16.4:region0+0x4, 4) = 0x800a0a08
3250@1455399352.147923:vfio_region_write  (0000:00:16.4:region0+0x4, 0x800a0a09, 4)
3250@1455399352.147939:vfio_region_read  (0000:00:16.4:region0+0x4, 4) = 0x800a0a09
3250@1455399352.149182:vfio_region_read  (0000:00:16.4:region0+0x4, 4) = 0x800a0a0b
3250@1455399352.149213:vfio_region_write  (0000:00:16.4:region0+0x4, 0x800a0a0a, 4)
3250@1455399352.149233:vfio_region_read  (0000:00:16.4:region0+0x4, 4) = 0x800a0a08
3250@1455399352.149251:vfio_region_read  (0000:00:16.4:region0+0xc, 4) = 0x80100a09
3250@1455399352.149304:vfio_region_read  (0000:00:16.4:region0+0x800, 4) = 0x0
3250@1455399352.149322:vfio_region_read  (0000:00:16.4:region0+0xc, 4) = 0x80100a09
3250@1455399352.149339:vfio_region_read  (0000:00:16.4:region0+0x4, 4) = 0x800a0a08
3250@1455399352.149356:vfio_region_read  (0000:00:16.4:region0+0x8, 4) = 0x8014000c
3250@1455399352.149373:vfio_region_read  (0000:00:16.4:region0+0x8, 4) = 0x80000009
3250@1455399352.149389:vfio_region_read  (0000:00:16.4:region0+0x8, 4) = 0x0
3250@1455399352.149405:vfio_region_read  (0000:00:16.4:region0+0x8, 4) = 0x1e
3250@1455399352.149421:vfio_region_read  (0000:00:16.4:region0+0x8, 4) = 0x0
3250@1455399352.149437:vfio_region_read  (0000:00:16.4:region0+0x8, 4) = 0x0
3250@1455399352.149453:vfio_region_read  (0000:00:16.4:region0+0xc, 4) = 0x80101009
3250@1455399352.149470:vfio_region_read  (0000:00:16.4:region0+0x4, 4) = 0x800a0a08
3250@1455399352.149481:vfio_region_write  (0000:00:16.4:region0+0x4, 0x800a0a0c, 4)
3250@1455399352.149508:vfio_region_read  (0000:00:16.4:region0+0xc, 4) = 0x8010100b
3250@1455399352.149525:vfio_region_read  (0000:00:16.4:region0+0x4, 4) = 0x800a0a08
3250@1455399352.149542:vfio_region_read  (0000:00:16.4:region0+0x4, 4) = 0x800a0a08
3250@1455399352.149555:vfio_region_write  (0000:00:16.4:region0+0x4, 0x800a0a09, 4)
3250@1455399352.149571:vfio_region_read  (0000:00:16.4:region0+0x4, 4) = 0x800a0a09
3250@1455399352.150047:vfio_region_read  (0000:00:16.4:region0+0x800, 4) = 0x0
3250@1455399352.150085:vfio_region_read  (0000:00:16.4:region0+0x800, 4) = 0x0
3250@1455399352.150104:vfio_region_read  (0000:00:16.4:region0+0xc, 4) = 0x80101009
3250@1455399352.150122:vfio_region_read  (0000:00:16.4:region0+0x4, 4) = 0x800a0a09
3250@1455399352.150138:vfio_region_read  (0000:00:16.4:region0+0xc, 4) = 0x80101009
3250@1455399352.150155:vfio_region_read  (0000:00:16.4:region0+0x4, 4) = 0x800a0a09
3250@1455399352.150169:vfio_region_write  (0000:00:16.4:region0+0x0, 0x8004000c, 4)
3250@1455399352.150182:vfio_region_write  (0000:00:16.4:region0+0x0, 0x8, 4)
3250@1455399352.150216:vfio_region_read  (0000:00:16.4:region0+0x4, 4) = 0x800c0a09
3250@1455399352.150231:vfio_region_write  (0000:00:16.4:region0+0x4, 0x800c0a0d, 4)
3250@1455399352.150265:vfio_region_read  (0000:00:16.4:region0+0xc, 4) = 0x8010100b
3250@1455399352.150550:vfio_region_read  (0000:00:16.4:region0+0x4, 4) = 0x800c0c0b

3250@1455399352.150578:vfio_region_write  (0000:00:16.4:region0+0x4, 0x800c0c0a, 4)
3250@1455399352.150596:vfio_region_read  (0000:00:16.4:region0+0x4, 4) = 0x800c0c08
3250@1455399352.150613:vfio_region_read  (0000:00:16.4:region0+0xc, 4) = 0x80101009
3250@1455399352.150652:vfio_region_read  (0000:00:16.4:region0+0x800, 4) = 0x0
3250@1455399352.150671:vfio_region_read  (0000:00:16.4:region0+0x4, 4) = 0x800c0c08
3250@1455399352.150694:vfio_region_write  (0000:00:16.4:region0+0x4, 0x800c0c09, 4)

3250@1455399352.150718:vfio_region_read  (0000:00:16.4:region0+0x4, 4) = 0x800c0c09
3250@1455399352.151278:vfio_region_read  (0000:00:16.4:region0+0x4, 4) = 0x800c0c0b
3250@1455399352.151305:vfio_region_write  (0000:00:16.4:region0+0x4, 0x800c0c0a, 4)
3250@1455399352.151324:vfio_region_read  (0000:00:16.4:region0+0x4, 4) = 0x800c0c08
3250@1455399352.151341:vfio_region_read  (0000:00:16.4:region0+0xc, 4) = 0x80161009
3250@1455399352.151377:vfio_region_read  (0000:00:16.4:region0+0x800, 4) = 0x0
3250@1455399352.151396:vfio_region_read  (0000:00:16.4:region0+0xc, 4) = 0x80161009
3250@1455399352.151412:vfio_region_read  (0000:00:16.4:region0+0x4, 4) = 0x800c0c08
3250@1455399352.151429:vfio_region_read  (0000:00:16.4:region0+0x8, 4) = 0x8014000c
3250@1455399352.151450:vfio_region_read  (0000:00:16.4:region0+0x8, 4) = 0x80000008
3250@1455399352.151467:vfio_region_read  (0000:00:16.4:region0+0x8, 4) = 0x0
3250@1455399352.151485:vfio_region_read  (0000:00:16.4:region0+0x8, 4) = 0x0
3250@1455399352.151503:vfio_region_read  (0000:00:16.4:region0+0x8, 4) = 0x0
3250@1455399352.151520:vfio_region_read  (0000:00:16.4:region0+0x8, 4) = 0x0
3250@1455399352.151538:vfio_region_read  (0000:00:16.4:region0+0xc, 4) = 0x80161609
3250@1455399352.151557:vfio_region_read  (0000:00:16.4:region0+0x4, 4) = 0x800c0c08
3250@1455399352.151572:vfio_region_write  (0000:00:16.4:region0+0x4, 0x800c0c0c, 4)
3250@1455399352.151597:vfio_region_read  (0000:00:16.4:region0+0xc, 4) = 0x8016160b
3250@1455399352.151614:vfio_region_read  (0000:00:16.4:region0+0x4, 4) = 0x800c0c08
3250@1455399352.151633:vfio_region_read  (0000:00:16.4:region0+0x4, 4) = 0x800c0c08
3250@1455399352.151647:vfio_region_write  (0000:00:16.4:region0+0x4, 0x800c0c09, 4)
3250@1455399352.151665:vfio_region_read  (0000:00:16.4:region0+0x4, 4) = 0x800c0c09
3250@1455399352.151703:vfio_region_read  (0000:00:16.4:region0+0x800, 4) = 0x0
3250@1455399352.151732:vfio_region_read  (0000:00:16.4:region0+0x800, 4) = 0x0
3250@1455399352.151752:vfio_region_read  (0000:00:16.4:region0+0xc, 4) = 0x80161609
3250@1455399352.151770:vfio_region_read  (0000:00:16.4:region0+0x4, 4) = 0x800c0c09
3250@1455399352.151788:vfio_region_read  (0000:00:16.4:region0+0xc, 4) = 0x80161609
3250@1455399352.151807:vfio_region_read  (0000:00:16.4:region0+0x4, 4) = 0x800c0c09
3250@1455399352.151823:vfio_region_write  (0000:00:16.4:region0+0x0, 0x8004000c, 4)
3250@1455399352.151836:vfio_region_write  (0000:00:16.4:region0+0x0, 0x1, 4)
3250@1455399352.151852:vfio_region_read  (0000:00:16.4:region0+0x4, 4) = 0x800e0c09
3250@1455399352.151864:vfio_region_write  (0000:00:16.4:region0+0x4, 0x800e0c0d, 4)
3250@1455399352.151880:vfio_region_read  (0000:00:16.4:region0+0xc, 4) = 0x8016160b
3250@1455399352.152159:vfio_region_read  (0000:00:16.4:region0+0x4, 4) = 0x800e0e0b
3250@1455399352.152194:vfio_region_write  (0000:00:16.4:region0+0x4, 0x800e0e0a, 4)
3250@1455399352.152218:vfio_region_read  (0000:00:16.4:region0+0x4, 4) = 0x800e0e08
3250@1455399352.152236:vfio_region_read  (0000:00:16.4:region0+0xc, 4) = 0x80161609
3250@1455399352.152271:vfio_region_read  (0000:00:16.4:region0+0x800, 4) = 0x0
3250@1455399352.152290:vfio_region_read  (0000:00:16.4:region0+0x4, 4) = 0x800e0e08
3250@1455399352.152303:vfio_region_write  (0000:00:16.4:region0+0x4, 0x800e0e09, 4)
3250@1455399352.152319:vfio_region_read  (0000:00:16.4:region0+0x4, 4) = 0x800e0e09
3250@1455399352.152941:vfio_region_read  (0000:00:16.4:region0+0x4, 4) = 0x800e0e0b
3250@1455399352.152964:vfio_region_write  (0000:00:16.4:region0+0x4, 0x800e0e0a, 4)
3250@1455399352.152985:vfio_region_read  (0000:00:16.4:region0+0x4, 4) = 0x800e0e08
3250@1455399352.153006:vfio_region_read  (0000:00:16.4:region0+0xc, 4) = 0x80241609
3250@1455399352.153046:vfio_region_read  (0000:00:16.4:region0+0x800, 4) = 0x0
3250@1455399352.153069:vfio_region_read  (0000:00:16.4:region0+0xc, 4) = 0x80241609
3250@1455399352.153089:vfio_region_read  (0000:00:16.4:region0+0x4, 4) = 0x800e0e08
3250@1455399352.153108:vfio_region_read  (0000:00:16.4:region0+0x8, 4) = 0x8034000c
3250@1455399352.153128:vfio_region_read  (0000:00:16.4:region0+0x8, 4) = 0x80000001
3250@1455399352.153148:vfio_region_read  (0000:00:16.4:region0+0x8, 4) = 0x0
3250@1455399352.153167:vfio_region_read  (0000:00:16.4:region0+0x8, 4) = 0x6a1b96
3250@1455399352.153187:vfio_region_read  (0000:00:16.4:region0+0x8, 4) = 0x1
3250@1455399352.153209:vfio_region_read  (0000:00:16.4:region0+0x8, 4) = 0x1330095
3250@1455399352.153229:vfio_region_read  (0000:00:16.4:region0+0x8, 4) = 0x4000
3250@1455399352.153247:vfio_region_read  (0000:00:16.4:region0+0x8, 4) = 0xa40
3250@1455399352.153267:vfio_region_read  (0000:00:16.4:region0+0x8, 4) = 0x0
3250@1455399352.153288:vfio_region_read  (0000:00:16.4:region0+0x8, 4) = 0x10a
3250@1455399352.153307:vfio_region_read  (0000:00:16.4:region0+0x8, 4) = 0x470047
3250@1455399352.153326:vfio_region_read  (0000:00:16.4:region0+0x8, 4) = 0x40101
3250@1455399352.153346:vfio_region_read  (0000:00:16.4:region0+0x8, 4) = 0x0
3250@1455399352.153368:vfio_region_read  (0000:00:16.4:region0+0x8, 4) = 0x0
3250@1455399352.153387:vfio_region_read  (0000:00:16.4:region0+0xc, 4) = 0x80242409
3250@1455399352.153406:vfio_region_read  (0000:00:16.4:region0+0x4, 4) = 0x800e0e08
3250@1455399352.153422:vfio_region_write  (0000:00:16.4:region0+0x4, 0x800e0e0c, 4)
3250@1455399352.153460:vfio_region_read  (0000:00:16.4:region0+0xc, 4) = 0x8024240b
3250@1455399352.153479:vfio_region_read  (0000:00:16.4:region0+0x800, 4) = 0x0
3250@1455399352.153516:vfio_region_read  (0000:00:16.4:region0+0x4, 4) = 0x800e0e08
3250@1455399352.153537:vfio_region_read  (0000:00:16.4:region0+0x800, 4) = 0x0
3250@1455399352.153555:vfio_region_read  (0000:00:16.4:region0+0x4, 4) = 0x800e0e08
3250@1455399352.153586:vfio_region_read  (0000:00:16.4:region0+0xc, 4) = 0x80242409
3250@1455399352.153606:vfio_region_write  (0000:00:16.4:region0+0x4, 0x800e0e09, 4)
3250@1455399352.153626:vfio_region_read  (0000:00:16.4:region0+0x4, 4) = 0x800e0e09
3250@1455399352.153648:vfio_region_read  (0000:00:16.4:region0+0xc, 4) = 0x80242409
3250@1455399352.153668:vfio_region_read  (0000:00:16.4:region0+0x4, 4) = 0x800e0e09
3250@1455399352.153687:vfio_region_read  (0000:00:16.4:region0+0x4, 4) = 0x800e0e09
3250@1455399352.153706:vfio_region_write  (0000:00:16.4:region0+0x0, 0x8014000c, 4)
3250@1455399352.153722:vfio_region_write  (0000:00:16.4:region0+0x0, 0x2, 4)
3250@1455399352.153737:vfio_region_write  (0000:00:16.4:region0+0x0, 0x0, 4)
3250@1455399352.153750:vfio_region_write  (0000:00:16.4:region0+0x0, 0x0, 4)
3250@1455399352.153765:vfio_region_write  (0000:00:16.4:region0+0x0, 0x0, 4)
3250@1455399352.153779:vfio_region_write  (0000:00:16.4:region0+0x0, 0x0, 4)
3250@1455399352.153798:vfio_region_read  (0000:00:16.4:region0+0x4, 4) = 0x80140e09
3250@1455399352.153819:vfio_region_write  (0000:00:16.4:region0+0x4, 0x80140e0d, 4)
3250@1455399352.153838:vfio_region_read  (0000:00:16.4:region0+0xc, 4) = 0x8024240b
3250@1455399352.154133:vfio_region_read  (0000:00:16.4:region0+0x4, 4) = 0x8014140b
3250@1455399352.154153:vfio_region_write  (0000:00:16.4:region0+0x4, 0x8014140a, 4)
3250@1455399352.154172:vfio_region_read  (0000:00:16.4:region0+0x4, 4) = 0x80141408
3250@1455399352.154188:vfio_region_read  (0000:00:16.4:region0+0xc, 4) = 0x80242409
3250@1455399352.154228:vfio_region_read  (0000:00:16.4:region0+0x800, 4) = 0x0
3250@1455399352.154246:vfio_region_read  (0000:00:16.4:region0+0x4, 4) = 0x80141408
3250@1455399352.154266:vfio_region_write  (0000:00:16.4:region0+0x4, 0x80141409, 4)
3250@1455399352.154284:vfio_region_read  (0000:00:16.4:region0+0x4, 4) = 0x80141409
3250@1455399352.155094:vfio_region_read  (0000:00:16.4:region0+0x4, 4) = 0x8014140b
3250@1455399352.155111:vfio_region_write  (0000:00:16.4:region0+0x4, 0x8014140a, 4)
3250@1455399352.155123:vfio_region_read  (0000:00:16.4:region0+0x4, 4) = 0x80141408
3250@1455399352.155138:vfio_region_read  (0000:00:16.4:region0+0xc, 4) = 0x802a2409
3250@1455399352.155167:vfio_region_read  (0000:00:16.4:region0+0x800, 4) = 0x0
3250@1455399352.155181:vfio_region_read  (0000:00:16.4:region0+0xc, 4) = 0x802a2409
3250@1455399352.155198:vfio_region_read  (0000:00:16.4:region0+0x4, 4) = 0x80141408
3250@1455399352.155209:vfio_region_read  (0000:00:16.4:region0+0x8, 4) = 0x8014000c
3250@1455399352.155222:vfio_region_read  (0000:00:16.4:region0+0x8, 4) = 0x80000002
3250@1455399352.155237:vfio_region_read  (0000:00:16.4:region0+0x8, 4) = 0x0
3250@1455399352.155251:vfio_region_read  (0000:00:16.4:region0+0x8, 4) = 0x0
3250@1455399352.155264:vfio_region_read  (0000:00:16.4:region0+0x8, 4) = 0x0
3250@1455399352.155275:vfio_region_read  (0000:00:16.4:region0+0x8, 4) = 0x0
3250@1455399352.155285:vfio_region_read  (0000:00:16.4:region0+0xc, 4) = 0x802a2a09
3250@1455399352.155296:vfio_region_read  (0000:00:16.4:region0+0x4, 4) = 0x80141408
3250@1455399352.155303:vfio_region_write  (0000:00:16.4:region0+0x4, 0x8014140c, 4)
3250@1455399352.155326:vfio_region_read  (0000:00:16.4:region0+0xc, 4) = 0x802a2a0b
3250@1455399352.155339:vfio_region_read  (0000:00:16.4:region0+0x800, 4) = 0x0
3250@1455399352.155365:vfio_region_read  (0000:00:16.4:region0+0x4, 4) = 0x80141408
3250@1455399352.155382:vfio_region_read  (0000:00:16.4:region0+0x4, 4) = 0x80141408
3250@1455399352.155393:vfio_region_write  (0000:00:16.4:region0+0x4, 0x80141409, 4)
3250@1455399352.155405:vfio_region_read  (0000:00:16.4:region0+0x4, 4) = 0x80141409
3250@1455399352.157724:vfio_region_read  (0000:00:16.4:region0+0x800, 4) = 0x0
3250@1455399352.157761:vfio_region_read  (0000:00:16.4:region0+0xc, 4) = 0x802a2a09
3250@1455399352.157781:vfio_region_read  (0000:00:16.4:region0+0x4, 4) = 0x80141409
3250@1455399352.157803:vfio_region_read  (0000:00:16.4:region0+0xc, 4) = 0x802a2a09
3250@1455399352.157822:vfio_region_read  (0000:00:16.4:region0+0x4, 4) = 0x80141409
3250@1455399352.157840:vfio_region_write  (0000:00:16.4:region0+0x0, 0x7c000c, 4)
3250@1455399352.157856:vfio_region_write  (0000:00:16.4:region0+0x0, 0x3, 4)
3250@1455399352.157873:vfio_region_write  (0000:00:16.4:region0+0x0, 0x7f84a000, 4)
3250@1455399352.157887:vfio_region_write  (0000:00:16.4:region0+0x0, 0x7f7d9000, 4)
3250@1455399352.157903:vfio_region_write  (0000:00:16.4:region0+0x0, 0x7f763000, 4)
3250@1455399352.157918:vfio_region_write  (0000:00:16.4:region0+0x0, 0x7f757000, 4)
3250@1455399352.157934:vfio_region_write  (0000:00:16.4:region0+0x0, 0x7f726000, 4)
3250@1455399352.157949:vfio_region_write  (0000:00:16.4:region0+0x0, 0x7f722000, 4)
3250@1455399352.157965:vfio_region_write  (0000:00:16.4:region0+0x0, 0x7f6b6000, 4)
3250@1455399352.157980:vfio_region_write  (0000:00:16.4:region0+0x0, 0x7f6ae000, 4)
3250@1455399352.157995:vfio_region_write  (0000:00:16.4:region0+0x0, 0x7f6aa000, 4)
3250@1455399352.158011:vfio_region_write  (0000:00:16.4:region0+0x0, 0x7f6a2000, 4)
3250@1455399352.158026:vfio_region_write  (0000:00:16.4:region0+0x0, 0x7f683000, 4)
3250@1455399352.158042:vfio_region_write  (0000:00:16.4:region0+0x0, 0x7f66a000, 4)
3250@1455399352.158058:vfio_region_write  (0000:00:16.4:region0+0x0, 0x7f635000, 4)
3250@1455399352.158073:vfio_region_write  (0000:00:16.4:region0+0x0, 0x7f5ed000, 4)
3250@1455399352.158089:vfio_region_write  (0000:00:16.4:region0+0x0, 0x7f5e9000, 4)
3250@1455399352.158104:vfio_region_write  (0000:00:16.4:region0+0x0, 0x7f43c000, 4)
3250@1455399352.158120:vfio_region_write  (0000:00:16.4:region0+0x0, 0x0, 4)
3250@1455399352.158135:vfio_region_write  (0000:00:16.4:region0+0x0, 0x0, 4)
3250@1455399352.158150:vfio_region_write  (0000:00:16.4:region0+0x0, 0x0, 4)
3250@1455399352.158166:vfio_region_write  (0000:00:16.4:region0+0x0, 0x0, 4)
3250@1455399352.158181:vfio_region_write  (0000:00:16.4:region0+0x0, 0x0, 4)
3250@1455399352.158197:vfio_region_write  (0000:00:16.4:region0+0x0, 0x0, 4)
3250@1455399352.158213:vfio_region_write  (0000:00:16.4:region0+0x0, 0x0, 4)
3250@1455399352.158228:vfio_region_write  (0000:00:16.4:region0+0x0, 0x0, 4)
3250@1455399352.158243:vfio_region_write  (0000:00:16.4:region0+0x0, 0x0, 4)
3250@1455399352.158259:vfio_region_write  (0000:00:16.4:region0+0x0, 0x0, 4)
3250@1455399352.158279:vfio_region_write  (0000:00:16.4:region0+0x0, 0x0, 4)
3250@1455399352.158295:vfio_region_write  (0000:00:16.4:region0+0x0, 0x0, 4)
3250@1455399352.158309:vfio_region_write  (0000:00:16.4:region0+0x0, 0x0, 4)
3250@1455399352.158328:vfio_region_write  (0000:00:16.4:region0+0x0, 0x0, 4)
3250@1455399352.158350:vfio_region_read  (0000:00:16.4:region0+0x4, 4) = 0x80341409
3250@1455399352.158367:vfio_region_write  (0000:00:16.4:region0+0x4, 0x8034140d, 4)
3250@1455399352.158387:vfio_region_read  (0000:00:16.4:region0+0xc, 4) = 0x802a2a0b
3250@1455399352.158408:vfio_region_read  (0000:00:16.4:region0+0xc, 4) = 0x802a2a0b
3250@1455399352.158573:vfio_region_read  (0000:00:16.4:region0+0x4, 4) = 0x80341409
3250@1455399352.158598:vfio_region_read  (0000:00:16.4:region0+0xc, 4) = 0x802a2a09
3250@1455399352.158616:vfio_region_read  (0000:00:16.4:region0+0x4, 4) = 0x8034340b
3250@1455399352.158629:vfio_region_write  (0000:00:16.4:region0+0x0, 0x7c000c, 4)
3250@1455399352.158642:vfio_region_write  (0000:00:16.4:region0+0x0, 0x0, 4)
3250@1455399352.158654:vfio_region_write  (0000:00:16.4:region0+0x0, 0x0, 4)
3250@1455399352.158666:vfio_region_write  (0000:00:16.4:region0+0x0, 0x7f983000, 4)
3250@1455399352.158678:vfio_region_write  (0000:00:16.4:region0+0x0, 0x0, 4)
3250@1455399352.158690:vfio_region_write  (0000:00:16.4:region0+0x0, 0x0, 4)
3250@1455399352.158702:vfio_region_write  (0000:00:16.4:region0+0x0, 0x0, 4)
3250@1455399352.158714:vfio_region_write  (0000:00:16.4:region0+0x0, 0x7f95c000, 4)
3250@1455399352.158726:vfio_region_write  (0000:00:16.4:region0+0x0, 0x7f95b000, 4)
3250@1455399352.158738:vfio_region_write  (0000:00:16.4:region0+0x0, 0x7f899000, 4)
3250@1455399352.158751:vfio_region_write  (0000:00:16.4:region0+0x0, 0x7f898000, 4)
3250@1455399352.158770:vfio_region_read  (0000:00:16.4:region0+0x4, 4) = 0x803f340b
3250@1455399352.158785:vfio_region_write  (0000:00:16.4:region0+0x4, 0x803f340a, 4)
3250@1455399352.158805:vfio_region_read  (0000:00:16.4:region0+0x4, 4) = 0x803f3408
3250@1455399352.158826:vfio_region_read  (0000:00:16.4:region0+0xc, 4) = 0x802a2a09
3250@1455399352.158863:vfio_region_read  (0000:00:16.4:region0+0x800, 4) = 0x0
3250@1455399352.158883:vfio_region_read  (0000:00:16.4:region0+0x4, 4) = 0x803f3408
3250@1455399352.158900:vfio_region_write  (0000:00:16.4:region0+0x4, 0x803f3409, 4)
3250@1455399352.158919:vfio_region_read  (0000:00:16.4:region0+0x4, 4) = 0x803f3409
3250@1455399352.158937:vfio_region_write  (0000:00:16.4:region0+0x0, 0x7f81f000, 4)
3250@1455399352.158953:vfio_region_write  (0000:00:16.4:region0+0x0, 0x7f80a000, 4)
3250@1455399352.158969:vfio_region_write  (0000:00:16.4:region0+0x0, 0x7f809000, 4)
3250@1455399352.158984:vfio_region_write  (0000:00:16.4:region0+0x0, 0x7f807000, 4)
3250@1455399352.159000:vfio_region_write  (0000:00:16.4:region0+0x0, 0x7f7f8000, 4)
3250@1455399352.159015:vfio_region_write  (0000:00:16.4:region0+0x0, 0x7f7f7000, 4)
3250@1455399352.159029:vfio_region_write  (0000:00:16.4:region0+0x0, 0x7f7f6000, 4)
3250@1455399352.159045:vfio_region_write  (0000:00:16.4:region0+0x0, 0x7f7e0000, 4)
3250@1455399352.159061:vfio_region_write  (0000:00:16.4:region0+0x0, 0x7f7df000, 4)
3250@1455399352.159076:vfio_region_write  (0000:00:16.4:region0+0x0, 0x7f7d7000, 4)
3250@1455399352.159092:vfio_region_write  (0000:00:16.4:region0+0x0, 0x7f7d6000, 4)
3250@1455399352.159107:vfio_region_write  (0000:00:16.4:region0+0x0, 0x7f7d4000, 4)
3250@1455399352.159123:vfio_region_write  (0000:00:16.4:region0+0x0, 0x0, 4)
3250@1455399352.159139:vfio_region_write  (0000:00:16.4:region0+0x0, 0x0, 4)
3250@1455399352.159154:vfio_region_write  (0000:00:16.4:region0+0x0, 0x0, 4)
3250@1455399352.159172:vfio_region_write  (0000:00:16.4:region0+0x0, 0x0, 4)
3250@1455399352.159187:vfio_region_write  (0000:00:16.4:region0+0x0, 0x0, 4)
3250@1455399352.159202:vfio_region_write  (0000:00:16.4:region0+0x0, 0x0, 4)
3250@1455399352.159217:vfio_region_write  (0000:00:16.4:region0+0x0, 0x0, 4)
3250@1455399352.159233:vfio_region_write  (0000:00:16.4:region0+0x0, 0x0, 4)
3250@1455399352.159248:vfio_region_write  (0000:00:16.4:region0+0x0, 0x0, 4)
3250@1455399352.159267:vfio_region_read  (0000:00:16.4:region0+0x4, 4) = 0x80543409
3250@1455399352.159283:vfio_region_write  (0000:00:16.4:region0+0x4, 0x8054340d, 4)
3250@1455399352.159302:vfio_region_read  (0000:00:16.4:region0+0xc, 4) = 0x802a2a0b
3250@1455399352.159333:vfio_region_read  (0000:00:16.4:region0+0xc, 4) = 0x802a2a09
3250@1455399352.159351:vfio_region_read  (0000:00:16.4:region0+0x4, 4) = 0x80543409
3250@1455399352.159376:vfio_region_read  (0000:00:16.4:region0+0xc, 4) = 0x802a2a09
3250@1455399352.159398:vfio_region_read  (0000:00:16.4:region0+0x4, 4) = 0x80543409
3250@1455399352.159415:vfio_region_write  (0000:00:16.4:region0+0x0, 0x804c000c, 4)
3250@1455399352.159430:vfio_region_write  (0000:00:16.4:region0+0x0, 0x0, 4)
3250@1455399352.159446:vfio_region_write  (0000:00:16.4:region0+0x0, 0x0, 4)
3250@1455399352.159461:vfio_region_write  (0000:00:16.4:region0+0x0, 0x0, 4)
3250@1455399352.159476:vfio_region_write  (0000:00:16.4:region0+0x0, 0x0, 4)
3250@1455399352.159491:vfio_region_write  (0000:00:16.4:region0+0x0, 0x0, 4)
3250@1455399352.159505:vfio_region_write  (0000:00:16.4:region0+0x0, 0x0, 4)
3250@1455399352.159516:vfio_region_write  (0000:00:16.4:region0+0x0, 0x0, 4)
3250@1455399352.159528:vfio_region_write  (0000:00:16.4:region0+0x0, 0x7f984000, 4)
3250@1455399352.159542:vfio_region_write  (0000:00:16.4:region0+0x0, 0x0, 4)
3250@1455399352.159555:vfio_region_write  (0000:00:16.4:region0+0x0, 0xa40, 4)
3250@1455399352.159568:vfio_region_write  (0000:00:16.4:region0+0x0, 0x1001000, 4)
3250@1455399352.159579:vfio_region_write  (0000:00:16.4:region0+0x0, 0x0, 4)
3250@1455399352.159589:vfio_region_write  (0000:00:16.4:region0+0x0, 0x0, 4)
3250@1455399352.159602:vfio_region_write  (0000:00:16.4:region0+0x0, 0x0, 4)
3250@1455399352.159615:vfio_region_write  (0000:00:16.4:region0+0x0, 0x0, 4)
3250@1455399352.159626:vfio_region_write  (0000:00:16.4:region0+0x0, 0x0, 4)
3250@1455399352.159638:vfio_region_write  (0000:00:16.4:region0+0x0, 0x0, 4)
3250@1455399352.159652:vfio_region_write  (0000:00:16.4:region0+0x0, 0x0, 4)
3250@1455399352.159670:vfio_region_read  (0000:00:16.4:region0+0x4, 4) = 0x8067540b
3250@1455399352.159690:vfio_region_write  (0000:00:16.4:region0+0x4, 0x8067540a, 4)
3250@1455399352.159710:vfio_region_read  (0000:00:16.4:region0+0x4, 4) = 0x80675408
3250@1455399352.159730:vfio_region_read  (0000:00:16.4:region0+0xc, 4) = 0x802a2a09
3250@1455399352.159761:vfio_region_read  (0000:00:16.4:region0+0x800, 4) = 0x0
3250@1455399352.159782:vfio_region_read  (0000:00:16.4:region0+0x4, 4) = 0x80675408
3250@1455399352.159797:vfio_region_write  (0000:00:16.4:region0+0x4, 0x80675409, 4)
3250@1455399352.159817:vfio_region_read  (0000:00:16.4:region0+0x4, 4) = 0x80675409
3250@1455399352.159833:vfio_region_write  (0000:00:16.4:region0+0x0, 0x0, 4)
3250@1455399352.159853:vfio_region_read  (0000:00:16.4:region0+0x4, 4) = 0x80685409
3250@1455399352.159868:vfio_region_write  (0000:00:16.4:region0+0x4, 0x8068540d, 4)
3250@1455399352.159886:vfio_region_read  (0000:00:16.4:region0+0xc, 4) = 0x802a2a0b
3250@1455399352.160219:vfio_region_read  (0000:00:16.4:region0+0x4, 4) = 0x8068680b
3250@1455399352.160244:vfio_region_write  (0000:00:16.4:region0+0x4, 0x8068680a, 4)
3250@1455399352.160264:vfio_region_read  (0000:00:16.4:region0+0x4, 4) = 0x80686808
3250@1455399352.160283:vfio_region_read  (0000:00:16.4:region0+0xc, 4) = 0x802a2a09
3250@1455399352.160315:vfio_region_read  (0000:00:16.4:region0+0x800, 4) = 0x0
3250@1455399352.160336:vfio_region_read  (0000:00:16.4:region0+0x4, 4) = 0x80686808
3250@1455399352.160397:vfio_region_write  (0000:00:16.4:region0+0x4, 0x80686809, 4)
3250@1455399352.160451:vfio_region_read  (0000:00:16.4:region0+0x4, 4) = 0x80686809
3250@1455399352.162954:vfio_region_read  (0000:00:16.4:region0+0x4, 4) = 0x8068680b
3250@1455399352.163009:vfio_region_write  (0000:00:16.4:region0+0x4, 0x8068680a, 4)
3250@1455399352.163032:vfio_region_read  (0000:00:16.4:region0+0x4, 4) = 0x80686808
3250@1455399352.163051:vfio_region_read  (0000:00:16.4:region0+0xc, 4) = 0x80302a09
3250@1455399352.163087:vfio_region_read  (0000:00:16.4:region0+0x800, 4) = 0x0
3250@1455399352.163107:vfio_region_read  (0000:00:16.4:region0+0xc, 4) = 0x80302a09
3250@1455399352.163126:vfio_region_read  (0000:00:16.4:region0+0x4, 4) = 0x80686808
3250@1455399352.163145:vfio_region_read  (0000:00:16.4:region0+0x8, 4) = 0x8014000c
3250@1455399352.163162:vfio_region_read  (0000:00:16.4:region0+0x8, 4) = 0x80000003
3250@1455399352.163180:vfio_region_read  (0000:00:16.4:region0+0x8, 4) = 0x0
3250@1455399352.163198:vfio_region_read  (0000:00:16.4:region0+0x8, 4) = 0x0
3250@1455399352.163216:vfio_region_read  (0000:00:16.4:region0+0x8, 4) = 0x0
3250@1455399352.163234:vfio_region_read  (0000:00:16.4:region0+0x8, 4) = 0x0
3250@1455399352.163250:vfio_region_read  (0000:00:16.4:region0+0xc, 4) = 0x80303009
3250@1455399352.163266:vfio_region_read  (0000:00:16.4:region0+0x4, 4) = 0x80686808
3250@1455399352.163278:vfio_region_write  (0000:00:16.4:region0+0x4, 0x8068680c, 4)
3250@1455399352.163303:vfio_region_read  (0000:00:16.4:region0+0x800, 4) = 0x0
3250@1455399352.163320:vfio_region_read  (0000:00:16.4:region0+0xc, 4) = 0x8030300b
3250@1455399352.163342:vfio_region_read  (0000:00:16.4:region0+0x4, 4) = 0x80686808
3250@1455399352.163359:vfio_region_read  (0000:00:16.4:region0+0xc, 4) = 0x80303009
3250@1455399352.163374:vfio_region_read  (0000:00:16.4:region0+0x4, 4) = 0x80686808
3250@1455399352.163386:vfio_region_write  (0000:00:16.4:region0+0x0, 0x8004000c, 4)
3250@1455399352.163399:vfio_region_write  (0000:00:16.4:region0+0x0, 0x5, 4)
3250@1455399352.163414:vfio_region_read  (0000:00:16.4:region0+0x4, 4) = 0x806a6808
3250@1455399352.163425:vfio_region_write  (0000:00:16.4:region0+0x4, 0x806a680c, 4)
3250@1455399352.163438:vfio_region_read  (0000:00:16.4:region0+0xc, 4) = 0x8030300b
3250@1455399352.163456:vfio_region_read  (0000:00:16.4:region0+0xc, 4) = 0x8030300b
3250@1455399352.163471:vfio_region_read  (0000:00:16.4:region0+0x4, 4) = 0x806a6808
3250@1455399352.163485:vfio_region_read  (0000:00:16.4:region0+0x4, 4) = 0x806a6808
3250@1455399352.163498:vfio_region_write  (0000:00:16.4:region0+0x4, 0x806a6809, 4)
3250@1455399352.185409:vfio_region_read  (0000:00:16.4:region0+0x4, 4) = 0x806a6a0b
3250@1455399352.185505:vfio_region_read  (0000:00:16.4:region0+0x4, 4) = 0x806a6a0b
3250@1455399352.190291:vfio_region_write  (0000:00:16.4:region0+0x4, 0x806a6a0a, 4)
3250@1455399352.190358:vfio_region_read  (0000:00:16.4:region0+0x4, 4) = 0x806a6a08
3250@1455399352.190377:vfio_region_read  (0000:00:16.4:region0+0xc, 4) = 0x80303009
3250@1455399352.190453:vfio_region_read  (0000:00:16.4:region0+0x800, 4) = 0x0
3250@1455399352.190474:vfio_region_read  (0000:00:16.4:region0+0x4, 4) = 0x806a6a08
3250@1455399352.190488:vfio_region_write  (0000:00:16.4:region0+0x4, 0x806a6a09, 4)
3250@1455399352.190504:vfio_region_read  (0000:00:16.4:region0+0x4, 4) = 0x806a6a09


