Running Qemu with Precise passthrough
2224@1455310059.530557:vfio_initfn  (0000:00:16.4) group 6
2224@1455310059.530629:vfio_listener_region_add_ram region_add [ram] 0 - 9ffff [0x7fc4dbe00000]
2224@1455310059.530766:vfio_listener_region_add_skip SKIPPING region_add a0000 - bffff
2224@1455310059.530771:vfio_listener_region_add_ram region_add [ram] c0000 - dffff [0x7fc571400000]
2224@1455310059.530821:vfio_listener_region_add_ram region_add [ram] e0000 - fffff [0x7fc5716e0000]
2224@1455310059.530851:vfio_listener_region_add_ram region_add [ram] 100000 - 7fffffff [0x7fc4dbf00000]
2224@1455310059.698565:vfio_listener_region_add_skip SKIPPING region_add fec00000 - fec00fff
2224@1455310059.698582:vfio_listener_region_add_skip SKIPPING region_add fed00000 - fed003ff
2224@1455310059.698583:vfio_listener_region_add_skip SKIPPING region_add fee00000 - feefffff
2224@1455310059.698585:vfio_listener_region_add_ram region_add [ram] fff00000 - ffffffff [0x7fc571600000]
2224@1455310059.711297:vfio_get_device Device 0000:00:16.4 flags: 2, regions: 9, irqs: 5
2224@1455310059.711312:vfio_populate_device_region Device 0000:00:16.4 region 0:
  size: 0x1000, offset: 0x0, flags: 0x7
2224@1455310059.711318:vfio_populate_device_region Device 0000:00:16.4 region 1:
  size: 0x0, offset: 0x10000000000, flags: 0x0
2224@1455310059.711323:vfio_populate_device_region Device 0000:00:16.4 region 2:
  size: 0x0, offset: 0x20000000000, flags: 0x0
2224@1455310059.711327:vfio_populate_device_region Device 0000:00:16.4 region 3:
  size: 0x0, offset: 0x30000000000, flags: 0x0
2224@1455310059.711331:vfio_populate_device_region Device 0000:00:16.4 region 4:
  size: 0x0, offset: 0x40000000000, flags: 0x0
2224@1455310059.711335:vfio_populate_device_region Device 0000:00:16.4 region 5:
  size: 0x0, offset: 0x50000000000, flags: 0x0
2224@1455310059.711339:vfio_populate_device_config Device 0000:00:16.4 config:
  size: 0x100, offset: 0x70000000000, flags: 0x3
2224@1455310059.711344:vfio_populate_device_get_irq_info_failure VFIO_DEVICE_GET_IRQ_INFO failure: Invalid argument
2224@1455310059.712288:vfio_msi_setup 0000:00:16.4 PCI MSI CAP @0x8c
2224@1455310059.712299:vfio_pci_read_config  (0000:00:16.4, @0x3d, len=0x1) 1
2224@1455310059.712303:vfio_pci_read_config  (0000:00:16.4, @0x3d, len=0x1) 1
2224@1455310059.712387:vfio_intx_enable_kvm  (0000:00:16.4) KVM INTx accel enabled
2224@1455310059.712393:vfio_intx_enable  (0000:00:16.4)
2224@1455310059.785520:vfio_pci_hot_reset  (0000:00:16.4) multi
2224@1455310059.785688:vfio_intx_disable_kvm  (0000:00:16.4) KVM INTx accel disabled
2224@1455310059.785733:vfio_intx_disable  (0000:00:16.4)
2224@1455310059.785751:vfio_pci_read_config  (0000:00:16.4, @0x54, len=0x2) 8
2224@1455310059.785761:vfio_pci_read_config  (0000:00:16.4, @0x4, len=0x2) 2
2224@1455310059.785767:vfio_pci_write_config  (0000:00:16.4, @0x4, 0x0, len=0x2)
qemu-system-x86_64: vfio: Cannot reset device 0000:00:16.4, no available reset mechanism.
2224@1455310059.785801:vfio_pci_read_config  (0000:00:16.4, @0x3d, len=0x1) 1
2224@1455310059.785844:vfio_intx_enable  (0000:00:16.4)
2224@1455310059.785974:vfio_pci_reset  (0000:00:16.4)
2224@1455310059.786013:vfio_intx_disable  (0000:00:16.4)
2224@1455310059.786031:vfio_pci_read_config  (0000:00:16.4, @0x54, len=0x2) 8
2224@1455310059.786041:vfio_pci_read_config  (0000:00:16.4, @0x4, len=0x2) 0
2224@1455310059.786044:vfio_pci_write_config  (0000:00:16.4, @0x4, 0x0, len=0x2)
2224@1455310059.786063:vfio_pci_hot_reset  (0000:00:16.4) one
2224@1455310059.786073:vfio_pci_read_config  (0000:00:16.4, @0x54, len=0x2) 8
2224@1455310059.786081:vfio_pci_read_config  (0000:00:16.4, @0x4, len=0x2) 0
2224@1455310059.786087:vfio_pci_write_config  (0000:00:16.4, @0x4, 0x0, len=0x2)
qemu-system-x86_64: vfio: Cannot reset device 0000:00:16.4, no available reset mechanism.
2224@1455310059.786110:vfio_pci_read_config  (0000:00:16.4, @0x3d, len=0x1) 1
2224@1455310059.786149:vfio_intx_enable  (0000:00:16.4)
2224@1455310059.786156:vfio_pci_read_config  (0000:00:16.4, @0x3d, len=0x1) 1
2224@1455310059.786168:vfio_intx_disable  (0000:00:16.4)
2224@1455310059.786185:vfio_intx_enable  (0000:00:16.4)
2224@1455310060.231551:vfio_pci_read_config  (0000:00:16.4, @0x0, len=0x4) 9d3e8086
2224@1455310060.231591:vfio_pci_read_config  (0000:00:16.4, @0x0, len=0x4) 9d3e8086
2224@1455310060.231615:vfio_pci_read_config  (0000:00:16.4, @0x4, len=0x4) 100000
2224@1455310060.231652:vfio_pci_read_config  (0000:00:16.4, @0x8, len=0x4) 7800021
2224@1455310060.231672:vfio_pci_read_config  (0000:00:16.4, @0xc, len=0x4) 0
2224@1455310060.231689:vfio_pci_read_config  (0000:00:16.4, @0x10, len=0x4) a173f004
2224@1455310060.231706:vfio_pci_read_config  (0000:00:16.4, @0x14, len=0x4) 0
2224@1455310060.231724:vfio_pci_read_config  (0000:00:16.4, @0x18, len=0x4) 0
2224@1455310060.231747:vfio_pci_read_config  (0000:00:16.4, @0x1c, len=0x4) 0
2224@1455310060.231782:vfio_pci_read_config  (0000:00:16.4, @0x20, len=0x4) 0
2224@1455310060.231800:vfio_pci_read_config  (0000:00:16.4, @0x24, len=0x4) 0
2224@1455310060.231826:vfio_pci_read_config  (0000:00:16.4, @0x28, len=0x4) 0
2224@1455310060.231864:vfio_pci_read_config  (0000:00:16.4, @0x2c, len=0x4) 0
2224@1455310060.231881:vfio_pci_read_config  (0000:00:16.4, @0x30, len=0x4) 0
2224@1455310060.231902:vfio_pci_read_config  (0000:00:16.4, @0x34, len=0x4) 50
2224@1455310060.231924:vfio_pci_read_config  (0000:00:16.4, @0x38, len=0x4) 0
2224@1455310060.231946:vfio_pci_read_config  (0000:00:16.4, @0x3c, len=0x4) 1ff
2224@1455310060.235166:vfio_pci_read_config  (0000:00:16.4, @0x0, len=0x4) 9d3e8086
2224@1455310060.235185:vfio_pci_read_config  (0000:00:16.4, @0x0, len=0x4) 9d3e8086
2224@1455310060.235210:vfio_pci_read_config  (0000:00:16.4, @0x4, len=0x4) 100000
2224@1455310060.235233:vfio_pci_read_config  (0000:00:16.4, @0x8, len=0x4) 7800021
2224@1455310060.235255:vfio_pci_read_config  (0000:00:16.4, @0xc, len=0x4) 0
2224@1455310060.235272:vfio_pci_read_config  (0000:00:16.4, @0x10, len=0x4) a173f004
2224@1455310060.235288:vfio_pci_read_config  (0000:00:16.4, @0x14, len=0x4) 0
2224@1455310060.235304:vfio_pci_read_config  (0000:00:16.4, @0x18, len=0x4) 0
2224@1455310060.235320:vfio_pci_read_config  (0000:00:16.4, @0x1c, len=0x4) 0
2224@1455310060.235336:vfio_pci_read_config  (0000:00:16.4, @0x20, len=0x4) 0
2224@1455310060.235352:vfio_pci_read_config  (0000:00:16.4, @0x24, len=0x4) 0
2224@1455310060.235373:vfio_pci_read_config  (0000:00:16.4, @0x28, len=0x4) 0
2224@1455310060.235395:vfio_pci_read_config  (0000:00:16.4, @0x2c, len=0x4) 0
2224@1455310060.235412:vfio_pci_read_config  (0000:00:16.4, @0x30, len=0x4) 0
2224@1455310060.235434:vfio_pci_read_config  (0000:00:16.4, @0x34, len=0x4) 50
2224@1455310060.235455:vfio_pci_read_config  (0000:00:16.4, @0x38, len=0x4) 0
2224@1455310060.235477:vfio_pci_read_config  (0000:00:16.4, @0x3c, len=0x4) 1ff
2224@1455310060.235500:vfio_pci_read_config  (0000:00:16.4, @0x34, len=0x1) 50
2224@1455310060.235523:vfio_pci_read_config  (0000:00:16.4, @0x50, len=0x2) 8c01
2224@1455310060.235540:vfio_pci_read_config  (0000:00:16.4, @0x8c, len=0x2) 5
2224@1455310060.235562:vfio_pci_read_config  (0000:00:16.4, @0x4, len=0x2) 0
2224@1455310060.235579:vfio_pci_write_config  (0000:00:16.4, @0x4, 0x0, len=0x2)
2224@1455310060.235607:vfio_pci_read_config  (0000:00:16.4, @0x10, len=0x4) a173f004
2224@1455310060.235624:vfio_pci_write_config  (0000:00:16.4, @0x10, 0xffffffff, len=0x4)
2224@1455310060.235640:vfio_pci_read_config  (0000:00:16.4, @0x10, len=0x4) fffff004
2224@1455310060.235661:vfio_pci_write_config  (0000:00:16.4, @0x10, 0xa173f004, len=0x4)
2224@1455310060.235678:vfio_pci_read_config  (0000:00:16.4, @0x14, len=0x4) 0
2224@1455310060.235694:vfio_pci_write_config  (0000:00:16.4, @0x14, 0xffffffff, len=0x4)
2224@1455310060.235710:vfio_pci_read_config  (0000:00:16.4, @0x14, len=0x4) ffffffff
2224@1455310060.235729:vfio_pci_write_config  (0000:00:16.4, @0x14, 0x0, len=0x4)
2224@1455310060.235746:vfio_pci_read_config  (0000:00:16.4, @0x18, len=0x4) 0
2224@1455310060.235763:vfio_pci_write_config  (0000:00:16.4, @0x18, 0xffffffff, len=0x4)
2224@1455310060.235779:vfio_pci_read_config  (0000:00:16.4, @0x18, len=0x4) 0
2224@1455310060.235795:vfio_pci_write_config  (0000:00:16.4, @0x18, 0x0, len=0x4)
2224@1455310060.235812:vfio_pci_read_config  (0000:00:16.4, @0x1c, len=0x4) 0
2224@1455310060.235828:vfio_pci_write_config  (0000:00:16.4, @0x1c, 0xffffffff, len=0x4)
2224@1455310060.235845:vfio_pci_read_config  (0000:00:16.4, @0x1c, len=0x4) 0
2224@1455310060.235861:vfio_pci_write_config  (0000:00:16.4, @0x1c, 0x0, len=0x4)
2224@1455310060.235877:vfio_pci_read_config  (0000:00:16.4, @0x20, len=0x4) 0
2224@1455310060.235893:vfio_pci_write_config  (0000:00:16.4, @0x20, 0xffffffff, len=0x4)
2224@1455310060.235909:vfio_pci_read_config  (0000:00:16.4, @0x20, len=0x4) 0
2224@1455310060.235925:vfio_pci_write_config  (0000:00:16.4, @0x20, 0x0, len=0x4)
2224@1455310060.235941:vfio_pci_read_config  (0000:00:16.4, @0x24, len=0x4) 0
2224@1455310060.235957:vfio_pci_write_config  (0000:00:16.4, @0x24, 0xffffffff, len=0x4)
2224@1455310060.235973:vfio_pci_read_config  (0000:00:16.4, @0x24, len=0x4) 0
2224@1455310060.235989:vfio_pci_write_config  (0000:00:16.4, @0x24, 0x0, len=0x4)
2224@1455310060.236007:vfio_pci_write_config  (0000:00:16.4, @0x30, 0xfffffffe, len=0x4)
2224@1455310060.236023:vfio_pci_read_config  (0000:00:16.4, @0x30, len=0x4) 0
2224@1455310060.236040:vfio_pci_read_config  (0000:00:16.4, @0x34, len=0x1) 50
2224@1455310060.236062:vfio_pci_read_config  (0000:00:16.4, @0x50, len=0x2) 8c01
2224@1455310060.236084:vfio_pci_read_config  (0000:00:16.4, @0x54, len=0x2) 8
2224@1455310060.236100:vfio_pci_write_config  (0000:00:16.4, @0x54, 0x8008, len=0x2)
2224@1455310060.241378:vfio_pci_read_config  (0000:00:16.4, @0x0, len=0x4) 9d3e8086
2224@1455310060.241397:vfio_pci_read_config  (0000:00:16.4, @0x0, len=0x4) 9d3e8086
2224@1455310060.241421:vfio_pci_read_config  (0000:00:16.4, @0x4, len=0x4) 100000
2224@1455310060.241444:vfio_pci_read_config  (0000:00:16.4, @0x8, len=0x4) 7800021
2224@1455310060.241466:vfio_pci_read_config  (0000:00:16.4, @0xc, len=0x4) 0
2224@1455310060.241482:vfio_pci_read_config  (0000:00:16.4, @0x10, len=0x4) a173f004
2224@1455310060.241498:vfio_pci_read_config  (0000:00:16.4, @0x14, len=0x4) 0
2224@1455310060.241514:vfio_pci_read_config  (0000:00:16.4, @0x18, len=0x4) 0
2224@1455310060.241531:vfio_pci_read_config  (0000:00:16.4, @0x1c, len=0x4) 0
2224@1455310060.241547:vfio_pci_read_config  (0000:00:16.4, @0x20, len=0x4) 0
2224@1455310060.241562:vfio_pci_read_config  (0000:00:16.4, @0x24, len=0x4) 0
2224@1455310060.241584:vfio_pci_read_config  (0000:00:16.4, @0x28, len=0x4) 0
2224@1455310060.241605:vfio_pci_read_config  (0000:00:16.4, @0x2c, len=0x4) 0
2224@1455310060.241622:vfio_pci_read_config  (0000:00:16.4, @0x30, len=0x4) 0
2224@1455310060.241643:vfio_pci_read_config  (0000:00:16.4, @0x34, len=0x4) 50
2224@1455310060.241664:vfio_pci_read_config  (0000:00:16.4, @0x38, len=0x4) 0
2224@1455310060.241686:vfio_pci_read_config  (0000:00:16.4, @0x3c, len=0x4) 1ff
2224@1455310060.241709:vfio_pci_read_config  (0000:00:16.4, @0x34, len=0x1) 50
2224@1455310060.241731:vfio_pci_read_config  (0000:00:16.4, @0x50, len=0x2) 8c01
2224@1455310060.241748:vfio_pci_read_config  (0000:00:16.4, @0x8c, len=0x2) 5
2224@1455310060.241770:vfio_pci_read_config  (0000:00:16.4, @0x4, len=0x2) 0
2224@1455310060.241786:vfio_pci_write_config  (0000:00:16.4, @0x4, 0x0, len=0x2)
2224@1455310060.241812:vfio_pci_read_config  (0000:00:16.4, @0x10, len=0x4) a173f004
2224@1455310060.241828:vfio_pci_write_config  (0000:00:16.4, @0x10, 0xffffffff, len=0x4)
2224@1455310060.241844:vfio_pci_read_config  (0000:00:16.4, @0x10, len=0x4) fffff004
2224@1455310060.241860:vfio_pci_write_config  (0000:00:16.4, @0x10, 0xa173f004, len=0x4)
2224@1455310060.241876:vfio_pci_read_config  (0000:00:16.4, @0x14, len=0x4) 0
2224@1455310060.241892:vfio_pci_write_config  (0000:00:16.4, @0x14, 0xffffffff, len=0x4)
2224@1455310060.241908:vfio_pci_read_config  (0000:00:16.4, @0x14, len=0x4) ffffffff
2224@1455310060.241924:vfio_pci_write_config  (0000:00:16.4, @0x14, 0x0, len=0x4)
2224@1455310060.241940:vfio_pci_read_config  (0000:00:16.4, @0x18, len=0x4) 0
2224@1455310060.241956:vfio_pci_write_config  (0000:00:16.4, @0x18, 0xffffffff, len=0x4)
2224@1455310060.241974:vfio_pci_read_config  (0000:00:16.4, @0x18, len=0x4) 0
2224@1455310060.241989:vfio_pci_write_config  (0000:00:16.4, @0x18, 0x0, len=0x4)
2224@1455310060.242006:vfio_pci_read_config  (0000:00:16.4, @0x1c, len=0x4) 0
2224@1455310060.242022:vfio_pci_write_config  (0000:00:16.4, @0x1c, 0xffffffff, len=0x4)
2224@1455310060.242038:vfio_pci_read_config  (0000:00:16.4, @0x1c, len=0x4) 0
2224@1455310060.242054:vfio_pci_write_config  (0000:00:16.4, @0x1c, 0x0, len=0x4)
2224@1455310060.242071:vfio_pci_read_config  (0000:00:16.4, @0x20, len=0x4) 0
2224@1455310060.242087:vfio_pci_write_config  (0000:00:16.4, @0x20, 0xffffffff, len=0x4)
2224@1455310060.242103:vfio_pci_read_config  (0000:00:16.4, @0x20, len=0x4) 0
2224@1455310060.242120:vfio_pci_write_config  (0000:00:16.4, @0x20, 0x0, len=0x4)
2224@1455310060.242137:vfio_pci_read_config  (0000:00:16.4, @0x24, len=0x4) 0
2224@1455310060.242153:vfio_pci_write_config  (0000:00:16.4, @0x24, 0xffffffff, len=0x4)
2224@1455310060.242169:vfio_pci_read_config  (0000:00:16.4, @0x24, len=0x4) 0
2224@1455310060.242185:vfio_pci_write_config  (0000:00:16.4, @0x24, 0x0, len=0x4)
2224@1455310060.242203:vfio_pci_write_config  (0000:00:16.4, @0x30, 0xfffffffe, len=0x4)
2224@1455310060.242247:vfio_pci_read_config  (0000:00:16.4, @0x30, len=0x4) 0
2224@1455310060.242265:vfio_pci_read_config  (0000:00:16.4, @0x34, len=0x1) 50
2224@1455310060.242287:vfio_pci_read_config  (0000:00:16.4, @0x50, len=0x2) 8c01
2224@1455310060.242310:vfio_pci_read_config  (0000:00:16.4, @0x54, len=0x2) 8
2224@1455310060.242329:vfio_pci_write_config  (0000:00:16.4, @0x54, 0x8008, len=0x2)
2224@1455310060.245104:vfio_listener_region_add_ram region_add [ram] 80000000 - 8000ffff [0x7fc563e00000]
2224@1455310060.248795:vfio_listener_region_del region_del 80000000 - 8000ffff
2224@1455310060.249242:vfio_listener_region_add_ram region_add [ram] 80000000 - 8003ffff [0x7fc563c00000]
2224@1455310060.268886:vfio_listener_region_del region_del 80000000 - 8003ffff
2224@1455310060.269337:vfio_pci_write_config  (0000:00:16.4, @0x10, 0x81000000, len=0x4)
2224@1455310060.269360:vfio_pci_write_config  (0000:00:16.4, @0x14, 0x0, len=0x4)
2224@1455310060.272058:vfio_listener_region_add_ram region_add [ram] 80000000 - 80ffffff [0x7fc570200000]
2224@1455310060.274037:vfio_listener_region_add_skip SKIPPING region_add 81003400 - 8100341f
2224@1455310060.274048:vfio_listener_region_add_skip SKIPPING region_add 81003500 - 81003515
2224@1455310060.274050:vfio_listener_region_add_skip SKIPPING region_add 81003600 - 81003607
2224@1455310060.274980:vfio_listener_region_del region_del 80000000 - 80ffffff
2224@1455310060.276085:vfio_listener_region_del_skip SKIPPING region_del 81003400 - 8100341f
2224@1455310060.276103:vfio_listener_region_del_skip SKIPPING region_del 81003500 - 81003515
2224@1455310060.276106:vfio_listener_region_del_skip SKIPPING region_del 81003600 - 81003607
2224@1455310060.277609:vfio_listener_region_add_skip SKIPPING region_add 81002000 - 8100202f
2224@1455310060.277638:vfio_listener_region_add_skip SKIPPING region_add 81002800 - 81002807
2224@1455310060.279100:vfio_listener_region_del_skip SKIPPING region_del 81002000 - 8100202f
2224@1455310060.279110:vfio_listener_region_del_skip SKIPPING region_del 81002800 - 81002807
2224@1455310060.280068:vfio_pci_read_config  (0000:00:16.4, @0x4, len=0x2) 0
2224@1455310060.280088:vfio_pci_write_config  (0000:00:16.4, @0x4, 0x27, len=0x2)
2224@1455310060.280135:vfio_listener_region_add_skip SKIPPING region_add 81000000 - 81000fff
2224@1455310060.280488:vfio_pci_read_config  (0000:00:16.4, @0x4, len=0x2) 6
2224@1455310060.280508:vfio_pci_write_config  (0000:00:16.4, @0x4, 0x0, len=0x2)
2224@1455310060.280531:vfio_listener_region_del_skip SKIPPING region_del 81000000 - 81000fff
2224@1455310060.280879:vfio_pci_read_config  (0000:00:16.4, @0x4, len=0x2) 0
2224@1455310060.280898:vfio_pci_write_config  (0000:00:16.4, @0x4, 0x10, len=0x2)
2224@1455310060.280931:vfio_pci_read_config  (0000:00:16.4, @0x6, len=0x2) 10
2224@1455310060.281178:vfio_listener_region_add_skip SKIPPING region_add 81001000 - 8100101f
2224@1455310060.281183:vfio_listener_region_add_skip SKIPPING region_add 81001800 - 81001807
2224@1455310060.281866:vfio_listener_region_del_skip SKIPPING region_del 81001000 - 8100101f
2224@1455310060.281870:vfio_listener_region_del_skip SKIPPING region_del 81001800 - 81001807
2224@1455310060.282443:vfio_pci_read_config  (0000:00:16.4, @0x4, len=0x2) 0
2224@1455310060.282465:vfio_pci_write_config  (0000:00:16.4, @0x4, 0x0, len=0x2)
2224@1455310060.307238:vfio_pci_read_config  (0000:00:16.4, @0x34, len=0x1) 50
2224@1455310060.307310:vfio_pci_read_config  (0000:00:16.4, @0x50, len=0x2) 8c01
2224@1455310060.307340:vfio_pci_read_config  (0000:00:16.4, @0x8c, len=0x2) 5
2224@1455310060.307364:vfio_pci_write_config  (0000:00:16.4, @0x3c, 0xff, len=0x1)
2224@1455310062.881054:vfio_pci_read_config  (0000:00:16.4, @0x0, len=0x4) 9d3e8086
2224@1455310062.881088:vfio_pci_read_config  (0000:00:16.4, @0x4, len=0x4) 100000
2224@1455310062.881111:vfio_pci_read_config  (0000:00:16.4, @0x8, len=0x4) 7800021
2224@1455310062.881171:vfio_pci_read_config  (0000:00:16.4, @0xc, len=0x4) 0
2224@1455310062.881191:vfio_pci_read_config  (0000:00:16.4, @0x10, len=0x4) 81000004
2224@1455310062.881220:vfio_pci_read_config  (0000:00:16.4, @0x14, len=0x4) 0
2224@1455310062.881233:vfio_pci_read_config  (0000:00:16.4, @0x18, len=0x4) 0
2224@1455310062.881246:vfio_pci_read_config  (0000:00:16.4, @0x1c, len=0x4) 0
2224@1455310062.881265:vfio_pci_read_config  (0000:00:16.4, @0x20, len=0x4) 0
2224@1455310062.881283:vfio_pci_read_config  (0000:00:16.4, @0x24, len=0x4) 0
2224@1455310062.881307:vfio_pci_read_config  (0000:00:16.4, @0x28, len=0x4) 0
2224@1455310062.881330:vfio_pci_read_config  (0000:00:16.4, @0x2c, len=0x4) 0
2224@1455310062.881347:vfio_pci_read_config  (0000:00:16.4, @0x30, len=0x4) 0
2224@1455310062.881370:vfio_pci_read_config  (0000:00:16.4, @0x34, len=0x4) 50
2224@1455310062.881394:vfio_pci_read_config  (0000:00:16.4, @0x38, len=0x4) 0
2224@1455310062.881420:vfio_pci_read_config  (0000:00:16.4, @0x3c, len=0x4) 1ff
2224@1455310062.882025:vfio_listener_region_add_skip SKIPPING region_add 81001000 - 8100101f
2224@1455310062.882030:vfio_listener_region_add_skip SKIPPING region_add 81001800 - 81001807
2224@1455310063.346567:vfio_listener_region_add_ram region_add [ram] 80000000 - 80ffffff [0x7fc570200000]
2224@1455310063.347554:vfio_listener_region_add_skip SKIPPING region_add 81003400 - 8100341f
2224@1455310063.347558:vfio_listener_region_add_skip SKIPPING region_add 81003500 - 81003515
2224@1455310063.347560:vfio_listener_region_add_skip SKIPPING region_add 81003600 - 81003607
2224@1455310063.349894:vfio_listener_region_del_skip SKIPPING region_del a0000 - bffff
2224@1455310063.349919:vfio_listener_region_add_ram region_add [ram] a0000 - affff [0x7fc570200000]
2224@1455310063.349964:vfio_listener_region_add_skip SKIPPING region_add b0000 - bffff
2224@1455310063.406696:vfio_listener_region_del region_del c0000 - dffff
2224@1455310063.406775:vfio_listener_region_add_ram region_add [ram] c0000 - c3fff [0x7fc4dbec0000]
2224@1455310063.406804:vfio_listener_region_add_ram region_add [ram] c4000 - dffff [0x7fc571404000]
2224@1455310063.407562:vfio_listener_region_del region_del c0000 - c3fff
2224@1455310063.407583:vfio_listener_region_add_ram region_add [ram] c0000 - c3fff [0x7fc4dbec0000]
2224@1455310063.506197:vfio_listener_region_add_skip SKIPPING region_add 81002000 - 8100202f
2224@1455310063.506208:vfio_listener_region_add_skip SKIPPING region_add 81002800 - 81002807
2224@1455310063.507467:vfio_pci_read_config  (0000:00:16.4, @0x0, len=0x4) 9d3e8086
2224@1455310063.507493:vfio_pci_read_config  (0000:00:16.4, @0x4, len=0x4) 100000
2224@1455310063.507514:vfio_pci_read_config  (0000:00:16.4, @0x8, len=0x4) 7800021
2224@1455310063.507534:vfio_pci_read_config  (0000:00:16.4, @0xc, len=0x4) 0
2224@1455310063.507552:vfio_pci_read_config  (0000:00:16.4, @0x10, len=0x4) 81000004
2224@1455310063.507570:vfio_pci_read_config  (0000:00:16.4, @0x14, len=0x4) 0
2224@1455310063.507587:vfio_pci_read_config  (0000:00:16.4, @0x18, len=0x4) 0
2224@1455310063.507605:vfio_pci_read_config  (0000:00:16.4, @0x1c, len=0x4) 0
2224@1455310063.507623:vfio_pci_read_config  (0000:00:16.4, @0x20, len=0x4) 0
2224@1455310063.507639:vfio_pci_read_config  (0000:00:16.4, @0x24, len=0x4) 0
2224@1455310063.507658:vfio_pci_read_config  (0000:00:16.4, @0x28, len=0x4) 0
2224@1455310063.507683:vfio_pci_read_config  (0000:00:16.4, @0x2c, len=0x4) 0
2224@1455310063.507703:vfio_pci_read_config  (0000:00:16.4, @0x30, len=0x4) 0
2224@1455310063.507746:vfio_pci_read_config  (0000:00:16.4, @0x34, len=0x4) 50
2224@1455310063.507767:vfio_pci_read_config  (0000:00:16.4, @0x38, len=0x4) 0
2224@1455310063.507799:vfio_pci_read_config  (0000:00:16.4, @0x3c, len=0x4) 1ff
2224@1455310063.507828:vfio_pci_read_config  (0000:00:16.4, @0x4, len=0x2) 0
2224@1455310063.507847:vfio_pci_write_config  (0000:00:16.4, @0x4, 0x6, len=0x2)
2224@1455310063.507912:vfio_listener_region_add_skip SKIPPING region_add 81000000 - 81000fff
2224@1455310064.000502:vfio_listener_region_del region_del a0000 - affff
2224@1455310064.000521:vfio_listener_region_del_skip SKIPPING region_del b0000 - bffff
2224@1455310064.000533:vfio_listener_region_add_skip SKIPPING region_add a0000 - bffff
2224@1455310064.001298:vfio_listener_region_del_skip SKIPPING region_del a0000 - bffff
2224@1455310064.001308:vfio_listener_region_add_ram region_add [ram] a0000 - affff [0x7fc570200000]
2224@1455310064.001331:vfio_listener_region_add_skip SKIPPING region_add b0000 - bffff
2224@1455310064.002031:vfio_listener_region_del region_del a0000 - affff
2224@1455310064.002041:vfio_listener_region_del_skip SKIPPING region_del b0000 - bffff
2224@1455310064.002049:vfio_listener_region_add_skip SKIPPING region_add a0000 - bffff
2224@1455310064.002745:vfio_listener_region_del_skip SKIPPING region_del a0000 - bffff
2224@1455310064.002754:vfio_listener_region_add_ram region_add [ram] a0000 - affff [0x7fc570200000]
2224@1455310064.002772:vfio_listener_region_add_skip SKIPPING region_add b0000 - bffff
2224@1455310064.003589:vfio_listener_region_del region_del a0000 - affff
2224@1455310064.003601:vfio_listener_region_del_skip SKIPPING region_del b0000 - bffff
2224@1455310064.003623:vfio_listener_region_add_skip SKIPPING region_add a0000 - bffff
2224@1455310064.004501:vfio_listener_region_del_skip SKIPPING region_del a0000 - bffff
2224@1455310064.004517:vfio_listener_region_add_ram region_add [ram] a0000 - affff [0x7fc570200000]
2224@1455310064.004538:vfio_listener_region_add_skip SKIPPING region_add b0000 - bffff
2224@1455310065.518641:vfio_pci_read_config  (0000:00:16.4, @0x4, len=0x2) 6
2224@1455310065.518668:vfio_pci_write_config  (0000:00:16.4, @0x4, 0x6, len=0x2)
2224@1455310065.518709:vfio_pci_read_config  (0000:00:16.4, @0x4, len=0x2) 6
2224@1455310065.518721:vfio_pci_write_config  (0000:00:16.4, @0x4, 0x6, len=0x2)
2224@1455310065.518740:vfio_pci_read_config  (0000:00:16.4, @0x0, len=0x4) 9d3e8086
2224@1455310065.518756:vfio_pci_read_config  (0000:00:16.4, @0x8, len=0x4) 7800021
2224@1455310065.518768:vfio_pci_read_config  (0000:00:16.4, @0x3c, len=0x1) ff
2224@1455310065.518781:vfio_pci_read_config  (0000:00:16.4, @0x10, len=0x4) 81000004
2224@1455310065.518793:vfio_pci_read_config  (0000:00:16.4, @0x14, len=0x4) 0
2224@1455310065.518806:vfio_pci_read_config  (0000:00:16.4, @0x18, len=0x4) 0
2224@1455310065.518818:vfio_pci_read_config  (0000:00:16.4, @0x1c, len=0x4) 0
2224@1455310065.518830:vfio_pci_read_config  (0000:00:16.4, @0x20, len=0x4) 0
2224@1455310065.518843:vfio_pci_read_config  (0000:00:16.4, @0x24, len=0x4) 0
2224@1455310065.518860:vfio_pci_read_config  (0000:00:16.4, @0x9, len=0x1) 0
2224@1455310065.518874:vfio_pci_read_config  (0000:00:16.4, @0xa, len=0x1) 80
2224@1455310065.518888:vfio_pci_read_config  (0000:00:16.4, @0xb, len=0x1) 7
2224@1455310065.518905:vfio_pci_read_config  (0000:00:16.4, @0x9, len=0x1) 0
2224@1455310065.518922:vfio_pci_read_config  (0000:00:16.4, @0xa, len=0x1) 80
2224@1455310065.518936:vfio_pci_read_config  (0000:00:16.4, @0xb, len=0x1) 7
2224@1455310065.518951:vfio_pci_read_config  (0000:00:16.4, @0x9, len=0x1) 0
2224@1455310065.518966:vfio_pci_read_config  (0000:00:16.4, @0xa, len=0x1) 80
2224@1455310065.518979:vfio_pci_read_config  (0000:00:16.4, @0xb, len=0x1) 7
2224@1455310065.518994:vfio_pci_read_config  (0000:00:16.4, @0x0, len=0x4) 9d3e8086
2224@1455310065.519008:vfio_pci_read_config  (0000:00:16.4, @0x4, len=0x4) 100006
2224@1455310065.519023:vfio_pci_read_config  (0000:00:16.4, @0x8, len=0x4) 7800021
2224@1455310065.519037:vfio_pci_read_config  (0000:00:16.4, @0xc, len=0x4) 0
2224@1455310065.519049:vfio_pci_read_config  (0000:00:16.4, @0x10, len=0x4) 81000004
2224@1455310065.519061:vfio_pci_read_config  (0000:00:16.4, @0x14, len=0x4) 0
2224@1455310065.519073:vfio_pci_read_config  (0000:00:16.4, @0x18, len=0x4) 0
2224@1455310065.519085:vfio_pci_read_config  (0000:00:16.4, @0x1c, len=0x4) 0
2224@1455310065.519097:vfio_pci_read_config  (0000:00:16.4, @0x20, len=0x4) 0
2224@1455310065.519112:vfio_pci_read_config  (0000:00:16.4, @0x24, len=0x4) 0
2224@1455310065.519126:vfio_pci_read_config  (0000:00:16.4, @0x28, len=0x4) 0
2224@1455310065.519140:vfio_pci_read_config  (0000:00:16.4, @0x2c, len=0x4) 0
2224@1455310065.519153:vfio_pci_read_config  (0000:00:16.4, @0x30, len=0x4) 0
2224@1455310065.519167:vfio_pci_read_config  (0000:00:16.4, @0x34, len=0x4) 50
2224@1455310065.519181:vfio_pci_read_config  (0000:00:16.4, @0x38, len=0x4) 0
2224@1455310065.519195:vfio_pci_read_config  (0000:00:16.4, @0x3c, len=0x4) 1ff
2224@1455310065.519209:vfio_pci_read_config  (0000:00:16.4, @0x0, len=0x4) 9d3e8086
2224@1455310065.519223:vfio_pci_read_config  (0000:00:16.4, @0x4, len=0x4) 100006
2224@1455310065.519237:vfio_pci_read_config  (0000:00:16.4, @0x8, len=0x4) 7800021
2224@1455310065.519251:vfio_pci_read_config  (0000:00:16.4, @0xc, len=0x4) 0
2224@1455310065.519263:vfio_pci_read_config  (0000:00:16.4, @0x10, len=0x4) 81000004
2224@1455310065.519276:vfio_pci_read_config  (0000:00:16.4, @0x14, len=0x4) 0
2224@1455310065.519292:vfio_pci_read_config  (0000:00:16.4, @0x18, len=0x4) 0
2224@1455310065.519305:vfio_pci_read_config  (0000:00:16.4, @0x1c, len=0x4) 0
2224@1455310065.519317:vfio_pci_read_config  (0000:00:16.4, @0x20, len=0x4) 0
2224@1455310065.519329:vfio_pci_read_config  (0000:00:16.4, @0x24, len=0x4) 0
2224@1455310065.519343:vfio_pci_read_config  (0000:00:16.4, @0x28, len=0x4) 0
2224@1455310065.519357:vfio_pci_read_config  (0000:00:16.4, @0x2c, len=0x4) 0
2224@1455310065.519369:vfio_pci_read_config  (0000:00:16.4, @0x30, len=0x4) 0
2224@1455310065.519383:vfio_pci_read_config  (0000:00:16.4, @0x34, len=0x4) 50
2224@1455310065.519397:vfio_pci_read_config  (0000:00:16.4, @0x38, len=0x4) 0
2224@1455310065.519411:vfio_pci_read_config  (0000:00:16.4, @0x3c, len=0x4) 1ff
2224@1455310065.519425:vfio_pci_read_config  (0000:00:16.4, @0x0, len=0x4) 9d3e8086
2224@1455310065.519439:vfio_pci_read_config  (0000:00:16.4, @0x4, len=0x4) 100006
2224@1455310065.519453:vfio_pci_read_config  (0000:00:16.4, @0x8, len=0x4) 7800021
2224@1455310065.519467:vfio_pci_read_config  (0000:00:16.4, @0xc, len=0x4) 0
2224@1455310065.519479:vfio_pci_read_config  (0000:00:16.4, @0x10, len=0x4) 81000004
2224@1455310065.519491:vfio_pci_read_config  (0000:00:16.4, @0x14, len=0x4) 0
2224@1455310065.519503:vfio_pci_read_config  (0000:00:16.4, @0x18, len=0x4) 0
2224@1455310065.519515:vfio_pci_read_config  (0000:00:16.4, @0x1c, len=0x4) 0
2224@1455310065.519527:vfio_pci_read_config  (0000:00:16.4, @0x20, len=0x4) 0
2224@1455310065.519539:vfio_pci_read_config  (0000:00:16.4, @0x24, len=0x4) 0
2224@1455310065.519554:vfio_pci_read_config  (0000:00:16.4, @0x28, len=0x4) 0
2224@1455310065.519568:vfio_pci_read_config  (0000:00:16.4, @0x2c, len=0x4) 0
2224@1455310065.519580:vfio_pci_read_config  (0000:00:16.4, @0x30, len=0x4) 0
2224@1455310065.519594:vfio_pci_read_config  (0000:00:16.4, @0x34, len=0x4) 50
2224@1455310065.519609:vfio_pci_read_config  (0000:00:16.4, @0x38, len=0x4) 0
2224@1455310065.519623:vfio_pci_read_config  (0000:00:16.4, @0x3c, len=0x4) 1ff
2224@1455310065.519640:vfio_pci_read_config  (0000:00:16.4, @0xb, len=0x1) 7
2224@1455310065.519655:vfio_pci_read_config  (0000:00:16.4, @0xa, len=0x1) 80
2224@1455310065.519673:vfio_pci_read_config  (0000:00:16.4, @0x0, len=0x4) 9d3e8086
2224@1455310065.519689:vfio_pci_read_config  (0000:00:16.4, @0x4, len=0x4) 100006
2224@1455310065.519703:vfio_pci_read_config  (0000:00:16.4, @0x8, len=0x4) 7800021
2224@1455310065.519718:vfio_pci_read_config  (0000:00:16.4, @0xc, len=0x4) 0
2224@1455310065.519730:vfio_pci_read_config  (0000:00:16.4, @0x10, len=0x4) 81000004
2224@1455310065.519743:vfio_pci_read_config  (0000:00:16.4, @0x14, len=0x4) 0
2224@1455310065.519755:vfio_pci_read_config  (0000:00:16.4, @0x18, len=0x4) 0
2224@1455310065.519767:vfio_pci_read_config  (0000:00:16.4, @0x1c, len=0x4) 0
2224@1455310065.519780:vfio_pci_read_config  (0000:00:16.4, @0x20, len=0x4) 0
2224@1455310065.519793:vfio_pci_read_config  (0000:00:16.4, @0x24, len=0x4) 0
2224@1455310065.519807:vfio_pci_read_config  (0000:00:16.4, @0x28, len=0x4) 0
2224@1455310065.519821:vfio_pci_read_config  (0000:00:16.4, @0x2c, len=0x4) 0
2224@1455310065.519833:vfio_pci_read_config  (0000:00:16.4, @0x30, len=0x4) 0
2224@1455310065.519846:vfio_pci_read_config  (0000:00:16.4, @0x34, len=0x4) 50
2224@1455310065.519860:vfio_pci_read_config  (0000:00:16.4, @0x38, len=0x4) 0
2224@1455310065.519875:vfio_pci_read_config  (0000:00:16.4, @0x3c, len=0x4) 1ff
2224@1455310065.577622:vfio_pci_read_config  (0000:00:16.4, @0x4, len=0x2) 6
2224@1455310065.577645:vfio_pci_write_config  (0000:00:16.4, @0x4, 0x6, len=0x2)
2224@1455310065.577670:vfio_pci_read_config  (0000:00:16.4, @0x4, len=0x2) 6
2224@1455310065.577699:vfio_pci_write_config  (0000:00:16.4, @0x4, 0x6, len=0x2)
2224@1455310065.577719:vfio_pci_read_config  (0000:00:16.4, @0x0, len=0x4) 9d3e8086
2224@1455310065.577734:vfio_pci_read_config  (0000:00:16.4, @0x8, len=0x4) 7800021
2224@1455310065.577747:vfio_pci_read_config  (0000:00:16.4, @0x3c, len=0x1) ff
2224@1455310065.577762:vfio_pci_read_config  (0000:00:16.4, @0x10, len=0x4) 81000004
2224@1455310065.577775:vfio_pci_read_config  (0000:00:16.4, @0x14, len=0x4) 0
2224@1455310065.577788:vfio_pci_read_config  (0000:00:16.4, @0x18, len=0x4) 0
2224@1455310065.577800:vfio_pci_read_config  (0000:00:16.4, @0x1c, len=0x4) 0
2224@1455310065.577813:vfio_pci_read_config  (0000:00:16.4, @0x20, len=0x4) 0
2224@1455310065.577826:vfio_pci_read_config  (0000:00:16.4, @0x24, len=0x4) 0
2224@1455310065.577842:vfio_pci_read_config  (0000:00:16.4, @0x9, len=0x1) 0
2224@1455310065.577857:vfio_pci_read_config  (0000:00:16.4, @0xa, len=0x1) 80
2224@1455310065.577871:vfio_pci_read_config  (0000:00:16.4, @0xb, len=0x1) 7
2224@1455310065.577887:vfio_pci_read_config  (0000:00:16.4, @0x9, len=0x1) 0
2224@1455310065.577901:vfio_pci_read_config  (0000:00:16.4, @0xa, len=0x1) 80
2224@1455310065.577916:vfio_pci_read_config  (0000:00:16.4, @0xb, len=0x1) 7
2224@1455310065.577931:vfio_pci_read_config  (0000:00:16.4, @0x9, len=0x1) 0
2224@1455310065.577946:vfio_pci_read_config  (0000:00:16.4, @0xa, len=0x1) 80
2224@1455310065.577960:vfio_pci_read_config  (0000:00:16.4, @0xb, len=0x1) 7
2224@1455310065.577975:vfio_pci_read_config  (0000:00:16.4, @0x0, len=0x4) 9d3e8086
2224@1455310065.577990:vfio_pci_read_config  (0000:00:16.4, @0x4, len=0x4) 100006
2224@1455310065.578004:vfio_pci_read_config  (0000:00:16.4, @0x8, len=0x4) 7800021
2224@1455310065.578019:vfio_pci_read_config  (0000:00:16.4, @0xc, len=0x4) 0
2224@1455310065.578031:vfio_pci_read_config  (0000:00:16.4, @0x10, len=0x4) 81000004
2224@1455310065.578044:vfio_pci_read_config  (0000:00:16.4, @0x14, len=0x4) 0
2224@1455310065.578057:vfio_pci_read_config  (0000:00:16.4, @0x18, len=0x4) 0
2224@1455310065.578070:vfio_pci_read_config  (0000:00:16.4, @0x1c, len=0x4) 0
2224@1455310065.578082:vfio_pci_read_config  (0000:00:16.4, @0x20, len=0x4) 0
2224@1455310065.578094:vfio_pci_read_config  (0000:00:16.4, @0x24, len=0x4) 0
2224@1455310065.578109:vfio_pci_read_config  (0000:00:16.4, @0x28, len=0x4) 0
2224@1455310065.578123:vfio_pci_read_config  (0000:00:16.4, @0x2c, len=0x4) 0
2224@1455310065.578136:vfio_pci_read_config  (0000:00:16.4, @0x30, len=0x4) 0
2224@1455310065.578150:vfio_pci_read_config  (0000:00:16.4, @0x34, len=0x4) 50
2224@1455310065.578164:vfio_pci_read_config  (0000:00:16.4, @0x38, len=0x4) 0
2224@1455310065.578178:vfio_pci_read_config  (0000:00:16.4, @0x3c, len=0x4) 1ff
2224@1455310065.578192:vfio_pci_read_config  (0000:00:16.4, @0x0, len=0x4) 9d3e8086
2224@1455310065.578206:vfio_pci_read_config  (0000:00:16.4, @0x4, len=0x4) 100006
2224@1455310065.578221:vfio_pci_read_config  (0000:00:16.4, @0x8, len=0x4) 7800021
2224@1455310065.578235:vfio_pci_read_config  (0000:00:16.4, @0xc, len=0x4) 0
2224@1455310065.578248:vfio_pci_read_config  (0000:00:16.4, @0x10, len=0x4) 81000004
2224@1455310065.578260:vfio_pci_read_config  (0000:00:16.4, @0x14, len=0x4) 0
2224@1455310065.578273:vfio_pci_read_config  (0000:00:16.4, @0x18, len=0x4) 0
2224@1455310065.578285:vfio_pci_read_config  (0000:00:16.4, @0x1c, len=0x4) 0
2224@1455310065.578298:vfio_pci_read_config  (0000:00:16.4, @0x20, len=0x4) 0
2224@1455310065.578310:vfio_pci_read_config  (0000:00:16.4, @0x24, len=0x4) 0
2224@1455310065.578325:vfio_pci_read_config  (0000:00:16.4, @0x28, len=0x4) 0
2224@1455310065.578339:vfio_pci_read_config  (0000:00:16.4, @0x2c, len=0x4) 0
2224@1455310065.578352:vfio_pci_read_config  (0000:00:16.4, @0x30, len=0x4) 0
2224@1455310065.578366:vfio_pci_read_config  (0000:00:16.4, @0x34, len=0x4) 50
2224@1455310065.578381:vfio_pci_read_config  (0000:00:16.4, @0x38, len=0x4) 0
2224@1455310065.578395:vfio_pci_read_config  (0000:00:16.4, @0x3c, len=0x4) 1ff
2224@1455310065.578409:vfio_pci_read_config  (0000:00:16.4, @0x0, len=0x4) 9d3e8086
2224@1455310065.578423:vfio_pci_read_config  (0000:00:16.4, @0x4, len=0x4) 100006
2224@1455310065.578438:vfio_pci_read_config  (0000:00:16.4, @0x8, len=0x4) 7800021
2224@1455310065.578452:vfio_pci_read_config  (0000:00:16.4, @0xc, len=0x4) 0
2224@1455310065.578465:vfio_pci_read_config  (0000:00:16.4, @0x10, len=0x4) 81000004
2224@1455310065.578477:vfio_pci_read_config  (0000:00:16.4, @0x14, len=0x4) 0
2224@1455310065.578490:vfio_pci_read_config  (0000:00:16.4, @0x18, len=0x4) 0
2224@1455310065.578502:vfio_pci_read_config  (0000:00:16.4, @0x1c, len=0x4) 0
2224@1455310065.578514:vfio_pci_read_config  (0000:00:16.4, @0x20, len=0x4) 0
2224@1455310065.578527:vfio_pci_read_config  (0000:00:16.4, @0x24, len=0x4) 0
2224@1455310065.578541:vfio_pci_read_config  (0000:00:16.4, @0x28, len=0x4) 0
2224@1455310065.578556:vfio_pci_read_config  (0000:00:16.4, @0x2c, len=0x4) 0
2224@1455310065.578569:vfio_pci_read_config  (0000:00:16.4, @0x30, len=0x4) 0
2224@1455310065.578583:vfio_pci_read_config  (0000:00:16.4, @0x34, len=0x4) 50
2224@1455310065.578598:vfio_pci_read_config  (0000:00:16.4, @0x38, len=0x4) 0
2224@1455310065.578612:vfio_pci_read_config  (0000:00:16.4, @0x3c, len=0x4) 1ff
2224@1455310065.578629:vfio_pci_read_config  (0000:00:16.4, @0xb, len=0x1) 7
2224@1455310065.578645:vfio_pci_read_config  (0000:00:16.4, @0xa, len=0x1) 80
2224@1455310065.578659:vfio_pci_read_config  (0000:00:16.4, @0x0, len=0x4) 9d3e8086
2224@1455310065.578673:vfio_pci_read_config  (0000:00:16.4, @0x4, len=0x4) 100006
2224@1455310065.578688:vfio_pci_read_config  (0000:00:16.4, @0x8, len=0x4) 7800021
2224@1455310065.578702:vfio_pci_read_config  (0000:00:16.4, @0xc, len=0x4) 0
2224@1455310065.578715:vfio_pci_read_config  (0000:00:16.4, @0x10, len=0x4) 81000004
2224@1455310065.578727:vfio_pci_read_config  (0000:00:16.4, @0x14, len=0x4) 0
2224@1455310065.578740:vfio_pci_read_config  (0000:00:16.4, @0x18, len=0x4) 0
2224@1455310065.578752:vfio_pci_read_config  (0000:00:16.4, @0x1c, len=0x4) 0
2224@1455310065.578765:vfio_pci_read_config  (0000:00:16.4, @0x20, len=0x4) 0
2224@1455310065.578778:vfio_pci_read_config  (0000:00:16.4, @0x24, len=0x4) 0
2224@1455310065.578792:vfio_pci_read_config  (0000:00:16.4, @0x28, len=0x4) 0
2224@1455310065.578806:vfio_pci_read_config  (0000:00:16.4, @0x2c, len=0x4) 0
2224@1455310065.578819:vfio_pci_read_config  (0000:00:16.4, @0x30, len=0x4) 0
2224@1455310065.578834:vfio_pci_read_config  (0000:00:16.4, @0x34, len=0x4) 50
2224@1455310065.578848:vfio_pci_read_config  (0000:00:16.4, @0x38, len=0x4) 0
2224@1455310065.578863:vfio_pci_read_config  (0000:00:16.4, @0x3c, len=0x4) 1ff
2224@1455310066.119746:vfio_intx_update  (0000:00:16.4) IRQ moved -1 -> 10
2224@1455310066.119806:vfio_intx_enable_kvm  (0000:00:16.4) KVM INTx accel enabled
2224@1455310066.120867:vfio_pci_read_config  (0000:00:16.4, @0x0, len=0x4) 9d3e8086
2224@1455310066.120887:vfio_pci_read_config  (0000:00:16.4, @0x4, len=0x4) 100006
2224@1455310066.120906:vfio_pci_read_config  (0000:00:16.4, @0x8, len=0x4) 7800021
2224@1455310066.120924:vfio_pci_read_config  (0000:00:16.4, @0xc, len=0x4) 0
2224@1455310066.120950:vfio_pci_read_config  (0000:00:16.4, @0x10, len=0x4) 81000004
2224@1455310066.120962:vfio_pci_read_config  (0000:00:16.4, @0x14, len=0x4) 0
2224@1455310066.120974:vfio_pci_read_config  (0000:00:16.4, @0x18, len=0x4) 0
2224@1455310066.120986:vfio_pci_read_config  (0000:00:16.4, @0x1c, len=0x4) 0
2224@1455310066.120998:vfio_pci_read_config  (0000:00:16.4, @0x20, len=0x4) 0
2224@1455310066.121020:vfio_pci_read_config  (0000:00:16.4, @0x24, len=0x4) 0
2224@1455310066.121038:vfio_pci_read_config  (0000:00:16.4, @0x28, len=0x4) 0
2224@1455310066.121056:vfio_pci_read_config  (0000:00:16.4, @0x2c, len=0x4) 0
2224@1455310066.121069:vfio_pci_read_config  (0000:00:16.4, @0x30, len=0x4) 0
2224@1455310066.121088:vfio_pci_read_config  (0000:00:16.4, @0x34, len=0x4) 50
2224@1455310066.121106:vfio_pci_read_config  (0000:00:16.4, @0x38, len=0x4) 0
2224@1455310066.121124:vfio_pci_read_config  (0000:00:16.4, @0x3c, len=0x4) 1ff
2224@1455310066.121141:vfio_pci_write_config  (0000:00:16.4, @0x3c, 0xb, len=0x1)
2224@1455310066.200309:vfio_pci_read_config  (0000:00:16.4, @0x4, len=0x2) 6
2224@1455310066.200343:vfio_pci_write_config  (0000:00:16.4, @0x4, 0x6, len=0x2)
2224@1455310066.200375:vfio_pci_read_config  (0000:00:16.4, @0x4, len=0x2) 6
2224@1455310066.200391:vfio_pci_write_config  (0000:00:16.4, @0x4, 0x6, len=0x2)
2224@1455310066.200434:vfio_pci_read_config  (0000:00:16.4, @0x0, len=0x4) 9d3e8086
2224@1455310066.200469:vfio_pci_read_config  (0000:00:16.4, @0x8, len=0x4) 7800021
2224@1455310066.200500:vfio_pci_read_config  (0000:00:16.4, @0x3c, len=0x1) b
2224@1455310066.200531:vfio_pci_read_config  (0000:00:16.4, @0x10, len=0x4) 81000004
2224@1455310066.200548:vfio_pci_read_config  (0000:00:16.4, @0x14, len=0x4) 0
2224@1455310066.200567:vfio_pci_read_config  (0000:00:16.4, @0x18, len=0x4) 0
2224@1455310066.200585:vfio_pci_read_config  (0000:00:16.4, @0x1c, len=0x4) 0
2224@1455310066.200602:vfio_pci_read_config  (0000:00:16.4, @0x20, len=0x4) 0
2224@1455310066.200620:vfio_pci_read_config  (0000:00:16.4, @0x24, len=0x4) 0
2224@1455310066.200646:vfio_pci_read_config  (0000:00:16.4, @0x9, len=0x1) 0
2224@1455310066.200668:vfio_pci_read_config  (0000:00:16.4, @0xa, len=0x1) 80
2224@1455310066.200690:vfio_pci_read_config  (0000:00:16.4, @0xb, len=0x1) 7
2224@1455310066.200715:vfio_pci_read_config  (0000:00:16.4, @0x9, len=0x1) 0
2224@1455310066.200737:vfio_pci_read_config  (0000:00:16.4, @0xa, len=0x1) 80
2224@1455310066.200760:vfio_pci_read_config  (0000:00:16.4, @0xb, len=0x1) 7
2224@1455310066.200785:vfio_pci_read_config  (0000:00:16.4, @0x9, len=0x1) 0
2224@1455310066.200807:vfio_pci_read_config  (0000:00:16.4, @0xa, len=0x1) 80
2224@1455310066.200830:vfio_pci_read_config  (0000:00:16.4, @0xb, len=0x1) 7
2224@1455310066.200850:vfio_pci_read_config  (0000:00:16.4, @0x0, len=0x4) 9d3e8086
2224@1455310066.200873:vfio_pci_read_config  (0000:00:16.4, @0x4, len=0x4) 100006
2224@1455310066.200896:vfio_pci_read_config  (0000:00:16.4, @0x8, len=0x4) 7800021
2224@1455310066.200919:vfio_pci_read_config  (0000:00:16.4, @0xc, len=0x4) 0
2224@1455310066.200936:vfio_pci_read_config  (0000:00:16.4, @0x10, len=0x4) 81000004
2224@1455310066.200953:vfio_pci_read_config  (0000:00:16.4, @0x14, len=0x4) 0
2224@1455310066.200977:vfio_pci_read_config  (0000:00:16.4, @0x18, len=0x4) 0
2224@1455310066.200994:vfio_pci_read_config  (0000:00:16.4, @0x1c, len=0x4) 0
2224@1455310066.201014:vfio_pci_read_config  (0000:00:16.4, @0x20, len=0x4) 0
2224@1455310066.201030:vfio_pci_read_config  (0000:00:16.4, @0x24, len=0x4) 0
2224@1455310066.201051:vfio_pci_read_config  (0000:00:16.4, @0x28, len=0x4) 0
2224@1455310066.201073:vfio_pci_read_config  (0000:00:16.4, @0x2c, len=0x4) 0
2224@1455310066.201090:vfio_pci_read_config  (0000:00:16.4, @0x30, len=0x4) 0
2224@1455310066.201113:vfio_pci_read_config  (0000:00:16.4, @0x34, len=0x4) 50
2224@1455310066.201136:vfio_pci_read_config  (0000:00:16.4, @0x38, len=0x4) 0
2224@1455310066.201158:vfio_pci_read_config  (0000:00:16.4, @0x3c, len=0x4) 10b
2224@1455310066.201177:vfio_pci_read_config  (0000:00:16.4, @0x0, len=0x4) 9d3e8086
2224@1455310066.201200:vfio_pci_read_config  (0000:00:16.4, @0x4, len=0x4) 100006
2224@1455310066.201223:vfio_pci_read_config  (0000:00:16.4, @0x8, len=0x4) 7800021
2224@1455310066.201246:vfio_pci_read_config  (0000:00:16.4, @0xc, len=0x4) 0
2224@1455310066.201263:vfio_pci_read_config  (0000:00:16.4, @0x10, len=0x4) 81000004
2224@1455310066.201280:vfio_pci_read_config  (0000:00:16.4, @0x14, len=0x4) 0
2224@1455310066.201297:vfio_pci_read_config  (0000:00:16.4, @0x18, len=0x4) 0
2224@1455310066.201314:vfio_pci_read_config  (0000:00:16.4, @0x1c, len=0x4) 0
2224@1455310066.201331:vfio_pci_read_config  (0000:00:16.4, @0x20, len=0x4) 0
2224@1455310066.201348:vfio_pci_read_config  (0000:00:16.4, @0x24, len=0x4) 0
2224@1455310066.201371:vfio_pci_read_config  (0000:00:16.4, @0x28, len=0x4) 0
2224@1455310066.201393:vfio_pci_read_config  (0000:00:16.4, @0x2c, len=0x4) 0
2224@1455310066.201411:vfio_pci_read_config  (0000:00:16.4, @0x30, len=0x4) 0
2224@1455310066.201434:vfio_pci_read_config  (0000:00:16.4, @0x34, len=0x4) 50
2224@1455310066.201456:vfio_pci_read_config  (0000:00:16.4, @0x38, len=0x4) 0
2224@1455310066.201477:vfio_pci_read_config  (0000:00:16.4, @0x3c, len=0x4) 10b
2224@1455310066.201490:vfio_pci_read_config  (0000:00:16.4, @0x0, len=0x4) 9d3e8086
2224@1455310066.201509:vfio_pci_read_config  (0000:00:16.4, @0x4, len=0x4) 100006
2224@1455310066.201527:vfio_pci_read_config  (0000:00:16.4, @0x8, len=0x4) 7800021
2224@1455310066.201545:vfio_pci_read_config  (0000:00:16.4, @0xc, len=0x4) 0
2224@1455310066.201558:vfio_pci_read_config  (0000:00:16.4, @0x10, len=0x4) 81000004
2224@1455310066.201570:vfio_pci_read_config  (0000:00:16.4, @0x14, len=0x4) 0
2224@1455310066.201582:vfio_pci_read_config  (0000:00:16.4, @0x18, len=0x4) 0
2224@1455310066.201594:vfio_pci_read_config  (0000:00:16.4, @0x1c, len=0x4) 0
2224@1455310066.201606:vfio_pci_read_config  (0000:00:16.4, @0x20, len=0x4) 0
2224@1455310066.201618:vfio_pci_read_config  (0000:00:16.4, @0x24, len=0x4) 0
2224@1455310066.201636:vfio_pci_read_config  (0000:00:16.4, @0x28, len=0x4) 0
2224@1455310066.201654:vfio_pci_read_config  (0000:00:16.4, @0x2c, len=0x4) 0
2224@1455310066.201666:vfio_pci_read_config  (0000:00:16.4, @0x30, len=0x4) 0
2224@1455310066.201684:vfio_pci_read_config  (0000:00:16.4, @0x34, len=0x4) 50
2224@1455310066.201702:vfio_pci_read_config  (0000:00:16.4, @0x38, len=0x4) 0
2224@1455310066.201720:vfio_pci_read_config  (0000:00:16.4, @0x3c, len=0x4) 10b
2224@1455310066.201740:vfio_pci_read_config  (0000:00:16.4, @0xb, len=0x1) 7
2224@1455310066.201759:vfio_pci_read_config  (0000:00:16.4, @0xa, len=0x1) 80
2224@1455310066.201772:vfio_pci_read_config  (0000:00:16.4, @0x0, len=0x4) 9d3e8086
2224@1455310066.201790:vfio_pci_read_config  (0000:00:16.4, @0x4, len=0x4) 100006
2224@1455310066.201807:vfio_pci_read_config  (0000:00:16.4, @0x8, len=0x4) 7800021
2224@1455310066.201825:vfio_pci_read_config  (0000:00:16.4, @0xc, len=0x4) 0
2224@1455310066.201837:vfio_pci_read_config  (0000:00:16.4, @0x10, len=0x4) 81000004
2224@1455310066.201849:vfio_pci_read_config  (0000:00:16.4, @0x14, len=0x4) 0
2224@1455310066.201861:vfio_pci_read_config  (0000:00:16.4, @0x18, len=0x4) 0
2224@1455310066.201874:vfio_pci_read_config  (0000:00:16.4, @0x1c, len=0x4) 0
2224@1455310066.201886:vfio_pci_read_config  (0000:00:16.4, @0x20, len=0x4) 0
2224@1455310066.201898:vfio_pci_read_config  (0000:00:16.4, @0x24, len=0x4) 0
2224@1455310066.201916:vfio_pci_read_config  (0000:00:16.4, @0x28, len=0x4) 0
2224@1455310066.201933:vfio_pci_read_config  (0000:00:16.4, @0x2c, len=0x4) 0
2224@1455310066.201946:vfio_pci_read_config  (0000:00:16.4, @0x30, len=0x4) 0
2224@1455310066.201963:vfio_pci_read_config  (0000:00:16.4, @0x34, len=0x4) 50
2224@1455310066.201981:vfio_pci_read_config  (0000:00:16.4, @0x38, len=0x4) 0
2224@1455310066.201999:vfio_pci_read_config  (0000:00:16.4, @0x3c, len=0x4) 10b
2224@1455310066.742256:vfio_pci_read_config  (0000:00:16.4, @0x4, len=0x2) 6
2224@1455310066.742278:vfio_pci_write_config  (0000:00:16.4, @0x4, 0x6, len=0x2)
2224@1455310066.742314:vfio_pci_read_config  (0000:00:16.4, @0x4, len=0x2) 6
2224@1455310066.742383:vfio_pci_write_config  (0000:00:16.4, @0x4, 0x6, len=0x2)
2224@1455310066.742418:vfio_pci_read_config  (0000:00:16.4, @0x0, len=0x4) 9d3e8086
2224@1455310066.742443:vfio_pci_read_config  (0000:00:16.4, @0x8, len=0x4) 7800021
2224@1455310066.742460:vfio_pci_read_config  (0000:00:16.4, @0x3c, len=0x1) b
2224@1455310066.742492:vfio_pci_read_config  (0000:00:16.4, @0x10, len=0x4) 81000004
2224@1455310066.742509:vfio_pci_read_config  (0000:00:16.4, @0x14, len=0x4) 0
2224@1455310066.742526:vfio_pci_read_config  (0000:00:16.4, @0x18, len=0x4) 0
2224@1455310066.742544:vfio_pci_read_config  (0000:00:16.4, @0x1c, len=0x4) 0
2224@1455310066.742562:vfio_pci_read_config  (0000:00:16.4, @0x20, len=0x4) 0
2224@1455310066.742592:vfio_pci_read_config  (0000:00:16.4, @0x24, len=0x4) 0
2224@1455310066.742619:vfio_pci_read_config  (0000:00:16.4, @0x9, len=0x1) 0
2224@1455310066.742641:vfio_pci_read_config  (0000:00:16.4, @0xa, len=0x1) 80
2224@1455310066.742664:vfio_pci_read_config  (0000:00:16.4, @0xb, len=0x1) 7
2224@1455310066.742689:vfio_pci_read_config  (0000:00:16.4, @0x9, len=0x1) 0
2224@1455310066.742711:vfio_pci_read_config  (0000:00:16.4, @0xa, len=0x1) 80
2224@1455310066.742734:vfio_pci_read_config  (0000:00:16.4, @0xb, len=0x1) 7
2224@1455310066.742761:vfio_pci_read_config  (0000:00:16.4, @0x9, len=0x1) 0
2224@1455310066.742787:vfio_pci_read_config  (0000:00:16.4, @0xa, len=0x1) 80
2224@1455310066.742809:vfio_pci_read_config  (0000:00:16.4, @0xb, len=0x1) 7
2224@1455310066.742829:vfio_pci_read_config  (0000:00:16.4, @0x0, len=0x4) 9d3e8086
2224@1455310066.742851:vfio_pci_read_config  (0000:00:16.4, @0x4, len=0x4) 100006
2224@1455310066.742874:vfio_pci_read_config  (0000:00:16.4, @0x8, len=0x4) 7800021
2224@1455310066.742897:vfio_pci_read_config  (0000:00:16.4, @0xc, len=0x4) 0
2224@1455310066.742914:vfio_pci_read_config  (0000:00:16.4, @0x10, len=0x4) 81000004
2224@1455310066.742930:vfio_pci_read_config  (0000:00:16.4, @0x14, len=0x4) 0
2224@1455310066.742947:vfio_pci_read_config  (0000:00:16.4, @0x18, len=0x4) 0
2224@1455310066.742965:vfio_pci_read_config  (0000:00:16.4, @0x1c, len=0x4) 0
2224@1455310066.742982:vfio_pci_read_config  (0000:00:16.4, @0x20, len=0x4) 0
2224@1455310066.742999:vfio_pci_read_config  (0000:00:16.4, @0x24, len=0x4) 0
2224@1455310066.743022:vfio_pci_read_config  (0000:00:16.4, @0x28, len=0x4) 0
2224@1455310066.743045:vfio_pci_read_config  (0000:00:16.4, @0x2c, len=0x4) 0
2224@1455310066.743061:vfio_pci_read_config  (0000:00:16.4, @0x30, len=0x4) 0
2224@1455310066.743084:vfio_pci_read_config  (0000:00:16.4, @0x34, len=0x4) 50
2224@1455310066.743107:vfio_pci_read_config  (0000:00:16.4, @0x38, len=0x4) 0
2224@1455310066.743130:vfio_pci_read_config  (0000:00:16.4, @0x3c, len=0x4) 10b
2224@1455310066.743149:vfio_pci_read_config  (0000:00:16.4, @0x0, len=0x4) 9d3e8086
2224@1455310066.743171:vfio_pci_read_config  (0000:00:16.4, @0x4, len=0x4) 100006
2224@1455310066.743195:vfio_pci_read_config  (0000:00:16.4, @0x8, len=0x4) 7800021
2224@1455310066.743217:vfio_pci_read_config  (0000:00:16.4, @0xc, len=0x4) 0
2224@1455310066.743233:vfio_pci_read_config  (0000:00:16.4, @0x10, len=0x4) 81000004
2224@1455310066.743251:vfio_pci_read_config  (0000:00:16.4, @0x14, len=0x4) 0
2224@1455310066.743268:vfio_pci_read_config  (0000:00:16.4, @0x18, len=0x4) 0
2224@1455310066.743285:vfio_pci_read_config  (0000:00:16.4, @0x1c, len=0x4) 0
2224@1455310066.743302:vfio_pci_read_config  (0000:00:16.4, @0x20, len=0x4) 0
2224@1455310066.743316:vfio_pci_read_config  (0000:00:16.4, @0x24, len=0x4) 0
2224@1455310066.743339:vfio_pci_read_config  (0000:00:16.4, @0x28, len=0x4) 0
2224@1455310066.743361:vfio_pci_read_config  (0000:00:16.4, @0x2c, len=0x4) 0
2224@1455310066.743378:vfio_pci_read_config  (0000:00:16.4, @0x30, len=0x4) 0
2224@1455310066.743401:vfio_pci_read_config  (0000:00:16.4, @0x34, len=0x4) 50
2224@1455310066.743423:vfio_pci_read_config  (0000:00:16.4, @0x38, len=0x4) 0
2224@1455310066.743490:vfio_pci_read_config  (0000:00:16.4, @0x3c, len=0x4) 10b
2224@1455310066.743504:vfio_pci_read_config  (0000:00:16.4, @0x0, len=0x4) 9d3e8086
2224@1455310066.743522:vfio_pci_read_config  (0000:00:16.4, @0x4, len=0x4) 100006
2224@1455310066.743540:vfio_pci_read_config  (0000:00:16.4, @0x8, len=0x4) 7800021
2224@1455310066.743558:vfio_pci_read_config  (0000:00:16.4, @0xc, len=0x4) 0
2224@1455310066.743570:vfio_pci_read_config  (0000:00:16.4, @0x10, len=0x4) 81000004
2224@1455310066.743582:vfio_pci_read_config  (0000:00:16.4, @0x14, len=0x4) 0
2224@1455310066.743594:vfio_pci_read_config  (0000:00:16.4, @0x18, len=0x4) 0
2224@1455310066.743607:vfio_pci_read_config  (0000:00:16.4, @0x1c, len=0x4) 0
2224@1455310066.743619:vfio_pci_read_config  (0000:00:16.4, @0x20, len=0x4) 0
2224@1455310066.743631:vfio_pci_read_config  (0000:00:16.4, @0x24, len=0x4) 0
2224@1455310066.743649:vfio_pci_read_config  (0000:00:16.4, @0x28, len=0x4) 0
2224@1455310066.743666:vfio_pci_read_config  (0000:00:16.4, @0x2c, len=0x4) 0
2224@1455310066.743679:vfio_pci_read_config  (0000:00:16.4, @0x30, len=0x4) 0
2224@1455310066.743697:vfio_pci_read_config  (0000:00:16.4, @0x34, len=0x4) 50
2224@1455310066.743716:vfio_pci_read_config  (0000:00:16.4, @0x38, len=0x4) 0
2224@1455310066.743734:vfio_pci_read_config  (0000:00:16.4, @0x3c, len=0x4) 10b
2224@1455310066.743755:vfio_pci_read_config  (0000:00:16.4, @0xb, len=0x1) 7
2224@1455310066.743773:vfio_pci_read_config  (0000:00:16.4, @0xa, len=0x1) 80
2224@1455310066.743787:vfio_pci_read_config  (0000:00:16.4, @0x0, len=0x4) 9d3e8086
2224@1455310066.743805:vfio_pci_read_config  (0000:00:16.4, @0x4, len=0x4) 100006
2224@1455310066.743823:vfio_pci_read_config  (0000:00:16.4, @0x8, len=0x4) 7800021
2224@1455310066.743841:vfio_pci_read_config  (0000:00:16.4, @0xc, len=0x4) 0
2224@1455310066.743853:vfio_pci_read_config  (0000:00:16.4, @0x10, len=0x4) 81000004
2224@1455310066.743865:vfio_pci_read_config  (0000:00:16.4, @0x14, len=0x4) 0
2224@1455310066.743877:vfio_pci_read_config  (0000:00:16.4, @0x18, len=0x4) 0
2224@1455310066.743891:vfio_pci_read_config  (0000:00:16.4, @0x1c, len=0x4) 0
2224@1455310066.743904:vfio_pci_read_config  (0000:00:16.4, @0x20, len=0x4) 0
2224@1455310066.743917:vfio_pci_read_config  (0000:00:16.4, @0x24, len=0x4) 0
2224@1455310066.743935:vfio_pci_read_config  (0000:00:16.4, @0x28, len=0x4) 0
2224@1455310066.743953:vfio_pci_read_config  (0000:00:16.4, @0x2c, len=0x4) 0
2224@1455310066.743966:vfio_pci_read_config  (0000:00:16.4, @0x30, len=0x4) 0
2224@1455310066.743983:vfio_pci_read_config  (0000:00:16.4, @0x34, len=0x4) 50
2224@1455310066.744001:vfio_pci_read_config  (0000:00:16.4, @0x38, len=0x4) 0
2224@1455310066.744019:vfio_pci_read_config  (0000:00:16.4, @0x3c, len=0x4) 10b
2224@1455310071.872530:vfio_listener_region_del region_del a0000 - affff
2224@1455310071.872551:vfio_listener_region_del_skip SKIPPING region_del b0000 - bffff
2224@1455310071.872588:vfio_listener_region_add_skip SKIPPING region_add a0000 - bffff
2224@1455310071.874520:vfio_pci_hot_reset  (0000:00:16.4) multi
2224@1455310071.874566:vfio_intx_disable_kvm  (0000:00:16.4) KVM INTx accel disabled
2224@1455310071.874578:vfio_intx_disable  (0000:00:16.4)
2224@1455310071.874585:vfio_pci_read_config  (0000:00:16.4, @0x54, len=0x2) 8
2224@1455310071.874590:vfio_pci_read_config  (0000:00:16.4, @0x4, len=0x2) 6
2224@1455310071.874593:vfio_pci_write_config  (0000:00:16.4, @0x4, 0x0, len=0x2)
2224@1455310071.874618:vfio_listener_region_del_skip SKIPPING region_del 81000000 - 81000fff
qemu-system-x86_64: vfio: Cannot reset device 0000:00:16.4, no available reset mechanism.
2224@1455310071.876108:vfio_pci_read_config  (0000:00:16.4, @0x3d, len=0x1) 1
2224@1455310071.876144:vfio_intx_enable  (0000:00:16.4)
2224@1455310071.876220:vfio_pci_reset  (0000:00:16.4)
2224@1455310071.876227:vfio_intx_disable  (0000:00:16.4)
2224@1455310071.876232:vfio_pci_read_config  (0000:00:16.4, @0x54, len=0x2) 8
2224@1455310071.876236:vfio_pci_read_config  (0000:00:16.4, @0x4, len=0x2) 0
2224@1455310071.876239:vfio_pci_write_config  (0000:00:16.4, @0x4, 0x0, len=0x2)
2224@1455310071.876249:vfio_pci_hot_reset  (0000:00:16.4) one
2224@1455310071.876254:vfio_pci_read_config  (0000:00:16.4, @0x54, len=0x2) 8
2224@1455310071.876258:vfio_pci_read_config  (0000:00:16.4, @0x4, len=0x2) 0
2224@1455310071.876259:vfio_pci_write_config  (0000:00:16.4, @0x4, 0x0, len=0x2)
qemu-system-x86_64: vfio: Cannot reset device 0000:00:16.4, no available reset mechanism.
2224@1455310071.876273:vfio_pci_read_config  (0000:00:16.4, @0x3d, len=0x1) 1
2224@1455310071.876285:vfio_intx_enable  (0000:00:16.4)
2224@1455310071.876288:vfio_pci_read_config  (0000:00:16.4, @0x3d, len=0x1) 1
2224@1455310071.876292:vfio_intx_disable  (0000:00:16.4)
2224@1455310071.876301:vfio_intx_enable  (0000:00:16.4)
2224@1455310071.877095:vfio_listener_region_del region_del 80000000 - 80ffffff
2224@1455310071.878213:vfio_listener_region_del_skip SKIPPING region_del 81003400 - 8100341f
2224@1455310071.878218:vfio_listener_region_del_skip SKIPPING region_del 81003500 - 81003515
2224@1455310071.878219:vfio_listener_region_del_skip SKIPPING region_del 81003600 - 81003607
2224@1455310071.879541:vfio_listener_region_del_skip SKIPPING region_del 81002000 - 8100202f
2224@1455310071.879544:vfio_listener_region_del_skip SKIPPING region_del 81002800 - 81002807
2224@1455310071.880685:vfio_listener_region_del_skip SKIPPING region_del 81001000 - 8100101f
2224@1455310071.880689:vfio_listener_region_del_skip SKIPPING region_del 81001800 - 81001807
2224@1455310072.314100:vfio_pci_read_config  (0000:00:16.4, @0x0, len=0x4) 9d3e8086
2224@1455310072.314133:vfio_pci_read_config  (0000:00:16.4, @0x0, len=0x4) 9d3e8086
2224@1455310072.314152:vfio_pci_read_config  (0000:00:16.4, @0x4, len=0x4) 100000
2224@1455310072.314170:vfio_pci_read_config  (0000:00:16.4, @0x8, len=0x4) 7800021
2224@1455310072.314204:vfio_pci_read_config  (0000:00:16.4, @0xc, len=0x4) 0
2224@1455310072.314224:vfio_pci_read_config  (0000:00:16.4, @0x10, len=0x4) 81000004
2224@1455310072.314239:vfio_pci_read_config  (0000:00:16.4, @0x14, len=0x4) 0
2224@1455310072.314251:vfio_pci_read_config  (0000:00:16.4, @0x18, len=0x4) 0
2224@1455310072.314262:vfio_pci_read_config  (0000:00:16.4, @0x1c, len=0x4) 0
2224@1455310072.314273:vfio_pci_read_config  (0000:00:16.4, @0x20, len=0x4) 0
2224@1455310072.314286:vfio_pci_read_config  (0000:00:16.4, @0x24, len=0x4) 0
2224@1455310072.314304:vfio_pci_read_config  (0000:00:16.4, @0x28, len=0x4) 0
2224@1455310072.314321:vfio_pci_read_config  (0000:00:16.4, @0x2c, len=0x4) 0
2224@1455310072.314333:vfio_pci_read_config  (0000:00:16.4, @0x30, len=0x4) 0
2224@1455310072.314356:vfio_pci_read_config  (0000:00:16.4, @0x34, len=0x4) 50
2224@1455310072.314374:vfio_pci_read_config  (0000:00:16.4, @0x38, len=0x4) 0
2224@1455310072.314392:vfio_pci_read_config  (0000:00:16.4, @0x3c, len=0x4) 10b
2224@1455310072.319015:vfio_pci_read_config  (0000:00:16.4, @0x0, len=0x4) 9d3e8086
2224@1455310072.319035:vfio_pci_read_config  (0000:00:16.4, @0x0, len=0x4) 9d3e8086
2224@1455310072.319053:vfio_pci_read_config  (0000:00:16.4, @0x4, len=0x4) 100000
2224@1455310072.319071:vfio_pci_read_config  (0000:00:16.4, @0x8, len=0x4) 7800021
2224@1455310072.319089:vfio_pci_read_config  (0000:00:16.4, @0xc, len=0x4) 0
2224@1455310072.319101:vfio_pci_read_config  (0000:00:16.4, @0x10, len=0x4) 81000004
2224@1455310072.319113:vfio_pci_read_config  (0000:00:16.4, @0x14, len=0x4) 0
2224@1455310072.319126:vfio_pci_read_config  (0000:00:16.4, @0x18, len=0x4) 0
2224@1455310072.319137:vfio_pci_read_config  (0000:00:16.4, @0x1c, len=0x4) 0
2224@1455310072.319149:vfio_pci_read_config  (0000:00:16.4, @0x20, len=0x4) 0
2224@1455310072.319159:vfio_pci_read_config  (0000:00:16.4, @0x24, len=0x4) 0
2224@1455310072.319176:vfio_pci_read_config  (0000:00:16.4, @0x28, len=0x4) 0
2224@1455310072.319193:vfio_pci_read_config  (0000:00:16.4, @0x2c, len=0x4) 0
2224@1455310072.319205:vfio_pci_read_config  (0000:00:16.4, @0x30, len=0x4) 0
2224@1455310072.319222:vfio_pci_read_config  (0000:00:16.4, @0x34, len=0x4) 50
2224@1455310072.319240:vfio_pci_read_config  (0000:00:16.4, @0x38, len=0x4) 0
2224@1455310072.319258:vfio_pci_read_config  (0000:00:16.4, @0x3c, len=0x4) 10b
2224@1455310072.319276:vfio_pci_read_config  (0000:00:16.4, @0x34, len=0x1) 50
2224@1455310072.319295:vfio_pci_read_config  (0000:00:16.4, @0x50, len=0x2) 8c01
2224@1455310072.319309:vfio_pci_read_config  (0000:00:16.4, @0x8c, len=0x2) 5
2224@1455310072.319328:vfio_pci_read_config  (0000:00:16.4, @0x4, len=0x2) 0
2224@1455310072.319342:vfio_pci_write_config  (0000:00:16.4, @0x4, 0x0, len=0x2)
2224@1455310072.319365:vfio_pci_read_config  (0000:00:16.4, @0x10, len=0x4) 81000004
2224@1455310072.319377:vfio_pci_write_config  (0000:00:16.4, @0x10, 0xffffffff, len=0x4)
2224@1455310072.319389:vfio_pci_read_config  (0000:00:16.4, @0x10, len=0x4) fffff004
2224@1455310072.319400:vfio_pci_write_config  (0000:00:16.4, @0x10, 0x81000004, len=0x4)
2224@1455310072.319412:vfio_pci_read_config  (0000:00:16.4, @0x14, len=0x4) 0
2224@1455310072.319424:vfio_pci_write_config  (0000:00:16.4, @0x14, 0xffffffff, len=0x4)
2224@1455310072.319436:vfio_pci_read_config  (0000:00:16.4, @0x14, len=0x4) ffffffff
2224@1455310072.319447:vfio_pci_write_config  (0000:00:16.4, @0x14, 0x0, len=0x4)
2224@1455310072.319459:vfio_pci_read_config  (0000:00:16.4, @0x18, len=0x4) 0
2224@1455310072.319471:vfio_pci_write_config  (0000:00:16.4, @0x18, 0xffffffff, len=0x4)
2224@1455310072.319483:vfio_pci_read_config  (0000:00:16.4, @0x18, len=0x4) 0
2224@1455310072.319495:vfio_pci_write_config  (0000:00:16.4, @0x18, 0x0, len=0x4)
2224@1455310072.319507:vfio_pci_read_config  (0000:00:16.4, @0x1c, len=0x4) 0
2224@1455310072.319519:vfio_pci_write_config  (0000:00:16.4, @0x1c, 0xffffffff, len=0x4)
2224@1455310072.319531:vfio_pci_read_config  (0000:00:16.4, @0x1c, len=0x4) 0
2224@1455310072.319543:vfio_pci_write_config  (0000:00:16.4, @0x1c, 0x0, len=0x4)
2224@1455310072.319556:vfio_pci_read_config  (0000:00:16.4, @0x20, len=0x4) 0
2224@1455310072.319569:vfio_pci_write_config  (0000:00:16.4, @0x20, 0xffffffff, len=0x4)
2224@1455310072.319580:vfio_pci_read_config  (0000:00:16.4, @0x20, len=0x4) 0
2224@1455310072.319593:vfio_pci_write_config  (0000:00:16.4, @0x20, 0x0, len=0x4)
2224@1455310072.319606:vfio_pci_read_config  (0000:00:16.4, @0x24, len=0x4) 0
2224@1455310072.319618:vfio_pci_write_config  (0000:00:16.4, @0x24, 0xffffffff, len=0x4)
2224@1455310072.319630:vfio_pci_read_config  (0000:00:16.4, @0x24, len=0x4) 0
2224@1455310072.319642:vfio_pci_write_config  (0000:00:16.4, @0x24, 0x0, len=0x4)
2224@1455310072.319655:vfio_pci_write_config  (0000:00:16.4, @0x30, 0xfffffffe, len=0x4)
2224@1455310072.319667:vfio_pci_read_config  (0000:00:16.4, @0x30, len=0x4) 0
2224@1455310072.319680:vfio_pci_read_config  (0000:00:16.4, @0x34, len=0x1) 50
2224@1455310072.319697:vfio_pci_read_config  (0000:00:16.4, @0x50, len=0x2) 8c01
2224@1455310072.319715:vfio_pci_read_config  (0000:00:16.4, @0x54, len=0x2) 8
2224@1455310072.319727:vfio_pci_write_config  (0000:00:16.4, @0x54, 0x8008, len=0x2)
2224@1455310072.324914:vfio_pci_read_config  (0000:00:16.4, @0x0, len=0x4) 9d3e8086
2224@1455310072.324928:vfio_pci_read_config  (0000:00:16.4, @0x0, len=0x4) 9d3e8086
2224@1455310072.324946:vfio_pci_read_config  (0000:00:16.4, @0x4, len=0x4) 100000
2224@1455310072.324964:vfio_pci_read_config  (0000:00:16.4, @0x8, len=0x4) 7800021
2224@1455310072.324981:vfio_pci_read_config  (0000:00:16.4, @0xc, len=0x4) 0
2224@1455310072.324993:vfio_pci_read_config  (0000:00:16.4, @0x10, len=0x4) 81000004
2224@1455310072.325004:vfio_pci_read_config  (0000:00:16.4, @0x14, len=0x4) 0
2224@1455310072.325016:vfio_pci_read_config  (0000:00:16.4, @0x18, len=0x4) 0
2224@1455310072.325027:vfio_pci_read_config  (0000:00:16.4, @0x1c, len=0x4) 0
2224@1455310072.325039:vfio_pci_read_config  (0000:00:16.4, @0x20, len=0x4) 0
2224@1455310072.325050:vfio_pci_read_config  (0000:00:16.4, @0x24, len=0x4) 0
2224@1455310072.325067:vfio_pci_read_config  (0000:00:16.4, @0x28, len=0x4) 0
2224@1455310072.325088:vfio_pci_read_config  (0000:00:16.4, @0x2c, len=0x4) 0
2224@1455310072.325306:vfio_pci_read_config  (0000:00:16.4, @0x30, len=0x4) 0
2224@1455310072.325327:vfio_pci_read_config  (0000:00:16.4, @0x34, len=0x4) 50
2224@1455310072.325344:vfio_pci_read_config  (0000:00:16.4, @0x38, len=0x4) 0
2224@1455310072.325361:vfio_pci_read_config  (0000:00:16.4, @0x3c, len=0x4) 10b
2224@1455310072.325394:vfio_pci_read_config  (0000:00:16.4, @0x34, len=0x1) 50
2224@1455310072.325412:vfio_pci_read_config  (0000:00:16.4, @0x50, len=0x2) 8c01
2224@1455310072.325424:vfio_pci_read_config  (0000:00:16.4, @0x8c, len=0x2) 5
2224@1455310072.325442:vfio_pci_read_config  (0000:00:16.4, @0x4, len=0x2) 0
2224@1455310072.325454:vfio_pci_write_config  (0000:00:16.4, @0x4, 0x0, len=0x2)
2224@1455310072.325477:vfio_pci_read_config  (0000:00:16.4, @0x10, len=0x4) 81000004
2224@1455310072.325489:vfio_pci_write_config  (0000:00:16.4, @0x10, 0xffffffff, len=0x4)
2224@1455310072.325502:vfio_pci_read_config  (0000:00:16.4, @0x10, len=0x4) fffff004
2224@1455310072.325514:vfio_pci_write_config  (0000:00:16.4, @0x10, 0x81000004, len=0x4)
2224@1455310072.325526:vfio_pci_read_config  (0000:00:16.4, @0x14, len=0x4) 0
2224@1455310072.325538:vfio_pci_write_config  (0000:00:16.4, @0x14, 0xffffffff, len=0x4)
2224@1455310072.325549:vfio_pci_read_config  (0000:00:16.4, @0x14, len=0x4) ffffffff
2224@1455310072.325564:vfio_pci_write_config  (0000:00:16.4, @0x14, 0x0, len=0x4)
2224@1455310072.325577:vfio_pci_read_config  (0000:00:16.4, @0x18, len=0x4) 0
2224@1455310072.325588:vfio_pci_write_config  (0000:00:16.4, @0x18, 0xffffffff, len=0x4)
2224@1455310072.325600:vfio_pci_read_config  (0000:00:16.4, @0x18, len=0x4) 0
2224@1455310072.325612:vfio_pci_write_config  (0000:00:16.4, @0x18, 0x0, len=0x4)
2224@1455310072.325624:vfio_pci_read_config  (0000:00:16.4, @0x1c, len=0x4) 0
2224@1455310072.325636:vfio_pci_write_config  (0000:00:16.4, @0x1c, 0xffffffff, len=0x4)
2224@1455310072.325648:vfio_pci_read_config  (0000:00:16.4, @0x1c, len=0x4) 0
2224@1455310072.325659:vfio_pci_write_config  (0000:00:16.4, @0x1c, 0x0, len=0x4)
2224@1455310072.325671:vfio_pci_read_config  (0000:00:16.4, @0x20, len=0x4) 0
2224@1455310072.325683:vfio_pci_write_config  (0000:00:16.4, @0x20, 0xffffffff, len=0x4)
2224@1455310072.325695:vfio_pci_read_config  (0000:00:16.4, @0x20, len=0x4) 0
2224@1455310072.325707:vfio_pci_write_config  (0000:00:16.4, @0x20, 0x0, len=0x4)
2224@1455310072.325718:vfio_pci_read_config  (0000:00:16.4, @0x24, len=0x4) 0
2224@1455310072.325730:vfio_pci_write_config  (0000:00:16.4, @0x24, 0xffffffff, len=0x4)
2224@1455310072.325742:vfio_pci_read_config  (0000:00:16.4, @0x24, len=0x4) 0
2224@1455310072.325754:vfio_pci_write_config  (0000:00:16.4, @0x24, 0x0, len=0x4)
2224@1455310072.325768:vfio_pci_write_config  (0000:00:16.4, @0x30, 0xfffffffe, len=0x4)
2224@1455310072.325780:vfio_pci_read_config  (0000:00:16.4, @0x30, len=0x4) 0
2224@1455310072.325792:vfio_pci_read_config  (0000:00:16.4, @0x34, len=0x1) 50
2224@1455310072.325810:vfio_pci_read_config  (0000:00:16.4, @0x50, len=0x2) 8c01
2224@1455310072.325827:vfio_pci_read_config  (0000:00:16.4, @0x54, len=0x2) 8
2224@1455310072.325839:vfio_pci_write_config  (0000:00:16.4, @0x54, 0x8008, len=0x2)
2224@1455310072.328586:vfio_listener_region_add_ram region_add [ram] 80000000 - 8000ffff [0x7fc563e00000]
2224@1455310072.332028:vfio_listener_region_del region_del 80000000 - 8000ffff
2224@1455310072.332378:vfio_listener_region_add_ram region_add [ram] 80000000 - 8003ffff [0x7fc563c00000]
2224@1455310072.352968:vfio_listener_region_del region_del 80000000 - 8003ffff
2224@1455310072.353398:vfio_pci_write_config  (0000:00:16.4, @0x10, 0x81000000, len=0x4)
2224@1455310072.353414:vfio_pci_write_config  (0000:00:16.4, @0x14, 0x0, len=0x4)
2224@1455310072.355668:vfio_listener_region_add_ram region_add [ram] 80000000 - 80ffffff [0x7fc570200000]
2224@1455310072.356221:vfio_listener_region_add_skip SKIPPING region_add 81003400 - 8100341f
2224@1455310072.356224:vfio_listener_region_add_skip SKIPPING region_add 81003500 - 81003515
2224@1455310072.356226:vfio_listener_region_add_skip SKIPPING region_add 81003600 - 81003607
2224@1455310072.356807:vfio_listener_region_del region_del 80000000 - 80ffffff
2224@1455310072.357501:vfio_listener_region_del_skip SKIPPING region_del 81003400 - 8100341f
2224@1455310072.357504:vfio_listener_region_del_skip SKIPPING region_del 81003500 - 81003515
2224@1455310072.357505:vfio_listener_region_del_skip SKIPPING region_del 81003600 - 81003607
2224@1455310072.358295:vfio_listener_region_add_skip SKIPPING region_add 81002000 - 8100202f
2224@1455310072.358299:vfio_listener_region_add_skip SKIPPING region_add 81002800 - 81002807
2224@1455310072.359127:vfio_listener_region_del_skip SKIPPING region_del 81002000 - 8100202f
2224@1455310072.359130:vfio_listener_region_del_skip SKIPPING region_del 81002800 - 81002807
2224@1455310072.359630:vfio_pci_read_config  (0000:00:16.4, @0x4, len=0x2) 0
2224@1455310072.359648:vfio_pci_write_config  (0000:00:16.4, @0x4, 0x27, len=0x2)
2224@1455310072.359690:vfio_listener_region_add_skip SKIPPING region_add 81000000 - 81000fff
2224@1455310072.360157:vfio_pci_read_config  (0000:00:16.4, @0x4, len=0x2) 6
2224@1455310072.360171:vfio_pci_write_config  (0000:00:16.4, @0x4, 0x0, len=0x2)
2224@1455310072.360195:vfio_listener_region_del_skip SKIPPING region_del 81000000 - 81000fff
2224@1455310072.360659:vfio_pci_read_config  (0000:00:16.4, @0x4, len=0x2) 0
2224@1455310072.360673:vfio_pci_write_config  (0000:00:16.4, @0x4, 0x10, len=0x2)
2224@1455310072.360702:vfio_pci_read_config  (0000:00:16.4, @0x6, len=0x2) 10
2224@1455310072.360981:vfio_listener_region_add_skip SKIPPING region_add 81001000 - 8100101f
2224@1455310072.360984:vfio_listener_region_add_skip SKIPPING region_add 81001800 - 81001807
2224@1455310072.361873:vfio_listener_region_del_skip SKIPPING region_del 81001000 - 8100101f
2224@1455310072.361882:vfio_listener_region_del_skip SKIPPING region_del 81001800 - 81001807
2224@1455310072.362907:vfio_pci_read_config  (0000:00:16.4, @0x4, len=0x2) 0
2224@1455310072.362970:vfio_pci_write_config  (0000:00:16.4, @0x4, 0x0, len=0x2)
2224@1455310072.392488:vfio_pci_read_config  (0000:00:16.4, @0x34, len=0x1) 50
2224@1455310072.392521:vfio_pci_read_config  (0000:00:16.4, @0x50, len=0x2) 8c01
2224@1455310072.392534:vfio_pci_read_config  (0000:00:16.4, @0x8c, len=0x2) 5
2224@1455310072.392546:vfio_pci_write_config  (0000:00:16.4, @0x3c, 0xff, len=0x1)
2224@1455310074.818112:vfio_pci_read_config  (0000:00:16.4, @0x0, len=0x4) 9d3e8086
2224@1455310074.818142:vfio_pci_read_config  (0000:00:16.4, @0x4, len=0x4) 100000
2224@1455310074.818160:vfio_pci_read_config  (0000:00:16.4, @0x8, len=0x4) 7800021
2224@1455310074.818182:vfio_pci_read_config  (0000:00:16.4, @0xc, len=0x4) 0
2224@1455310074.818200:vfio_pci_read_config  (0000:00:16.4, @0x10, len=0x4) 81000004
2224@1455310074.818216:vfio_pci_read_config  (0000:00:16.4, @0x14, len=0x4) 0
2224@1455310074.818232:vfio_pci_read_config  (0000:00:16.4, @0x18, len=0x4) 0
2224@1455310074.818248:vfio_pci_read_config  (0000:00:16.4, @0x1c, len=0x4) 0
2224@1455310074.818265:vfio_pci_read_config  (0000:00:16.4, @0x20, len=0x4) 0
2224@1455310074.818292:vfio_pci_read_config  (0000:00:16.4, @0x24, len=0x4) 0
2224@1455310074.818311:vfio_pci_read_config  (0000:00:16.4, @0x28, len=0x4) 0
2224@1455310074.818329:vfio_pci_read_config  (0000:00:16.4, @0x2c, len=0x4) 0
2224@1455310074.818341:vfio_pci_read_config  (0000:00:16.4, @0x30, len=0x4) 0
2224@1455310074.818359:vfio_pci_read_config  (0000:00:16.4, @0x34, len=0x4) 50
2224@1455310074.818376:vfio_pci_read_config  (0000:00:16.4, @0x38, len=0x4) 0
2224@1455310074.818394:vfio_pci_read_config  (0000:00:16.4, @0x3c, len=0x4) 1ff
2224@1455310074.818989:vfio_listener_region_add_skip SKIPPING region_add 81001000 - 8100101f
2224@1455310074.818994:vfio_listener_region_add_skip SKIPPING region_add 81001800 - 81001807
2224@1455310074.917991:vfio_listener_region_add_ram region_add [ram] 80000000 - 80ffffff [0x7fc570200000]
2224@1455310074.919131:vfio_listener_region_add_skip SKIPPING region_add 81003400 - 8100341f
2224@1455310074.919140:vfio_listener_region_add_skip SKIPPING region_add 81003500 - 81003515
2224@1455310074.919141:vfio_listener_region_add_skip SKIPPING region_add 81003600 - 81003607
2224@1455310074.921251:vfio_listener_region_del_skip SKIPPING region_del a0000 - bffff
2224@1455310074.921264:vfio_listener_region_add_ram region_add [ram] a0000 - affff [0x7fc570200000]
2224@1455310074.921288:vfio_listener_region_add_skip SKIPPING region_add b0000 - bffff
2224@1455310074.977470:vfio_listener_region_del region_del c0000 - c3fff
2224@1455310074.977501:vfio_listener_region_add_ram region_add [ram] c0000 - c3fff [0x7fc4dbec0000]
2224@1455310074.978156:vfio_listener_region_del region_del c0000 - c3fff
2224@1455310074.978193:vfio_listener_region_add_ram region_add [ram] c0000 - c3fff [0x7fc4dbec0000]
2224@1455310075.040815:vfio_listener_region_add_skip SKIPPING region_add 81002000 - 8100202f
2224@1455310075.040826:vfio_listener_region_add_skip SKIPPING region_add 81002800 - 81002807
2224@1455310075.041927:vfio_pci_read_config  (0000:00:16.4, @0x0, len=0x4) 9d3e8086
2224@1455310075.041946:vfio_pci_read_config  (0000:00:16.4, @0x4, len=0x4) 100000
2224@1455310075.041961:vfio_pci_read_config  (0000:00:16.4, @0x8, len=0x4) 7800021
2224@1455310075.041975:vfio_pci_read_config  (0000:00:16.4, @0xc, len=0x4) 0
2224@1455310075.041988:vfio_pci_read_config  (0000:00:16.4, @0x10, len=0x4) 81000004
2224@1455310075.042000:vfio_pci_read_config  (0000:00:16.4, @0x14, len=0x4) 0
2224@1455310075.042012:vfio_pci_read_config  (0000:00:16.4, @0x18, len=0x4) 0
2224@1455310075.042025:vfio_pci_read_config  (0000:00:16.4, @0x1c, len=0x4) 0
2224@1455310075.042037:vfio_pci_read_config  (0000:00:16.4, @0x20, len=0x4) 0
2224@1455310075.042049:vfio_pci_read_config  (0000:00:16.4, @0x24, len=0x4) 0
2224@1455310075.042063:vfio_pci_read_config  (0000:00:16.4, @0x28, len=0x4) 0
2224@1455310075.042077:vfio_pci_read_config  (0000:00:16.4, @0x2c, len=0x4) 0
2224@1455310075.042090:vfio_pci_read_config  (0000:00:16.4, @0x30, len=0x4) 0
2224@1455310075.042104:vfio_pci_read_config  (0000:00:16.4, @0x34, len=0x4) 50
2224@1455310075.042118:vfio_pci_read_config  (0000:00:16.4, @0x38, len=0x4) 0
2224@1455310075.042132:vfio_pci_read_config  (0000:00:16.4, @0x3c, len=0x4) 1ff
2224@1455310075.042150:vfio_pci_read_config  (0000:00:16.4, @0x4, len=0x2) 0
2224@1455310075.042163:vfio_pci_write_config  (0000:00:16.4, @0x4, 0x6, len=0x2)
2224@1455310075.042196:vfio_listener_region_add_skip SKIPPING region_add 81000000 - 81000fff
2224@1455310075.472352:vfio_listener_region_del region_del a0000 - affff
2224@1455310075.472407:vfio_listener_region_del_skip SKIPPING region_del b0000 - bffff
2224@1455310075.472423:vfio_listener_region_add_skip SKIPPING region_add a0000 - bffff
2224@1455310075.473216:vfio_listener_region_del_skip SKIPPING region_del a0000 - bffff
2224@1455310075.473225:vfio_listener_region_add_ram region_add [ram] a0000 - affff [0x7fc570200000]
2224@1455310075.473243:vfio_listener_region_add_skip SKIPPING region_add b0000 - bffff
2224@1455310075.473952:vfio_listener_region_del region_del a0000 - affff
2224@1455310075.473960:vfio_listener_region_del_skip SKIPPING region_del b0000 - bffff
2224@1455310075.473966:vfio_listener_region_add_skip SKIPPING region_add a0000 - bffff
2224@1455310075.474618:vfio_listener_region_del_skip SKIPPING region_del a0000 - bffff
2224@1455310075.474625:vfio_listener_region_add_ram region_add [ram] a0000 - affff [0x7fc570200000]
2224@1455310075.474652:vfio_listener_region_add_skip SKIPPING region_add b0000 - bffff
2224@1455310075.475463:vfio_listener_region_del region_del a0000 - affff
2224@1455310075.475473:vfio_listener_region_del_skip SKIPPING region_del b0000 - bffff
2224@1455310075.475479:vfio_listener_region_add_skip SKIPPING region_add a0000 - bffff
2224@1455310075.476237:vfio_listener_region_del_skip SKIPPING region_del a0000 - bffff
2224@1455310075.476248:vfio_listener_region_add_ram region_add [ram] a0000 - affff [0x7fc570200000]
2224@1455310075.476264:vfio_listener_region_add_skip SKIPPING region_add b0000 - bffff
2224@1455310076.873596:vfio_pci_read_config  (0000:00:16.4, @0x4, len=0x2) 6
2224@1455310076.873624:vfio_pci_write_config  (0000:00:16.4, @0x4, 0x6, len=0x2)
2224@1455310076.873652:vfio_pci_read_config  (0000:00:16.4, @0x4, len=0x2) 6
2224@1455310076.873690:vfio_pci_write_config  (0000:00:16.4, @0x4, 0x6, len=0x2)
2224@1455310076.873721:vfio_pci_read_config  (0000:00:16.4, @0x0, len=0x4) 9d3e8086
2224@1455310076.873743:vfio_pci_read_config  (0000:00:16.4, @0x8, len=0x4) 7800021
2224@1455310076.873762:vfio_pci_read_config  (0000:00:16.4, @0x3c, len=0x1) ff
2224@1455310076.873780:vfio_pci_read_config  (0000:00:16.4, @0x10, len=0x4) 81000004
2224@1455310076.873797:vfio_pci_read_config  (0000:00:16.4, @0x14, len=0x4) 0
2224@1455310076.873815:vfio_pci_read_config  (0000:00:16.4, @0x18, len=0x4) 0
2224@1455310076.873833:vfio_pci_read_config  (0000:00:16.4, @0x1c, len=0x4) 0
2224@1455310076.873850:vfio_pci_read_config  (0000:00:16.4, @0x20, len=0x4) 0
2224@1455310076.873867:vfio_pci_read_config  (0000:00:16.4, @0x24, len=0x4) 0
2224@1455310076.873891:vfio_pci_read_config  (0000:00:16.4, @0x9, len=0x1) 0
2224@1455310076.873909:vfio_pci_read_config  (0000:00:16.4, @0xa, len=0x1) 80
2224@1455310076.873928:vfio_pci_read_config  (0000:00:16.4, @0xb, len=0x1) 7
2224@1455310076.873949:vfio_pci_read_config  (0000:00:16.4, @0x9, len=0x1) 0
2224@1455310076.873968:vfio_pci_read_config  (0000:00:16.4, @0xa, len=0x1) 80
2224@1455310076.873987:vfio_pci_read_config  (0000:00:16.4, @0xb, len=0x1) 7
2224@1455310076.874008:vfio_pci_read_config  (0000:00:16.4, @0x9, len=0x1) 0
2224@1455310076.874026:vfio_pci_read_config  (0000:00:16.4, @0xa, len=0x1) 80
2224@1455310076.874045:vfio_pci_read_config  (0000:00:16.4, @0xb, len=0x1) 7
2224@1455310076.874069:vfio_pci_read_config  (0000:00:16.4, @0x0, len=0x4) 9d3e8086
2224@1455310076.874087:vfio_pci_read_config  (0000:00:16.4, @0x4, len=0x4) 100006
2224@1455310076.874107:vfio_pci_read_config  (0000:00:16.4, @0x8, len=0x4) 7800021
2224@1455310076.874125:vfio_pci_read_config  (0000:00:16.4, @0xc, len=0x4) 0
2224@1455310076.874142:vfio_pci_read_config  (0000:00:16.4, @0x10, len=0x4) 81000004
2224@1455310076.874159:vfio_pci_read_config  (0000:00:16.4, @0x14, len=0x4) 0
2224@1455310076.874176:vfio_pci_read_config  (0000:00:16.4, @0x18, len=0x4) 0
2224@1455310076.874193:vfio_pci_read_config  (0000:00:16.4, @0x1c, len=0x4) 0
2224@1455310076.874210:vfio_pci_read_config  (0000:00:16.4, @0x20, len=0x4) 0
2224@1455310076.874227:vfio_pci_read_config  (0000:00:16.4, @0x24, len=0x4) 0
2224@1455310076.874246:vfio_pci_read_config  (0000:00:16.4, @0x28, len=0x4) 0
2224@1455310076.874265:vfio_pci_read_config  (0000:00:16.4, @0x2c, len=0x4) 0
2224@1455310076.874282:vfio_pci_read_config  (0000:00:16.4, @0x30, len=0x4) 0
2224@1455310076.874301:vfio_pci_read_config  (0000:00:16.4, @0x34, len=0x4) 50
2224@1455310076.874320:vfio_pci_read_config  (0000:00:16.4, @0x38, len=0x4) 0
2224@1455310076.874338:vfio_pci_read_config  (0000:00:16.4, @0x3c, len=0x4) 1ff
2224@1455310076.874366:vfio_pci_read_config  (0000:00:16.4, @0x0, len=0x4) 9d3e8086
2224@1455310076.874383:vfio_pci_read_config  (0000:00:16.4, @0x4, len=0x4) 100006
2224@1455310076.874403:vfio_pci_read_config  (0000:00:16.4, @0x8, len=0x4) 7800021
2224@1455310076.874422:vfio_pci_read_config  (0000:00:16.4, @0xc, len=0x4) 0
2224@1455310076.874438:vfio_pci_read_config  (0000:00:16.4, @0x10, len=0x4) 81000004
2224@1455310076.874455:vfio_pci_read_config  (0000:00:16.4, @0x14, len=0x4) 0
2224@1455310076.874472:vfio_pci_read_config  (0000:00:16.4, @0x18, len=0x4) 0
2224@1455310076.874489:vfio_pci_read_config  (0000:00:16.4, @0x1c, len=0x4) 0
2224@1455310076.874506:vfio_pci_read_config  (0000:00:16.4, @0x20, len=0x4) 0
2224@1455310076.874523:vfio_pci_read_config  (0000:00:16.4, @0x24, len=0x4) 0
2224@1455310076.874539:vfio_pci_read_config  (0000:00:16.4, @0x28, len=0x4) 0
2224@1455310076.874559:vfio_pci_read_config  (0000:00:16.4, @0x2c, len=0x4) 0
2224@1455310076.874574:vfio_pci_read_config  (0000:00:16.4, @0x30, len=0x4) 0
2224@1455310076.874593:vfio_pci_read_config  (0000:00:16.4, @0x34, len=0x4) 50
2224@1455310076.874612:vfio_pci_read_config  (0000:00:16.4, @0x38, len=0x4) 0
2224@1455310076.874629:vfio_pci_read_config  (0000:00:16.4, @0x3c, len=0x4) 1ff
2224@1455310076.874642:vfio_pci_read_config  (0000:00:16.4, @0x0, len=0x4) 9d3e8086
2224@1455310076.874657:vfio_pci_read_config  (0000:00:16.4, @0x4, len=0x4) 100006
2224@1455310076.874671:vfio_pci_read_config  (0000:00:16.4, @0x8, len=0x4) 7800021
2224@1455310076.874685:vfio_pci_read_config  (0000:00:16.4, @0xc, len=0x4) 0
2224@1455310076.874697:vfio_pci_read_config  (0000:00:16.4, @0x10, len=0x4) 81000004
2224@1455310076.874709:vfio_pci_read_config  (0000:00:16.4, @0x14, len=0x4) 0
2224@1455310076.874721:vfio_pci_read_config  (0000:00:16.4, @0x18, len=0x4) 0
2224@1455310076.874733:vfio_pci_read_config  (0000:00:16.4, @0x1c, len=0x4) 0
2224@1455310076.874745:vfio_pci_read_config  (0000:00:16.4, @0x20, len=0x4) 0
2224@1455310076.874757:vfio_pci_read_config  (0000:00:16.4, @0x24, len=0x4) 0
2224@1455310076.874771:vfio_pci_read_config  (0000:00:16.4, @0x28, len=0x4) 0
2224@1455310076.874785:vfio_pci_read_config  (0000:00:16.4, @0x2c, len=0x4) 0
2224@1455310076.874797:vfio_pci_read_config  (0000:00:16.4, @0x30, len=0x4) 0
2224@1455310076.874811:vfio_pci_read_config  (0000:00:16.4, @0x34, len=0x4) 50
2224@1455310076.874829:vfio_pci_read_config  (0000:00:16.4, @0x38, len=0x4) 0
2224@1455310076.874843:vfio_pci_read_config  (0000:00:16.4, @0x3c, len=0x4) 1ff
2224@1455310076.874860:vfio_pci_read_config  (0000:00:16.4, @0xb, len=0x1) 7
2224@1455310076.874875:vfio_pci_read_config  (0000:00:16.4, @0xa, len=0x1) 80
2224@1455310076.874888:vfio_pci_read_config  (0000:00:16.4, @0x0, len=0x4) 9d3e8086
2224@1455310076.874902:vfio_pci_read_config  (0000:00:16.4, @0x4, len=0x4) 100006
2224@1455310076.874916:vfio_pci_read_config  (0000:00:16.4, @0x8, len=0x4) 7800021
2224@1455310076.874930:vfio_pci_read_config  (0000:00:16.4, @0xc, len=0x4) 0
2224@1455310076.874942:vfio_pci_read_config  (0000:00:16.4, @0x10, len=0x4) 81000004
2224@1455310076.874954:vfio_pci_read_config  (0000:00:16.4, @0x14, len=0x4) 0
2224@1455310076.874966:vfio_pci_read_config  (0000:00:16.4, @0x18, len=0x4) 0
2224@1455310076.874978:vfio_pci_read_config  (0000:00:16.4, @0x1c, len=0x4) 0
2224@1455310076.874990:vfio_pci_read_config  (0000:00:16.4, @0x20, len=0x4) 0
2224@1455310076.875002:vfio_pci_read_config  (0000:00:16.4, @0x24, len=0x4) 0
2224@1455310076.875016:vfio_pci_read_config  (0000:00:16.4, @0x28, len=0x4) 0
2224@1455310076.875030:vfio_pci_read_config  (0000:00:16.4, @0x2c, len=0x4) 0
2224@1455310076.875042:vfio_pci_read_config  (0000:00:16.4, @0x30, len=0x4) 0
2224@1455310076.875056:vfio_pci_read_config  (0000:00:16.4, @0x34, len=0x4) 50
2224@1455310076.875070:vfio_pci_read_config  (0000:00:16.4, @0x38, len=0x4) 0
2224@1455310076.875084:vfio_pci_read_config  (0000:00:16.4, @0x3c, len=0x4) 1ff
2224@1455310076.933042:vfio_pci_read_config  (0000:00:16.4, @0x4, len=0x2) 6
2224@1455310076.933063:vfio_pci_write_config  (0000:00:16.4, @0x4, 0x6, len=0x2)
2224@1455310076.933087:vfio_pci_read_config  (0000:00:16.4, @0x4, len=0x2) 6
2224@1455310076.933105:vfio_pci_write_config  (0000:00:16.4, @0x4, 0x6, len=0x2)
2224@1455310076.933130:vfio_pci_read_config  (0000:00:16.4, @0x0, len=0x4) 9d3e8086
2224@1455310076.933151:vfio_pci_read_config  (0000:00:16.4, @0x8, len=0x4) 7800021
2224@1455310076.933168:vfio_pci_read_config  (0000:00:16.4, @0x3c, len=0x1) ff
2224@1455310076.933185:vfio_pci_read_config  (0000:00:16.4, @0x10, len=0x4) 81000004
2224@1455310076.933203:vfio_pci_read_config  (0000:00:16.4, @0x14, len=0x4) 0
2224@1455310076.933222:vfio_pci_read_config  (0000:00:16.4, @0x18, len=0x4) 0
2224@1455310076.933255:vfio_pci_read_config  (0000:00:16.4, @0x1c, len=0x4) 0
2224@1455310076.933269:vfio_pci_read_config  (0000:00:16.4, @0x20, len=0x4) 0
2224@1455310076.933287:vfio_pci_read_config  (0000:00:16.4, @0x24, len=0x4) 0
2224@1455310076.933307:vfio_pci_read_config  (0000:00:16.4, @0x9, len=0x1) 0
2224@1455310076.933326:vfio_pci_read_config  (0000:00:16.4, @0xa, len=0x1) 80
2224@1455310076.933345:vfio_pci_read_config  (0000:00:16.4, @0xb, len=0x1) 7
2224@1455310076.933366:vfio_pci_read_config  (0000:00:16.4, @0x9, len=0x1) 0
2224@1455310076.933385:vfio_pci_read_config  (0000:00:16.4, @0xa, len=0x1) 80
2224@1455310076.933404:vfio_pci_read_config  (0000:00:16.4, @0xb, len=0x1) 7
2224@1455310076.933425:vfio_pci_read_config  (0000:00:16.4, @0x9, len=0x1) 0
2224@1455310076.933443:vfio_pci_read_config  (0000:00:16.4, @0xa, len=0x1) 80
2224@1455310076.933462:vfio_pci_read_config  (0000:00:16.4, @0xb, len=0x1) 7
2224@1455310076.933482:vfio_pci_read_config  (0000:00:16.4, @0x0, len=0x4) 9d3e8086
2224@1455310076.933500:vfio_pci_read_config  (0000:00:16.4, @0x4, len=0x4) 100006
2224@1455310076.933520:vfio_pci_read_config  (0000:00:16.4, @0x8, len=0x4) 7800021
2224@1455310076.933538:vfio_pci_read_config  (0000:00:16.4, @0xc, len=0x4) 0
2224@1455310076.933555:vfio_pci_read_config  (0000:00:16.4, @0x10, len=0x4) 81000004
2224@1455310076.933572:vfio_pci_read_config  (0000:00:16.4, @0x14, len=0x4) 0
2224@1455310076.933589:vfio_pci_read_config  (0000:00:16.4, @0x18, len=0x4) 0
2224@1455310076.933606:vfio_pci_read_config  (0000:00:16.4, @0x1c, len=0x4) 0
2224@1455310076.933623:vfio_pci_read_config  (0000:00:16.4, @0x20, len=0x4) 0
2224@1455310076.933640:vfio_pci_read_config  (0000:00:16.4, @0x24, len=0x4) 0
2224@1455310076.933659:vfio_pci_read_config  (0000:00:16.4, @0x28, len=0x4) 0
2224@1455310076.933677:vfio_pci_read_config  (0000:00:16.4, @0x2c, len=0x4) 0
2224@1455310076.933693:vfio_pci_read_config  (0000:00:16.4, @0x30, len=0x4) 0
2224@1455310076.933713:vfio_pci_read_config  (0000:00:16.4, @0x34, len=0x4) 50
2224@1455310076.933731:vfio_pci_read_config  (0000:00:16.4, @0x38, len=0x4) 0
2224@1455310076.933750:vfio_pci_read_config  (0000:00:16.4, @0x3c, len=0x4) 1ff
2224@1455310076.933769:vfio_pci_read_config  (0000:00:16.4, @0x0, len=0x4) 9d3e8086
2224@1455310076.933787:vfio_pci_read_config  (0000:00:16.4, @0x4, len=0x4) 100006
2224@1455310076.933806:vfio_pci_read_config  (0000:00:16.4, @0x8, len=0x4) 7800021
2224@1455310076.933825:vfio_pci_read_config  (0000:00:16.4, @0xc, len=0x4) 0
2224@1455310076.933842:vfio_pci_read_config  (0000:00:16.4, @0x10, len=0x4) 81000004
2224@1455310076.933859:vfio_pci_read_config  (0000:00:16.4, @0x14, len=0x4) 0
2224@1455310076.933879:vfio_pci_read_config  (0000:00:16.4, @0x18, len=0x4) 0
2224@1455310076.933896:vfio_pci_read_config  (0000:00:16.4, @0x1c, len=0x4) 0
2224@1455310076.933913:vfio_pci_read_config  (0000:00:16.4, @0x20, len=0x4) 0
2224@1455310076.933930:vfio_pci_read_config  (0000:00:16.4, @0x24, len=0x4) 0
2224@1455310076.933949:vfio_pci_read_config  (0000:00:16.4, @0x28, len=0x4) 0
2224@1455310076.933968:vfio_pci_read_config  (0000:00:16.4, @0x2c, len=0x4) 0
2224@1455310076.933984:vfio_pci_read_config  (0000:00:16.4, @0x30, len=0x4) 0
2224@1455310076.934003:vfio_pci_read_config  (0000:00:16.4, @0x34, len=0x4) 50
2224@1455310076.934022:vfio_pci_read_config  (0000:00:16.4, @0x38, len=0x4) 0
2224@1455310076.934038:vfio_pci_read_config  (0000:00:16.4, @0x3c, len=0x4) 1ff
2224@1455310076.934052:vfio_pci_read_config  (0000:00:16.4, @0x0, len=0x4) 9d3e8086
2224@1455310076.934066:vfio_pci_read_config  (0000:00:16.4, @0x4, len=0x4) 100006
2224@1455310076.934080:vfio_pci_read_config  (0000:00:16.4, @0x8, len=0x4) 7800021
2224@1455310076.934094:vfio_pci_read_config  (0000:00:16.4, @0xc, len=0x4) 0
2224@1455310076.934106:vfio_pci_read_config  (0000:00:16.4, @0x10, len=0x4) 81000004
2224@1455310076.934118:vfio_pci_read_config  (0000:00:16.4, @0x14, len=0x4) 0
2224@1455310076.934130:vfio_pci_read_config  (0000:00:16.4, @0x18, len=0x4) 0
2224@1455310076.934142:vfio_pci_read_config  (0000:00:16.4, @0x1c, len=0x4) 0
2224@1455310076.934154:vfio_pci_read_config  (0000:00:16.4, @0x20, len=0x4) 0
2224@1455310076.934166:vfio_pci_read_config  (0000:00:16.4, @0x24, len=0x4) 0
2224@1455310076.934180:vfio_pci_read_config  (0000:00:16.4, @0x28, len=0x4) 0
2224@1455310076.934194:vfio_pci_read_config  (0000:00:16.4, @0x2c, len=0x4) 0
2224@1455310076.934206:vfio_pci_read_config  (0000:00:16.4, @0x30, len=0x4) 0
2224@1455310076.934220:vfio_pci_read_config  (0000:00:16.4, @0x34, len=0x4) 50
2224@1455310076.934235:vfio_pci_read_config  (0000:00:16.4, @0x38, len=0x4) 0
2224@1455310076.934249:vfio_pci_read_config  (0000:00:16.4, @0x3c, len=0x4) 1ff
2224@1455310076.934265:vfio_pci_read_config  (0000:00:16.4, @0xb, len=0x1) 7
2224@1455310076.934280:vfio_pci_read_config  (0000:00:16.4, @0xa, len=0x1) 80
2224@1455310076.934293:vfio_pci_read_config  (0000:00:16.4, @0x0, len=0x4) 9d3e8086
2224@1455310076.934307:vfio_pci_read_config  (0000:00:16.4, @0x4, len=0x4) 100006
2224@1455310076.934321:vfio_pci_read_config  (0000:00:16.4, @0x8, len=0x4) 7800021
2224@1455310076.934335:vfio_pci_read_config  (0000:00:16.4, @0xc, len=0x4) 0
2224@1455310076.934354:vfio_pci_read_config  (0000:00:16.4, @0x10, len=0x4) 81000004
2224@1455310076.934367:vfio_pci_read_config  (0000:00:16.4, @0x14, len=0x4) 0
2224@1455310076.934379:vfio_pci_read_config  (0000:00:16.4, @0x18, len=0x4) 0
2224@1455310076.934391:vfio_pci_read_config  (0000:00:16.4, @0x1c, len=0x4) 0
2224@1455310076.934403:vfio_pci_read_config  (0000:00:16.4, @0x20, len=0x4) 0
2224@1455310076.934415:vfio_pci_read_config  (0000:00:16.4, @0x24, len=0x4) 0
2224@1455310076.934429:vfio_pci_read_config  (0000:00:16.4, @0x28, len=0x4) 0
2224@1455310076.934443:vfio_pci_read_config  (0000:00:16.4, @0x2c, len=0x4) 0
2224@1455310076.934455:vfio_pci_read_config  (0000:00:16.4, @0x30, len=0x4) 0
2224@1455310076.934469:vfio_pci_read_config  (0000:00:16.4, @0x34, len=0x4) 50
2224@1455310076.934483:vfio_pci_read_config  (0000:00:16.4, @0x38, len=0x4) 0
2224@1455310076.934500:vfio_pci_read_config  (0000:00:16.4, @0x3c, len=0x4) 1ff
2224@1455310077.474872:vfio_intx_update  (0000:00:16.4) IRQ moved -1 -> 10
2224@1455310077.474942:vfio_intx_enable_kvm  (0000:00:16.4) KVM INTx accel enabled
2224@1455310077.475994:vfio_pci_read_config  (0000:00:16.4, @0x0, len=0x4) 9d3e8086
2224@1455310077.476018:vfio_pci_read_config  (0000:00:16.4, @0x4, len=0x4) 100006
2224@1455310077.476043:vfio_pci_read_config  (0000:00:16.4, @0x8, len=0x4) 7800021
2224@1455310077.476067:vfio_pci_read_config  (0000:00:16.4, @0xc, len=0x4) 0
2224@1455310077.476084:vfio_pci_read_config  (0000:00:16.4, @0x10, len=0x4) 81000004
2224@1455310077.476116:vfio_pci_read_config  (0000:00:16.4, @0x14, len=0x4) 0
2224@1455310077.476134:vfio_pci_read_config  (0000:00:16.4, @0x18, len=0x4) 0
2224@1455310077.476153:vfio_pci_read_config  (0000:00:16.4, @0x1c, len=0x4) 0
2224@1455310077.476173:vfio_pci_read_config  (0000:00:16.4, @0x20, len=0x4) 0
2224@1455310077.476194:vfio_pci_read_config  (0000:00:16.4, @0x24, len=0x4) 0
2224@1455310077.476218:vfio_pci_read_config  (0000:00:16.4, @0x28, len=0x4) 0
2224@1455310077.476241:vfio_pci_read_config  (0000:00:16.4, @0x2c, len=0x4) 0
2224@1455310077.476258:vfio_pci_read_config  (0000:00:16.4, @0x30, len=0x4) 0
2224@1455310077.476281:vfio_pci_read_config  (0000:00:16.4, @0x34, len=0x4) 50
2224@1455310077.476304:vfio_pci_read_config  (0000:00:16.4, @0x38, len=0x4) 0
2224@1455310077.476327:vfio_pci_read_config  (0000:00:16.4, @0x3c, len=0x4) 1ff
2224@1455310077.476351:vfio_pci_write_config  (0000:00:16.4, @0x3c, 0xb, len=0x1)
2224@1455310077.554192:vfio_pci_read_config  (0000:00:16.4, @0x4, len=0x2) 6
2224@1455310077.554215:vfio_pci_write_config  (0000:00:16.4, @0x4, 0x6, len=0x2)
2224@1455310077.554253:vfio_pci_read_config  (0000:00:16.4, @0x4, len=0x2) 6
2224@1455310077.554272:vfio_pci_write_config  (0000:00:16.4, @0x4, 0x6, len=0x2)
2224@1455310077.554314:vfio_pci_read_config  (0000:00:16.4, @0x0, len=0x4) 9d3e8086
2224@1455310077.554336:vfio_pci_read_config  (0000:00:16.4, @0x8, len=0x4) 7800021
2224@1455310077.554358:vfio_pci_read_config  (0000:00:16.4, @0x3c, len=0x1) b
2224@1455310077.554378:vfio_pci_read_config  (0000:00:16.4, @0x10, len=0x4) 81000004
2224@1455310077.554393:vfio_pci_read_config  (0000:00:16.4, @0x14, len=0x4) 0
2224@1455310077.554411:vfio_pci_read_config  (0000:00:16.4, @0x18, len=0x4) 0
2224@1455310077.554489:vfio_pci_read_config  (0000:00:16.4, @0x1c, len=0x4) 0
2224@1455310077.554506:vfio_pci_read_config  (0000:00:16.4, @0x20, len=0x4) 0
2224@1455310077.554524:vfio_pci_read_config  (0000:00:16.4, @0x24, len=0x4) 0
2224@1455310077.554562:vfio_pci_read_config  (0000:00:16.4, @0x9, len=0x1) 0
2224@1455310077.554584:vfio_pci_read_config  (0000:00:16.4, @0xa, len=0x1) 80
2224@1455310077.554607:vfio_pci_read_config  (0000:00:16.4, @0xb, len=0x1) 7
2224@1455310077.554632:vfio_pci_read_config  (0000:00:16.4, @0x9, len=0x1) 0
2224@1455310077.554655:vfio_pci_read_config  (0000:00:16.4, @0xa, len=0x1) 80
2224@1455310077.554677:vfio_pci_read_config  (0000:00:16.4, @0xb, len=0x1) 7
2224@1455310077.554702:vfio_pci_read_config  (0000:00:16.4, @0x9, len=0x1) 0
2224@1455310077.554724:vfio_pci_read_config  (0000:00:16.4, @0xa, len=0x1) 80
2224@1455310077.554747:vfio_pci_read_config  (0000:00:16.4, @0xb, len=0x1) 7
2224@1455310077.554768:vfio_pci_read_config  (0000:00:16.4, @0x0, len=0x4) 9d3e8086
2224@1455310077.554790:vfio_pci_read_config  (0000:00:16.4, @0x4, len=0x4) 100006
2224@1455310077.554813:vfio_pci_read_config  (0000:00:16.4, @0x8, len=0x4) 7800021
2224@1455310077.554836:vfio_pci_read_config  (0000:00:16.4, @0xc, len=0x4) 0
2224@1455310077.554853:vfio_pci_read_config  (0000:00:16.4, @0x10, len=0x4) 81000004
2224@1455310077.554871:vfio_pci_read_config  (0000:00:16.4, @0x14, len=0x4) 0
2224@1455310077.554888:vfio_pci_read_config  (0000:00:16.4, @0x18, len=0x4) 0
2224@1455310077.554905:vfio_pci_read_config  (0000:00:16.4, @0x1c, len=0x4) 0
2224@1455310077.554923:vfio_pci_read_config  (0000:00:16.4, @0x20, len=0x4) 0
2224@1455310077.554946:vfio_pci_read_config  (0000:00:16.4, @0x24, len=0x4) 0
2224@1455310077.554969:vfio_pci_read_config  (0000:00:16.4, @0x28, len=0x4) 0
2224@1455310077.554992:vfio_pci_read_config  (0000:00:16.4, @0x2c, len=0x4) 0
2224@1455310077.555008:vfio_pci_read_config  (0000:00:16.4, @0x30, len=0x4) 0
2224@1455310077.555031:vfio_pci_read_config  (0000:00:16.4, @0x34, len=0x4) 50
2224@1455310077.555054:vfio_pci_read_config  (0000:00:16.4, @0x38, len=0x4) 0
2224@1455310077.555077:vfio_pci_read_config  (0000:00:16.4, @0x3c, len=0x4) 10b
2224@1455310077.555096:vfio_pci_read_config  (0000:00:16.4, @0x0, len=0x4) 9d3e8086
2224@1455310077.555118:vfio_pci_read_config  (0000:00:16.4, @0x4, len=0x4) 100006
2224@1455310077.555141:vfio_pci_read_config  (0000:00:16.4, @0x8, len=0x4) 7800021
2224@1455310077.555166:vfio_pci_read_config  (0000:00:16.4, @0xc, len=0x4) 0
2224@1455310077.555199:vfio_pci_read_config  (0000:00:16.4, @0x10, len=0x4) 81000004
2224@1455310077.555216:vfio_pci_read_config  (0000:00:16.4, @0x14, len=0x4) 0
2224@1455310077.555233:vfio_pci_read_config  (0000:00:16.4, @0x18, len=0x4) 0
2224@1455310077.555249:vfio_pci_read_config  (0000:00:16.4, @0x1c, len=0x4) 0
2224@1455310077.555265:vfio_pci_read_config  (0000:00:16.4, @0x20, len=0x4) 0
2224@1455310077.555280:vfio_pci_read_config  (0000:00:16.4, @0x24, len=0x4) 0
2224@1455310077.555302:vfio_pci_read_config  (0000:00:16.4, @0x28, len=0x4) 0
2224@1455310077.555324:vfio_pci_read_config  (0000:00:16.4, @0x2c, len=0x4) 0
2224@1455310077.555341:vfio_pci_read_config  (0000:00:16.4, @0x30, len=0x4) 0
2224@1455310077.555362:vfio_pci_read_config  (0000:00:16.4, @0x34, len=0x4) 50
2224@1455310077.555384:vfio_pci_read_config  (0000:00:16.4, @0x38, len=0x4) 0
2224@1455310077.555405:vfio_pci_read_config  (0000:00:16.4, @0x3c, len=0x4) 10b
2224@1455310077.555423:vfio_pci_read_config  (0000:00:16.4, @0x0, len=0x4) 9d3e8086
2224@1455310077.555444:vfio_pci_read_config  (0000:00:16.4, @0x4, len=0x4) 100006
2224@1455310077.555466:vfio_pci_read_config  (0000:00:16.4, @0x8, len=0x4) 7800021
2224@1455310077.555487:vfio_pci_read_config  (0000:00:16.4, @0xc, len=0x4) 0
2224@1455310077.555503:vfio_pci_read_config  (0000:00:16.4, @0x10, len=0x4) 81000004
2224@1455310077.555520:vfio_pci_read_config  (0000:00:16.4, @0x14, len=0x4) 0
2224@1455310077.555536:vfio_pci_read_config  (0000:00:16.4, @0x18, len=0x4) 0
2224@1455310077.555552:vfio_pci_read_config  (0000:00:16.4, @0x1c, len=0x4) 0
2224@1455310077.555568:vfio_pci_read_config  (0000:00:16.4, @0x20, len=0x4) 0
2224@1455310077.555583:vfio_pci_read_config  (0000:00:16.4, @0x24, len=0x4) 0
2224@1455310077.555604:vfio_pci_read_config  (0000:00:16.4, @0x28, len=0x4) 0
2224@1455310077.555626:vfio_pci_read_config  (0000:00:16.4, @0x2c, len=0x4) 0
2224@1455310077.555643:vfio_pci_read_config  (0000:00:16.4, @0x30, len=0x4) 0
2224@1455310077.555665:vfio_pci_read_config  (0000:00:16.4, @0x34, len=0x4) 50
2224@1455310077.555686:vfio_pci_read_config  (0000:00:16.4, @0x38, len=0x4) 0
2224@1455310077.555708:vfio_pci_read_config  (0000:00:16.4, @0x3c, len=0x4) 10b
2224@1455310077.555734:vfio_pci_read_config  (0000:00:16.4, @0xb, len=0x1) 7
2224@1455310077.555756:vfio_pci_read_config  (0000:00:16.4, @0xa, len=0x1) 80
2224@1455310077.555774:vfio_pci_read_config  (0000:00:16.4, @0x0, len=0x4) 9d3e8086
2224@1455310077.555795:vfio_pci_read_config  (0000:00:16.4, @0x4, len=0x4) 100006
2224@1455310077.555817:vfio_pci_read_config  (0000:00:16.4, @0x8, len=0x4) 7800021
2224@1455310077.555839:vfio_pci_read_config  (0000:00:16.4, @0xc, len=0x4) 0
2224@1455310077.555854:vfio_pci_read_config  (0000:00:16.4, @0x10, len=0x4) 81000004
2224@1455310077.555870:vfio_pci_read_config  (0000:00:16.4, @0x14, len=0x4) 0
2224@1455310077.555885:vfio_pci_read_config  (0000:00:16.4, @0x18, len=0x4) 0
2224@1455310077.555901:vfio_pci_read_config  (0000:00:16.4, @0x1c, len=0x4) 0
2224@1455310077.555917:vfio_pci_read_config  (0000:00:16.4, @0x20, len=0x4) 0
2224@1455310077.555932:vfio_pci_read_config  (0000:00:16.4, @0x24, len=0x4) 0
2224@1455310077.555954:vfio_pci_read_config  (0000:00:16.4, @0x28, len=0x4) 0
2224@1455310077.555975:vfio_pci_read_config  (0000:00:16.4, @0x2c, len=0x4) 0
2224@1455310077.555991:vfio_pci_read_config  (0000:00:16.4, @0x30, len=0x4) 0
2224@1455310077.556012:vfio_pci_read_config  (0000:00:16.4, @0x34, len=0x4) 50
2224@1455310077.556034:vfio_pci_read_config  (0000:00:16.4, @0x38, len=0x4) 0
2224@1455310077.556056:vfio_pci_read_config  (0000:00:16.4, @0x3c, len=0x4) 10b
2224@1455310078.096112:vfio_pci_read_config  (0000:00:16.4, @0x4, len=0x2) 6
2224@1455310078.096140:vfio_pci_write_config  (0000:00:16.4, @0x4, 0x6, len=0x2)
2224@1455310078.096174:vfio_pci_read_config  (0000:00:16.4, @0x4, len=0x2) 6
2224@1455310078.096192:vfio_pci_write_config  (0000:00:16.4, @0x4, 0x6, len=0x2)
2224@1455310078.096238:vfio_pci_read_config  (0000:00:16.4, @0x0, len=0x4) 9d3e8086
2224@1455310078.096259:vfio_pci_read_config  (0000:00:16.4, @0x8, len=0x4) 7800021
2224@1455310078.096286:vfio_pci_read_config  (0000:00:16.4, @0x3c, len=0x1) b
2224@1455310078.096307:vfio_pci_read_config  (0000:00:16.4, @0x10, len=0x4) 81000004
2224@1455310078.096326:vfio_pci_read_config  (0000:00:16.4, @0x14, len=0x4) 0
2224@1455310078.096346:vfio_pci_read_config  (0000:00:16.4, @0x18, len=0x4) 0
2224@1455310078.096364:vfio_pci_read_config  (0000:00:16.4, @0x1c, len=0x4) 0
2224@1455310078.096381:vfio_pci_read_config  (0000:00:16.4, @0x20, len=0x4) 0
2224@1455310078.096397:vfio_pci_read_config  (0000:00:16.4, @0x24, len=0x4) 0
2224@1455310078.096422:vfio_pci_read_config  (0000:00:16.4, @0x9, len=0x1) 0
2224@1455310078.096441:vfio_pci_read_config  (0000:00:16.4, @0xa, len=0x1) 80
2224@1455310078.096459:vfio_pci_read_config  (0000:00:16.4, @0xb, len=0x1) 7
2224@1455310078.096478:vfio_pci_read_config  (0000:00:16.4, @0x9, len=0x1) 0
2224@1455310078.096496:vfio_pci_read_config  (0000:00:16.4, @0xa, len=0x1) 80
2224@1455310078.096514:vfio_pci_read_config  (0000:00:16.4, @0xb, len=0x1) 7
2224@1455310078.096534:vfio_pci_read_config  (0000:00:16.4, @0x9, len=0x1) 0
2224@1455310078.096552:vfio_pci_read_config  (0000:00:16.4, @0xa, len=0x1) 80
2224@1455310078.096570:vfio_pci_read_config  (0000:00:16.4, @0xb, len=0x1) 7
2224@1455310078.096588:vfio_pci_read_config  (0000:00:16.4, @0x0, len=0x4) 9d3e8086
2224@1455310078.096608:vfio_pci_read_config  (0000:00:16.4, @0x4, len=0x4) 100006
2224@1455310078.096627:vfio_pci_read_config  (0000:00:16.4, @0x8, len=0x4) 7800021
2224@1455310078.096645:vfio_pci_read_config  (0000:00:16.4, @0xc, len=0x4) 0
2224@1455310078.096661:vfio_pci_read_config  (0000:00:16.4, @0x10, len=0x4) 81000004
2224@1455310078.096677:vfio_pci_read_config  (0000:00:16.4, @0x14, len=0x4) 0
2224@1455310078.096692:vfio_pci_read_config  (0000:00:16.4, @0x18, len=0x4) 0
2224@1455310078.096708:vfio_pci_read_config  (0000:00:16.4, @0x1c, len=0x4) 0
2224@1455310078.096724:vfio_pci_read_config  (0000:00:16.4, @0x20, len=0x4) 0
2224@1455310078.096740:vfio_pci_read_config  (0000:00:16.4, @0x24, len=0x4) 0
2224@1455310078.096758:vfio_pci_read_config  (0000:00:16.4, @0x28, len=0x4) 0
2224@1455310078.096775:vfio_pci_read_config  (0000:00:16.4, @0x2c, len=0x4) 0
2224@1455310078.096792:vfio_pci_read_config  (0000:00:16.4, @0x30, len=0x4) 0
2224@1455310078.096809:vfio_pci_read_config  (0000:00:16.4, @0x34, len=0x4) 50
2224@1455310078.096827:vfio_pci_read_config  (0000:00:16.4, @0x38, len=0x4) 0
2224@1455310078.096845:vfio_pci_read_config  (0000:00:16.4, @0x3c, len=0x4) 10b
2224@1455310078.096862:vfio_pci_read_config  (0000:00:16.4, @0x0, len=0x4) 9d3e8086
2224@1455310078.096880:vfio_pci_read_config  (0000:00:16.4, @0x4, len=0x4) 100006
2224@1455310078.096898:vfio_pci_read_config  (0000:00:16.4, @0x8, len=0x4) 7800021
2224@1455310078.096916:vfio_pci_read_config  (0000:00:16.4, @0xc, len=0x4) 0
2224@1455310078.096935:vfio_pci_read_config  (0000:00:16.4, @0x10, len=0x4) 81000004
2224@1455310078.096951:vfio_pci_read_config  (0000:00:16.4, @0x14, len=0x4) 0
2224@1455310078.096967:vfio_pci_read_config  (0000:00:16.4, @0x18, len=0x4) 0
2224@1455310078.096983:vfio_pci_read_config  (0000:00:16.4, @0x1c, len=0x4) 0
2224@1455310078.096998:vfio_pci_read_config  (0000:00:16.4, @0x20, len=0x4) 0
2224@1455310078.097014:vfio_pci_read_config  (0000:00:16.4, @0x24, len=0x4) 0
2224@1455310078.097032:vfio_pci_read_config  (0000:00:16.4, @0x28, len=0x4) 0
2224@1455310078.097049:vfio_pci_read_config  (0000:00:16.4, @0x2c, len=0x4) 0
2224@1455310078.097068:vfio_pci_read_config  (0000:00:16.4, @0x30, len=0x4) 0
2224@1455310078.097085:vfio_pci_read_config  (0000:00:16.4, @0x34, len=0x4) 50
2224@1455310078.097103:vfio_pci_read_config  (0000:00:16.4, @0x38, len=0x4) 0
2224@1455310078.097121:vfio_pci_read_config  (0000:00:16.4, @0x3c, len=0x4) 10b
2224@1455310078.097138:vfio_pci_read_config  (0000:00:16.4, @0x0, len=0x4) 9d3e8086
2224@1455310078.097156:vfio_pci_read_config  (0000:00:16.4, @0x4, len=0x4) 100006
2224@1455310078.097173:vfio_pci_read_config  (0000:00:16.4, @0x8, len=0x4) 7800021
2224@1455310078.097191:vfio_pci_read_config  (0000:00:16.4, @0xc, len=0x4) 0
2224@1455310078.097207:vfio_pci_read_config  (0000:00:16.4, @0x10, len=0x4) 81000004
2224@1455310078.097222:vfio_pci_read_config  (0000:00:16.4, @0x14, len=0x4) 0
2224@1455310078.097238:vfio_pci_read_config  (0000:00:16.4, @0x18, len=0x4) 0
2224@1455310078.097253:vfio_pci_read_config  (0000:00:16.4, @0x1c, len=0x4) 0
2224@1455310078.097269:vfio_pci_read_config  (0000:00:16.4, @0x20, len=0x4) 0
2224@1455310078.097284:vfio_pci_read_config  (0000:00:16.4, @0x24, len=0x4) 0
2224@1455310078.097302:vfio_pci_read_config  (0000:00:16.4, @0x28, len=0x4) 0
2224@1455310078.097319:vfio_pci_read_config  (0000:00:16.4, @0x2c, len=0x4) 0
2224@1455310078.097335:vfio_pci_read_config  (0000:00:16.4, @0x30, len=0x4) 0
2224@1455310078.097353:vfio_pci_read_config  (0000:00:16.4, @0x34, len=0x4) 50
2224@1455310078.097370:vfio_pci_read_config  (0000:00:16.4, @0x38, len=0x4) 0
2224@1455310078.097388:vfio_pci_read_config  (0000:00:16.4, @0x3c, len=0x4) 10b
2224@1455310078.097409:vfio_pci_read_config  (0000:00:16.4, @0xb, len=0x1) 7
2224@1455310078.097427:vfio_pci_read_config  (0000:00:16.4, @0xa, len=0x1) 80
2224@1455310078.097450:vfio_pci_read_config  (0000:00:16.4, @0x0, len=0x4) 9d3e8086
2224@1455310078.097470:vfio_pci_read_config  (0000:00:16.4, @0x4, len=0x4) 100006
2224@1455310078.097488:vfio_pci_read_config  (0000:00:16.4, @0x8, len=0x4) 7800021
2224@1455310078.097506:vfio_pci_read_config  (0000:00:16.4, @0xc, len=0x4) 0
2224@1455310078.097522:vfio_pci_read_config  (0000:00:16.4, @0x10, len=0x4) 81000004
2224@1455310078.097538:vfio_pci_read_config  (0000:00:16.4, @0x14, len=0x4) 0
2224@1455310078.097554:vfio_pci_read_config  (0000:00:16.4, @0x18, len=0x4) 0
2224@1455310078.097569:vfio_pci_read_config  (0000:00:16.4, @0x1c, len=0x4) 0
2224@1455310078.097584:vfio_pci_read_config  (0000:00:16.4, @0x20, len=0x4) 0
2224@1455310078.097600:vfio_pci_read_config  (0000:00:16.4, @0x24, len=0x4) 0
2224@1455310078.097618:vfio_pci_read_config  (0000:00:16.4, @0x28, len=0x4) 0
2224@1455310078.097635:vfio_pci_read_config  (0000:00:16.4, @0x2c, len=0x4) 0
2224@1455310078.097651:vfio_pci_read_config  (0000:00:16.4, @0x30, len=0x4) 0
2224@1455310078.097669:vfio_pci_read_config  (0000:00:16.4, @0x34, len=0x4) 50
2224@1455310078.097694:vfio_pci_read_config  (0000:00:16.4, @0x38, len=0x4) 0
2224@1455310078.097712:vfio_pci_read_config  (0000:00:16.4, @0x3c, len=0x4) 10b
2224@1455310083.006109:vfio_pci_read_config  (0000:00:16.4, @0x0, len=0x2) 8086
2224@1455310083.006133:vfio_pci_read_config  (0000:00:16.4, @0x0, len=0x4) 9d3e8086
2224@1455310083.006146:vfio_pci_read_config  (0000:00:16.4, @0x4, len=0x4) 100006
2224@1455310083.006157:vfio_pci_read_config  (0000:00:16.4, @0x8, len=0x4) 7800021
2224@1455310083.006169:vfio_pci_read_config  (0000:00:16.4, @0xc, len=0x4) 0
2224@1455310083.693869:vfio_pci_read_config  (0000:00:16.4, @0x0, len=0x4) 9d3e8086
2224@1455310083.693902:vfio_pci_read_config  (0000:00:16.4, @0x4, len=0x4) 100006
2224@1455310083.693915:vfio_pci_read_config  (0000:00:16.4, @0x8, len=0x4) 7800021
2224@1455310083.693926:vfio_pci_read_config  (0000:00:16.4, @0xc, len=0x4) 0
2224@1455310083.693948:vfio_pci_read_config  (0000:00:16.4, @0x10, len=0x4) 81000004
2224@1455310083.693960:vfio_pci_read_config  (0000:00:16.4, @0x14, len=0x4) 0
2224@1455310083.693968:vfio_pci_read_config  (0000:00:16.4, @0x18, len=0x4) 0
2224@1455310083.693975:vfio_pci_read_config  (0000:00:16.4, @0x1c, len=0x4) 0
2224@1455310083.693983:vfio_pci_read_config  (0000:00:16.4, @0x20, len=0x4) 0
2224@1455310083.693991:vfio_pci_read_config  (0000:00:16.4, @0x24, len=0x4) 0
2224@1455310083.694004:vfio_pci_read_config  (0000:00:16.4, @0x28, len=0x4) 0
2224@1455310083.694015:vfio_pci_read_config  (0000:00:16.4, @0x2c, len=0x4) 0
2224@1455310083.694023:vfio_pci_read_config  (0000:00:16.4, @0x30, len=0x4) 0
2224@1455310083.694038:vfio_pci_read_config  (0000:00:16.4, @0x34, len=0x4) 50
2224@1455310083.694052:vfio_pci_read_config  (0000:00:16.4, @0x38, len=0x4) 0
2224@1455310083.694065:vfio_pci_read_config  (0000:00:16.4, @0x3c, len=0x4) 10b
2224@1455310083.694075:vfio_pci_read_config  (0000:00:16.4, @0x0, len=0x4) 9d3e8086
2224@1455310083.694089:vfio_pci_read_config  (0000:00:16.4, @0x4, len=0x4) 100006
2224@1455310083.694102:vfio_pci_read_config  (0000:00:16.4, @0x8, len=0x4) 7800021
2224@1455310083.694113:vfio_pci_read_config  (0000:00:16.4, @0xc, len=0x4) 0
2224@1455310083.694121:vfio_pci_read_config  (0000:00:16.4, @0x10, len=0x4) 81000004
2224@1455310083.694128:vfio_pci_read_config  (0000:00:16.4, @0x14, len=0x4) 0
2224@1455310083.694136:vfio_pci_read_config  (0000:00:16.4, @0x18, len=0x4) 0
2224@1455310083.694143:vfio_pci_read_config  (0000:00:16.4, @0x1c, len=0x4) 0
2224@1455310083.694150:vfio_pci_read_config  (0000:00:16.4, @0x20, len=0x4) 0
2224@1455310083.694158:vfio_pci_read_config  (0000:00:16.4, @0x24, len=0x4) 0
2224@1455310083.694171:vfio_pci_read_config  (0000:00:16.4, @0x28, len=0x4) 0
2224@1455310083.694182:vfio_pci_read_config  (0000:00:16.4, @0x2c, len=0x4) 0
2224@1455310083.694190:vfio_pci_read_config  (0000:00:16.4, @0x30, len=0x4) 0
2224@1455310083.694203:vfio_pci_read_config  (0000:00:16.4, @0x34, len=0x4) 50
2224@1455310083.694216:vfio_pci_read_config  (0000:00:16.4, @0x38, len=0x4) 0
2224@1455310083.694227:vfio_pci_read_config  (0000:00:16.4, @0x3c, len=0x4) 10b
2224@1455310083.702724:vfio_intx_update  (0000:00:16.4) IRQ moved 10 -> -1
2224@1455310083.702798:vfio_intx_disable_kvm  (0000:00:16.4) KVM INTx accel disabled
2224@1455310083.714282:vfio_pci_read_config  (0000:00:16.4, @0x0, len=0x4) 9d3e8086
2224@1455310083.714306:vfio_pci_read_config  (0000:00:16.4, @0x4, len=0x4) 100006
2224@1455310083.714319:vfio_pci_read_config  (0000:00:16.4, @0x8, len=0x4) 7800021
2224@1455310083.714358:vfio_pci_read_config  (0000:00:16.4, @0xc, len=0x4) 0
2224@1455310083.714365:vfio_pci_read_config  (0000:00:16.4, @0x10, len=0x4) 81000004
2224@1455310083.714372:vfio_pci_read_config  (0000:00:16.4, @0x14, len=0x4) 0
2224@1455310083.714378:vfio_pci_read_config  (0000:00:16.4, @0x18, len=0x4) 0
2224@1455310083.714386:vfio_pci_read_config  (0000:00:16.4, @0x1c, len=0x4) 0
2224@1455310083.714392:vfio_pci_read_config  (0000:00:16.4, @0x20, len=0x4) 0
2224@1455310083.714399:vfio_pci_read_config  (0000:00:16.4, @0x24, len=0x4) 0
2224@1455310083.714412:vfio_pci_read_config  (0000:00:16.4, @0x28, len=0x4) 0
2224@1455310083.714423:vfio_pci_read_config  (0000:00:16.4, @0x2c, len=0x4) 0
2224@1455310083.714431:vfio_pci_read_config  (0000:00:16.4, @0x30, len=0x4) 0
2224@1455310083.714444:vfio_pci_read_config  (0000:00:16.4, @0x34, len=0x4) 50
2224@1455310083.714457:vfio_pci_read_config  (0000:00:16.4, @0x38, len=0x4) 0
2224@1455310083.714468:vfio_pci_read_config  (0000:00:16.4, @0x3c, len=0x4) 10b
2224@1455310083.733397:vfio_listener_region_del region_del 80000000 - 80ffffff
2224@1455310083.734969:vfio_listener_region_del_skip SKIPPING region_del 81003400 - 8100341f
2224@1455310083.734979:vfio_listener_region_del_skip SKIPPING region_del 81003500 - 81003515
2224@1455310083.734981:vfio_listener_region_del_skip SKIPPING region_del 81003600 - 81003607
2224@1455310083.737044:vfio_listener_region_add_ram region_add [ram] 80000000 - 80ffffff [0x7fc570200000]
2224@1455310083.738279:vfio_listener_region_add_skip SKIPPING region_add 81003400 - 8100341f
2224@1455310083.738285:vfio_listener_region_add_skip SKIPPING region_add 81003500 - 81003515
2224@1455310083.738287:vfio_listener_region_add_skip SKIPPING region_add 81003600 - 81003607
2224@1455310083.742595:vfio_listener_region_del_skip SKIPPING region_del 81002000 - 8100202f
2224@1455310083.742614:vfio_listener_region_del_skip SKIPPING region_del 81002800 - 81002807
2224@1455310083.746279:vfio_listener_region_add_skip SKIPPING region_add 81002000 - 8100202f
2224@1455310083.746288:vfio_listener_region_add_skip SKIPPING region_add 81002800 - 81002807
2224@1455310083.748295:vfio_pci_read_config  (0000:00:16.4, @0x0, len=0x2) 8086
2224@1455310083.748314:vfio_pci_read_config  (0000:00:16.4, @0x2, len=0x2) 9d3e
2224@1455310083.748338:vfio_pci_read_config  (0000:00:16.4, @0x8, len=0x1) 21
2224@1455310083.748357:vfio_pci_read_config  (0000:00:16.4, @0x9, len=0x1) 0
2224@1455310083.748376:vfio_pci_read_config  (0000:00:16.4, @0xa, len=0x1) 80
2224@1455310083.748394:vfio_pci_read_config  (0000:00:16.4, @0xb, len=0x1) 7
2224@1455310083.748413:vfio_pci_read_config  (0000:00:16.4, @0xe, len=0x1) 0
2224@1455310083.748432:vfio_pci_read_config  (0000:00:16.4, @0x2c, len=0x2) 0
2224@1455310083.748450:vfio_pci_read_config  (0000:00:16.4, @0x2e, len=0x2) 0
2224@1455310083.748540:vfio_pci_read_config  (0000:00:16.4, @0x6, len=0x2) 10
2224@1455310083.748554:vfio_pci_read_config  (0000:00:16.4, @0x34, len=0x1) 50
2224@1455310083.748573:vfio_pci_read_config  (0000:00:16.4, @0x50, len=0x2) 8c01
2224@1455310083.748585:vfio_pci_read_config  (0000:00:16.4, @0x8c, len=0x2) 5
2224@1455310083.748605:vfio_pci_read_config  (0000:00:16.4, @0x4, len=0x2) 6
2224@1455310083.748618:vfio_pci_read_config  (0000:00:16.4, @0x10, len=0x4) 81000004
2224@1455310083.748628:vfio_pci_read_config  (0000:00:16.4, @0x14, len=0x4) 0
2224@1455310083.748637:vfio_pci_read_config  (0000:00:16.4, @0x18, len=0x4) 0
2224@1455310083.748646:vfio_pci_read_config  (0000:00:16.4, @0x1c, len=0x4) 0
2224@1455310083.748656:vfio_pci_read_config  (0000:00:16.4, @0x20, len=0x4) 0
2224@1455310083.748665:vfio_pci_read_config  (0000:00:16.4, @0x24, len=0x4) 0
2224@1455310083.748682:vfio_pci_read_config  (0000:00:16.4, @0x30, len=0x4) 0
2224@1455310083.749136:vfio_pci_read_config  (0000:00:16.4, @0x4, len=0x2) 6
2224@1455310083.749159:vfio_pci_read_config  (0000:00:16.4, @0x50, len=0x4) 40038c01
2224@1455310083.749173:vfio_pci_read_config  (0000:00:16.4, @0x54, len=0x4) 8
2224@1455310083.749193:vfio_pci_read_config  (0000:00:16.4, @0x6, len=0x2) 10
2224@1455310083.749211:vfio_pci_read_config  (0000:00:16.4, @0x4, len=0x2) 6
2224@1455310083.749230:vfio_pci_read_config  (0000:00:16.4, @0xc, len=0x1) 0
2224@1455310083.749265:vfio_pci_read_config  (0000:00:16.4, @0xd, len=0x1) 0
2224@1455310083.749282:vfio_pci_read_config  (0000:00:16.4, @0x3c, len=0x1) b
2224@1455310083.749295:vfio_pci_read_config  (0000:00:16.4, @0x3d, len=0x1) 1
2224@1455310083.749308:vfio_pci_read_config  (0000:00:16.4, @0x0, len=0x4) 9d3e8086
2224@1455310083.749324:vfio_pci_read_config  (0000:00:16.4, @0x4, len=0x4) 100006
2224@1455310083.749340:vfio_pci_read_config  (0000:00:16.4, @0x8, len=0x4) 7800021
2224@1455310083.749354:vfio_pci_read_config  (0000:00:16.4, @0xc, len=0x4) 0
2224@1455310083.749364:vfio_pci_read_config  (0000:00:16.4, @0x10, len=0x4) 81000004
2224@1455310083.749374:vfio_pci_read_config  (0000:00:16.4, @0x14, len=0x4) 0
2224@1455310083.749382:vfio_pci_read_config  (0000:00:16.4, @0x18, len=0x4) 0
2224@1455310083.749391:vfio_pci_read_config  (0000:00:16.4, @0x1c, len=0x4) 0
2224@1455310083.749401:vfio_pci_read_config  (0000:00:16.4, @0x20, len=0x4) 0
2224@1455310083.749410:vfio_pci_read_config  (0000:00:16.4, @0x24, len=0x4) 0
2224@1455310083.749425:vfio_pci_read_config  (0000:00:16.4, @0x28, len=0x4) 0
2224@1455310083.749441:vfio_pci_read_config  (0000:00:16.4, @0x2c, len=0x4) 0
2224@1455310083.749451:vfio_pci_read_config  (0000:00:16.4, @0x30, len=0x4) 0
2224@1455310083.749466:vfio_pci_read_config  (0000:00:16.4, @0x34, len=0x4) 50
2224@1455310083.749481:vfio_pci_read_config  (0000:00:16.4, @0x38, len=0x4) 0
2224@1455310083.749497:vfio_pci_read_config  (0000:00:16.4, @0x3c, len=0x4) 10b
2224@1455310083.749552:vfio_pci_read_config  (0000:00:16.4, @0x54, len=0x2) 8
2224@1455310083.749573:vfio_pci_read_config  (0000:00:16.4, @0x4, len=0x2) 6
2224@1455310083.749585:vfio_pci_write_config  (0000:00:16.4, @0x4, 0x400, len=0x2)
2224@1455310083.749662:vfio_listener_region_del_skip SKIPPING region_del 81000000 - 81000fff
2224@1455310083.753809:vfio_pci_read_config  (0000:00:16.4, @0x10, len=0x4) 81000004
2224@1455310083.753878:vfio_pci_read_config  (0000:00:16.4, @0x14, len=0x4) 0
2224@1455310083.753895:vfio_pci_read_config  (0000:00:16.4, @0x18, len=0x4) 0
2224@1455310083.753913:vfio_pci_read_config  (0000:00:16.4, @0x1c, len=0x4) 0
2224@1455310083.753927:vfio_pci_read_config  (0000:00:16.4, @0x20, len=0x4) 0
2224@1455310083.753942:vfio_pci_read_config  (0000:00:16.4, @0x24, len=0x4) 0
2224@1455310083.753972:vfio_pci_write_config  (0000:00:16.4, @0x10, 0xffffffff, len=0x4)
2224@1455310083.753993:vfio_pci_write_config  (0000:00:16.4, @0x14, 0xffffffff, len=0x4)
2224@1455310083.754012:vfio_pci_write_config  (0000:00:16.4, @0x18, 0xffffffff, len=0x4)
2224@1455310083.754032:vfio_pci_write_config  (0000:00:16.4, @0x1c, 0xffffffff, len=0x4)
2224@1455310083.754405:vfio_pci_write_config  (0000:00:16.4, @0x20, 0xffffffff, len=0x4)
2224@1455310083.754498:vfio_pci_write_config  (0000:00:16.4, @0x24, 0xffffffff, len=0x4)
2224@1455310083.754878:vfio_pci_read_config  (0000:00:16.4, @0x10, len=0x4) fffff004
2224@1455310083.754942:vfio_pci_read_config  (0000:00:16.4, @0x14, len=0x4) ffffffff
2224@1455310083.754969:vfio_pci_read_config  (0000:00:16.4, @0x18, len=0x4) 0
2224@1455310083.754994:vfio_pci_read_config  (0000:00:16.4, @0x1c, len=0x4) 0
2224@1455310083.755011:vfio_pci_read_config  (0000:00:16.4, @0x20, len=0x4) 0
2224@1455310083.755052:vfio_pci_read_config  (0000:00:16.4, @0x24, len=0x4) 0
2224@1455310083.755096:vfio_pci_write_config  (0000:00:16.4, @0x10, 0x81000004, len=0x4)
2224@1455310083.755120:vfio_pci_write_config  (0000:00:16.4, @0x14, 0x0, len=0x4)
2224@1455310083.755137:vfio_pci_write_config  (0000:00:16.4, @0x18, 0x0, len=0x4)
2224@1455310083.755157:vfio_pci_write_config  (0000:00:16.4, @0x1c, 0x0, len=0x4)
2224@1455310083.755182:vfio_pci_write_config  (0000:00:16.4, @0x20, 0x0, len=0x4)
2224@1455310083.755204:vfio_pci_write_config  (0000:00:16.4, @0x24, 0x0, len=0x4)
2224@1455310083.755251:vfio_pci_read_config  (0000:00:16.4, @0x30, len=0x4) 0
2224@1455310083.755295:vfio_pci_write_config  (0000:00:16.4, @0x30, 0xffffffff, len=0x4)
2224@1455310083.755344:vfio_pci_read_config  (0000:00:16.4, @0x30, len=0x4) 0
2224@1455310083.755385:vfio_pci_write_config  (0000:00:16.4, @0x30, 0x0, len=0x4)
2224@1455310083.757024:vfio_pci_write_config  (0000:00:16.4, @0x4, 0x6, len=0x2)
2224@1455310083.757229:vfio_listener_region_add_skip SKIPPING region_add 81000000 - 81000fff
2224@1455310083.759533:vfio_pci_read_config  (0000:00:16.4, @0x8e, len=0x2) 80
2224@1455310083.759567:vfio_pci_read_config  (0000:00:16.4, @0x8e, len=0x2) 80
2224@1455310083.759580:vfio_pci_write_config  (0000:00:16.4, @0x8e, 0x80, len=0x2)
2224@1455310083.759638:vfio_pci_read_config  (0000:00:16.4, @0x4, len=0x2) 6
2224@1455310083.759657:vfio_pci_read_config  (0000:00:16.4, @0x10, len=0x4) 81000004
2224@1455310083.759668:vfio_pci_read_config  (0000:00:16.4, @0x14, len=0x4) 0
2224@1455310083.759680:vfio_pci_read_config  (0000:00:16.4, @0x18, len=0x4) 0
2224@1455310083.759688:vfio_pci_read_config  (0000:00:16.4, @0x1c, len=0x4) 0
2224@1455310083.759697:vfio_pci_read_config  (0000:00:16.4, @0x20, len=0x4) 0
2224@1455310083.759705:vfio_pci_read_config  (0000:00:16.4, @0x24, len=0x4) 0
2224@1455310083.759718:vfio_pci_read_config  (0000:00:16.4, @0x30, len=0x4) 0
2224@1455310083.762900:vfio_listener_region_del_skip SKIPPING region_del 81001000 - 8100101f
2224@1455310083.762917:vfio_listener_region_del_skip SKIPPING region_del 81001800 - 81001807
2224@1455310083.766631:vfio_listener_region_add_skip SKIPPING region_add 81001000 - 8100101f
2224@1455310083.766686:vfio_listener_region_add_skip SKIPPING region_add 81001800 - 81001807
2224@1455310083.773282:vfio_pci_read_config  (0000:00:16.4, @0x0, len=0x2) 8086
2224@1455310083.773343:vfio_pci_read_config  (0000:00:16.4, @0x2, len=0x2) 9d3e
2224@1455310083.773363:vfio_pci_read_config  (0000:00:16.4, @0x4, len=0x2) 6
2224@1455310083.773383:vfio_pci_read_config  (0000:00:16.4, @0x6, len=0x2) 10
2224@1455310083.773403:vfio_pci_read_config  (0000:00:16.4, @0x8, len=0x2) 21
2224@1455310083.773421:vfio_pci_read_config  (0000:00:16.4, @0xa, len=0x2) 780
2224@1455310083.773436:vfio_pci_read_config  (0000:00:16.4, @0xc, len=0x2) 0
2224@1455310083.773452:vfio_pci_read_config  (0000:00:16.4, @0xe, len=0x2) 0
2224@1455310083.773464:vfio_pci_read_config  (0000:00:16.4, @0x10, len=0x2) 4
2224@1455310083.773476:vfio_pci_read_config  (0000:00:16.4, @0x12, len=0x2) 8100
2224@1455310083.773488:vfio_pci_read_config  (0000:00:16.4, @0x14, len=0x2) 0
2224@1455310083.773499:vfio_pci_read_config  (0000:00:16.4, @0x16, len=0x2) 0
2224@1455310083.773510:vfio_pci_read_config  (0000:00:16.4, @0x18, len=0x2) 0
2224@1455310083.786324:vfio_pci_read_config  (0000:00:16.4, @0x0, len=0x2) 8086
2224@1455310083.786409:vfio_pci_read_config  (0000:00:16.4, @0x2, len=0x2) 9d3e
2224@1455310083.786453:vfio_pci_read_config  (0000:00:16.4, @0x8, len=0x1) 21
2224@1455310083.786487:vfio_pci_read_config  (0000:00:16.4, @0x9, len=0x1) 0
2224@1455310083.786520:vfio_pci_read_config  (0000:00:16.4, @0xa, len=0x1) 80
2224@1455310083.786552:vfio_pci_read_config  (0000:00:16.4, @0xb, len=0x1) 7
2224@1455310083.786594:vfio_pci_read_config  (0000:00:16.4, @0xe, len=0x1) 0
2224@1455310083.786636:vfio_pci_read_config  (0000:00:16.4, @0x2c, len=0x2) 0
2224@1455310083.786692:vfio_pci_read_config  (0000:00:16.4, @0x2e, len=0x2) 0
2224@1455310083.786733:vfio_pci_read_config  (0000:00:16.4, @0x4, len=0x2) 6
2224@1455310083.786771:vfio_pci_read_config  (0000:00:16.4, @0x10, len=0x4) 81000004
2224@1455310083.786802:vfio_pci_read_config  (0000:00:16.4, @0x14, len=0x4) 0
2224@1455310083.786831:vfio_pci_read_config  (0000:00:16.4, @0x18, len=0x4) 0
2224@1455310083.786856:vfio_pci_read_config  (0000:00:16.4, @0x1c, len=0x4) 0
2224@1455310083.786907:vfio_pci_read_config  (0000:00:16.4, @0x20, len=0x4) 0
2224@1455310083.786932:vfio_pci_read_config  (0000:00:16.4, @0x24, len=0x4) 0
2224@1455310083.786962:vfio_pci_read_config  (0000:00:16.4, @0x30, len=0x4) 0
2224@1455310083.786998:vfio_pci_read_config  (0000:00:16.4, @0x4, len=0x2) 6


#
# Windows boot
#

2224@1455310085.863099:vfio_listener_region_del_skip SKIPPING region_del 81001000 - 8100101f
2224@1455310085.863132:vfio_listener_region_del_skip SKIPPING region_del 81001800 - 81001807
2224@1455310085.870080:vfio_listener_region_add_skip SKIPPING region_add 81001000 - 8100101f
2224@1455310085.870107:vfio_listener_region_add_skip SKIPPING region_add 81001800 - 81001807
2224@1455310087.195244:vfio_pci_read_config  (0000:00:16.4, @0x0, len=0x4) 9d3e8086
2224@1455310087.195268:vfio_pci_read_config  (0000:00:16.4, @0x4, len=0x4) 100006
2224@1455310087.195278:vfio_pci_read_config  (0000:00:16.4, @0x8, len=0x4) 7800021
2224@1455310087.195287:vfio_pci_read_config  (0000:00:16.4, @0xc, len=0x4) 0
2224@1455310087.195294:vfio_pci_read_config  (0000:00:16.4, @0x10, len=0x4) 81000004
2224@1455310087.195302:vfio_pci_read_config  (0000:00:16.4, @0x14, len=0x4) 0
2224@1455310087.195311:vfio_pci_read_config  (0000:00:16.4, @0x18, len=0x4) 0
2224@1455310087.195320:vfio_pci_read_config  (0000:00:16.4, @0x1c, len=0x4) 0
2224@1455310087.195330:vfio_pci_read_config  (0000:00:16.4, @0x20, len=0x4) 0
2224@1455310087.195341:vfio_pci_read_config  (0000:00:16.4, @0x24, len=0x4) 0
2224@1455310087.195353:vfio_pci_read_config  (0000:00:16.4, @0x28, len=0x4) 0
2224@1455310087.195363:vfio_pci_read_config  (0000:00:16.4, @0x2c, len=0x4) 0
2224@1455310087.195372:vfio_pci_read_config  (0000:00:16.4, @0x30, len=0x4) 0
2224@1455310087.195413:vfio_pci_read_config  (0000:00:16.4, @0x34, len=0x4) 50
2224@1455310087.195424:vfio_pci_read_config  (0000:00:16.4, @0x38, len=0x4) 0
2224@1455310087.195433:vfio_pci_read_config  (0000:00:16.4, @0x3c, len=0x4) 10b
2224@1455310087.196728:vfio_pci_read_config  (0000:00:16.4, @0x0, len=0x4) 9d3e8086
2224@1455310087.196746:vfio_pci_read_config  (0000:00:16.4, @0x4, len=0x4) 100006
2224@1455310087.196757:vfio_pci_read_config  (0000:00:16.4, @0x8, len=0x4) 7800021
2224@1455310087.196766:vfio_pci_read_config  (0000:00:16.4, @0xc, len=0x4) 0
2224@1455310087.196773:vfio_pci_read_config  (0000:00:16.4, @0x10, len=0x4) 81000004
2224@1455310087.196782:vfio_pci_read_config  (0000:00:16.4, @0x14, len=0x4) 0
2224@1455310087.196789:vfio_pci_read_config  (0000:00:16.4, @0x18, len=0x4) 0
2224@1455310087.196796:vfio_pci_read_config  (0000:00:16.4, @0x1c, len=0x4) 0
2224@1455310087.196802:vfio_pci_read_config  (0000:00:16.4, @0x20, len=0x4) 0
2224@1455310087.196808:vfio_pci_read_config  (0000:00:16.4, @0x24, len=0x4) 0
2224@1455310087.196817:vfio_pci_read_config  (0000:00:16.4, @0x28, len=0x4) 0
2224@1455310087.196845:vfio_pci_read_config  (0000:00:16.4, @0x2c, len=0x4) 0
2224@1455310087.196855:vfio_pci_read_config  (0000:00:16.4, @0x30, len=0x4) 0
2224@1455310087.196864:vfio_pci_read_config  (0000:00:16.4, @0x34, len=0x4) 50
2224@1455310087.196872:vfio_pci_read_config  (0000:00:16.4, @0x38, len=0x4) 0
2224@1455310087.196881:vfio_pci_read_config  (0000:00:16.4, @0x3c, len=0x4) 10b
2224@1455310087.197093:vfio_intx_update  (0000:00:16.4) IRQ moved -1 -> 5
2224@1455310087.197130:vfio_intx_enable_kvm  (0000:00:16.4) KVM INTx accel enabled
2224@1455310087.197189:vfio_pci_write_config  (0000:00:16.4, @0x3c, 0x5, len=0x1)
2224@1455310087.199140:vfio_pci_write_config  (0000:00:16.4, @0x3c, 0x5, len=0x1)
2224@1455310087.199664:vfio_pci_write_config  (0000:00:16.4, @0x3c, 0x5, len=0x1)
2224@1455310087.200000:vfio_pci_write_config  (0000:00:16.4, @0x3c, 0x5, len=0x1)
2224@1455310087.200624:vfio_pci_write_config  (0000:00:16.4, @0x3c, 0x5, len=0x1)
2224@1455310087.200964:vfio_pci_write_config  (0000:00:16.4, @0x3c, 0x5, len=0x1)
2224@1455310087.201251:vfio_pci_write_config  (0000:00:16.4, @0x3c, 0x5, len=0x1)
2224@1455310087.405245:vfio_listener_region_del region_del 80000000 - 80ffffff
2224@1455310087.406712:vfio_listener_region_del_skip SKIPPING region_del 81003400 - 8100341f
2224@1455310087.406718:vfio_listener_region_del_skip SKIPPING region_del 81003500 - 81003515
2224@1455310087.406719:vfio_listener_region_del_skip SKIPPING region_del 81003600 - 81003607
2224@1455310087.408562:vfio_listener_region_add_ram region_add [ram] 80000000 - 80ffffff [0x7fc570200000]
2224@1455310087.409912:vfio_listener_region_add_skip SKIPPING region_add 81003400 - 8100341f
2224@1455310087.409917:vfio_listener_region_add_skip SKIPPING region_add 81003500 - 81003515
2224@1455310087.409919:vfio_listener_region_add_skip SKIPPING region_add 81003600 - 81003607
2224@1455310087.413517:vfio_listener_region_del_skip SKIPPING region_del 81002000 - 8100202f
2224@1455310087.413527:vfio_listener_region_del_skip SKIPPING region_del 81002800 - 81002807
2224@1455310087.415427:vfio_listener_region_add_skip SKIPPING region_add 81002000 - 8100202f
2224@1455310087.415434:vfio_listener_region_add_skip SKIPPING region_add 81002800 - 81002807
2224@1455310087.419030:vfio_pci_read_config  (0000:00:16.4, @0x0, len=0x2) 8086
2224@1455310087.419053:vfio_pci_read_config  (0000:00:16.4, @0x2, len=0x2) 9d3e
2224@1455310087.419617:vfio_pci_read_config  (0000:00:16.4, @0x8, len=0x1) 21
2224@1455310087.419640:vfio_pci_read_config  (0000:00:16.4, @0x9, len=0x1) 0
2224@1455310087.419656:vfio_pci_read_config  (0000:00:16.4, @0xa, len=0x1) 80
2224@1455310087.419673:vfio_pci_read_config  (0000:00:16.4, @0xb, len=0x1) 7
2224@1455310087.419691:vfio_pci_read_config  (0000:00:16.4, @0xe, len=0x1) 0
2224@1455310087.419711:vfio_pci_read_config  (0000:00:16.4, @0x2c, len=0x2) 0
2224@1455310087.419729:vfio_pci_read_config  (0000:00:16.4, @0x2e, len=0x2) 0
2224@1455310087.419749:vfio_pci_read_config  (0000:00:16.4, @0x50, len=0x4) 40038c01
2224@1455310087.419763:vfio_pci_read_config  (0000:00:16.4, @0x54, len=0x4) 8
2224@1455310087.419778:vfio_pci_write_config  (0000:00:16.4, @0x54, 0x8, len=0x2)
2224@1455310087.456876:vfio_pci_read_config  (0000:00:16.4, @0x54, len=0x2) 8
2224@1455310087.456956:vfio_pci_read_config  (0000:00:16.4, @0x4, len=0x2) 6
2224@1455310087.456969:vfio_pci_write_config  (0000:00:16.4, @0x4, 0x400, len=0x2)
2224@1455310087.457012:vfio_listener_region_del_skip SKIPPING region_del 81000000 - 81000fff
2224@1455310087.458299:vfio_pci_write_config  (0000:00:16.4, @0x10, 0x81000000, len=0x4)
2224@1455310087.458314:vfio_pci_write_config  (0000:00:16.4, @0x14, 0x0, len=0x4)
2224@1455310087.458322:vfio_pci_write_config  (0000:00:16.4, @0x18, 0x0, len=0x4)
2224@1455310087.458329:vfio_pci_write_config  (0000:00:16.4, @0x1c, 0x0, len=0x4)
2224@1455310087.458338:vfio_pci_write_config  (0000:00:16.4, @0x20, 0x0, len=0x4)
2224@1455310087.458346:vfio_pci_write_config  (0000:00:16.4, @0x24, 0x0, len=0x4)
2224@1455310087.458387:vfio_pci_write_config  (0000:00:16.4, @0x30, 0x0, len=0x4)
2224@1455310087.458398:vfio_pci_write_config  (0000:00:16.4, @0x3c, 0x5, len=0x1)
2224@1455310087.458412:vfio_pci_write_config  (0000:00:16.4, @0xc, 0x0, len=0x1)
2224@1455310087.458465:vfio_pci_write_config  (0000:00:16.4, @0xd, 0x0, len=0x1)
2224@1455310087.458490:vfio_pci_write_config  (0000:00:16.4, @0x4, 0x400, len=0x2)
2224@1455310087.458521:vfio_pci_read_config  (0000:00:16.4, @0x4, len=0x2) 400
2224@1455310087.458584:vfio_pci_write_config  (0000:00:16.4, @0x4, 0x406, len=0x2)
2224@1455310087.458635:vfio_listener_region_add_skip SKIPPING region_add 81000000 - 81000fff
2224@1455310087.460056:vfio_pci_write_config  (0000:00:16.4, @0x6, 0xf900, len=0x2)
2224@1455310087.460082:vfio_pci_read_config  (0000:00:16.4, @0x4, len=0x2) 406
2224@1455310087.460096:vfio_pci_write_config  (0000:00:16.4, @0x4, 0x406, len=0x2)
2224@1455310087.460120:vfio_pci_read_config  (0000:00:16.4, @0x8e, len=0x2) 80
2224@1455310087.460166:vfio_pci_write_config  (0000:00:16.4, @0x8e, 0x80, len=0x2)
2224@1455310087.460188:vfio_pci_read_config  (0000:00:16.4, @0x4, len=0x2) 406
2224@1455310087.460236:vfio_pci_write_config  (0000:00:16.4, @0x4, 0x6, len=0x2)
2224@1455310087.460539:vfio_region_read  (0000:00:16.4:region0+0xc, 4) = 0x80303009
2224@1455310087.544913:vfio_region_read  (0000:00:16.4:region0+0x800, 4) = 0x0
2224@1455310087.544936:vfio_region_read  (0000:00:16.4:region0+0x4, 4) = 0x806a6a09
2224@1455310087.545033:vfio_region_write  (0000:00:16.4:region0+0x4, 0x806a6a09, 4)
2224@1455310087.545081:vfio_region_read  (0000:00:16.4:region0+0x4, 4) = 0x806a6a09
2224@1455310087.545106:vfio_region_read  (0000:00:16.4:region0+0x4, 4) = 0x806a6a09
2224@1455310087.545129:vfio_region_write  (0000:00:16.4:region0+0x4, 0x806a6a1f, 4)
2224@1455310087.545940:vfio_region_read  (0000:00:16.4:region0+0x4, 4) = 0x80000013
2224@1455310087.545979:vfio_region_write  (0000:00:16.4:region0+0x4, 0x80000012, 4)
2224@1455310087.545990:vfio_region_read  (0000:00:16.4:region0+0x4, 4) = 0x80000010
2224@1455310087.545998:vfio_region_read  (0000:00:16.4:region0+0xc, 4) = 0x80000009
2224@1455310087.546101:vfio_region_read  (0000:00:16.4:region0+0x800, 4) = 0x0
2224@1455310087.546113:vfio_region_read  (0000:00:16.4:region0+0x4, 4) = 0x80000010
2224@1455310087.546118:vfio_region_write  (0000:00:16.4:region0+0x4, 0x8000000c, 4)
2224@1455310087.546132:vfio_region_read  (0000:00:16.4:region0+0x4, 4) = 0x80000008
2224@1455310087.546137:vfio_region_write  (0000:00:16.4:region0+0x4, 0x80000009, 4)
2224@1455310087.546144:vfio_region_read  (0000:00:16.4:region0+0x4, 4) = 0x80000009
2224@1455310087.546237:vfio_region_read  (0000:00:16.4:region0+0x800, 4) = 0x0
2224@1455310087.546284:vfio_region_read  (0000:00:16.4:region0+0xc, 4) = 0x80000009
2224@1455310087.546293:vfio_region_read  (0000:00:16.4:region0+0x4, 4) = 0x80000009
2224@1455310087.546300:vfio_region_read  (0000:00:16.4:region0+0xc, 4) = 0x80000009
2224@1455310087.546307:vfio_region_read  (0000:00:16.4:region0+0x4, 4) = 0x80000009
2224@1455310087.546326:vfio_region_write  (0000:00:16.4:region0+0x0, 0x80040000, 4)
2224@1455310087.546334:vfio_region_write  (0000:00:16.4:region0+0x0, 0x1000001, 4)
2224@1455310087.546341:vfio_region_read  (0000:00:16.4:region0+0x4, 4) = 0x80020009
2224@1455310087.546346:vfio_region_write  (0000:00:16.4:region0+0x4, 0x8002000d, 4)
2224@1455310087.546352:vfio_region_read  (0000:00:16.4:region0+0xc, 4) = 0x8000000b
2224@1455310087.546832:vfio_region_read  (0000:00:16.4:region0+0x4, 4) = 0x8002020b
2224@1455310087.546854:vfio_region_write  (0000:00:16.4:region0+0x4, 0x8002020a, 4)
2224@1455310087.546866:vfio_region_read  (0000:00:16.4:region0+0x4, 4) = 0x80020208
2224@1455310087.546878:vfio_region_read  (0000:00:16.4:region0+0xc, 4) = 0x80020009
2224@1455310087.547031:vfio_region_read  (0000:00:16.4:region0+0x800, 4) = 0x0
2224@1455310087.547041:vfio_region_read  (0000:00:16.4:region0+0xc, 4) = 0x80020009
2224@1455310087.547050:vfio_region_read  (0000:00:16.4:region0+0x4, 4) = 0x80020208
2224@1455310087.547061:vfio_region_read  (0000:00:16.4:region0+0x8, 4) = 0x80040000
2224@1455310087.547071:vfio_region_read  (0000:00:16.4:region0+0x8, 4) = 0x2000181
2224@1455310087.547081:vfio_region_read  (0000:00:16.4:region0+0xc, 4) = 0x80020209
2224@1455310087.547092:vfio_region_read  (0000:00:16.4:region0+0x4, 4) = 0x80020208
2224@1455310087.547101:vfio_region_write  (0000:00:16.4:region0+0x4, 0x8002020c, 4)
2224@1455310087.547124:vfio_region_read  (0000:00:16.4:region0+0xc, 4) = 0x8002020b
2224@1455310087.547134:vfio_region_read  (0000:00:16.4:region0+0x4, 4) = 0x80020208
2224@1455310087.547142:vfio_region_read  (0000:00:16.4:region0+0x800, 4) = 0x0
2224@1455310087.547153:vfio_region_read  (0000:00:16.4:region0+0x4, 4) = 0x80020208
2224@1455310087.547160:vfio_region_read  (0000:00:16.4:region0+0xc, 4) = 0x80020209
2224@1455310087.547164:vfio_region_write  (0000:00:16.4:region0+0x4, 0x80020209, 4)
2224@1455310087.547171:vfio_region_read  (0000:00:16.4:region0+0x4, 4) = 0x80020209
2224@1455310087.547178:vfio_region_read  (0000:00:16.4:region0+0x4, 4) = 0x80020209
2224@1455310087.547215:vfio_region_read  (0000:00:16.4:region0+0xc, 4) = 0x80020209
2224@1455310087.547439:vfio_region_read  (0000:00:16.4:region0+0x4, 4) = 0x80020209
2224@1455310087.547450:vfio_region_write  (0000:00:16.4:region0+0x0, 0x80040000, 4)
2224@1455310087.547458:vfio_region_write  (0000:00:16.4:region0+0x0, 0xc05, 4)
2224@1455310087.547468:vfio_region_read  (0000:00:16.4:region0+0x4, 4) = 0x80040209
2224@1455310087.547476:vfio_region_write  (0000:00:16.4:region0+0x4, 0x8004020d, 4)
2224@1455310087.547485:vfio_region_read  (0000:00:16.4:region0+0xc, 4) = 0x8002020b
2224@1455310087.547970:vfio_region_read  (0000:00:16.4:region0+0x4, 4) = 0x8004040b
2224@1455310087.548008:vfio_region_write  (0000:00:16.4:region0+0x4, 0x8004040a, 4)
2224@1455310087.548019:vfio_region_read  (0000:00:16.4:region0+0x4, 4) = 0x80040408
2224@1455310087.548027:vfio_region_read  (0000:00:16.4:region0+0xc, 4) = 0x800a0209
2224@1455310087.548058:vfio_region_read  (0000:00:16.4:region0+0x800, 4) = 0x0
2224@1455310087.548068:vfio_region_read  (0000:00:16.4:region0+0xc, 4) = 0x800a0209
2224@1455310087.548076:vfio_region_read  (0000:00:16.4:region0+0x4, 4) = 0x80040408
2224@1455310087.548085:vfio_region_read  (0000:00:16.4:region0+0x8, 4) = 0x801c0000
2224@1455310087.548092:vfio_region_read  (0000:00:16.4:region0+0x8, 4) = 0xc85
2224@1455310087.548100:vfio_region_read  (0000:00:16.4:region0+0x8, 4) = 0x3e8d0870
2224@1455310087.548127:vfio_region_read  (0000:00:16.4:region0+0x8, 4) = 0x4208271a
2224@1455310087.548137:vfio_region_read  (0000:00:16.4:region0+0x8, 4) = 0xcb9ab58e
2224@1455310087.548143:vfio_region_read  (0000:00:16.4:region0+0x8, 4) = 0x4ae0294
2224@1455310087.548150:vfio_region_read  (0000:00:16.4:region0+0x8, 4) = 0x10c000a
2224@1455310087.548156:vfio_region_read  (0000:00:16.4:region0+0x8, 4) = 0x144
2224@1455310087.548163:vfio_region_read  (0000:00:16.4:region0+0xc, 4) = 0x800a0a09
2224@1455310087.548171:vfio_region_read  (0000:00:16.4:region0+0x4, 4) = 0x80040408
2224@1455310087.548177:vfio_region_write  (0000:00:16.4:region0+0x4, 0x8004040c, 4)
2224@1455310087.548192:vfio_region_read  (0000:00:16.4:region0+0xc, 4) = 0x800a0a0b
2224@1455310087.548200:vfio_region_read  (0000:00:16.4:region0+0x4, 4) = 0x80040408
2224@1455310087.548207:vfio_region_read  (0000:00:16.4:region0+0x800, 4) = 0x0
2224@1455310087.548216:vfio_region_read  (0000:00:16.4:region0+0x4, 4) = 0x80040408
2224@1455310087.548222:vfio_region_read  (0000:00:16.4:region0+0x800, 4) = 0x0
2224@1455310087.548228:vfio_region_write  (0000:00:16.4:region0+0x4, 0x80040409, 4)
2224@1455310087.548234:vfio_region_read  (0000:00:16.4:region0+0xc, 4) = 0x800a0a09
2224@1455310087.548242:vfio_region_read  (0000:00:16.4:region0+0x4, 4) = 0x80040409
2224@1455310087.548250:vfio_region_read  (0000:00:16.4:region0+0x4, 4) = 0x80040409
2224@1455310087.548262:vfio_region_read  (0000:00:16.4:region0+0xc, 4) = 0x800a0a09
2224@1455310087.548273:vfio_region_read  (0000:00:16.4:region0+0x4, 4) = 0x80040409
2224@1455310087.548321:vfio_region_write  (0000:00:16.4:region0+0x0, 0x8014000c, 4)
2224@1455310087.548329:vfio_region_write  (0000:00:16.4:region0+0x0, 0x9, 4)
2224@1455310087.548334:vfio_region_write  (0000:00:16.4:region0+0x0, 0x0, 4)
2224@1455310087.548338:vfio_region_write  (0000:00:16.4:region0+0x0, 0x1e, 4)
2224@1455310087.548343:vfio_region_write  (0000:00:16.4:region0+0x0, 0x0, 4)
2224@1455310087.548347:vfio_region_write  (0000:00:16.4:region0+0x0, 0x0, 4)
2224@1455310087.548439:vfio_region_read  (0000:00:16.4:region0+0x4, 4) = 0x800a0409
2224@1455310087.548446:vfio_region_write  (0000:00:16.4:region0+0x4, 0x800a040d, 4)
2224@1455310087.548499:vfio_region_read  (0000:00:16.4:region0+0xc, 4) = 0x800a0a09
2224@1455310087.548957:vfio_region_read  (0000:00:16.4:region0+0x4, 4) = 0x800a0a0b
2224@1455310087.548984:vfio_region_write  (0000:00:16.4:region0+0x4, 0x800a0a0a, 4)
2224@1455310087.548994:vfio_region_read  (0000:00:16.4:region0+0x4, 4) = 0x800a0a08
2224@1455310087.549003:vfio_region_read  (0000:00:16.4:region0+0xc, 4) = 0x800a0a09
2224@1455310087.549027:vfio_region_read  (0000:00:16.4:region0+0x800, 4) = 0x0
2224@1455310087.549035:vfio_region_read  (0000:00:16.4:region0+0x4, 4) = 0x800a0a08
2224@1455310087.549041:vfio_region_write  (0000:00:16.4:region0+0x4, 0x800a0a09, 4)
2224@1455310087.549049:vfio_region_read  (0000:00:16.4:region0+0x4, 4) = 0x800a0a09
2224@1455310087.549721:vfio_region_read  (0000:00:16.4:region0+0x4, 4) = 0x800a0a0b
2224@1455310087.549742:vfio_region_write  (0000:00:16.4:region0+0x4, 0x800a0a0a, 4)
2224@1455310087.549754:vfio_region_read  (0000:00:16.4:region0+0x4, 4) = 0x800a0a08
2224@1455310087.549764:vfio_region_read  (0000:00:16.4:region0+0xc, 4) = 0x80100a09
2224@1455310087.549792:vfio_region_read  (0000:00:16.4:region0+0x800, 4) = 0x0
2224@1455310087.549801:vfio_region_read  (0000:00:16.4:region0+0xc, 4) = 0x80100a09
2224@1455310087.549808:vfio_region_read  (0000:00:16.4:region0+0x4, 4) = 0x800a0a08
2224@1455310087.549819:vfio_region_read  (0000:00:16.4:region0+0x8, 4) = 0x8014000c
2224@1455310087.549826:vfio_region_read  (0000:00:16.4:region0+0x8, 4) = 0x80000009
2224@1455310087.549833:vfio_region_read  (0000:00:16.4:region0+0x8, 4) = 0x0
2224@1455310087.549840:vfio_region_read  (0000:00:16.4:region0+0x8, 4) = 0x1e
2224@1455310087.549885:vfio_region_read  (0000:00:16.4:region0+0x8, 4) = 0x0
2224@1455310087.549895:vfio_region_read  (0000:00:16.4:region0+0x8, 4) = 0x0
2224@1455310087.549903:vfio_region_read  (0000:00:16.4:region0+0xc, 4) = 0x80101009
2224@1455310087.549910:vfio_region_read  (0000:00:16.4:region0+0x4, 4) = 0x800a0a08
2224@1455310087.549920:vfio_region_write  (0000:00:16.4:region0+0x4, 0x800a0a0c, 4)
2224@1455310087.549932:vfio_region_read  (0000:00:16.4:region0+0xc, 4) = 0x8010100b
2224@1455310087.549940:vfio_region_read  (0000:00:16.4:region0+0x4, 4) = 0x800a0a08
2224@1455310087.549946:vfio_region_read  (0000:00:16.4:region0+0x4, 4) = 0x800a0a08
2224@1455310087.549952:vfio_region_write  (0000:00:16.4:region0+0x4, 0x800a0a09, 4)
2224@1455310087.549971:vfio_region_read  (0000:00:16.4:region0+0x4, 4) = 0x800a0a09
2224@1455310087.550094:vfio_region_read  (0000:00:16.4:region0+0x800, 4) = 0x0
2224@1455310087.550103:vfio_region_read  (0000:00:16.4:region0+0x800, 4) = 0x0
2224@1455310087.550110:vfio_region_read  (0000:00:16.4:region0+0xc, 4) = 0x80101009
2224@1455310087.550117:vfio_region_read  (0000:00:16.4:region0+0x4, 4) = 0x800a0a09
2224@1455310087.550123:vfio_region_read  (0000:00:16.4:region0+0xc, 4) = 0x80101009
2224@1455310087.550131:vfio_region_read  (0000:00:16.4:region0+0x4, 4) = 0x800a0a09
2224@1455310087.550151:vfio_region_write  (0000:00:16.4:region0+0x0, 0x8004000c, 4)
2224@1455310087.550170:vfio_region_write  (0000:00:16.4:region0+0x0, 0x8, 4)
2224@1455310087.550180:vfio_region_read  (0000:00:16.4:region0+0x4, 4) = 0x800c0a09
2224@1455310087.550187:vfio_region_write  (0000:00:16.4:region0+0x4, 0x800c0a0d, 4)
2224@1455310087.550193:vfio_region_read  (0000:00:16.4:region0+0xc, 4) = 0x8010100b
2224@1455310087.550716:vfio_region_read  (0000:00:16.4:region0+0x4, 4) = 0x800c0c0b
2224@1455310087.550741:vfio_region_write  (0000:00:16.4:region0+0x4, 0x800c0c0a, 4)
2224@1455310087.550750:vfio_region_read  (0000:00:16.4:region0+0x4, 4) = 0x800c0c08
2224@1455310087.550757:vfio_region_read  (0000:00:16.4:region0+0xc, 4) = 0x80101009
2224@1455310087.550784:vfio_region_read  (0000:00:16.4:region0+0x800, 4) = 0x0
2224@1455310087.550795:vfio_region_read  (0000:00:16.4:region0+0x4, 4) = 0x800c0c08
2224@1455310087.550801:vfio_region_write  (0000:00:16.4:region0+0x4, 0x800c0c09, 4)
2224@1455310087.550808:vfio_region_read  (0000:00:16.4:region0+0x4, 4) = 0x800c0c09
2224@1455310087.551430:vfio_region_read  (0000:00:16.4:region0+0x4, 4) = 0x800c0c0b
2224@1455310087.551460:vfio_region_write  (0000:00:16.4:region0+0x4, 0x800c0c0a, 4)
2224@1455310087.551471:vfio_region_read  (0000:00:16.4:region0+0x4, 4) = 0x800c0c08
2224@1455310087.551479:vfio_region_read  (0000:00:16.4:region0+0xc, 4) = 0x80161009
2224@1455310087.551640:vfio_region_read  (0000:00:16.4:region0+0x800, 4) = 0x0
2224@1455310087.551652:vfio_region_read  (0000:00:16.4:region0+0xc, 4) = 0x80161009
2224@1455310087.551658:vfio_region_read  (0000:00:16.4:region0+0x4, 4) = 0x800c0c08
2224@1455310087.551665:vfio_region_read  (0000:00:16.4:region0+0x8, 4) = 0x8014000c
2224@1455310087.551671:vfio_region_read  (0000:00:16.4:region0+0x8, 4) = 0x80000008
2224@1455310087.551679:vfio_region_read  (0000:00:16.4:region0+0x8, 4) = 0x0
2224@1455310087.551685:vfio_region_read  (0000:00:16.4:region0+0x8, 4) = 0x0
2224@1455310087.551691:vfio_region_read  (0000:00:16.4:region0+0x8, 4) = 0x0
2224@1455310087.551698:vfio_region_read  (0000:00:16.4:region0+0x8, 4) = 0x0
2224@1455310087.551704:vfio_region_read  (0000:00:16.4:region0+0xc, 4) = 0x80161609
2224@1455310087.551712:vfio_region_read  (0000:00:16.4:region0+0x4, 4) = 0x800c0c08
2224@1455310087.551718:vfio_region_write  (0000:00:16.4:region0+0x4, 0x800c0c0c, 4)
2224@1455310087.551729:vfio_region_read  (0000:00:16.4:region0+0xc, 4) = 0x8016160b
2224@1455310087.551736:vfio_region_read  (0000:00:16.4:region0+0x4, 4) = 0x800c0c08
2224@1455310087.551742:vfio_region_read  (0000:00:16.4:region0+0x4, 4) = 0x800c0c08
2224@1455310087.551748:vfio_region_write  (0000:00:16.4:region0+0x4, 0x800c0c09, 4)
2224@1455310087.551754:vfio_region_read  (0000:00:16.4:region0+0x4, 4) = 0x800c0c09
2224@1455310087.551850:vfio_region_read  (0000:00:16.4:region0+0x800, 4) = 0x0
2224@1455310087.551859:vfio_region_read  (0000:00:16.4:region0+0x800, 4) = 0x0
2224@1455310087.551865:vfio_region_read  (0000:00:16.4:region0+0xc, 4) = 0x80161609
2224@1455310087.551872:vfio_region_read  (0000:00:16.4:region0+0x4, 4) = 0x800c0c09
2224@1455310087.551879:vfio_region_read  (0000:00:16.4:region0+0xc, 4) = 0x80161609
2224@1455310087.551886:vfio_region_read  (0000:00:16.4:region0+0x4, 4) = 0x800c0c09
2224@1455310087.551892:vfio_region_write  (0000:00:16.4:region0+0x0, 0x8004000c, 4)
2224@1455310087.551897:vfio_region_write  (0000:00:16.4:region0+0x0, 0x1, 4)
2224@1455310087.551903:vfio_region_read  (0000:00:16.4:region0+0x4, 4) = 0x800e0c09
2224@1455310087.551912:vfio_region_write  (0000:00:16.4:region0+0x4, 0x800e0c0d, 4)
2224@1455310087.551922:vfio_region_read  (0000:00:16.4:region0+0xc, 4) = 0x8016160b
2224@1455310087.552401:vfio_region_read  (0000:00:16.4:region0+0x4, 4) = 0x800e0e0b
2224@1455310087.552410:vfio_region_write  (0000:00:16.4:region0+0x4, 0x800e0e0a, 4)
2224@1455310087.552417:vfio_region_read  (0000:00:16.4:region0+0x4, 4) = 0x800e0e08
2224@1455310087.552424:vfio_region_read  (0000:00:16.4:region0+0xc, 4) = 0x80161609
2224@1455310087.552528:vfio_region_read  (0000:00:16.4:region0+0x800, 4) = 0x0
2224@1455310087.552538:vfio_region_read  (0000:00:16.4:region0+0x4, 4) = 0x800e0e08
2224@1455310087.552543:vfio_region_write  (0000:00:16.4:region0+0x4, 0x800e0e09, 4)
2224@1455310087.552550:vfio_region_read  (0000:00:16.4:region0+0x4, 4) = 0x800e0e09
2224@1455310087.553187:vfio_region_read  (0000:00:16.4:region0+0x4, 4) = 0x800e0e0b
2224@1455310087.553197:vfio_region_write  (0000:00:16.4:region0+0x4, 0x800e0e0a, 4)
2224@1455310087.553204:vfio_region_read  (0000:00:16.4:region0+0x4, 4) = 0x800e0e08
2224@1455310087.553210:vfio_region_read  (0000:00:16.4:region0+0xc, 4) = 0x80241609
2224@1455310087.553227:vfio_region_read  (0000:00:16.4:region0+0x800, 4) = 0x0
2224@1455310087.553235:vfio_region_read  (0000:00:16.4:region0+0xc, 4) = 0x80241609
2224@1455310087.553242:vfio_region_read  (0000:00:16.4:region0+0x4, 4) = 0x800e0e08
2224@1455310087.553250:vfio_region_read  (0000:00:16.4:region0+0x8, 4) = 0x8034000c
2224@1455310087.553256:vfio_region_read  (0000:00:16.4:region0+0x8, 4) = 0x80000001
2224@1455310087.553263:vfio_region_read  (0000:00:16.4:region0+0x8, 4) = 0x0
2224@1455310087.553270:vfio_region_read  (0000:00:16.4:region0+0x8, 4) = 0x6a1b96
2224@1455310087.553277:vfio_region_read  (0000:00:16.4:region0+0x8, 4) = 0x1
2224@1455310087.553284:vfio_region_read  (0000:00:16.4:region0+0x8, 4) = 0x1330095
2224@1455310087.553291:vfio_region_read  (0000:00:16.4:region0+0x8, 4) = 0x4000
2224@1455310087.553297:vfio_region_read  (0000:00:16.4:region0+0x8, 4) = 0xa40
2224@1455310087.553305:vfio_region_read  (0000:00:16.4:region0+0x8, 4) = 0x0
2224@1455310087.553311:vfio_region_read  (0000:00:16.4:region0+0x8, 4) = 0x10a
2224@1455310087.553318:vfio_region_read  (0000:00:16.4:region0+0x8, 4) = 0x470047
2224@1455310087.553325:vfio_region_read  (0000:00:16.4:region0+0x8, 4) = 0x40101
2224@1455310087.553332:vfio_region_read  (0000:00:16.4:region0+0x8, 4) = 0x0
2224@1455310087.553339:vfio_region_read  (0000:00:16.4:region0+0x8, 4) = 0x0
2224@1455310087.553345:vfio_region_read  (0000:00:16.4:region0+0xc, 4) = 0x80242409
2224@1455310087.553353:vfio_region_read  (0000:00:16.4:region0+0x4, 4) = 0x800e0e08
2224@1455310087.553359:vfio_region_write  (0000:00:16.4:region0+0x4, 0x800e0e0c, 4)
2224@1455310087.553374:vfio_region_read  (0000:00:16.4:region0+0xc, 4) = 0x8024240b
2224@1455310087.553382:vfio_region_read  (0000:00:16.4:region0+0x4, 4) = 0x800e0e08
2224@1455310087.553390:vfio_region_read  (0000:00:16.4:region0+0x4, 4) = 0x800e0e08
2224@1455310087.553396:vfio_region_write  (0000:00:16.4:region0+0x4, 0x800e0e09, 4)
2224@1455310087.553419:vfio_region_read  (0000:00:16.4:region0+0x4, 4) = 0x800e0e09
2224@1455310087.553586:vfio_region_read  (0000:00:16.4:region0+0x800, 4) = 0x0
2224@1455310087.553600:vfio_region_read  (0000:00:16.4:region0+0x800, 4) = 0x0
2224@1455310087.553612:vfio_region_read  (0000:00:16.4:region0+0xc, 4) = 0x80242409
2224@1455310087.553624:vfio_region_read  (0000:00:16.4:region0+0x4, 4) = 0x800e0e09
2224@1455310087.553635:vfio_region_read  (0000:00:16.4:region0+0xc, 4) = 0x80242409
2224@1455310087.553645:vfio_region_read  (0000:00:16.4:region0+0x4, 4) = 0x800e0e09
2224@1455310087.553655:vfio_region_write  (0000:00:16.4:region0+0x0, 0x8014000c, 4)
2224@1455310087.553664:vfio_region_write  (0000:00:16.4:region0+0x0, 0x2, 4)
2224@1455310087.553672:vfio_region_write  (0000:00:16.4:region0+0x0, 0x0, 4)
2224@1455310087.553680:vfio_region_write  (0000:00:16.4:region0+0x0, 0x0, 4)
2224@1455310087.553688:vfio_region_write  (0000:00:16.4:region0+0x0, 0x0, 4)
2224@1455310087.553695:vfio_region_write  (0000:00:16.4:region0+0x0, 0x0, 4)
2224@1455310087.553722:vfio_region_read  (0000:00:16.4:region0+0x4, 4) = 0x80140e09
2224@1455310087.553739:vfio_region_write  (0000:00:16.4:region0+0x4, 0x80140e0d, 4)
2224@1455310087.554243:vfio_region_read  (0000:00:16.4:region0+0x4, 4) = 0x8014140b
2224@1455310087.554256:vfio_region_write  (0000:00:16.4:region0+0x4, 0x8014140a, 4)
2224@1455310087.554263:vfio_region_read  (0000:00:16.4:region0+0x4, 4) = 0x80141408
2224@1455310087.554270:vfio_region_read  (0000:00:16.4:region0+0xc, 4) = 0x80242409
2224@1455310087.554439:vfio_region_read  (0000:00:16.4:region0+0x800, 4) = 0x0
2224@1455310087.554458:vfio_region_read  (0000:00:16.4:region0+0x4, 4) = 0x80141408
2224@1455310087.554471:vfio_region_write  (0000:00:16.4:region0+0x4, 0x80141409, 4)
2224@1455310087.554481:vfio_region_read  (0000:00:16.4:region0+0x4, 4) = 0x80141409
2224@1455310087.554643:vfio_region_read  (0000:00:16.4:region0+0xc, 4) = 0x802a2409
2224@1455310087.555015:vfio_region_read  (0000:00:16.4:region0+0x4, 4) = 0x8014140b
2224@1455310087.555031:vfio_region_write  (0000:00:16.4:region0+0x4, 0x8014140a, 4)
2224@1455310087.555042:vfio_region_read  (0000:00:16.4:region0+0x4, 4) = 0x80141408
2224@1455310087.555053:vfio_region_read  (0000:00:16.4:region0+0xc, 4) = 0x802a2409
2224@1455310087.555091:vfio_region_read  (0000:00:16.4:region0+0x800, 4) = 0x0
2224@1455310087.555102:vfio_region_read  (0000:00:16.4:region0+0xc, 4) = 0x802a2409
2224@1455310087.555113:vfio_region_read  (0000:00:16.4:region0+0x4, 4) = 0x80141408
2224@1455310087.555123:vfio_region_read  (0000:00:16.4:region0+0x8, 4) = 0x8014000c
2224@1455310087.555132:vfio_region_read  (0000:00:16.4:region0+0x8, 4) = 0x80000002
2224@1455310087.555142:vfio_region_read  (0000:00:16.4:region0+0x8, 4) = 0x0
2224@1455310087.555152:vfio_region_read  (0000:00:16.4:region0+0x8, 4) = 0x0
2224@1455310087.555163:vfio_region_read  (0000:00:16.4:region0+0x8, 4) = 0x0
2224@1455310087.555174:vfio_region_read  (0000:00:16.4:region0+0x8, 4) = 0x0
2224@1455310087.555185:vfio_region_read  (0000:00:16.4:region0+0xc, 4) = 0x802a2a09
2224@1455310087.555196:vfio_region_read  (0000:00:16.4:region0+0x4, 4) = 0x80141408
2224@1455310087.555206:vfio_region_write  (0000:00:16.4:region0+0x4, 0x8014140c, 4)
2224@1455310087.555220:vfio_region_read  (0000:00:16.4:region0+0xc, 4) = 0x802a2a0b
2224@1455310087.555231:vfio_region_read  (0000:00:16.4:region0+0x4, 4) = 0x80141408
2224@1455310087.555242:vfio_region_read  (0000:00:16.4:region0+0x4, 4) = 0x80141408
2224@1455310087.555250:vfio_region_write  (0000:00:16.4:region0+0x4, 0x80141409, 4)
2224@1455310087.555260:vfio_region_read  (0000:00:16.4:region0+0x4, 4) = 0x80141409
2224@1455310087.555302:vfio_region_read  (0000:00:16.4:region0+0x800, 4) = 0x0
2224@1455310087.558380:vfio_region_read  (0000:00:16.4:region0+0x800, 4) = 0x0
2224@1455310087.558405:vfio_region_read  (0000:00:16.4:region0+0xc, 4) = 0x802a2a09
2224@1455310087.558413:vfio_region_read  (0000:00:16.4:region0+0x4, 4) = 0x80141409
2224@1455310087.558421:vfio_region_read  (0000:00:16.4:region0+0xc, 4) = 0x802a2a09
2224@1455310087.558430:vfio_region_read  (0000:00:16.4:region0+0x4, 4) = 0x80141409
2224@1455310087.558439:vfio_region_write  (0000:00:16.4:region0+0x0, 0x7c000c, 4)
2224@1455310087.558449:vfio_region_write  (0000:00:16.4:region0+0x0, 0x3, 4)
2224@1455310087.558455:vfio_region_write  (0000:00:16.4:region0+0x0, 0x7f482000, 4)
2224@1455310087.558461:vfio_region_write  (0000:00:16.4:region0+0x0, 0x7f47d000, 4)
2224@1455310087.558468:vfio_region_write  (0000:00:16.4:region0+0x0, 0x7f478000, 4)
2224@1455310087.558476:vfio_region_write  (0000:00:16.4:region0+0x0, 0x7f473000, 4)
2224@1455310087.558485:vfio_region_write  (0000:00:16.4:region0+0x0, 0x7f46e000, 4)
2224@1455310087.558492:vfio_region_write  (0000:00:16.4:region0+0x0, 0x7f469000, 4)
2224@1455310087.558497:vfio_region_write  (0000:00:16.4:region0+0x0, 0x7f464000, 4)
2224@1455310087.558501:vfio_region_write  (0000:00:16.4:region0+0x0, 0x7f45f000, 4)
2224@1455310087.558506:vfio_region_write  (0000:00:16.4:region0+0x0, 0x7f45a000, 4)
2224@1455310087.558510:vfio_region_write  (0000:00:16.4:region0+0x0, 0x7f455000, 4)
2224@1455310087.558515:vfio_region_write  (0000:00:16.4:region0+0x0, 0x7f450000, 4)
2224@1455310087.558519:vfio_region_write  (0000:00:16.4:region0+0x0, 0x7f44b000, 4)
2224@1455310087.558524:vfio_region_write  (0000:00:16.4:region0+0x0, 0x7f446000, 4)
2224@1455310087.558528:vfio_region_write  (0000:00:16.4:region0+0x0, 0x7f441000, 4)
2224@1455310087.558533:vfio_region_write  (0000:00:16.4:region0+0x0, 0x7f43c000, 4)
2224@1455310087.558537:vfio_region_write  (0000:00:16.4:region0+0x0, 0x7f437000, 4)
2224@1455310087.558542:vfio_region_write  (0000:00:16.4:region0+0x0, 0x0, 4)
2224@1455310087.558549:vfio_region_write  (0000:00:16.4:region0+0x0, 0x0, 4)
2224@1455310087.558555:vfio_region_write  (0000:00:16.4:region0+0x0, 0x0, 4)
2224@1455310087.558560:vfio_region_write  (0000:00:16.4:region0+0x0, 0x0, 4)
2224@1455310087.558564:vfio_region_write  (0000:00:16.4:region0+0x0, 0x0, 4)
2224@1455310087.558568:vfio_region_write  (0000:00:16.4:region0+0x0, 0x0, 4)
2224@1455310087.558573:vfio_region_write  (0000:00:16.4:region0+0x0, 0x0, 4)
2224@1455310087.558577:vfio_region_write  (0000:00:16.4:region0+0x0, 0x0, 4)
2224@1455310087.558586:vfio_region_write  (0000:00:16.4:region0+0x0, 0x0, 4)
2224@1455310087.558592:vfio_region_write  (0000:00:16.4:region0+0x0, 0x0, 4)
2224@1455310087.558596:vfio_region_write  (0000:00:16.4:region0+0x0, 0x0, 4)
2224@1455310087.558601:vfio_region_write  (0000:00:16.4:region0+0x0, 0x0, 4)
2224@1455310087.558605:vfio_region_write  (0000:00:16.4:region0+0x0, 0x0, 4)
2224@1455310087.558610:vfio_region_write  (0000:00:16.4:region0+0x0, 0x0, 4)
2224@1455310087.558645:vfio_region_read  (0000:00:16.4:region0+0x4, 4) = 0x80341409
2224@1455310087.558657:vfio_region_write  (0000:00:16.4:region0+0x4, 0x8034140d, 4)
2224@1455310087.558668:vfio_region_read  (0000:00:16.4:region0+0xc, 4) = 0x802a2a0b
2224@1455310087.558679:vfio_region_read  (0000:00:16.4:region0+0xc, 4) = 0x802a2a0b
2224@1455310087.558689:vfio_region_read  (0000:00:16.4:region0+0x4, 4) = 0x80341409
2224@1455310087.558699:vfio_region_read  (0000:00:16.4:region0+0xc, 4) = 0x802a2a0b
2224@1455310087.558709:vfio_region_read  (0000:00:16.4:region0+0x4, 4) = 0x80341409
2224@1455310087.558716:vfio_region_write  (0000:00:16.4:region0+0x0, 0x7c000c, 4)
2224@1455310087.558723:vfio_region_write  (0000:00:16.4:region0+0x0, 0x0, 4)
2224@1455310087.558730:vfio_region_write  (0000:00:16.4:region0+0x0, 0x0, 4)
2224@1455310087.558737:vfio_region_write  (0000:00:16.4:region0+0x0, 0x7f486000, 4)
2224@1455310087.558743:vfio_region_write  (0000:00:16.4:region0+0x0, 0x0, 4)
2224@1455310087.558751:vfio_region_write  (0000:00:16.4:region0+0x0, 0x0, 4)
2224@1455310087.558758:vfio_region_write  (0000:00:16.4:region0+0x0, 0x0, 4)
2224@1455310087.558766:vfio_region_write  (0000:00:16.4:region0+0x0, 0x7f481000, 4)
2224@1455310087.558775:vfio_region_write  (0000:00:16.4:region0+0x0, 0x7f47c000, 4)
2224@1455310087.558783:vfio_region_write  (0000:00:16.4:region0+0x0, 0x7f477000, 4)
2224@1455310087.558793:vfio_region_write  (0000:00:16.4:region0+0x0, 0x7f472000, 4)
2224@1455310087.558802:vfio_region_write  (0000:00:16.4:region0+0x0, 0x7f46d000, 4)
2224@1455310087.558844:vfio_region_write  (0000:00:16.4:region0+0x0, 0x7f468000, 4)
2224@1455310087.559030:vfio_region_read  (0000:00:16.4:region0+0x4, 4) = 0x8041340b
2224@1455310087.559046:vfio_region_write  (0000:00:16.4:region0+0x4, 0x8041340a, 4)
2224@1455310087.559057:vfio_region_read  (0000:00:16.4:region0+0x4, 4) = 0x80413408
2224@1455310087.559067:vfio_region_read  (0000:00:16.4:region0+0xc, 4) = 0x802a2a09
2224@1455310087.559111:vfio_region_read  (0000:00:16.4:region0+0x800, 4) = 0x0
2224@1455310087.559125:vfio_region_read  (0000:00:16.4:region0+0x4, 4) = 0x80413408
2224@1455310087.559135:vfio_region_write  (0000:00:16.4:region0+0x4, 0x80413409, 4)
2224@1455310087.559142:vfio_region_read  (0000:00:16.4:region0+0x4, 4) = 0x80413409
2224@1455310087.559247:vfio_region_write  (0000:00:16.4:region0+0x0, 0x7f463000, 4)
2224@1455310087.559257:vfio_region_write  (0000:00:16.4:region0+0x0, 0x7f45e000, 4)
2224@1455310087.559264:vfio_region_write  (0000:00:16.4:region0+0x0, 0x7f459000, 4)
2224@1455310087.559271:vfio_region_write  (0000:00:16.4:region0+0x0, 0x7f454000, 4)
2224@1455310087.559280:vfio_region_write  (0000:00:16.4:region0+0x0, 0x7f44f000, 4)
2224@1455310087.559290:vfio_region_write  (0000:00:16.4:region0+0x0, 0x7f44a000, 4)
2224@1455310087.559298:vfio_region_write  (0000:00:16.4:region0+0x0, 0x7f445000, 4)
2224@1455310087.559306:vfio_region_write  (0000:00:16.4:region0+0x0, 0x7f440000, 4)
2224@1455310087.559314:vfio_region_write  (0000:00:16.4:region0+0x0, 0x7f43b000, 4)
2224@1455310087.559323:vfio_region_write  (0000:00:16.4:region0+0x0, 0x7f436000, 4)
2224@1455310087.559331:vfio_region_write  (0000:00:16.4:region0+0x0, 0x0, 4)
2224@1455310087.559339:vfio_region_write  (0000:00:16.4:region0+0x0, 0x0, 4)
2224@1455310087.559347:vfio_region_write  (0000:00:16.4:region0+0x0, 0x0, 4)
2224@1455310087.559355:vfio_region_write  (0000:00:16.4:region0+0x0, 0x0, 4)
2224@1455310087.559363:vfio_region_write  (0000:00:16.4:region0+0x0, 0x0, 4)
2224@1455310087.559375:vfio_region_write  (0000:00:16.4:region0+0x0, 0x0, 4)
2224@1455310087.559382:vfio_region_write  (0000:00:16.4:region0+0x0, 0x0, 4)
2224@1455310087.559389:vfio_region_write  (0000:00:16.4:region0+0x0, 0x0, 4)
2224@1455310087.559396:vfio_region_write  (0000:00:16.4:region0+0x0, 0x0, 4)
2224@1455310087.559408:vfio_region_read  (0000:00:16.4:region0+0x4, 4) = 0x80543409
2224@1455310087.559418:vfio_region_write  (0000:00:16.4:region0+0x4, 0x8054340d, 4)
2224@1455310087.559430:vfio_region_read  (0000:00:16.4:region0+0xc, 4) = 0x802a2a0b
2224@1455310087.559442:vfio_region_read  (0000:00:16.4:region0+0xc, 4) = 0x802a2a0b
2224@1455310087.559457:vfio_region_read  (0000:00:16.4:region0+0x4, 4) = 0x80543409
2224@1455310087.559469:vfio_region_read  (0000:00:16.4:region0+0xc, 4) = 0x802a2a09
2224@1455310087.559481:vfio_region_read  (0000:00:16.4:region0+0x4, 4) = 0x80543409
2224@1455310087.559490:vfio_region_write  (0000:00:16.4:region0+0x0, 0x804c000c, 4)
2224@1455310087.559499:vfio_region_write  (0000:00:16.4:region0+0x0, 0x0, 4)
2224@1455310087.559509:vfio_region_write  (0000:00:16.4:region0+0x0, 0x0, 4)
2224@1455310087.559518:vfio_region_write  (0000:00:16.4:region0+0x0, 0x0, 4)
2224@1455310087.559550:vfio_region_write  (0000:00:16.4:region0+0x0, 0x0, 4)
2224@1455310087.559827:vfio_region_read  (0000:00:16.4:region0+0x4, 4) = 0x8059540b
2224@1455310087.559841:vfio_region_write  (0000:00:16.4:region0+0x4, 0x8059540a, 4)
2224@1455310087.559850:vfio_region_write  (0000:00:16.4:region0+0x0, 0x0, 4)
2224@1455310087.559859:vfio_region_read  (0000:00:16.4:region0+0x4, 4) = 0x805a5408
2224@1455310087.559865:vfio_region_write  (0000:00:16.4:region0+0x0, 0x0, 4)
2224@1455310087.559872:vfio_region_read  (0000:00:16.4:region0+0xc, 4) = 0x802a2a09
2224@1455310087.559878:vfio_region_write  (0000:00:16.4:region0+0x0, 0x0, 4)
2224@1455310087.559886:vfio_region_write  (0000:00:16.4:region0+0x0, 0x7f487000, 4)
2224@1455310087.559895:vfio_region_read  (0000:00:16.4:region0+0x800, 4) = 0x0
2224@1455310087.559901:vfio_region_write  (0000:00:16.4:region0+0x0, 0x0, 4)
2224@1455310087.559908:vfio_region_read  (0000:00:16.4:region0+0x4, 4) = 0x805e5408
2224@1455310087.559911:vfio_region_write  (0000:00:16.4:region0+0x0, 0xa40, 4)
2224@1455310087.559915:vfio_region_write  (0000:00:16.4:region0+0x4, 0x805e5409, 4)
2224@1455310087.559919:vfio_region_write  (0000:00:16.4:region0+0x0, 0x1001000, 4)
2224@1455310087.559926:vfio_region_read  (0000:00:16.4:region0+0x4, 4) = 0x80605409
2224@1455310087.559932:vfio_region_write  (0000:00:16.4:region0+0x0, 0x0, 4)
2224@1455310087.559941:vfio_region_write  (0000:00:16.4:region0+0x0, 0x0, 4)
2224@1455310087.559948:vfio_region_write  (0000:00:16.4:region0+0x0, 0x0, 4)
2224@1455310087.559957:vfio_region_write  (0000:00:16.4:region0+0x0, 0x0, 4)
2224@1455310087.559966:vfio_region_write  (0000:00:16.4:region0+0x0, 0x0, 4)
2224@1455310087.559974:vfio_region_write  (0000:00:16.4:region0+0x0, 0x0, 4)
2224@1455310087.559982:vfio_region_write  (0000:00:16.4:region0+0x0, 0x0, 4)
2224@1455310087.559990:vfio_region_write  (0000:00:16.4:region0+0x0, 0x0, 4)
2224@1455310087.560001:vfio_region_read  (0000:00:16.4:region0+0x4, 4) = 0x80685409
2224@1455310087.560009:vfio_region_write  (0000:00:16.4:region0+0x4, 0x8068540d, 4)
2224@1455310087.560019:vfio_region_read  (0000:00:16.4:region0+0xc, 4) = 0x802a2a0b
2224@1455310087.560356:vfio_region_read  (0000:00:16.4:region0+0x4, 4) = 0x8068680b
2224@1455310087.560372:vfio_region_write  (0000:00:16.4:region0+0x4, 0x8068680a, 4)
2224@1455310087.560383:vfio_region_read  (0000:00:16.4:region0+0x4, 4) = 0x80686808
2224@1455310087.560390:vfio_region_read  (0000:00:16.4:region0+0xc, 4) = 0x802a2a09
2224@1455310087.560407:vfio_region_read  (0000:00:16.4:region0+0x800, 4) = 0x0
2224@1455310087.560416:vfio_region_read  (0000:00:16.4:region0+0x4, 4) = 0x80686808
2224@1455310087.560425:vfio_region_write  (0000:00:16.4:region0+0x4, 0x80686809, 4)
2224@1455310087.560432:vfio_region_read  (0000:00:16.4:region0+0x4, 4) = 0x80686809
2224@1455310087.563424:vfio_region_read  (0000:00:16.4:region0+0x4, 4) = 0x8068680b
2224@1455310087.563443:vfio_region_write  (0000:00:16.4:region0+0x4, 0x8068680a, 4)
2224@1455310087.563450:vfio_region_read  (0000:00:16.4:region0+0x4, 4) = 0x80686808
2224@1455310087.563457:vfio_region_read  (0000:00:16.4:region0+0xc, 4) = 0x80302a09
2224@1455310087.563475:vfio_region_read  (0000:00:16.4:region0+0x800, 4) = 0x0
2224@1455310087.563485:vfio_region_read  (0000:00:16.4:region0+0xc, 4) = 0x80302a09
2224@1455310087.563494:vfio_region_read  (0000:00:16.4:region0+0x4, 4) = 0x80686808
2224@1455310087.563501:vfio_region_read  (0000:00:16.4:region0+0x8, 4) = 0x8014000c
2224@1455310087.563511:vfio_region_read  (0000:00:16.4:region0+0x8, 4) = 0x80000003
2224@1455310087.563520:vfio_region_read  (0000:00:16.4:region0+0x8, 4) = 0x0
2224@1455310087.563527:vfio_region_read  (0000:00:16.4:region0+0x8, 4) = 0x0
2224@1455310087.563534:vfio_region_read  (0000:00:16.4:region0+0x8, 4) = 0x0
2224@1455310087.563540:vfio_region_read  (0000:00:16.4:region0+0x8, 4) = 0x0
2224@1455310087.563546:vfio_region_read  (0000:00:16.4:region0+0xc, 4) = 0x80303009
2224@1455310087.563553:vfio_region_read  (0000:00:16.4:region0+0x4, 4) = 0x80686808
2224@1455310087.563568:vfio_region_write  (0000:00:16.4:region0+0x4, 0x8068680c, 4)
2224@1455310087.563604:vfio_region_read  (0000:00:16.4:region0+0x800, 4) = 0x0
2224@1455310087.563615:vfio_region_read  (0000:00:16.4:region0+0xc, 4) = 0x8030300b
2224@1455310087.563622:vfio_region_read  (0000:00:16.4:region0+0x4, 4) = 0x80686808
2224@1455310087.563628:vfio_region_read  (0000:00:16.4:region0+0xc, 4) = 0x8030300b
2224@1455310087.563635:vfio_region_read  (0000:00:16.4:region0+0x4, 4) = 0x80686808
2224@1455310087.563640:vfio_region_write  (0000:00:16.4:region0+0x0, 0x8004000c, 4)
2224@1455310087.563645:vfio_region_write  (0000:00:16.4:region0+0x0, 0x5, 4)
2224@1455310087.563651:vfio_region_read  (0000:00:16.4:region0+0x4, 4) = 0x806a6808
2224@1455310087.563657:vfio_region_write  (0000:00:16.4:region0+0x4, 0x806a680c, 4)
2224@1455310087.563664:vfio_region_read  (0000:00:16.4:region0+0xc, 4) = 0x8030300b
2224@1455310087.563674:vfio_region_read  (0000:00:16.4:region0+0xc, 4) = 0x8030300b
2224@1455310087.563681:vfio_region_read  (0000:00:16.4:region0+0x4, 4) = 0x806a6808
2224@1455310087.563691:vfio_region_read  (0000:00:16.4:region0+0x4, 4) = 0x806a6808
2224@1455310087.563697:vfio_region_write  (0000:00:16.4:region0+0x4, 0x806a6809, 4)
2224@1455310087.563704:vfio_region_read  (0000:00:16.4:region0+0x4, 4) = 0x806a6809
2224@1455310087.563919:vfio_region_read  (0000:00:16.4:region0+0x4, 4) = 0x806a6a0b
2224@1455310087.563953:vfio_region_write  (0000:00:16.4:region0+0x4, 0x806a6a0a, 4)
2224@1455310087.563965:vfio_region_read  (0000:00:16.4:region0+0x4, 4) = 0x806a6a08
2224@1455310087.563973:vfio_region_read  (0000:00:16.4:region0+0xc, 4) = 0x80303009
2224@1455310087.563989:vfio_region_read  (0000:00:16.4:region0+0x800, 4) = 0x0
2224@1455310087.563997:vfio_region_read  (0000:00:16.4:region0+0x4, 4) = 0x806a6a08
2224@1455310087.564002:vfio_region_write  (0000:00:16.4:region0+0x4, 0x806a6a09, 4)
2224@1455310087.564010:vfio_region_read  (0000:00:16.4:region0+0x4, 4) = 0x806a6a09
